,brief,classes_name,header,news_url,pubtime,savetime
139,10月8日，长沙晚报公布了一批长沙市委管理干部任前公示名单，公示了34名长沙市委常委会会议研究同意的拟任人选，湖南龙骧交通发展集团党委书记、董事长已有新人选。,澎湃新闻,5名北京游客滇藏交界徒步失联，2人系北京移动员工,https://www.thepaper.cn/newsDetail_forward_2507155,6小时前,2018-10-08 20:05:14
140,国庆期间北京出发游客一行五人在滇藏交界“甲应村庄”附近徒步，从10月1日失联至今，家属已报警。,澎湃新闻,国庆期间北京市住建委专项检查公租房：将全面推广人脸识别,https://www.thepaper.cn/newsDetail_forward_2507007,6小时前,2018-10-08 20:05:14
141,检查组介绍，检查过程中发现，被抽检公租房项目在宣传标识设置、举报信息处理、监督检查记录等方面总体符合要求。,澎湃新闻,达州塌陷事故现场断电确保救援人员安全，近两千户居民停电,https://www.thepaper.cn/newsDetail_forward_2506969,6小时前,2018-10-08 20:05:14
142,为保障救援人员安全，现场临时采取了断电措施：切断塌陷处的供电电缆。此举直接导致该条线路上的近2000户居民停电。,澎湃新闻,湖南福彩1.59亿元巨奖得主全副武装现身，奖金重1.6吨,https://www.thepaper.cn/newsDetail_forward_2507162,6小时前,2018-10-08 20:05:15
143,湖南省福利彩票发行中心副主任黄海林介绍，据银行工作人员说，奖金1.59亿还完20%的税后，以一百元钞票累积叠起来计算，一共有1.6吨重，160米高。,澎湃新闻,云南15个贫困县脱贫摘帽，系该省首次实现贫困县数量减少,https://www.thepaper.cn/newsDetail_forward_2507042,6小时前,2018-10-08 20:05:15
144,9月30日，云南省政府召开新闻发布会正式发布：2017年，我省15个贫困县（市）实现脱贫摘帽。这是我省历史上首次实现贫困县数量减少。,澎湃新闻,公安部党委：坚决拥护、坚决支持对孟宏伟受贿进行监察调查,https://www.thepaper.cn/newsDetail_forward_2507183,6小时前,2018-10-08 20:05:15
145,10月8日，公安部党委会议通报孟宏伟收受贿赂、涉嫌违法接受国家监委监察调查情况。公安部党委一致认为孟宏伟涉嫌违法接受调查，完全是其一意孤行、咎由自取的结果。,澎湃新闻,沪常高速一出口处一中型客车侧翻，车内一乘客当场死亡,https://www.thepaper.cn/newsDetail_forward_2507174,6小时前,2018-10-08 20:05:15
146,10月8日9时许，S26沪常高速联友路出口处发生一起中型客车侧翻事故。事故导致车内1名乘客当场死亡。目前，车辆驾驶员已被警方控制并排除酒驾、毒驾嫌疑。,澎湃新闻,国庆上海迎游客1038万人次，过夜游客每天人均消费千余元,https://www.thepaper.cn/newsDetail_forward_2507057,6小时前,2018-10-08 20:05:15
147,国庆七天，上海共接待游客1038万人次，同比增长12%，增幅创近年来新高；实现旅游收入102.9亿元，同比增11.4%；饭店宾馆客房出租率59%，同比基本持平。,澎湃新闻,流浪男子平文涛在西湖三处石碑上乱涂，涉嫌寻衅滋事被刑拘,https://www.thepaper.cn/newsDetail_forward_2507036,6小时前,2018-10-08 20:05:15
148,36岁的平文涛来杭州不久，没有固定住址、固定职业，属流浪人员。据了解，平文涛在西湖景区三处石碑上有乱涂行为。,澎湃新闻,安徽“假摔帝”国庆再出山，阜阳警方建议：不责不骂也不给钱,https://www.thepaper.cn/newsDetail_forward_2507029,6小时前,2018-10-08 20:05:15
149,“有一个老人突然在天桥下的草坪绿化带边上摔倒了，不过他坐起来后开始自然地喝水，抱怨子女不孝，向过往行人索要钱财。”,澎湃新闻,苹果公司致信美国国会，否认“中国黑客恶意植入芯片入侵”,https://www.thepaper.cn/newsDetail_forward_2506822,6小时前,2018-10-08 20:05:15
150,当地时间7日，苹果公司高级安全官员致信美国国会，称他们没有发现任何证据表明中国黑客通过芯片对该公司进行攻击。,澎湃新闻,“杰出校长”承接各种培训班，截留伙食费百余万存入小金库,https://www.thepaper.cn/newsDetail_forward_2506817,6小时前,2018-10-08 20:05:15
151,作为国家财政拨款的事业单位，天津铁道职业技术学院曾陆续承接过诸多培训项目，在该院原院长李群先主持工作期间，这些培训项目的“伙食费”前前后后竟被截留百余万元。,澎湃新闻,中国空军发布5枚外宣纪念封，记录地空导弹兵60年战斗荣光,https://www.thepaper.cn/newsDetail_forward_2506994,7小时前,2018-10-08 20:05:15
152,中国空军向海内外发布中英文版纪念封《中国空军地空导弹兵成立60周年》，生动讲述新时代中国空军地空导弹兵聚焦备战打仗、全面提升信息化条件下防空反导能力的强军故事。,澎湃新闻,《老舍五则》“归来”，雷恪生、李诚儒飙戏力求地道京味儿,https://www.thepaper.cn/newsDetail_forward_2506900,7小时前,2018-10-08 20:05:16
153,在《老舍五则》这个剧中，老北京味儿是林兆华着重追求的。除了剧本由老舍的儿子舒乙创意，编剧王翔完整保留了京味小说的语言魅力。,澎湃新闻,国庆档票房大幅缩水，是因为取消票补还是这届电影不行？,https://www.thepaper.cn/newsDetail_forward_2506574,7小时前,2018-10-08 20:05:16
154,随着《无双》的口碑不断发酵，10月2日，《李茶的姑妈》就失守国庆档的冠军位。而此前业内预计在20亿级别的票房也仅仅止步在5亿级别。,澎湃新闻,视频|惊险！阜阳一醉酒男子高速穿梭拦截车辆,https://www.thepaper.cn/newsDetail_forward_2506995,7小时前,2018-10-08 20:05:16
155,10月7日，安徽阜阳。一男子在高速公路上来回穿梭，拦截过往车辆。交警赶到后将男子带走，经检测男子属严重醉酒。目前警方正在对男子做进一步处理。,澎湃新闻,在西湖石碑刻字的平文涛被刑拘，岳王公园凉亭今天又被刻满字,https://www.thepaper.cn/newsDetail_forward_2507009,7小时前,2018-10-08 20:05:16
156,平文涛属于流浪人员，在杭州没有固定住所，也没有固定工作，目前也无法联系上他的家人。对于自己在西湖边石碑上写字的行为，他供认不讳。,澎湃新闻,视频|大火堵死一家三口逃生，消防员拆门救人,https://www.thepaper.cn/newsDetail_forward_2506959,7小时前,2018-10-08 20:05:16
157,10月7日，湖北黄石。一栋三层民宅突发大火，一楼的电瓶批发店还不时传来电瓶爆炸声。逃生门被大火阻挡，一家三口被困。消防员拆门救人。,澎湃新闻,澳大利亚游客擅入贵州海龙屯禁区失联，百人搜寻9个小时找回,https://www.thepaper.cn/newsDetail_forward_2506958,7小时前,2018-10-08 20:05:16
158,10月5日清晨，经上百人连续搜寻9个小时，一名擅入贵州遵义海龙屯景区禁区并失联的老外被寻回。经医护人员仔细检查发现，该游客身体无恙，各项身体指征均正常。,澎湃新闻,安徽粮油食品进出口公司原董事长陈焱华涉受贿罪被决定逮捕,https://www.thepaper.cn/newsDetail_forward_2506965,7小时前,2018-10-08 20:05:16
159,陈焱华在担任安徽省粮油食品进出口公司副总经理、总会计师、董事、总经理等职务期间，在企业改制、经营利润分配等事项上，为他人谋取利益，非法收受他人财物，数额巨大。,澎湃新闻,玛御谷稻田艺术季：对“在地性”艺术的一种探索,https://www.thepaper.cn/newsDetail_forward_2506953,7小时前,2018-10-08 20:05:16
