,brief,header,pub_time,url
0,盛博分析师Robin Zhu在报告中写到，盛博不认为蔚来汽车股票是稳妥投资。该公司怀疑蔚来汽车是否能够达到量产目标，并且担心该公司面临分销稳妥。盛博对蔚来汽车的初始评级为落后大盘，目标价4.2美元。（彭博）,蔚来汽车遭遇首个落后大盘评级,2018-09-13 19:44,http://share.baidu.com/s?type=text&searchPic=1&sign=on&to=tsina&key=595885820&url=https://36kr.com/newsflashes/136550&title=%E7%9B%9B%E5%8D%9A%E5%88%86%E6%9E%90%E5%B8%88Robin%20Zhu%E5%9C%A8%E6%8A%A5%E5%91%8A%E4%B8%AD%E5%86%99%E5%88%B0%EF%BC%8C%E7%9B%9B%E5%8D%9A%E4%B8%8D%E8%AE%A4%E4%B8%BA%E8%94%9A%E6%9D%A5%E6%B1%BD%E8%BD%A6%E8%82%A1%E7%A5%A8%E6%98%AF%E7%A8%B3%E5%A6%A5%E6%8A%95%E8%B5%84%E3%80%82%E8%AF%A5%E5%85%AC%E5%8F%B8%E6%80%80%E7%96%91%E8%94%9A%E6%9D%A5%E6%B1%BD%E8%BD%A6%E6%98%AF%E5%90%A6%E8%83%BD%E5%A4%9F%E8%BE%BE%E5%88%B0%E9%87%8F%E4%BA%A7%E7%9B%AE%E6%A0%87%EF%BC%8C%E5%B9%B6%E4%B8%94%E6%8B%85%E5%BF%83%E8%AF%A5%E5%85%AC%E5%8F%B8%E9%9D%A2%E4%B8%B4%E5%88%86%E9%94%80%E7%A8%B3%E5%A6%A5%E3%80%82%E7%9B%9B%E5%8D%9A%E5%AF%B9%E8%94%9A%E6%9D%A5%E6%B1%BD%E8%BD%A6%E7%9A%84%E5%88%9D%E5%A7%8B%E8%AF%84%E7%BA%A7%E4%B8%BA%E8%90%BD%E5%90%8E%E5%A4%A7%E7%9B%98%EF%BC%8C%E7%9B%AE%E6%A0%87%E4%BB%B74.2%E7%BE%8E%E5%85%83%E3%80%82%EF%BC%88%E5%BD%AD%E5%8D%9A%EF%BC%89
1,继踩雷ST龙力、ST凯迪、东方金钰之后，陆金所代销的神州长城资管计划也陷入“终止”状态。（21世纪经济报道）,陆金所代销产品又踩雷，大同证券两资管计划终止涉神州长城,2018-09-13 19:20,https://m.21jingji.com/article/20180913/herald/b2354a549dee425240ab37e321e658f8.html
2,据特斯拉批评家吉姆・查诺斯提供的数据，今年特斯拉已流失41名高管，在过去的12个月流失了58位。上周五，在特斯拉CEO埃隆・马斯克在直播中吸食大麻之后的数小时，特斯拉传出两位“C级别高管”离职的消息。这些消息最终促使特斯拉股价在当日重挫10%。（新浪）,特斯拉今年已流失41名高管,2018-09-13 19:16,https://tech.sina.com.cn/it/2018-09-13/doc-ihiixzkm8363355.shtml
3,据路透社消息，高通周四表示，将回购约160亿美元的普通股，作为先前宣布的300亿美元股票回购计划的一部分。由于中国的反对，高通今年7月份以440亿美元收购恩智浦计划破产，该公司正在寻求通过其他方式对投资者进行补偿。（品玩）,高通公司计划先回购160亿美元股票,2018-09-13 19:09,https://www.pingwest.com/w/177150
4,在今天上午举行的GTC2018日本站上，英伟达首席执行官黄仁勋宣布了一系列新产品，其中包括Tesla T4 GPU、Nvidia Drive AGX Xavier开发套件以及Jetson AGX Xavier开发套件等。据介绍，富士公司成为日本第一家采用NVIDIA DGX-2 AI超级计算机的公司。（网易）,英伟达在日本推多款新品，聚焦机器人和自动驾驶,2018-09-13 19:07,http://tech.163.com/18/0913/14/DRJE5P8R00098IEO.html
5,雀巢在欧洲、中东和北非的CEO Marco Settembri对《金融时报》表示，虽然在欧洲推出雀巢的高端胶囊咖啡Nespresso咖啡连锁店是不太可能的，但Blue Bottle可以在该地区发挥作用。Blue Bottle是总部位于美国加州的精品咖啡连锁店。2017年，雀巢高调地收购了它的68%的股份，成为实际的控股母公司。（界面）,精品咖啡Blue Bottle计划进入欧洲,2018-09-13 19:04,https://www.jiemian.com/article/2468323.html
6,9月13日，京东正式宣布将与中国电信共同打造线上线下精准融合的商业赋能模式，并就中国电信实体门店的无界零售合作举办启动仪式。京东将以供应链、线上流量、物流和技术等优势与中国电信广泛的实体店布局相融合，通过Jpass、全渠道、一盘货、小程序等最新的技术手段为门店提供引流、选品、精准营销、物流等全方位赋能支持。（证券时报）,京东电信联手线下实体门店开启无界零售合作,2018-09-13 18:59,http://www.egsea.com/news/detail?id=297865
7,2018腾讯全球合作伙伴大会将于11月1日-3日在南京江苏大剧院举办。在这场一年一度最高规格的合作伙伴大会上，腾讯将有20多个业务将集体出席，发布年度生态战略和合作政策。届时，来自全球各地的科技、文化、商业领域大咖也将莅临会场，与万名合作伙伴共探发展之路。（中新网）,2018腾讯全球合作伙伴大会将于11月在南京召开,2018-09-13 18:52,http://www.chinanews.com/wap/detail/zw/it/2018/09-13/8626394.shtml
8,36氪讯，腾讯控股今日公告称，耗资3950万港元回购12.4万股公司股票，每股价格为316.2~322.8港元。,腾讯控股连续第五个交易日回购公司股票,2018-09-13 18:51,http://www.hkexnews.hk/listedco/listconews/sehk/2018/0913/LTN20180913890_C.pdf
9,从权威人士处获悉，华夏养老2040三年持有混合FOF今日正式成立，此举意味着首只养老目标基金正式起航。据悉，华夏养老2040三年持有混合FOF首募规模2.11亿元，已超过基金成立门槛要求，募集有效认购户数为37585户，户均认购规模为5627元 。（中国证券网）,首只养老目标基金宣告成立，户均认购5627元,2018-09-13 18:48,"http://news.cnstock.com/news,bwkx-201809-4272391.htm"
10,高盛给予拼多多ADR买入评级，目标价为31.9美元，相较拼多多上次收盘价高38%，拼多多平均目标价为24.9美元。彭博数据显示，拼多多目前有2个买入和1个持有评级。（彭博）,高盛给予拼多多买入评级，目标价31.9美元,2018-09-13 18:47,http://share.baidu.com/s?type=text&searchPic=1&sign=on&to=tsina&key=595885820&url=https://36kr.com/newsflashes/136540&title=%E9%AB%98%E7%9B%9B%E7%BB%99%E4%BA%88%E6%8B%BC%E5%A4%9A%E5%A4%9AADR%E4%B9%B0%E5%85%A5%E8%AF%84%E7%BA%A7%EF%BC%8C%E7%9B%AE%E6%A0%87%E4%BB%B7%E4%B8%BA31.9%E7%BE%8E%E5%85%83%EF%BC%8C%E7%9B%B8%E8%BE%83%E6%8B%BC%E5%A4%9A%E5%A4%9A%E4%B8%8A%E6%AC%A1%E6%94%B6%E7%9B%98%E4%BB%B7%E9%AB%9838%25%EF%BC%8C%E6%8B%BC%E5%A4%9A%E5%A4%9A%E5%B9%B3%E5%9D%87%E7%9B%AE%E6%A0%87%E4%BB%B7%E4%B8%BA24.9%E7%BE%8E%E5%85%83%E3%80%82%E5%BD%AD%E5%8D%9A%E6%95%B0%E6%8D%AE%E6%98%BE%E7%A4%BA%EF%BC%8C%E6%8B%BC%E5%A4%9A%E5%A4%9A%E7%9B%AE%E5%89%8D%E6%9C%892%E4%B8%AA%E4%B9%B0%E5%85%A5%E5%92%8C1%E4%B8%AA%E6%8C%81%E6%9C%89%E8%AF%84%E7%BA%A7%E3%80%82%EF%BC%88%E5%BD%AD%E5%8D%9A%EF%BC%89
11,36氪讯，喜马拉雅与腾讯视频今日宣布联合会员计划，年费为198元。此外，现场双方还宣布了联合IP孵化计划，未来，两家平台将会在一些共有IP上的协同操作――筛选出有潜力的优质IP，两大平台出专门团队帮助完成商业化包装，并且打通两个平台的流量，给出S+级资源做宣发推广。,喜马拉雅与腾讯视频推联合会员，未来将跨平台孵化IP,2018-09-13 18:36,http://share.baidu.com/s?type=text&searchPic=1&sign=on&to=tsina&key=595885820&url=https://36kr.com/newsflashes/136539&title=36%E6%B0%AA%E8%AE%AF%EF%BC%8C%E5%96%9C%E9%A9%AC%E6%8B%89%E9%9B%85%E4%B8%8E%E8%85%BE%E8%AE%AF%E8%A7%86%E9%A2%91%E4%BB%8A%E6%97%A5%E5%AE%A3%E5%B8%83%E8%81%94%E5%90%88%E4%BC%9A%E5%91%98%E8%AE%A1%E5%88%92%EF%BC%8C%E5%B9%B4%E8%B4%B9%E4%B8%BA198%E5%85%83%E3%80%82%E6%AD%A4%E5%A4%96%EF%BC%8C%E7%8E%B0%E5%9C%BA%E5%8F%8C%E6%96%B9%E8%BF%98%E5%AE%A3%E5%B8%83%E4%BA%86%E8%81%94%E5%90%88IP%E5%AD%B5%E5%8C%96%E8%AE%A1%E5%88%92%EF%BC%8C%E6%9C%AA%E6%9D%A5%EF%BC%8C%E4%B8%A4%E5%AE%B6%E5%B9%B3%E5%8F%B0%E5%B0%86%E4%BC%9A%E5%9C%A8%E4%B8%80%E4%BA%9B%E5%85%B1%E6%9C%89IP%E4%B8%8A%E7%9A%84%E5%8D%8F%E5%90%8C%E6%93%8D%E4%BD%9C%E2%80%94%E2%80%94%E7%AD%9B%E9%80%89%E5%87%BA%E6%9C%89%E6%BD%9C%E5%8A%9B%E7%9A%84%E4%BC%98%E8%B4%A8IP%EF%BC%8C%E4%B8%A4%E5%A4%A7%E5%B9%B3%E5%8F%B0%E5%87%BA%E4%B8%93%E9%97%A8%E5%9B%A2%E9%98%9F%E5%B8%AE%E5%8A%A9%E5%AE%8C%E6%88%90%E5%95%86%E4%B8%9A%E5%8C%96%E5%8C%85%E8%A3%85%EF%BC%8C%E5%B9%B6%E4%B8%94%E6%89%93%E9%80%9A%E4%B8%A4%E4%B8%AA%E5%B9%B3%E5%8F%B0%E7%9A%84%E6%B5%81%E9%87%8F%EF%BC%8C%E7%BB%99%E5%87%BAS+%E7%BA%A7%E8%B5%84%E6%BA%90%E5%81%9A%E5%AE%A3%E5%8F%91%E6%8E%A8%E5%B9%BF%E3%80%82
12,AMD CEO苏姿丰在做客Jim Cramer的节目时表示，AMD正在帮助索尼和微软开发全新的系统。换言之她从侧面证明索尼和微软都在进行下一代游戏主机的开发。苏姿丰表示，AMD正在与索尼和微软就游戏主机展开合作，并且帮助他们实现各自的“秘密武器”。（IGN中国）,AMD透露索尼和微软都为下一代主机准备了“秘密武器”,2018-09-13 18:30,http://www.ign.xn--fiqs8s/you-xi-chan-ye/26765/news/amdtou-lu-suo-ni-he-wei-ruan-du-wei-xia-yi-dai-zhu-ji-zhun-b
13,近日，电影圈盛传国家电影局将推出针对票补、预售、结算及购票服务费的相关新政。9月13日，国家电影局相关人士回应称，一切以近期公告为准。据了解，上述公告预计在今明两日内发布。大地影院、博纳影业、保利院线、淘票票等称，已经获知相关信息，但条款的细节是否调整以主管单位公告为准。（新京报）,国家电影局近期将推针对票补、预售及结算等“新政”,2018-09-13 18:29,http://www.bjnews.com.cn/finance/2018/09/13/504969.html
14,诺基亚今日宣布，计划剥离旗下IP视频业务，并将大部分股权出售给多伦多软件公司Volaris Group。诺基亚的视频业务包括缓存与流媒体产品、存储技术和流媒体个性化软件等。根据诺基亚的计划，这部分业务将转让给Volaris Group，并组建新的流媒体技术公司Velocix，作为Volaris Group旗下一项独立业务。（新浪）,诺基亚将IP视频业务出售给多伦多软件公司Volaris,2018-09-13 18:27,https://tech.sina.com.cn/it/2018-09-13/doc-ihiixzkm8339743.shtml
15,Guggenheim把苹果目标价从235美元上调至245美元。（彭博）,Guggenheim把苹果目标价从235美元上调至245美元,2018-09-13 18:21,http://share.baidu.com/s?type=text&searchPic=1&sign=on&to=tsina&key=595885820&url=https://36kr.com/newsflashes/136535&title=Guggenheim%E6%8A%8A%E8%8B%B9%E6%9E%9C%E7%9B%AE%E6%A0%87%E4%BB%B7%E4%BB%8E235%E7%BE%8E%E5%85%83%E4%B8%8A%E8%B0%83%E8%87%B3245%E7%BE%8E%E5%85%83%E3%80%82%EF%BC%88%E5%BD%AD%E5%8D%9A%EF%BC%89
16,菜鸟今日宣布，双11期间所有菜鸟智能柜将对快递员继续免费。目前，菜鸟驿站智能柜已覆盖包括北、上、广、深、杭在内的全国大中城市，快递员可以免输手机号、批量投柜。当前，按需服务的菜鸟驿站2.0模式已在杭州、广州、深圳、天津、西安、苏州、无锡、大连、石家庄等20个大中城市部分站点落地，正面向全国推广。（亿欧）,菜鸟：双11期间所有菜鸟智能柜将对快递员继续免费,2018-09-13 18:20,https://www.iyiou.com/breaking/19298
17,近日，百度视觉团队在最大规模目标检测竞赛Google AI Open Images-Object Detection Track中获得冠军。据介绍，大赛采用Google今年5月份发布的Open Images V4数据集作为训练数据集，其中包含超过170万的图片数据，500个类别以及超过1200万物体框。（网易）,百度视觉团队获谷歌AI目标检测竞赛冠军,2018-09-13 18:10,http://tech.163.com/18/0913/14/DRJCTGCK00098IEO.html
18,据悉，特斯拉前副总法律顾问兼首席知识产权诉讼律师Jeff Risher加盟了FF。据了解，Jeff Risher在特斯拉任职2年，今年7月份离开特斯拉。之后有消息称其加入了FF，任职产品技术和知识产权战略副总裁。对此，FF内部人士确认，Jeff Risher确实在FF任职。（网易）,前特斯拉知识产权负责人加盟FF,2018-09-13 18:09,http://tech.163.com/18/0913/16/DRJJPJN500097U7T.html
19,百度全球首款L4级别自动驾驶巴士“阿波龙”(Apollo)将于9月18日正式首次亮相上海，而这标志着杨浦和百度即将开启一系列合作，其中包括在杨浦打造一个“百度(上海)创新中心”和“百度上海人工智能展示体验中心”。（上观新闻）,百度首个上海创新中心将落户杨浦区,2018-09-13 18:06,https://www.jfdaily.com/news/detail?id=105224
20,腾讯今日大涨4.99%，创2016年8月18日以来最大日涨幅，收报323.8港元，成交98.4亿港元，最新总市值30835亿港元，重回3万亿上方。腾讯发言人表示，“回购反映我们对公司的基本因素和业务的长远价值充满信心。”（格隆汇）,腾讯大涨4.99%，创逾2年来最大日涨幅,2018-09-13 18:06,http://share.baidu.com/s?type=text&searchPic=1&sign=on&to=tsina&key=595885820&url=https://36kr.com/newsflashes/136530&title=%E8%85%BE%E8%AE%AF%E4%BB%8A%E6%97%A5%E5%A4%A7%E6%B6%A84.99%25%EF%BC%8C%E5%88%9B2016%E5%B9%B48%E6%9C%8818%E6%97%A5%E4%BB%A5%E6%9D%A5%E6%9C%80%E5%A4%A7%E6%97%A5%E6%B6%A8%E5%B9%85%EF%BC%8C%E6%94%B6%E6%8A%A5323.8%E6%B8%AF%E5%85%83%EF%BC%8C%E6%88%90%E4%BA%A498.4%E4%BA%BF%E6%B8%AF%E5%85%83%EF%BC%8C%E6%9C%80%E6%96%B0%E6%80%BB%E5%B8%82%E5%80%BC30835%E4%BA%BF%E6%B8%AF%E5%85%83%EF%BC%8C%E9%87%8D%E5%9B%9E3%E4%B8%87%E4%BA%BF%E4%B8%8A%E6%96%B9%E3%80%82%E8%85%BE%E8%AE%AF%E5%8F%91%E8%A8%80%E4%BA%BA%E8%A1%A8%E7%A4%BA%EF%BC%8C%E2%80%9C%E5%9B%9E%E8%B4%AD%E5%8F%8D%E6%98%A0%E6%88%91%E4%BB%AC%E5%AF%B9%E5%85%AC%E5%8F%B8%E7%9A%84%E5%9F%BA%E6%9C%AC%E5%9B%A0%E7%B4%A0%E5%92%8C%E4%B8%9A%E5%8A%A1%E7%9A%84%E9%95%BF%E8%BF%9C%E4%BB%B7%E5%80%BC%E5%85%85%E6%BB%A1%E4%BF%A1%E5%BF%83%E3%80%82%E2%80%9D%EF%BC%88%E6%A0%BC%E9%9A%86%E6%B1%87%EF%BC%89
21,中国企业联合会、中国企业家协会日前发布了2018年中国企业500强榜单。分省市来看，北京上榜企业数量最多，达到100家；江苏上榜企业数量为52家，排名第二；广东、山东上榜企业数量均为51家。小米集团、北京电控、网易公司、物美等9家北京企业首次入围中国企业500强榜单。（北京日报）,中国企业500强出炉：入围门槛306.89亿元，小米首次进入,2018-09-13 18:00,http://tech.qq.com/a/20180913/090629.htm
22,记者从知情人士处获证实，中国银联与支付宝已于9月10日举行内部签约仪式，就支付清算业务达成相关合作。不过，就上述信息，银联和支付宝方面今日均表示，不作回应。（上证报）,中国银联与支付宝达成支付清算合作,2018-09-13 17:56,"http://news.cnstock.com/news,bwkx-201809-4272342.htm"
23,据TheMercuryNews报道，马斯克的地下隧道公司Boring Company今日获得Hawthorne市议会批准，在其最近买下的一座私宅上建一个通向隧道的新型车库原型，未来会在这个车库上装上一部电梯，可以让汽车在不离开车库的情况下进入隧道。（品玩）,马斯克的Boring Company获批在批在私宅车库内建隧道入口,2018-09-13 17:54,https://www.pingwest.com/w/177145
24,德国联邦最高法院(BGH)今日宣布，将推迟审理一起关于YouTube是否应该为用户上传的侵权内容承担责任的上诉案。该案件源于2008年，当时有YouTube用户非法上传了著名歌手莎拉・布莱曼的表演视频。后来，一音乐制作人将YouTube告上法庭，不仅要求这名用户做出赔偿，还要求YouTube给予赔偿。（新浪）,用户侵权平台要担责？德最高法推迟审理YouTube侵权案,2018-09-13 17:51,https://tech.sina.com.cn/i/2018-09-13/doc-ihiixzkm8309150.shtml
25,36氪获悉，今日，腾讯发布了《2017年企业社会责任报告》，在过去的2017年，整个经济社会进入了全面数字化转型升级的历史阶段，广度上，数字化进程已经从经济产业迅速扩展到民生、政务等等领域。深度上，以互联网代表的数字技术正在与各行各业深度融合，数字创新正在溶入每个垂直领域的血液。,腾讯发布2017年企业社会责任报告，呼吁保护数字生态,2018-09-13 17:34,http://share.baidu.com/s?type=text&searchPic=1&sign=on&to=tsina&key=595885820&url=https://36kr.com/newsflashes/136525&title=36%E6%B0%AA%E8%8E%B7%E6%82%89%EF%BC%8C%E4%BB%8A%E6%97%A5%EF%BC%8C%E8%85%BE%E8%AE%AF%E5%8F%91%E5%B8%83%E4%BA%86%E3%80%8A2017%E5%B9%B4%E4%BC%81%E4%B8%9A%E7%A4%BE%E4%BC%9A%E8%B4%A3%E4%BB%BB%E6%8A%A5%E5%91%8A%E3%80%8B%EF%BC%8C%E5%9C%A8%E8%BF%87%E5%8E%BB%E7%9A%842017%E5%B9%B4%EF%BC%8C%E6%95%B4%E4%B8%AA%E7%BB%8F%E6%B5%8E%E7%A4%BE%E4%BC%9A%E8%BF%9B%E5%85%A5%E4%BA%86%E5%85%A8%E9%9D%A2%E6%95%B0%E5%AD%97%E5%8C%96%E8%BD%AC%E5%9E%8B%E5%8D%87%E7%BA%A7%E7%9A%84%E5%8E%86%E5%8F%B2%E9%98%B6%E6%AE%B5%EF%BC%8C%E5%B9%BF%E5%BA%A6%E4%B8%8A%EF%BC%8C%E6%95%B0%E5%AD%97%E5%8C%96%E8%BF%9B%E7%A8%8B%E5%B7%B2%E7%BB%8F%E4%BB%8E%E7%BB%8F%E6%B5%8E%E4%BA%A7%E4%B8%9A%E8%BF%85%E9%80%9F%E6%89%A9%E5%B1%95%E5%88%B0%E6%B0%91%E7%94%9F%E3%80%81%E6%94%BF%E5%8A%A1%E7%AD%89%E7%AD%89%E9%A2%86%E5%9F%9F%E3%80%82%E6%B7%B1%E5%BA%A6%E4%B8%8A%EF%BC%8C%E4%BB%A5%E4%BA%92%E8%81%94%E7%BD%91%E4%BB%A3%E8%A1%A8%E7%9A%84%E6%95%B0%E5%AD%97%E6%8A%80%E6%9C%AF%E6%AD%A3%E5%9C%A8%E4%B8%8E%E5%90%84%E8%A1%8C%E5%90%84%E4%B8%9A%E6%B7%B1%E5%BA%A6%E8%9E%8D%E5%90%88%EF%BC%8C%E6%95%B0%E5%AD%97%E5%88%9B%E6%96%B0%E6%AD%A3%E5%9C%A8%E6%BA%B6%E5%85%A5%E6%AF%8F%E4%B8%AA%E5%9E%82%E7%9B%B4%E9%A2%86%E5%9F%9F%E7%9A%84%E8%A1%80%E6%B6%B2%E3%80%82
26,蚂蚁金服据悉聘请德意志银行的WU XIAOPIN加入投资团队，负责新的投资基金。（彭博）,蚂蚁金服聘请德意志银行的WU XIAOPIN加入投资团队,2018-09-13 17:23,http://share.baidu.com/s?type=text&searchPic=1&sign=on&to=tsina&key=595885820&url=https://36kr.com/newsflashes/136524&title=%E8%9A%82%E8%9A%81%E9%87%91%E6%9C%8D%E6%8D%AE%E6%82%89%E8%81%98%E8%AF%B7%E5%BE%B7%E6%84%8F%E5%BF%97%E9%93%B6%E8%A1%8C%E7%9A%84WU%20XIAOPIN%E5%8A%A0%E5%85%A5%E6%8A%95%E8%B5%84%E5%9B%A2%E9%98%9F%EF%BC%8C%E8%B4%9F%E8%B4%A3%E6%96%B0%E7%9A%84%E6%8A%95%E8%B5%84%E5%9F%BA%E9%87%91%E3%80%82%EF%BC%88%E5%BD%AD%E5%8D%9A%EF%BC%89
27,无人智慧酒店乐易住据悉获（战略）投资500万人民币。（ 亿邦动力网）,无人智慧酒店乐易住获（战略）投资500万人民币,2018-09-13 17:17,http://www.ebrun.com/20180913/297273.shtml?eb=hp_home_lcol_24kx
28,近日，一辆FF91样车运抵广州恒大中心，“恒大法拉第未来智能汽车（中国）集团称，的确已经收到样车，但暂不了解样车的具体用途。此前，贾跃亭控制的FF中国相关负责人回复媒体称，这辆样车系FF裂变营销活动的一个组成部分，供高端用户私密鉴赏，但具体亮相时间不便透露。（腾讯一线）,恒大法拉第未来收到FF91样车，具体用途不详,2018-09-13 17:11,https://finance.qq.com/a/20180913/088708.htm
29,近日有传言称华为将被“国资收购”，对此，华为今日予以否认。针对关于业务分拆、剥离部分业务的传闻，华为同样表示不属实。（一财）,华为否认“被收购”传言，100%由员工持股,2018-09-13 17:05,https://www.yicai.com/news/100026121.html
30,36氪获悉，人工智能公司westwell西井科技正式推出自动驾驶品牌――Qomolo逐路，并发布全时无人驾驶电动重卡 Q-Truck。该车采用开创性的无驾驶室整车设计，可应用于港口、物流园区，矿版，高速等多场景。同时，西井科技也正式对外宣布已和振华重工、珠海港、西藏珠峰三家A股上市公司达成合作。,人工智能公司西井科技推出自动驾驶品牌“Qomolo逐路”,2018-09-13 16:59,http://share.baidu.com/s?type=text&searchPic=1&sign=on&to=tsina&key=595885820&url=https://36kr.com/newsflashes/136520&title=36%E6%B0%AA%E8%8E%B7%E6%82%89%EF%BC%8C%E4%BA%BA%E5%B7%A5%E6%99%BA%E8%83%BD%E5%85%AC%E5%8F%B8westwell%E8%A5%BF%E4%BA%95%E7%A7%91%E6%8A%80%E6%AD%A3%E5%BC%8F%E6%8E%A8%E5%87%BA%E8%87%AA%E5%8A%A8%E9%A9%BE%E9%A9%B6%E5%93%81%E7%89%8C%E2%80%94%E2%80%94Qomolo%E9%80%90%E8%B7%AF%EF%BC%8C%E5%B9%B6%E5%8F%91%E5%B8%83%E5%85%A8%E6%97%B6%E6%97%A0%E4%BA%BA%E9%A9%BE%E9%A9%B6%E7%94%B5%E5%8A%A8%E9%87%8D%E5%8D%A1%20Q-Truck%E3%80%82%E8%AF%A5%E8%BD%A6%E9%87%87%E7%94%A8%E5%BC%80%E5%88%9B%E6%80%A7%E7%9A%84%E6%97%A0%E9%A9%BE%E9%A9%B6%E5%AE%A4%E6%95%B4%E8%BD%A6%E8%AE%BE%E8%AE%A1%EF%BC%8C%E5%8F%AF%E5%BA%94%E7%94%A8%E4%BA%8E%E6%B8%AF%E5%8F%A3%E3%80%81%E7%89%A9%E6%B5%81%E5%9B%AD%E5%8C%BA%EF%BC%8C%E7%9F%BF%E7%89%88%EF%BC%8C%E9%AB%98%E9%80%9F%E7%AD%89%E5%A4%9A%E5%9C%BA%E6%99%AF%E3%80%82%E5%90%8C%E6%97%B6%EF%BC%8C%E8%A5%BF%E4%BA%95%E7%A7%91%E6%8A%80%E4%B9%9F%E6%AD%A3%E5%BC%8F%E5%AF%B9%E5%A4%96%E5%AE%A3%E5%B8%83%E5%B7%B2%E5%92%8C%E6%8C%AF%E5%8D%8E%E9%87%8D%E5%B7%A5%E3%80%81%E7%8F%A0%E6%B5%B7%E6%B8%AF%E3%80%81%E8%A5%BF%E8%97%8F%E7%8F%A0%E5%B3%B0%E4%B8%89%E5%AE%B6A%E8%82%A1%E4%B8%8A%E5%B8%82%E5%85%AC%E5%8F%B8%E8%BE%BE%E6%88%90%E5%90%88%E4%BD%9C%E3%80%82
31,据美国财经网站CNBC报道，高盛分析师马克・德莱尼表示，在今年第四季度和明年上半年，随着供应增长加快，预计内存芯片的需求量将逐渐减弱。受此影响，美国芯片股于当地时间周三普遍下跌。（TechWeb）,投行高盛预计存储芯片需求将下滑，美芯片股应声普跌,2018-09-13 16:55,http://www.techweb.com.cn/world/2018-09-13/2701452.shtml
32,36氪获悉，小米组织架构做出重大变革，新设集团参谋部和集团组织部，并同时调整王川、刘德、洪锋和尚进等高管的工作分工；改组电视部、生态链部、MIUI部和互娱部等四个业务部重组成十个新的业务部。其中集团组织部将负责中高层管理干部的聘用、升迁、培训和考核激励等，以及各个部门的组织建设和编制审批，由联合创始人、高级副总裁刘德任部长。集团参谋部将协助CEO制定集团的发展战略，并督导各个业务部门的战略执行，由联合创始人、高级副总裁王川任参谋长。,小米启动组织结构变革：新设集团组织部和参谋部,2018-09-13 16:34,http://share.baidu.com/s?type=text&searchPic=1&sign=on&to=tsina&key=595885820&url=https://36kr.com/newsflashes/136518&title=36%E6%B0%AA%E8%8E%B7%E6%82%89%EF%BC%8C%E5%B0%8F%E7%B1%B3%E7%BB%84%E7%BB%87%E6%9E%B6%E6%9E%84%E5%81%9A%E5%87%BA%E9%87%8D%E5%A4%A7%E5%8F%98%E9%9D%A9%EF%BC%8C%E6%96%B0%E8%AE%BE%E9%9B%86%E5%9B%A2%E5%8F%82%E8%B0%8B%E9%83%A8%E5%92%8C%E9%9B%86%E5%9B%A2%E7%BB%84%E7%BB%87%E9%83%A8%EF%BC%8C%E5%B9%B6%E5%90%8C%E6%97%B6%E8%B0%83%E6%95%B4%E7%8E%8B%E5%B7%9D%E3%80%81%E5%88%98%E5%BE%B7%E3%80%81%E6%B4%AA%E9%94%8B%E5%92%8C%E5%B0%9A%E8%BF%9B%E7%AD%89%E9%AB%98%E7%AE%A1%E7%9A%84%E5%B7%A5%E4%BD%9C%E5%88%86%E5%B7%A5%EF%BC%9B%E6%94%B9%E7%BB%84%E7%94%B5%E8%A7%86%E9%83%A8%E3%80%81%E7%94%9F%E6%80%81%E9%93%BE%E9%83%A8%E3%80%81MIUI%E9%83%A8%E5%92%8C%E4%BA%92%E5%A8%B1%E9%83%A8%E7%AD%89%E5%9B%9B%E4%B8%AA%E4%B8%9A%E5%8A%A1%E9%83%A8%E9%87%8D%E7%BB%84%E6%88%90%E5%8D%81%E4%B8%AA%E6%96%B0%E7%9A%84%E4%B8%9A%E5%8A%A1%E9%83%A8%E3%80%82%E5%85%B6%E4%B8%AD%E9%9B%86%E5%9B%A2%E7%BB%84%E7%BB%87%E9%83%A8%E5%B0%86%E8%B4%9F%E8%B4%A3%E4%B8%AD%E9%AB%98%E5%B1%82%E7%AE%A1%E7%90%86%E5%B9%B2%E9%83%A8%E7%9A%84%E8%81%98%E7%94%A8%E3%80%81%E5%8D%87%E8%BF%81%E3%80%81%E5%9F%B9%E8%AE%AD%E5%92%8C%E8%80%83%E6%A0%B8%E6%BF%80%E5%8A%B1%E7%AD%89%EF%BC%8C%E4%BB%A5%E5%8F%8A%E5%90%84%E4%B8%AA%E9%83%A8%E9%97%A8%E7%9A%84%E7%BB%84%E7%BB%87%E5%BB%BA%E8%AE%BE%E5%92%8C%E7%BC%96%E5%88%B6%E5%AE%A1%E6%89%B9%EF%BC%8C%E7%94%B1%E8%81%94%E5%90%88%E5%88%9B%E5%A7%8B%E4%BA%BA%E3%80%81%E9%AB%98%E7%BA%A7%E5%89%AF%E6%80%BB%E8%A3%81%E5%88%98%E5%BE%B7%E4%BB%BB%E9%83%A8%E9%95%BF%E3%80%82%E9%9B%86%E5%9B%A2%E5%8F%82%E8%B0%8B%E9%83%A8%E5%B0%86%E5%8D%8F%E5%8A%A9CEO%E5%88%B6%E5%AE%9A%E9%9B%86%E5%9B%A2%E7%9A%84%E5%8F%91%E5%B1%95%E6%88%98%E7%95%A5%EF%BC%8C%E5%B9%B6%E7%9D%A3%E5%AF%BC%E5%90%84%E4%B8%AA%E4%B8%9A%E5%8A%A1%E9%83%A8%E9%97%A8%E7%9A%84%E6%88%98%E7%95%A5%E6%89%A7%E8%A1%8C%EF%BC%8C%E7%94%B1%E8%81%94%E5%90%88%E5%88%9B%E5%A7%8B%E4%BA%BA%E3%80%81%E9%AB%98%E7%BA%A7%E5%89%AF%E6%80%BB%E8%A3%81%E7%8E%8B%E5%B7%9D%E4%BB%BB%E5%8F%82%E8%B0%8B%E9%95%BF%E3%80%82
33,在今年年初，马克・扎克伯格承诺将努力确保Facebook在全球免受选举干扰活动的影响。本周三，Facebook首席执行官扎克伯格发表了一篇长达3300字的博文，详述了公司至今为止采取的所有措施。扎克伯格表示，“今天，Facebook为这类攻击做好了更充分的准备。”,扎克伯格发长博文承诺：Facebook已经准备好确保选举公正,2018-09-13 16:31,https://tech.sina.com.cn/i/2018-09-13/doc-ihkahyhw7002771.shtml
34,深圳市互联网金融风险等专项整治领导小组办公室于9月12日下发《关于开展深圳市P2P网贷借贷机构合规检查的通知》。通知要求，深圳市的P2P平台合规检查分为网贷机构自查、自律检查与行政核查，机构自查原则上应于2018年10月12日之前完成，自律检查于2018年11月12日之前完成，行政核查于2018年12月31日前完成。（网贷之家）,深圳启动P2P合规检查，网贷机构自查完成时间不得晚于10月12日,2018-09-13 16:21,https://www.wdzj.com/news/yc/3080951.html
35,据彭博社援引品牌研究公司铂慧（Prophet）的最新调查显示，华为和美团点评已经取代苹果和耐克，成为中国最受欢迎的品牌。在上榜的50个品牌中，30个为中国本土品牌，其中排名第一的是支付宝。（新浪）,华为和美团取代苹果和耐克，成中国最受欢迎品牌,2018-09-13 16:11,https://tech.sina.com.cn/it/2018-09-13/doc-ihiixyeu7026670.shtml
