,header,pub_time,url
0,默克尔宣布不再竞选党魁 盟友党派党魁或遭牵连,10-30 18:37,http://www.chinanews.com/gj/2018/10-30/8663937.shtml
1,澳塑料袋禁令引不满 部分购物者偷拿超市塑料袋,10-30 17:45,http://www.chinanews.com/gj/2018/10-30/8663898.shtml
2,澳大利亚建立航天咨询委员会 推动经济与就业发展,10-30 17:29,http://www.chinanews.com/gj/2018/10-30/8663893.shtml
3,加拿大跨山输油项目停滞 原油价格跌成“白菜价”,10-30 17:20,http://www.chinanews.com/gj/2018/10-30/8663883.shtml
4,巴西大选第二轮投票：弃权票超三成 候选人差距小,10-30 17:10,http://www.chinanews.com/gj/2018/10-30/8663885.shtml
5,调查：巴西大选影响该国绝大多数投资者决策,10-30 17:10,http://www.chinanews.com/gj/2018/10-30/8663884.shtml
6,印尼狮航坠机搜救第二日：重点搜寻“黑匣子”,10-30 17:09,http://www.chinanews.com/gj/2018/10-30/8663759.shtml
7,巴西当选总统博尔索纳罗：将组建正直廉洁的政府,10-30 17:04,http://www.chinanews.com/gj/2018/10-30/8663877.shtml
8,想与“隔壁老王”聊聊天？新型社交软件登陆澳洲,10-30 16:59,http://www.chinanews.com/gj/2018/10-30/8663873.shtml
9,新闻分析：日印强化合作难掩分歧,10-30 16:56,http://www.chinanews.com/gj/2018/10-30/8663868.shtml
10,日防卫省：将重启美军冲绳基地搬迁工程,10-30 16:34,http://www.chinanews.com/gj/2018/10-30/8663823.shtml
11,调查报告称党派极化主导当今美国 两党对立日趋严重,10-30 16:34,http://www.chinanews.com/gj/2018/10-30/8663838.shtml
12,日外相：东京绝对无法接受韩劳工索赔案判决结果,10-30 16:17,http://www.chinanews.com/gj/2018/10-30/8663796.shtml
13,韩国统一部：等待朝方就艺术团访韩日程表态,10-30 16:13,http://www.chinanews.com/gj/2018/10-30/8663789.shtml
14,中国代表：国际社会应继续向叙人民提供资金物资援助,10-30 15:51,http://www.chinanews.com/gj/2018/10-30/8663763.shtml
15,5300年前就有巧克力？厄瓜多尔考古遗址内发现可可粉,10-30 15:43,http://www.chinanews.com/gj/2018/10-30/8663737.shtml
16,韩最高法判日企承担强征韩籍劳工赔偿责任,10-30 15:39,http://www.chinanews.com/gj/2018/10-30/8663738.shtml
17,中国援建的柬埔寨考斯玛中柬友谊医院开建,10-30 14:52,http://www.chinanews.com/gj/2018/10-30/8663671.shtml
18,法兰克福发现一枚二战遗留炸弹 上万居民紧急疏散,10-30 14:35,http://www.chinanews.com/gj/2018/10-30/8663651.shtml
19,帕克探测器打破纪录 成为最接近太阳的人造物体,10-30 14:33,http://www.chinanews.com/gj/2018/10-30/8663620.shtml
20,逾千名因台风“玉兔”滞留塞班中国游客撤离回国,10-30 14:17,http://www.chinanews.com/gj/2018/10-30/8663618.shtml
21,意大利多地极端天气已致6人丧生,10-30 14:04,http://www.chinanews.com/gj/2018/10-30/8663601.shtml
22,叙外长称土耳其不愿履行非军事区有关义务,10-30 14:02,http://www.chinanews.com/gj/2018/10-30/8663597.shtml
23,新西兰地震：上万人有震感 国会运作短暂中止,10-30 14:00,http://www.chinanews.com/gj/2018/10-30/8663582.shtml
24,乌兹别克斯坦一副总理因强迫他人劳动被解除职务,10-30 13:58,http://www.chinanews.com/gj/2018/10-30/8663595.shtml
25,印尼：失事客机未发生空中爆炸 已打捞起部分遇难者遗体,10-30 13:43,http://www.chinanews.com/gj/2018/10-30/8663580.shtml
26,最新民调：美国中期选举在即 特朗普支持率跌至40%,10-30 13:42,http://www.chinanews.com/gj/2018/10-30/8663578.shtml
27,“默克尔时代”开始落幕　德政局增添不确定性,10-30 13:32,http://www.chinanews.com/gj/2018/10-30/8663568.shtml
28,悉尼为圣诞节预热 全新活动感受南半球圣诞节魅力,10-30 13:31,http://www.chinanews.com/gj/2018/10-30/8663567.shtml
29,默克尔萌生退意掀起德国领袖争夺战 谁来接她班？,10-30 13:30,http://www.chinanews.com/gj/2018/10-30/8663566.shtml
30,巴西一休假警察酒后枪支走火不慎射杀好友 直接拔枪自杀,10-30 13:30,http://www.chinanews.com/gj/2018/10-30/8663564.shtml
31,日本公司开发无人驾驶虚拟测试环境,10-30 13:23,http://www.chinanews.com/gj/2018/10-30/8663557.shtml
32,俄维修航母的船坞沉入水中,10-30 13:20,http://www.chinanews.com/gj/2018/10-30/8663554.shtml
33,印尼狮航失事客机搜救工作继续,10-30 13:15,http://www.chinanews.com/gj/2018/10-30/8663550.shtml
34,因交通堵塞没赶上失事客机 印尼男子“捡回一命”,10-30 12:46,http://www.chinanews.com/gj/2018/10-30/8663540.shtml
35,希腊西南部海域发生5.6级地震 震源深度10公里,10-30 12:22,http://www.chinanews.com/gj/2018/10-30/8663525.shtml
36,意大利2019年财年预算将提交国家议会审议,10-30 12:03,http://www.chinanews.com/gj/2018/10-30/8663517.shtml
37,印尼坠毁客机搜救紧张进行 找到9具遇难者遗体,10-30 11:58,http://www.chinanews.com/gj/2018/10-30/8663500.shtml
38,叙利亚政治和解面临三道“坎”,10-30 11:29,http://www.chinanews.com/gj/2018/10-30/8663495.shtml
39,意大利拜尔拉提公司宣布破产 咖啡摩卡壶将成为历史,10-30 11:12,http://www.chinanews.com/gj/2018/10-30/8663472.shtml
40,意大利极恶劣天气致10人死 罗马等多地学校停课,10-30 11:02,http://www.chinanews.com/gj/2018/10-30/8663466.shtml
41,泰国亿万富豪维猜骤逝 商业帝国前途面临挑战,10-30 11:01,http://www.chinanews.com/gj/2018/10-30/8663391.shtml
