,header,pub_time,url
0,人工智能行业中隐藏的“富士康”式劳动密集型产业,2小时前,https://ai.ofweek.com/news/2018-10/ART-201721-8470-30277672.html
1,人工智能可检出肺癌类型,2小时前,https://ai.ofweek.com/news/2018-10/ART-201721-8140-30277670.html
2,日本研发便当分装机器人，能以三维模式识别食物的形状,2小时前,https://ai.ofweek.com/news/2018-10/ART-201720-8140-30277667.html
3,100+高科技产业专家及大咖、5000+行业精英11月云集深圳 2019高科技未来趋势大预测！,3小时前,https://ai.ofweek.com/news/2018-10/ART-201700-8120-30277684.html
4,刷新世界纪录，云从科技AI帝国正在悄然崛起,3小时前,https://ai.ofweek.com/news/2018-10/ART-201700-8500-30277641.html
5,在AI的赛道上，老将英特尔“尚能饭否”？,3小时前,https://ai.ofweek.com/news/2018-10/ART-201714-8500-30277636.html
