,brief,header,pub_time,url
0,"营业收入 为10.747亿元人民币, 和2017年第三季度相比增长126.7%。毛利率达26.7%。归属于华米科技的净利润为1.138亿元人民币。",华米科技公布三季报：营业收入10.7亿元，同比增长126.7%,19:58,http://www.tmtpost.com/nictation/3611958.html
1,根据通知要求，拟挂牌企业名单于11月23日中午前上报。相关表格显示，推荐企业要在全球或者国内行业地位明显，企业不限于盈利但收入具备一定规模。,科创板拟挂牌企业名单征集结束，要求推荐企业行业地位明显,19:52,http://www.tmtpost.com/nictation/3611948.html
2,2018年度青年科学家奖揭晓，师从施一公的清华大学博士后万蕊雪，因剪接体三维结构及RNA剪接方面的研究成果成为细胞及分子生物学类别的胜出者。,清华大学博士后万蕊雪获2018年度青年科学家奖,19:44,http://www.tmtpost.com/nictation/3611937.html
3,母婴互联网公司宝宝树将于11月27日在香港主板挂牌。今日的暗盘收盘价7.18港元，较发行价6.8港元上涨5.59%。,宝宝树11月27日正式在港挂牌交易，26日暗盘较发行价收涨5.59%,19:29,http://www.tmtpost.com/nictation/3611917.html
4,据报道，近日，中科院自动化所的一位在读博士生cleardusk提出3D 实时换脸改进版本，每张图像的推理时间仅需约0.27 ms。,中科院博士生提出3D实时换脸改进版本,19:08,http://www.tmtpost.com/nictation/3611890.html
5,南方科技大学发声明称，学校对贺建奎的研究并不知情，后者的研究严重违背了学术伦理和学术规范。学校将立即聘请权威专家成立独立委员会进行深入调查。,南科大：贺建奎2月已停薪留职，学校对其研究并不知情,19:03,http://www.tmtpost.com/nictation/3611884.html
6,工商银行发布公告称，拟出资不超过160亿元，发起设立全资子公司工银理财有限责任公司。,工商银行拟不超160亿元发起设立理财子公司,18:56,http://www.tmtpost.com/nictation/3611874.html
7,负责人表示：“智能客服预装了多行业的知识库，无需商家投入大量人力进行训练，即开即用。”内测这一阶段有赞将着重关注智能客服的回复及时性、回复准确度，以及辅助决策能力。,有赞AI客服上岗，人工和智能模式可自由切换,18:50,http://www.tmtpost.com/nictation/3611860.html
8,北京市规划和自然资源委员会官网土地成交一览表显示，时代好未来教育科技（北京）有限公司以13.2亿元的价格拍下位于北京市昌平区的一处综合性商业金融服务业用地。,好未来13亿元于北京昌平拿地：需自持20年，与小米做邻居,18:16,http://www.tmtpost.com/nictation/3611759.html
9,日前，有门店员工集体投诉欠薪近半年，而社保早在一年前停缴。星美集团在深圳开设有12家电影院，如今只剩4家门店正常营运。,星美集团影院深圳门店大半已停业，还遭员工讨薪,18:13,http://www.tmtpost.com/nictation/3611755.html
10,据App Annie数据显示，在2018年10月中国iOS下载量榜单中，今日头条系的抖音短视频和轻颜相机分别位居第一和第二，腾讯的PUBG位列第三。,10月我国iOS下载榜单：头条系抖音短视频和轻颜相机分列一、二,18:08,http://www.tmtpost.com/nictation/3611746.html
11,装修平台优居客今日宣布，由于经营不善而财务状况严重恶化，决定自11月26日起进入解散清算程序，解除与所有员工的劳动关系，公司现有地址自即日起正式关闭。,优居客宣布即日起破产清算，解除与所有员工劳动关系,17:48,http://www.tmtpost.com/nictation/3611713.html
12,"疑点1：核心技术发明团队或早已呼吁暂停使用该技术；

疑点2：该项技术背后研究团队或为莆田系医院；

疑点3：审查申请书签名或为伪造。",基因编辑婴儿刷屏3大疑点引争议，监管已介入调查,17:46,http://www.tmtpost.com/nictation/3611709.html
13,今日头条反谣言官方头条号“头条辟谣”宣布，推出“谣零零”反谣言计划，汇聚社会力量打击谣言。,今日头条推出“谣零零”反谣言计划,17:32,http://www.tmtpost.com/nictation/3611683.html
14,云米今日发布了截至9月30日的2018财年第三季度财报，净营收为人民币5.653亿元(约合8230万美元)，同比增长170.9%。,云米三季度营收5.7亿，同比增长171%,17:23,http://www.tmtpost.com/nictation/3611669.html
15,在身份识别与验证、影像识别、智能风控、精准营销等多个领域，商汤科技将应用计算机视觉和深度学习原创技术，提供最优解决方案。,商汤科技与东亚中国签署战略合作协议,17:06,http://www.tmtpost.com/nictation/3611637.html
16,贝托鲁奇曾凭借执导的爱情片《巴黎最后的探戈》获得第46届奥斯卡金像奖最佳导演提名。1987年，他执导了传记片《末代皇帝》。,曾执导过《末代皇帝》的意大利知名导演贝托鲁奇去世，终年77岁,17:05,http://www.tmtpost.com/nictation/3611635.html
17,“一旦药店分级管理全面实施，最多只有1/6的药店可以达到AAA级别。随着药店分类分级管理制度的推行，45万多家药店预计超过一半会倒闭。”,零售药店分类分级管理将推行，45万多家药店过半或倒闭,16:42,http://www.tmtpost.com/nictation/3611592.html
18,我国科幻产业中，影视产业产值占据较大比重，仅2018年上半年，国内科幻电影整体票房就达到95.06亿元。此外，与2017年相比，科幻阅读市场也有所反弹。,今年上半年，中国科幻产业产值接近100亿元,16:38,http://www.tmtpost.com/nictation/3611581.html
19,最新数据显示，截至今年10月底，中国移动已围绕5G技术提交发明专利申请近1000件，跃居全球运营商第一阵营。,国资委:中移动5G专利申请量跃居全球运营商第一阵营,16:17,http://www.tmtpost.com/nictation/3611548.html
20,具体包括：新一代信息技术产业、高端装备制造产业、新材料产业、生物产业、新能源汽车产业、新能源产业、节能环保产业、数字创意产业、相关服务业等9大领域。,国家统计局发布战略性新兴产业分类，包括九大领域,16:15,http://www.tmtpost.com/nictation/3611545.html
21,公司已于今年11月获得逾1.6亿元人民币B轮融资，此轮融资由启明创投领投、DCM、光速中国跟投，创造了在中国劳动力管理市场上单笔最高的B轮融资。,哦趣获得逾1.6亿元B轮融资,15:53,http://www.tmtpost.com/nictation/3611517.html
22,软银集团旗下成立仅一年半的软银科技愿景基金，目前已在印度投资50亿美元，在Paytm公司14亿美元的投资，则是软银科技愿景基金目前在印度最大的一笔投资。,软银科技愿景基金已在印度投资50亿美元，最大一笔14亿美元,15:47,http://www.tmtpost.com/nictation/3611507.html
23,他们分别是北青网总经理陈静，运营副总经理皮涵冰，政务副总经理司秀琴，技术总监杜梅娟，她们均已于近期离职，暂未透露离职原因，也未透露去向。,北青网发生剧烈人事动荡，四位高管集体离职,15:44,http://www.tmtpost.com/nictation/3611503.html
24,深圳和美妇儿科医院11月26日下午回应，否认该院和基因编辑婴儿有关：“这件事不属实，我们没有接受过相关信息，不知道这件事为什么会上热搜，正在调查。”,深圳和美妇儿科医院回应基因编辑婴儿事件：与医院无关,15:24,http://www.tmtpost.com/nictation/3611479.html
25,据雅虎财经报道，一群客户在加州北部地区法院，向 Bitmain 发起了集体诉讼。至少一名原告认为，客户采购服务的“初始化”过程的时间差，可以为 其带来巨大利益。,Bitmain因利用“初始化”期间的客户设备挖矿而被提告,15:20,http://www.tmtpost.com/nictation/3611471.html
26,据悉，生效法律文书确定的义务为乐视网信息技术股份有限公司于本判决生效后七日内支付崔欣爽解除劳动关系经济补偿金150267元。被执行人的履行情况为，“全部未履行”。,前公关15万经济补偿案发，乐视网再被列为“老赖”,15:17,http://www.tmtpost.com/nictation/3611464.html
27,张峰指出，工业互联网下一步工作，一是提升技术产业能力，夯实持续发展基础。二是壮大应用市场，拓展融合发展空间。三是深化多方协同，持续优化产业生态。,工信部总工程师张峰：我国工业互联网开局良好，未来前景可期,15:12,http://www.tmtpost.com/nictation/3611454.html
28,11月26日，来自中国深圳的一组学者向外界公布，一对名为露露和娜娜的基因编辑婴儿于11月在中国健康诞生，他们能天然抵抗艾滋病，中科院研究员表示完全不能接受。,激烈反弹：基因改变婴儿导致生物医学界普遍批评,15:04,http://www.tmtpost.com/nictation/3611442.html
29,据工信部数据，1-10月，我国软件和信息技术服务业完成软件业务收入50507亿元，同比增长15.1%。,1至10月软件和信息技术服务业利润总额同比增12.1%,14:56,http://www.tmtpost.com/nictation/3611426.html
30,同程艺龙香港上市首日涨幅扩大至20%，腾讯、携程分别为其第一和第二大股东。腾讯涨2%，股价逼近300港元。,同程艺龙香港上市首日涨幅扩大至20%,14:45,http://www.tmtpost.com/nictation/3611409.html
31,三菱汽车董事会将于当地时间周一下午16点30分开会，解除卡洛斯-戈恩的董事长职务，上周戈恩因涉嫌财务不端被捕，并已被合作伙伴日产汽车解除了董事长职务。,三菱汽车将解除戈恩董事长职务,14:12,http://www.tmtpost.com/nictation/3611346.html
32,奇瑞捷豹路虎将在现有常熟20万辆燃油车年产能基础上，新建新能源动力总成工厂和全新车身车间；同时还将新建研发中心、研发测试设施和研发测试赛道等。,奇瑞捷豹路虎投资70亿进军新能源,13:56,http://www.tmtpost.com/nictation/3611322.html
33,《监管办法》明确，一手新房备案价超过15%就必须备案变更，人均租住建筑低于6O禁止出租。,深圳租房拟推行实名租赁制，人均面积不得低于6O,13:53,http://www.tmtpost.com/nictation/3611319.html
34,微软对Android端Edge浏览器进行了更新，最新版本号为42.0.0.2801。根据更新日志显示，新版Edge可以创建新的收藏夹，并改善了可视化搜索体验等。,微软对Android端Edge浏览器进行更新，强化可视化搜索功能,13:46,http://www.tmtpost.com/nictation/3611308.html
35,西安卫星测控中心某地面站目前正在加紧开展北斗三号地面站系统建设调试。据悉，北斗三号基本导航系统建成在即，与之对应的地面站建设也已进入了冲刺阶段。,"西安卫星测控中心开展""北斗三号""地面站系统建设",13:34,http://www.tmtpost.com/nictation/3611290.html
36,在今天发布的声明中，罗技公司表示，尽管它已经与Plantronics（缤特力）就潜在交易进行了讨论，但还是已经终止了谈判。,22亿美元收购案宣告终止，罗技放弃收购缤特力,13:13,http://www.tmtpost.com/nictation/3611267.html
37,苹果本周将前往美国最高法院提起上诉，以阻止一群iPhone客户以滥用垄断地位为由起诉这家科技巨头。,苹果将向美最高院上诉，以捍卫其应用商店提成30%权利,13:08,http://www.tmtpost.com/nictation/3611256.html
38,微软与大疆达成了一项新的合作协议：微软将为其研发一款全新的SDK套件，能够让Windows 10 PC直接对大疆的无人产品进行完整的飞行操控，并进行实时数据传输。,微软宣布与大疆合作，开发无人机云端后台SDK等解决方案,12:59,http://www.tmtpost.com/nictation/3611242.html
39,沃达丰的物联网网络将对该类车载资通讯技术研发起到支撑作用。这一服务依赖于沃达丰提供的内置网络功能，可提供实时交通信息、停车及定位服务、车载诊断及语音控制功能。,现代起亚携手沃达丰开展车联网技术合作,12:53,http://www.tmtpost.com/nictation/3611232.html
40,软银集团向争夺旗下电信业务IPO交易的银行索要贷款。之所以有这种底气，主要是因为该公司为各大金融机构创造了不菲的收入。,软银旗下电信业务即将IPO，向参与承销商索要贷款,12:31,http://www.tmtpost.com/nictation/3611209.html
41,阿里巴巴集团CEO张勇宣布阿里最新一次组织升级：阿里云升级为阿里云智能；天猫升级为“大天猫”；陈丽娟（花名：浅雪）带领的阿里人工智能实验室进入集团创新业务事业群。,阿里组织架构调整：阿里云升为阿里云智能，天猫升级为大天猫,11:54,http://www.tmtpost.com/nictation/3611160.html
42,微信官方宣布已对3312个混淆名称的公众号和小程序进行名称清除，对3326个混淆名称的公众号和小程序进行相关能力封禁。,微信宣布处置近七千公众号与小程序：清除名称或封禁,11:34,http://www.tmtpost.com/nictation/3611131.html
43,加拿大移民部（IRCC）在官网对外宣布：现在开始，中国游客可以自主选择提交芝麻信用签证报告，用作财务及履约能力证明，而不用再跑银行去打印流水单和存款证明了。,加拿大移民部：签证认可芝麻信用分用作财务及履约能力证明,11:12,http://www.tmtpost.com/nictation/3611094.html
44,沃尔沃宣布，他们的首个商用无人驾驶卡车项目落地挪威的Kalk矿井，这些无人驾驶卡车将会在港口与矿井间往返运输矿石。,沃尔沃落地首个矿山无人驾驶卡车运输服务,11:02,http://www.tmtpost.com/nictation/3611080.html
45,工业和信息化部向中国电信、中国移动、中国联通、中国信息通信研究院、移动通信转售企业发出通知，要求移动通信转售企业进一步做好物联网行业卡安全管理，切实管好物联网行业卡。,工信部要求相关企业进一步做好物联网行业卡安全管理,10:59,http://www.tmtpost.com/nictation/3611073.html
46,免疫系统创新抗体药物研发商鑫康合，完成1.15亿人民币A轮融资，投资方为北极光创投领投，荷塘投资、翼朴资本、元生创投等跟投。,免疫系统创新抗体药物研发商鑫康合完成1.15亿人民币A轮融资,10:31,http://www.tmtpost.com/nictation/3611027.html
47,“数字化保护与传承不是要拯救传统文化，而是要让传统文化在数字化时代实现新的绽放，数字化不仅是迁移的工具，更是创造新文化的手段。”,腾讯程武：新文创要敬畏传统，也要消费者买账,10:31,http://www.tmtpost.com/nictation/3611026.html
48,专注城市物流专车配送的驹马集团正式宣布已完成C轮15亿元融资，由普洛斯、远洋资本等知名投资机构联合投资。,城市物流专车配送公司驹马集团宣布已完成C轮15亿元融资,10:21,http://www.tmtpost.com/nictation/3610985.html
49,教育部开发的全国中小学生校外培训机构管理服务平台即将上线，各地审批的全国中小学生校外培训机构有望通过平台实现联网查询。,校外培训机构管理平台即上线，整改率近60%,10:13,http://www.tmtpost.com/nictation/3610970.html
50,山西帷幄智能科技有限公司投入5000万元、自主研发并拥有完全自主知识产权的“城市级静态交通大数据平台”在太原上线。,全国首个城市级智慧停车平台太原上线,09:57,http://www.tmtpost.com/nictation/3610942.html
51,宝宝树发布公告称，按发售价每股发售股份6.80港元计算，经扣除承销费用及佣金和全球发售应付的估计开支，宝宝树将收取的全球发售所得款项净额估计约为16.09亿港元。,宝宝树赴港上市：发行价6.8港元 全球融资约16亿港元,09:46,http://www.tmtpost.com/nictation/3610922.html
52,同程艺龙IPO首日高开10%，报10.78港元,同程艺龙IPO首日高开10%，报10.78港元,09:34,http://www.tmtpost.com/nictation/3610898.html
53,比亚迪的一位高管称，已搁置开设其首家加拿大电动卡车生产厂的计划，但可能在商业理由充足时重启该项目。 比亚迪原计划今年开设这家位于安大略省、员工人数约为40人的工厂。,传比亚迪搁置在加拿大开设电动卡车生产厂的计划,09:08,http://www.tmtpost.com/nictation/3610859.html
54,商务部市场秩序司就《全国零售药店分类分级管理指导意见》征求意见，提出将零售药店划分为三个类别,全国零售药店拟分类分级,08:57,http://www.tmtpost.com/nictation/3610848.html
55,Deliveroo可能正在商洽新一轮5亿美元融资，估值可达40亿美元。这一轮融资目前仍处于初步阶段。,外卖公司Deliveroo拟融资5亿美元，估值达40亿美元,08:49,http://www.tmtpost.com/nictation/3610839.html
56,这些机密文档可能包含马克・扎克伯格（Mark Zuckerberg）与其他高管之间的沟通邮件，表明该公司了解其隐私政策中的漏洞，并允许外界主动利用这些漏洞。,英议会截走FB内部文件：隐私漏洞被高管用来吸引广告,08:41,http://www.tmtpost.com/nictation/3610827.html
57,此前据外媒消息称，HTC已取消2019年上半年的旗舰产品计划。据台媒《电子时报》消息，HTC官方已经对此做出回应，不会放弃其手机业务。,HTC：不会退出手机市场，年底前推新机,08:37,http://www.tmtpost.com/nictation/3610820.html
58,比特币下探至3500美元，全球数字货币市场再现集体大幅杀跌，市值较顶点的8500亿美元市场规模缩水超过85%。,比特币下挫延续难言见底，数字货币市场规模缩水超八成,08:16,http://www.tmtpost.com/nictation/3610783.html
59,美国国家航空航天局可能会为此向每位乘客收取数百万美元的费用以提供太空旅游，让他们搭载波音公司和SpaceX公司开发的宇宙飞船前往空间站。,美国国家航空航天局（NASA）正考虑向公众提供太空旅游服务,07:53,http://www.tmtpost.com/nictation/3610757.html
60,审核结果显示，三十名非用户普通债权人的确认债权共计1920余万元，其中仅梅州市凯达共享单车有限公司确认的债券就近1400万元。,小鸣单车最新破产审核结果：欠债近2000万元,07:38,http://www.tmtpost.com/nictation/3610745.html
61,截至2018年11月25日14时05分，2018年中国电影票房达到559亿元，超越2017年全年成绩，创下国内市场新纪录。,年内票房破559亿元创新纪录，国产片包揽票房前三,07:28,http://www.tmtpost.com/nictation/3610738.html
62,我国跨境电商零售进口过渡期政策细则文件将很快落地，其中备受业内和消费者关注的跨境零售进口扩围税目清单发布在即。,跨境电商进口扩围产品清单将发布,07:22,http://www.tmtpost.com/nictation/3610731.html
63,,三星Galaxy S10将搭载超声波屏幕指纹：供应商为高通,16:49,http://www.tmtpost.com/nictation/3609673.html
64,,QQ安全功能升级，将不再提供单独账号申诉入口,16:31,http://www.tmtpost.com/nictation/3609651.html
65,微信已经3312个混淆名称的公众号和小程序进行名称清除，对3326个混淆名称的公众号和小程序进行相关能力封禁。,因故意混淆名称，微信封杀6千余个公众号、小程序,16:30,http://www.tmtpost.com/nictation/3609649.html
66,LG最近向欧盟知识产权局注册了三个属于Class 9产品（包含智能手机）的商标，即Flex、Foldi、Duplex，很可能是为了可折叠屏手机准备的。,LG为可折叠式装置注册3个商标：Flex、Foldi和Duplex,16:30,http://www.tmtpost.com/nictation/3609648.html
67,,日产曾就戈恩违规行为秘密展开内部调查,16:18,http://www.tmtpost.com/nictation/3609633.html
68,阿里巴巴副总裁、盒马鲜生创始人&CEO侯毅再回应“标签门”。,盒马CEO侯毅再谈“标签门”：是我们管理工作没做到位,16:07,http://www.tmtpost.com/nictation/3609619.html
69,,上海超过四成进出口来自自贸区,16:00,http://www.tmtpost.com/nictation/3609610.html
