,brief,header,pub_time,url
0,多名员工称，从未见过林宇，甚至不知此人是谁，而史文勇系公司高管，近期出差不在北京。,探访网秦办公地，员工：林宇是谁？从没见过他,19:09,http://m.tmtpost.com/nictation/3470248.html
1,大众汽车已承认系统性的尾气排放作弊行为，但否认在监管披露方面有不法行为。,大众汽车因柴油车排放丑闻遭起诉，投资者索赔百亿美元,19:00,http://m.tmtpost.com/nictation/3470234.html
2,董事长张勇表示，新技术的运用会解决一些食品安全问题。如果厨房都自动化生产的时候，我们可以把现场管理风险降到最低。,海底捞回应食品安全问题：用新技术解决难题,18:57,http://m.tmtpost.com/nictation/3470229.html
3,科大讯飞回应：“公司向快如科技提供语音技术，暂无投资该公司的计划。”,科大讯飞称，向子弹短信提供语音技术，但暂无投资计划,18:23,http://m.tmtpost.com/nictation/3470186.html
4,9月11日消息，北京互联网金融行业协会秘书长一职或将发生变动，原秘书长郭大刚将卸职。,北京互金协会秘书长将更替：郭大刚卸职，王思聪接任,18:15,http://m.tmtpost.com/nictation/3470176.html
5,马云回答说，“总统先生，我不年轻了，昨天刚好在俄罗斯过了54岁生日。我创业19年，做了一些事，但还有更多热爱的事想做。,普京问为何要“退休”，马云：还有很多热爱的事想做,17:56,http://m.tmtpost.com/nictation/3470151.html
6,2018年中国国际信息通信展览会将于9月底将在北京国家会议中心举行，会议期间将发布我国5G技术研发试验第三阶段测试成果。,5G试验第三阶段测试成果9月底将发布,17:53,http://m.tmtpost.com/nictation/3470146.html
7,数据显示，截至2018年8月31日，前程无忧今年发布的1800多万个空缺岗位中，来自教育/培训行业的工作机会有82万个，占比近5%，比2017年同期增长19%。,《2018教师供需情况报告》称，年资5年以上的教师非常紧缺,17:47,http://m.tmtpost.com/nictation/3470140.html
8,9月11日消息，上周滴滴宣布启动安全大整治工作，并从9月8日开始暂停一周深夜的出行服务。有不少声音认为，这是滴滴有意为之，一家独大的滴滴想借停服的方式倒逼舆论。,分析人士：滴滴深夜停服原因是担心整改期间再出恶性事件,17:40,http://m.tmtpost.com/nictation/3470083.html
9,9月11日消息，据悉，北京市发改委于9月10号上午，就我爱我家涉嫌利用垄断操纵租金一事，对北京公司展开调查。,北京市发改委昨日突袭我爱我家，员工手机电脑当场被查验,17:18,http://m.tmtpost.com/nictation/3470105.html
10,滴滴出行表示，滴滴从未在ofo融资或借款过程中使用过否决权。,滴滴：未在ofo融资或借款过程中使用过否决权,16:39,http://m.tmtpost.com/nictation/3470021.html
11,北京市城市管理委员会首次回应“公用充电桩为何使用率低”的问题。,北京市回应公用充电桩使用率低：使用率低并不意味着没有用,16:36,http://m.tmtpost.com/nictation/3470010.html
12,9月11日消息，据知情人士透露，中国最大的运动服生产商安踏体育正在考虑一项潜在交易，拟收购Wilson网球拍和Salomon登山鞋生产商Amer Sports Oyj,知情人士：安踏体育考虑竞购市值40亿美元的芬兰公司,16:25,http://m.tmtpost.com/nictation/3469974.html
13,美图手机T9将会发布六大动漫限量版手机，这六款限量版手机已经在微博上曝光，首批设备发布时间将会在9月17日。,美图T9手机将会发布六大动漫限量版,16:21,http://m.tmtpost.com/nictation/3469968.html
14,当地时间9月10日，明尼苏达大学校报刊文批评校方不作为。,明尼苏达大学校报怒怼校方：在刘强东案中逃避责任,16:15,http://m.tmtpost.com/nictation/3469958.html
15,在普京企业家圆桌会上，俄罗斯总统普京表示，支持阿里巴巴在俄罗斯的发展。,阿里放弃俄罗斯业务控制权，成立合资企业持股48%,16:10,http://m.tmtpost.com/nictation/3469950.html
16,9月10日消息，ofo小黄车官方微博声明称，《滴滴不表态致阿里借款未到账，仅部分员工拿到工资》报道不实，公司员工工资正常发放。,ofo回应“仅部分员工拿到工资” ：报道不实，正常发放,15:56,http://m.tmtpost.com/nictation/3469931.html
17,锤子科技CEO罗永浩回应：“身份地位摆在那，看谁都像碰瓷的，可以理解。,报道称腾讯怕被子弹短信碰瓷，罗永浩回应,15:53,http://m.tmtpost.com/nictation/3469921.html
18,从9月10日开始，沉寂多年的网秦公司因两位创始人的离奇纷争再次成为焦点。,网秦两位创始人内斗：一人称遭对方绑架，一人回应对方恶意造谣,15:40,http://m.tmtpost.com/nictation/3469896.html
19,滴滴公关人员表示，“一键报警”功能还在不断更新完善当中。,被乘客投诉“一键报警”形同虚设，滴滴回应：功能尚在完善中,15:30,http://m.tmtpost.com/nictation/3469870.html
20,9月11日消息，据外媒报道，诺基亚与土耳其运营商Turkcell公司签署了一项合作协议，以开发包括物联网（IOT），智能汽车技术，在线医疗和自动化等技术。,土耳其运营商Turkcell公司与诺基亚签署5G合作协议,15:22,http://m.tmtpost.com/nictation/3469853.html
21,9月11日消息，小米手环3NFC版将于9月19日开售，售价199元。小米手环3NFC版支持小米公交功能，是目前支持交通卡最多的NFC手环。,支持164个城市公交地铁，小米手环3NFC版9月19日开售,15:19,http://m.tmtpost.com/nictation/3469849.html
22,据中汽协，中国8月份乘用车销量179万辆，同比下降4.6%，8月份汽车销量210万辆，同比下降3.8%。,中国8月乘用车销量179万辆，同比连续两月下降,15:16,http://m.tmtpost.com/nictation/3469844.html
23,OPPO 5G专家杨宁称，泛在现实（Ubiquitous Reality）将是第一阶段5G支持的特色应用之一，包括远程VR、AR和JR。,OPPO杨宁：“泛在现实”将成为5G第一阶段应用,15:14,http://m.tmtpost.com/nictation/3469840.html
24,由交通运输部、中央网信办、公安部等多部门组成的网约车、顺风车安全专项工作检查组将陆续进驻首汽约车、神州专车、曹操专车等网约车和顺风车平台，开展安全专项检查。,检查组今起进驻首汽等七家网约车顺风车平台，开展安全专项检查,14:49,http://m.tmtpost.com/nictation/3469802.html
25,马斯克宣布周三起将特斯拉的7种可选配色移除2种，以简化生产程序。,马斯克宣布，特斯拉可选配色将被移除2种,14:00,http://m.tmtpost.com/nictation/3469690.html
26,即将在香港上市的华兴资本，已经确定了首批基石投资者，其中包括蚂蚁金服、LGT（LGT Group Foundation）及雪湖资本（Snow Lake Funds）,传华兴资本首批基石投资人为蚂蚁金服、LGT、雪湖资本,13:58,http://m.tmtpost.com/nictation/3469687.html
27,根据交通运输部、公安部发出的通知，顺风车平台社交功能将被关闭。通知提到“要加强乘客信息保护，关闭顺风车平台社交功能，屏蔽乘客信息，防止泄露个人隐私。”,据有关部门最新通知，顺风车平台社交功能确认被关闭,13:18,http://m.tmtpost.com/nictation/3469624.html
28,Sonos近日公布第三财季业绩。财报显示，第三季度营收2.084亿美元同比下滑6.6%，净亏损扩大。在第三财季财报发布后，该股在盘后下跌了13.42%。,Sonos公布上市后首份财报，亏损扩大， 股价盘后大跌13%,13:11,http://m.tmtpost.com/nictation/3469614.html
29,北京市政交通一卡通公司与腾讯公司达成战略合作，自9月12日起，“北京一卡通”微信小程序将正式上线试运行。,北京5000辆公交车9月12日起可刷微信乘坐,13:08,http://m.tmtpost.com/nictation/3469611.html
30,赵薇作为合伙人的杭州普霖投资管理合伙企业（普霖投资），8月29日开始进行清算备案。清算组组长为赵薇的哥哥赵健。,赵薇投资公司普霖投资清算备案,12:55,http://m.tmtpost.com/nictation/3469594.html
31,日本最大移动运营商 NTT Docomo 已与小米达成 一项全球授权协议，该协议覆盖了 NTT 的“标准必要无线专利”,小米与日本最大移动运营商NTT达成全球授权协议,12:40,http://m.tmtpost.com/nictation/3469575.html
32,在线旅游创企Evaneos宣布获8100万美元风险投资，目前的融资总额已达到1.09亿美元，最新的这轮融资由Partech和Level Equity领投。,在线旅游创企Evaneos获8100万美元风险投资,12:31,http://m.tmtpost.com/nictation/3469564.html
33,自如官方微博发布关于空气检测及治理工作情况的说明。9月24日起，所有首次出租房源配置完成后，必须同时满足空气质量经权威机构检测合格且空置30天以上才能上架出租。,自如：首租房源须空气检测合格，空置30天才可上架,12:28,http://m.tmtpost.com/nictation/3469560.html
34,中国联通表示，中国联通与腾讯、华为等合作伙伴共同实现了5G高清视频切片业务，能够实现5G切片从业务定制、资源分配、网络构建到业务呈现的全生命周期管理流程。,中国联通称，已与合作伙伴实现5G高清视频切片业务,12:12,http://m.tmtpost.com/nictation/3469539.html
35,阿里巴巴内部人士表示，没有借钱这回事。ofo方则称其为不实消息。,阿里巴巴与ofo均否定借钱传闻,12:11,http://m.tmtpost.com/nictation/3469537.html
36,数据显示，2018年上半年，中国TMT企业IPO数量锐减，共有26起IPO，环比下降47%；融资金额578亿元，环比上涨15%。,普华永道：2018上半年26家中国TMT企业IPO下降47%,11:51,http://m.tmtpost.com/nictation/3469512.html
37,特斯拉正通过各种方法提升Model 3产量和交付的现况。为了提升交付效率，特斯拉正在测试一种全新的交付Model 3的方式，即从工厂直接送到用户家中，省去中间环节。,特斯拉给出能立即交车的购车方案，提升Model 3交付量,11:49,http://m.tmtpost.com/nictation/3469509.html
38,Facebook宣布旗下的即时聊天应用WhatsApp登陆印度手机平台KaiOS。在新版WhatsApp中，KaiOS用户能够快速收发信息，发送照片、视频和语音信息。,Facebook宣布WhatsApp登陆印度第二大移动系统KaiOS,11:30,http://m.tmtpost.com/nictation/3469481.html
39,有知情人士透露，近期小黄车ofo再次获得一笔来自阿里巴巴的借款，数额在6000万元左右。,传ofo获得一笔阿里巴巴借款，约6000万元,11:27,http://m.tmtpost.com/nictation/3469476.html
40,9月10日，腾讯与北京荷风艺术基金会共同发起的艺术教育公益项目“艺术行动”线上课程开课。钢琴演奏家郎朗通过线上微课《郎朗的三分钟音乐故事》，讲述了经典童谣背后的故事。,腾讯发起的艺术公益线上课程开课，郎朗亲自录制全程把关,11:04,http://m.tmtpost.com/nictation/3469444.html
41,苹果公司的原创内容Carpool Karaoke（《拼车卡拉OK》）在今年的艾美创意艺术奖获得了最佳综艺短节目的奖项。这是苹果第一次在艾美奖获得原创内容类的奖项。,苹果原创节目《拼车卡拉OK》获艾美奖,10:48,http://m.tmtpost.com/nictation/3469422.html
42,抖音短视频官方公布了对违规账号及内容的处罚通告，其中，2018年8月1日至8月31日，抖音平台累计清理40385条视频，10528个音频,抖音公布违规处罚，下架“灵车漂移”等249个挑战,10:41,http://m.tmtpost.com/nictation/3469413.html
43,日本芯片制造商瑞萨电子周二表示，已同意以约67亿美元收购美国同业IDT，旨在与英伟达和英特尔在自动驾驶汽车技术方面展开竞争。,日本瑞萨电子将以67亿美元收购美国芯片商IDT,10:31,http://m.tmtpost.com/nictation/3469400.html
44,“抖音短视频”诉“伙拍小视频”信息网络传播权纠纷成为北京互联网法院受理的第一起案件。据悉，抖音方面控告伙拍小视频私自搬用抖音上签订独家协议作者的原创短视频。,抖音起诉百度旗下“伙拍”，成北京互联网法院第一案,10:25,http://m.tmtpost.com/nictation/3469390.html
45,据彭博社报道，奔驰母公司戴姆勒（Daimler）正在开发一种可以在载人和货物运输之间切换的电动自动驾驶汽车。,戴姆勒开发模块化电动自动驾驶汽车，能载人也能运货,10:07,http://m.tmtpost.com/nictation/3469355.html
46,美国无线运营商AT&T宣布，三星、爱立信和诺基亚将为其提供5G网络设备。,AT&T确认三星、爱立信以及诺基亚为其5G设备供应商,09:55,http://m.tmtpost.com/nictation/3469338.html
47,百度智能小程序近日在一个闭门式小型开发者论坛上称，百度智能小程序将在四季度全面开放智能小程序申请。目前，百度智能小程序仍在公测期内。,百度智能小程序将在四季度全面开放申请,09:38,http://m.tmtpost.com/nictation/3469316.html
48,中国时尚眼镜品牌LOHO和大钲资本联合宣布，LOHO已于近日完成近1亿美元的C轮融资，由大钲资本投资。,时尚眼镜LOHO获近1亿美元融资，新零售领域再现准独角兽,09:30,http://m.tmtpost.com/nictation/3469304.html
49,“快狗打车App”创始人兼董事长陈小华表示，企业未来两个季度将在12个城市投入10000辆新能源货车助力绿色出行，同时还会与菜鸟物流在新能源运力方面展开深度合作。,快狗打车发布新战略，将投入万辆新能源货车,09:25,http://m.tmtpost.com/nictation/3469291.html
50,北京苏宁易购与卜蜂莲花昨日宣布双方将围绕北京地区卜蜂莲花门店的家电3C专区进行深度合作经营。根据计划，年底前北京苏宁易购将陆续完成北京地区所有卜蜂莲花门店的重装改造。,北京苏宁易购将入驻卜蜂莲花，未来或在非电品类展开合作,09:17,http://m.tmtpost.com/nictation/3469273.html
51,华兴资本已初步确定超豪华的基石阵容，拥有定价的“意见领袖”效应，也为华兴资本的IPO保驾护航。本次IPO将于9月27日正式香港上市。,华兴资本9月27日正式香港上市,08:59,http://m.tmtpost.com/nictation/3469246.html
52,谷歌宣布，目前担任谷歌云AI/ML首席科学家的李飞飞将转为担任谷歌云AI/ML顾问，卡耐基梅隆大学计算机学院院长Andrew Moore将负责谷歌云AI业务。,李飞飞转任谷歌云顾问，工作重心将重新转回学术界,08:46,http://m.tmtpost.com/nictation/3469222.html
53,Uber宣布已聘请前可口可乐营销高级副总裁Rebecca Messina担任公司的首席营销官，这是Uber第一任首席营销官，其将与国际营销团队合作推动优步的品牌和营销策略,Uber任命可口可乐Rebecca Messina为第一任首席营销官,08:36,http://m.tmtpost.com/nictation/3469209.html
54,由前雅虎公司的海外投资组成的控股公司Altaba，将通过出售其持有的所有雅虎股票融资约43.4亿美元。,Altaba将出售所有雅虎日本股票，融资43亿美元,08:28,http://m.tmtpost.com/nictation/3469199.html
55,据港交所公告显示，周一，腾讯以312-321.2元水平内，回购12.4万股，涉资3910.8万港元。今年以来共计回购14.67万股，占公司股本0.0015%。,腾讯斥逾3900万元连续第二日回购，ADR仍创新低,08:02,http://m.tmtpost.com/nictation/3469171.html
56,特斯拉股价继上周五因受高管离职影响大跌之后，本周一收涨8.46%。此前包括Baird和Bernstein表示，该公司能够实现2018年下半年目标。,被两家簧炭春茫特斯拉涨收8.46%,07:54,http://m.tmtpost.com/nictation/3469163.html
57,连锁便利店7-Eleven今天宣布其美国境内全部 10000 余家店面将开始接受Apple Pay和Google Pay支付。,连锁便利店7-eleven今起在美国接受Apple Pay和Google Pay,07:34,http://m.tmtpost.com/nictation/3469140.html
58,芯片厂商英特尔周一对外宣布，其收购了总部位于加州圣何塞的NetSpeed Systems公司，收购价格暂未披露。,英特尔宣布收购NetSpeed，降低芯片设计成本,07:14,http://m.tmtpost.com/nictation/3469119.html
59,9月10日消息，今日华谊兄弟澄清称，公司实际控制人王忠军和王忠磊在公司正常履职，“已被通缉”、“以刑事犯罪被通缉”等内容纯属不实信息。,华谊兄弟：公司实际控制人王忠军、王忠磊“被通缉”消息不实,23:11,http://m.tmtpost.com/nictation/3468630.html
