,brief,header,pub_time,url
0,印度数字支付公司PhonePe宣布完成了一笔45.2亿卢比（约合6600万美元）的新一轮融资，投资方为本土知名电商Flipkart。截至目前，该公司已经获得了总计约1.43亿美元的风险投资。7月份，PhonePe在印度统一支付接口（UPI）交易中完成了9400万笔交易，占到所有统一支付接口交易量的40%（亿邦动力网）,印度数字支付公司PhonePe宣布完成了约6600万美元的新一轮融资,2018-08-11 18:08,http://www.ebrun.com/20180811/291483.shtml
1,今日，“世界科技创新论坛” 在北京举办。在“人工智能的标准化革命”论坛会议上，商汤科技联合创始人杨帆认为，人工智能做的是信息的采集、存储、分析计算、传输和反馈的行业，所以它必然是可长期发展的事业。中国对新技术的态度非常包容，中国企业也将在这样环境下获得快速发展。（新浪）,商汤科技联合创始人杨帆：人工智能不是风口 是长期发展事业,2018-08-11 17:59,https://tech.sina.com.cn/i/2018-08-11/doc-ihhqtaww8755671.shtml
2,8月10日，中国影市再度迎来火爆场面。根据猫眼数据显示，这一天中国电影单日总票房高达5.8亿，一举创下了在春节档和情人节档之外的最高单日票房记录，也成为历年暑期档里的单日票房最高纪录。（腾讯一线）,暑期档单日票房5.8亿创纪录《一出好戏》居第一,2018-08-11 16:10,http://ent.qq.com/a/20180811/044059.htm
3,新三板披露数据显示，自今年1月15日实施市场分层、交易制度等新政策以来，截至10日收盘，新三板挂牌公司累计成交金额535.55亿元。在交易方式方面，本周新三板挂牌公司成交15.08亿元，较上周下降0.71%。在指数方面，新三板两大指数持续走弱。（新华网）,新政策实施以来 新三板挂牌公司成交金额超530亿元,2018-08-11 15:53,http://www.xinhuanet.com/2018-08/11/c_1123255874.htm
4,36氪获悉，根据一份来自美国 SEC 的文件显示，国外二手交易平台「OfferUp」已开启新一轮融资，期望寻求 1.5 亿美元的现金，目前已从 15 位投资人手中成功募集 3900 万美元 。其 CEO Nick Huzar 表示，本轮融资将用于市场的快速扩张并招募顶尖人才，接下来 OfferUp 将会进行规模化复制并找到通往盈利的道路。,二手交易平台OfferUp正寻求新一轮 1.5 亿美元的股权融资,2018-08-11 14:51,https://36kr.com/p/5147711.html
5,8月11日消息，在今年9月份将召开的苹果秋季新品发布会上，苹果会带来三款新iPhone，屏幕尺寸分别为5.8英寸、6.1英寸(LCD屏、单摄)、6.5英寸。近日国外媒体又曝光出了新iPhone的价格信息，和去年发布的iPhone 8、iPhone 8Plus、iPhone X价格一样，新iPhone的价格也将锁定在699美元、899美元、999美元这三个档位。（techweb）,9月新品发布会上苹果将带来三款新iPhone,2018-08-11 14:41,http://www.techweb.com.cn/phone/2018-08-11/2694012.shtml
6,36氪讯，8月11日，北京居然之家家居连锁集团与盒马牵手后的首个门店今日正式落地居然之家顺义店。盒马顺义店面积约4300平米，拥有产品超过7000款。通过全球采购体系盒马可以从近百个国家采购食材，像波士顿龙虾、阿拉斯加帝王蟹、智力车厘子等特色生鲜商品都可以从盒马买到。,居然之家与盒马鲜生合作 首店今日落地北京顺义,2018-08-11 14:03,http://share.baidu.com/s?type=text&searchPic=1&sign=on&to=tsina&key=595885820&url=http://36kr.com/newsflashes/132397&title=36%E6%B0%AA%E8%AE%AF%EF%BC%8C8%E6%9C%8811%E6%97%A5%EF%BC%8C%E5%8C%97%E4%BA%AC%E5%B1%85%E7%84%B6%E4%B9%8B%E5%AE%B6%E5%AE%B6%E5%B1%85%E8%BF%9E%E9%94%81%E9%9B%86%E5%9B%A2%E4%B8%8E%E7%9B%92%E9%A9%AC%E7%89%B5%E6%89%8B%E5%90%8E%E7%9A%84%E9%A6%96%E4%B8%AA%E9%97%A8%E5%BA%97%E4%BB%8A%E6%97%A5%E6%AD%A3%E5%BC%8F%E8%90%BD%E5%9C%B0%E5%B1%85%E7%84%B6%E4%B9%8B%E5%AE%B6%E9%A1%BA%E4%B9%89%E5%BA%97%E3%80%82%E7%9B%92%E9%A9%AC%E9%A1%BA%E4%B9%89%E5%BA%97%E9%9D%A2%E7%A7%AF%E7%BA%A64300%E5%B9%B3%E7%B1%B3%EF%BC%8C%E6%8B%A5%E6%9C%89%E4%BA%A7%E5%93%81%E8%B6%85%E8%BF%877000%E6%AC%BE%E3%80%82%E9%80%9A%E8%BF%87%E5%85%A8%E7%90%83%E9%87%87%E8%B4%AD%E4%BD%93%E7%B3%BB%E7%9B%92%E9%A9%AC%E5%8F%AF%E4%BB%A5%E4%BB%8E%E8%BF%91%E7%99%BE%E4%B8%AA%E5%9B%BD%E5%AE%B6%E9%87%87%E8%B4%AD%E9%A3%9F%E6%9D%90%EF%BC%8C%E5%83%8F%E6%B3%A2%E5%A3%AB%E9%A1%BF%E9%BE%99%E8%99%BE%E3%80%81%E9%98%BF%E6%8B%89%E6%96%AF%E5%8A%A0%E5%B8%9D%E7%8E%8B%E8%9F%B9%E3%80%81%E6%99%BA%E5%8A%9B%E8%BD%A6%E5%8E%98%E5%AD%90%E7%AD%89%E7%89%B9%E8%89%B2%E7%94%9F%E9%B2%9C%E5%95%86%E5%93%81%E9%83%BD%E5%8F%AF%E4%BB%A5%E4%BB%8E%E7%9B%92%E9%A9%AC%E4%B9%B0%E5%88%B0%E3%80%82
7,近日，商务部发布了2018年第二季度《中国便利店景气指数报告》。2018年第二季度，我国便利店行业总体景气指数为70.25，高于荣枯线20.25。从整体趋势来看，波幅振动较小，行业整体表现较为稳定，处于健康发展区间。（北京商报）,盈利能力增强 便利店门店销售指数连续三季度上升,2018-08-11 13:50,http://share.baidu.com/s?type=text&searchPic=1&sign=on&to=tsina&key=595885820&url=http://36kr.com/newsflashes/132396&title=%E8%BF%91%E6%97%A5%EF%BC%8C%E5%95%86%E5%8A%A1%E9%83%A8%E5%8F%91%E5%B8%83%E4%BA%862018%E5%B9%B4%E7%AC%AC%E4%BA%8C%E5%AD%A3%E5%BA%A6%E3%80%8A%E4%B8%AD%E5%9B%BD%E4%BE%BF%E5%88%A9%E5%BA%97%E6%99%AF%E6%B0%94%E6%8C%87%E6%95%B0%E6%8A%A5%E5%91%8A%E3%80%8B%E3%80%822018%E5%B9%B4%E7%AC%AC%E4%BA%8C%E5%AD%A3%E5%BA%A6%EF%BC%8C%E6%88%91%E5%9B%BD%E4%BE%BF%E5%88%A9%E5%BA%97%E8%A1%8C%E4%B8%9A%E6%80%BB%E4%BD%93%E6%99%AF%E6%B0%94%E6%8C%87%E6%95%B0%E4%B8%BA70.25%EF%BC%8C%E9%AB%98%E4%BA%8E%E8%8D%A3%E6%9E%AF%E7%BA%BF20.25%E3%80%82%E4%BB%8E%E6%95%B4%E4%BD%93%E8%B6%8B%E5%8A%BF%E6%9D%A5%E7%9C%8B%EF%BC%8C%E6%B3%A2%E5%B9%85%E6%8C%AF%E5%8A%A8%E8%BE%83%E5%B0%8F%EF%BC%8C%E8%A1%8C%E4%B8%9A%E6%95%B4%E4%BD%93%E8%A1%A8%E7%8E%B0%E8%BE%83%E4%B8%BA%E7%A8%B3%E5%AE%9A%EF%BC%8C%E5%A4%84%E4%BA%8E%E5%81%A5%E5%BA%B7%E5%8F%91%E5%B1%95%E5%8C%BA%E9%97%B4%E3%80%82%EF%BC%88%E5%8C%97%E4%BA%AC%E5%95%86%E6%8A%A5%EF%BC%89
8,国外媒体报道，据知情人士透露，特斯拉CEO马斯克和顾问们正在寻求广泛的投资者群体，以支持这家汽车制造商潜在的私有化，并避免将所有权集中在少数几个新的大股东手中。知情人士称，特斯拉正就达成的交易的可行性和结构与银行进行初步讨论，他们正在游说包括大型资产管理公司在内的投资者。（ techweb）,特斯拉正寻求广泛投资者群体支持私有化计划,2018-08-11 13:40,http://www.techweb.com.cn/world/2018-08-11/2694005.shtml
9,据国外媒体报道，苹果市值已经达到万亿美元，但一位分析师表示，他仍认为“价值股”如苹果、Facebook和谷歌母公司Alphabet存在巨大的买入机会。分析师Brian White称，苹果仍然是世界上最被低估的股票。（techweb）,分析师称：苹果仍然是世界上最被低估的股票,2018-08-11 12:43,http://www.techweb.com.cn/world/2018-08-11/2694004.shtml
10,移动安全公司Kryptowire在本周五的黑帽安全会议上公布了自己最新的研究成果。研究报告发现，在10部由美国主要运营商销售的智能手机中存在大量“自带”的令人不安的漏洞。这些漏洞可以让不法之徒秘密锁定设备的麦克风以及其它功能的权限。这些漏洞都有一个共同的特点：形式不固定，不易被发现。（腾讯）,最新研究报告：绝大多数安卓智能手机出厂时就存在大量漏洞,2018-08-11 12:31,http://tech.qq.com/a/20180811/041119.htm
11,针对滴滴与ofo收购谈判已经接近尾声，且滴滴有意将投放市场的ofo置换成自己的品牌青桔的报道，ofo方面回应称内容完全虚构，保留诉诸法律的权利。（新浪）,滴滴要将青桔替换ofo？ofo否认：完全虚构,2018-08-11 11:50,https://tech.sina.com.cn/i/2018-08-11/doc-ihhnunsr3332640.shtml
12,8月11日，在第二届中国金融四十人伊春论坛上，周小川就金融开放与人民币国际化等话题发表观点，他认为，人民币国际化比预料中发生得早，目前人民币基本上可自由使用，但还要进一步推进人民币可自由使用的程度，“我们更欢迎中长期的资本流动，不太欢迎短期、超短期性金融交易。”（腾讯一线）,周小川：将进一步推近人民币自由使用程度,2018-08-11 11:34,https://finance.qq.com/a/20180811/040138.htm
13,数据库公司Crunchbase的数据显示，今年全球独角兽融资规模将有望超越2017年创下的记录。随着成长型投资者投入空前数量的资金，平均每轮的融资额也在增长。2018年前七个月，投资者向由私营资本支持、估值达10亿美元或以上的公司共注资了730亿美元。（凤凰网）,今年全球独角兽共融资730亿美元 即将超越去年全年,2018-08-11 11:32,http://tech.ifeng.com/a/20180811/45114290_0.shtml
14,北汽新能源轻享科技总经理王春风指出，共享汽车的发展不能靠取悦资本获得关注，企业只有靠自身运营跑出自己的模型才能实现稳健发展。他认为，在接下来的一段时间，每家运营商应该踏踏实实做运营，提升自己的供给能力，减少行业内部恶性竞争。（亿欧）,北汽新能源王春风：共享汽车的发展只有靠自身运营跑出模型,2018-08-11 11:11,https://www.iyiou.com/p/78891
15,根据科技新闻网站Daringfireball报道，Doug Field已经离开特斯拉，回到苹果与Bob Mansfield一起从事苹果的“Titan”汽车项目。苹果发言人Tom Neumayr已经证实Field确实已经回到苹果，但未证实事“Titan”项目。（品玩）,特斯拉Model 3负责人跳槽到苹果已证实,2018-08-11 11:02,https://www.pingwest.com/w/175864
16,据外媒最新消息，苹果的代工企业纬创集团已经决定在印度投资1.7亿美元建设iPhone工厂，另外苹果也要求印度政府提供相应的税费优惠政策。（腾讯）,苹果代工企业拟在印度建工厂扩大产能,2018-08-11 10:50,http://tech.qq.com/a/20180811/039329.htm
17,据CNET等美国科技媒体报道，Facebook已经设立了一个全新的部门“Facebook网络连接”（Facebook Connectivity），这一部门将掌管旗下各种正在开发的互联网接入服务。外媒指出，Facebook整合网络接入服务的举措，意味着其业务走向更加成熟，希望能够让更多发展中国家民众成为网络用户。（腾讯）,Facebook：把亚非拉更多民众迁移到网络上,2018-08-11 10:45,http://tech.qq.com/a/20180811/039110.htm
18,记者获悉，ofo涉及的收购谈判已经接近尾声，收购ofo的公司以滴滴为主。不仅如此，滴滴有意将投放市场的小黄车置换成自己的品牌青桔。虽然收购事宜被ofo官方否认，但与滴滴、ofo合作的物流公司早已事先知晓了收购事宜，并在秘密做着准备工作。为置换部分北京的小黄车，5万辆青桔单车已经运抵北京等待。（中国经营报）,ofo涉及的收购谈判已经接近尾声,2018-08-11 10:41,http://www.cb.com.cn/hangkongyuyunshu/2018_0811/1251198.html
19,8月11日，小米手环官方微博晒出了NFC版小米手环3，屏幕显示官方正在测试岭南通。根据之前官方公布的信息，小米手环3 NFC版预计在9月份开卖。和普通版对比，NFC版小米手环3核心亮点是支持城市公交一卡通功能，支持公交账户充值支付，分辨率为128×80，可显示24个汉字。（快科技）,小米手环3 NFC版9月开卖，可显示24个汉字,2018-08-11 10:26,http://news.mydrivers.com/1/590/590317.htm
20,据coindesk报道，加密采矿硬件制造商比特大陆（Bitmain）首次公开募股（IPO）规模将达180亿美元，估值或在400亿美元至500亿美元之间，并于2018年第四季度或2019年第一季度在港交所上市。日前，比特大陆正式完成Pre-IPO轮签约，本轮投资者包括腾讯、软银等，融资10亿美元，投后估值150亿美元。（品玩）,比特大陆IPO规模或达180亿美元，最早第四季度在港上市,2018-08-11 10:08,https://www.pingwest.com/w/175862
21,爱奇艺、优酷、腾讯三家视频网站联合正午阳光等六大影视制作公司发表联合声明，共同抑制明星不合理片酬：单个演员的单集片酬（含税）不得超过100万元人民币，其总片酬（含税）最高不得超过5000万元人民币。此外，声明称也将共同抵制偷税漏税等违法现象。（新浪）,爱奇艺等三大平台发声明：抑制明星不合理片酬,2018-08-11 09:55,https://tech.sina.com.cn/i/2018-08-11/doc-ihhnunsr2507552.shtml
22,36氪讯，网易游戏与国外知名游戏VR研发商Survios达成战略合作，为中国玩家带来更多优质的VR游戏体验。此外，Netvios 还为用户提供《Raw Data》线下特别版的现场试玩，让用户体验一次成为“头号玩家”的乐趣。,网易游戏与Survios合作研发VR游戏,2018-08-11 09:50,http://share.baidu.com/s?type=text&searchPic=1&sign=on&to=tsina&key=595885820&url=http://36kr.com/newsflashes/132380&title=36%E6%B0%AA%E8%AE%AF%EF%BC%8C%E7%BD%91%E6%98%93%E6%B8%B8%E6%88%8F%E4%B8%8E%E5%9B%BD%E5%A4%96%E7%9F%A5%E5%90%8D%E6%B8%B8%E6%88%8FVR%E7%A0%94%E5%8F%91%E5%95%86Survios%E8%BE%BE%E6%88%90%E6%88%98%E7%95%A5%E5%90%88%E4%BD%9C%EF%BC%8C%E4%B8%BA%E4%B8%AD%E5%9B%BD%E7%8E%A9%E5%AE%B6%E5%B8%A6%E6%9D%A5%E6%9B%B4%E5%A4%9A%E4%BC%98%E8%B4%A8%E7%9A%84VR%E6%B8%B8%E6%88%8F%E4%BD%93%E9%AA%8C%E3%80%82%E6%AD%A4%E5%A4%96%EF%BC%8CNetvios%20%E8%BF%98%E4%B8%BA%E7%94%A8%E6%88%B7%E6%8F%90%E4%BE%9B%E3%80%8ARaw%20Data%E3%80%8B%E7%BA%BF%E4%B8%8B%E7%89%B9%E5%88%AB%E7%89%88%E7%9A%84%E7%8E%B0%E5%9C%BA%E8%AF%95%E7%8E%A9%EF%BC%8C%E8%AE%A9%E7%94%A8%E6%88%B7%E4%BD%93%E9%AA%8C%E4%B8%80%E6%AC%A1%E6%88%90%E4%B8%BA%E2%80%9C%E5%A4%B4%E5%8F%B7%E7%8E%A9%E5%AE%B6%E2%80%9D%E7%9A%84%E4%B9%90%E8%B6%A3%E3%80%82
23,外媒报道，由于担任Facebook区块链项目负责人，David Marcus 将辞去加密货币交易所Coinbase董事会的职务。Coinbase发言人表示，辞去职务是为了避免出现利益冲突。值得一提的是，前不久Facebook开放了虚拟货币相关广告禁令，Coinbase目前已获得了审核通过，目前已经出现在Facebook和Instagram上。(品玩）,Facebook 区块链项目负责人将辞去Coinbase董事会职务,2018-08-11 09:43,http://share.baidu.com/s?type=text&searchPic=1&sign=on&to=tsina&key=595885820&url=http://36kr.com/newsflashes/132379&title=%E5%A4%96%E5%AA%92%E6%8A%A5%E9%81%93%EF%BC%8C%E7%94%B1%E4%BA%8E%E6%8B%85%E4%BB%BBFacebook%E5%8C%BA%E5%9D%97%E9%93%BE%E9%A1%B9%E7%9B%AE%E8%B4%9F%E8%B4%A3%E4%BA%BA%EF%BC%8CDavid%20Marcus%20%E5%B0%86%E8%BE%9E%E5%8E%BB%E5%8A%A0%E5%AF%86%E8%B4%A7%E5%B8%81%E4%BA%A4%E6%98%93%E6%89%80Coinbase%E8%91%A3%E4%BA%8B%E4%BC%9A%E7%9A%84%E8%81%8C%E5%8A%A1%E3%80%82Coinbase%E5%8F%91%E8%A8%80%E4%BA%BA%E8%A1%A8%E7%A4%BA%EF%BC%8C%E8%BE%9E%E5%8E%BB%E8%81%8C%E5%8A%A1%E6%98%AF%E4%B8%BA%E4%BA%86%E9%81%BF%E5%85%8D%E5%87%BA%E7%8E%B0%E5%88%A9%E7%9B%8A%E5%86%B2%E7%AA%81%E3%80%82%E5%80%BC%E5%BE%97%E4%B8%80%E6%8F%90%E7%9A%84%E6%98%AF%EF%BC%8C%E5%89%8D%E4%B8%8D%E4%B9%85Facebook%E5%BC%80%E6%94%BE%E4%BA%86%E8%99%9A%E6%8B%9F%E8%B4%A7%E5%B8%81%E7%9B%B8%E5%85%B3%E5%B9%BF%E5%91%8A%E7%A6%81%E4%BB%A4%EF%BC%8CCoinbase%E7%9B%AE%E5%89%8D%E5%B7%B2%E8%8E%B7%E5%BE%97%E4%BA%86%E5%AE%A1%E6%A0%B8%E9%80%9A%E8%BF%87%EF%BC%8C%E7%9B%AE%E5%89%8D%E5%B7%B2%E7%BB%8F%E5%87%BA%E7%8E%B0%E5%9C%A8Facebook%E5%92%8CInstagram%E4%B8%8A%E3%80%82(%E5%93%81%E7%8E%A9%EF%BC%89
24,1至7月中国汽车产销量继续保持小幅增长，其中，新能源汽车产销分别完成50.4万辆和49.6万辆，比上年同期分别增长85%和97.1%，新能源汽车产销量同比呈现高速增长态势。（新华社）,中国新能源汽车产销量同比保持高速增长,2018-08-11 09:03,http://www.xinhuanet.com/2018-08/10/c_1123253343.htm
25,谷歌在近日上线了一款视频问答App，功能极其简单：用户可以用它来回答问题，但是是以录制视频的形式。回答结果则会显示在Google的搜索结果中。（腾讯）,谷歌：上线主要面向名人和公众人士的视频问答APP,2018-08-11 08:53,http://tech.qq.com/a/20180811/022352.htm
26,业内人士表示，中国在5G业务部署方面明显具备领先优势。招商证券的研报显示，当前，三大运营商的5G试验网已全面启动，2018年已启动面向商用的大规模组网试验，将于2019年进入预商用阶段。综合来看2020年有望成为5G规模商用元年。（广州日报）,德勤：中国5G试验网已全面启动 将投入千亿资金,2018-08-11 08:50,http://share.baidu.com/s?type=text&searchPic=1&sign=on&to=tsina&key=595885820&url=http://36kr.com/newsflashes/132375&title=%E4%B8%9A%E5%86%85%E4%BA%BA%E5%A3%AB%E8%A1%A8%E7%A4%BA%EF%BC%8C%E4%B8%AD%E5%9B%BD%E5%9C%A85G%E4%B8%9A%E5%8A%A1%E9%83%A8%E7%BD%B2%E6%96%B9%E9%9D%A2%E6%98%8E%E6%98%BE%E5%85%B7%E5%A4%87%E9%A2%86%E5%85%88%E4%BC%98%E5%8A%BF%E3%80%82%E6%8B%9B%E5%95%86%E8%AF%81%E5%88%B8%E7%9A%84%E7%A0%94%E6%8A%A5%E6%98%BE%E7%A4%BA%EF%BC%8C%E5%BD%93%E5%89%8D%EF%BC%8C%E4%B8%89%E5%A4%A7%E8%BF%90%E8%90%A5%E5%95%86%E7%9A%845G%E8%AF%95%E9%AA%8C%E7%BD%91%E5%B7%B2%E5%85%A8%E9%9D%A2%E5%90%AF%E5%8A%A8%EF%BC%8C2018%E5%B9%B4%E5%B7%B2%E5%90%AF%E5%8A%A8%E9%9D%A2%E5%90%91%E5%95%86%E7%94%A8%E7%9A%84%E5%A4%A7%E8%A7%84%E6%A8%A1%E7%BB%84%E7%BD%91%E8%AF%95%E9%AA%8C%EF%BC%8C%E5%B0%86%E4%BA%8E2019%E5%B9%B4%E8%BF%9B%E5%85%A5%E9%A2%84%E5%95%86%E7%94%A8%E9%98%B6%E6%AE%B5%E3%80%82%E7%BB%BC%E5%90%88%E6%9D%A5%E7%9C%8B2020%E5%B9%B4%E6%9C%89%E6%9C%9B%E6%88%90%E4%B8%BA5G%E8%A7%84%E6%A8%A1%E5%95%86%E7%94%A8%E5%85%83%E5%B9%B4%E3%80%82%EF%BC%88%E5%B9%BF%E5%B7%9E%E6%97%A5%E6%8A%A5%EF%BC%89
27,8月11日上午消息，美国证券交易委员会（SEC）文件显示：P2P网贷平台微贷网递交美国IPO文件，有意在纽交所挂牌交易，代码“Wei”，计划最多融资1亿美元，承销商为摩根斯坦利和瑞士信贷。微贷网为中小微企业与个人用户提供金融服务，上半年净利4640万美元 同比增长14.6%。(新浪）,微贷网递交IPO文件有意在纽交所挂牌交易,2018-08-11 08:48,https://tech.sina.com.cn/i/2018-08-11/doc-ihhnunsr2146419.shtml
28,厦门市金融工作办公室今日发布“关于打击网贷平台借款人逃废债工作的通告”。通告表示，“在我市网贷平台签订合法借款合同的借款人，有可供履行债务的资产，但逾期后仍拒不履行还款义务的，我办将上报国家互金整治办并把逃废债信息纳入征信系统和‘信用中国’数据库，对相关逃废债行为人形成制约。”（每日经济新闻）,厦门金融办严打网贷“恶意逃废债”行为，将上报并纳入征信系统,2018-08-10 21:55,http://www.nbd.com.cn/articles/2018-08-10/1244098.html
29,电子支付平台PayPal今日宣布，通过提供定制化收款链接、同时支持PC和移动设备一键支付，以及提供反欺诈技术和卖家保障等方式，帮助中小跨境电商出海。PayPal统计数据显示，该公司海外买家每5笔交易中就有1笔是从中国购买。PayPal四年前就已向中国的监管部门提交了支付牌照申请，但是目前仍没有审批通过。（新京报）,PayPal发布多款产品帮助中国中小跨境电商出海，境内支付牌照仍未获得,2018-08-10 21:54,http://www.bjnews.com.cn/finance/2018/08/10/499054.html
30,据外媒报道，金融分析师詹姆斯・斯蒂芬森自2014年以来一直是特斯拉的投资者，他表示：“只要我选择和埃隆一起投资，我就会这么做。”斯蒂芬森说，“我不会以420美元的价格出售，与我交谈过的大多数特斯拉股东也不会出售。”他还说，他预计特斯拉未来十年的市值将达到1万亿美元，而今天的市值约为600亿美元。（腾讯）,散户投资者：计划长期持有特斯拉，预计未来十年市值达到1万亿美元,2018-08-10 21:44,http://tech.qq.com/a/20180810/058193.htm
31,据Digitimes报道，到2018年底，屏下指纹传感器的出货量将达到4200万，到了2019年，预计出货量更是会达到1亿。这代表明年会有更多智能手机采用屏下指纹技术，而且不止是高端机型，还包括中端机型。另外，屏下指纹的普及还会推动OLED面板的全球出货，今年仅在中国市场就有1亿台搭载OLED的手机出货。（快科技）,屏下指纹识别手机出货量提升：明年或成为中端标配,2018-08-10 21:23,http://news.mydrivers.com/1/590/590303.htm
32,线下自助类设备智能平台乐摇摇公司已完成亿级B+轮融资，本次融资由德同资本领投，前海梧桐跟投。本轮融资后，乐摇摇将接入更多的线下设备，服务好更多的商户。（亿欧）,线下自助类设备智能平台乐摇摇完成亿级B+轮融资,2018-08-10 21:05,https://www.iyiou.com/p/78916
33,据外媒报道，一位谷歌安全研究员说，自2016年以来他在苹果的iOS操作系统发中发现了30个漏洞，这些漏洞使得苹果的软件更加安全――他希望苹果公司能够为此支付更多费用。2016年开始，苹果邀请黑客向公司报告iOS漏洞，并为其发现提供高达六位数的奖励，这或许是为了阻止他们将漏洞卖给其他高收入的初创公司。（网易）,谷歌黑客要求苹果为iOS漏洞付费，并捐赠245万美元,2018-08-10 20:50,http://tech.163.com/18/0810/19/DOSCIDHR00097U7T.html
34,8月8日，宏董事会通过了分拆酷股份有限公司的决定，以分拆目前宏旗下的电竞周边与智能生活产品。具体来说，这次分拆的产品线包括宏电竞品牌Predator的周边产品，例如键鼠、耳机、电竞椅以及行李箱等等。宏预期，成立酷明确分拆业务后，将有利于进一步落实分工，激励创新，并有效推进周边产品的发展。（快科技）,宏成立酷公司，分拆旗下电竞周边产品,2018-08-10 20:46,http://news.mydrivers.com/1/590/590298.htm
35,据外媒报道，高盛已经将英特尔的股票评级下调为“中性”，高盛分析师Toshiya Hari指出：“英特尔在10纳米制程技术方面不断挣扎，对其在市场上的影响力和产品竞争力方面，都产生了负面影响。今年10纳米制程一直是市场的热点，但英特尔面临的制造问题可能要比大多数人认为的更严重，目前英特尔正面临与日益强大的台积电生态系统竞争的局面。”（腾讯）,多次推迟下一代工艺芯片上市时间，高盛下调英特尔股票评级,2018-08-10 20:44,http://tech.qq.com/a/20180810/057708.htm
36,目前拥有512GB存储的手机只有华为的Mate RS、OPPO的Find X兰博基尼版和三星Note9，华硕ROG游戏手机也会有512GB的版本，但还没有上市。外媒PhoneArena给出了这些拥有512GB存储的手机的售价，售价为1250美元的三星Note9是其中最便宜的。（IT之家）,外媒：三星Note9是目前最便宜的512GB存储手机,2018-08-10 20:42,https://www.ithome.com/html/android/376126.htm
37,36氪讯，微信今日宣布，小程序后台数据分析及插件功能升级，开发者可查看已添加「我的小程序」的用户数。此外，2018年8月1日至12月31日期间，小程序（含小游戏）流量主的广告收入分成比例优化上调，单日广告流水10-100万区间的部分，开发者可获得的分成由原来流水的30%上调到50%，优质小程序流量主可获得更高收益。,微信小程序流量主广告收入分成比例上调至50%,2018-08-10 20:33,https://mp.weixin.qq.com/s/h2IC1va-UwMvhh0arty9Ug
38,针对“美国电动车品牌特斯拉在沪建厂，上海至少4家银行已经开始对贷款评估程序”的传闻，一位接近此事的消息人士表示，银行目前并未收到该项目的核准报告和相关申请，目前的谈判仅仅是意向和大致金额的沟通。（腾讯一线）,上海地方银行对特斯拉贷款暂未进入评估阶段,2018-08-10 20:26,https://finance.qq.com/a/20180810/057519.htm
39,汽车之家正努力由一家汽车垂直媒体网站转型为以数据技术驱动的公司，汽车之家开始清除新车库存，改变之前的自营自销和自建库存模式，锁定轻资产发展的新向。行业普遍认为这是汽车之家媒体属性的回归。汽车之家CEO陆敏对此强调，之所以不再做自营业务，汽车之家是要专注于自己擅长的事情――内容生产和搭建平台。（一财）,汽车之家加速转型，放弃自营更强调内容和智能化,2018-08-10 20:14,https://www.yicai.com/news/100009381.html
