,brief,classes_name,header,news_url,pubtime,savetime
139,截至目前，这只名为Tahlequah的虎鲸已带着去世的幼崽同游17天，它所在的鲸群已多年没有幼崽出生并存活，所以它可能属于这一鲸群灭绝前的最后一代。,澎湃新闻,科普文章“高贵妃就这么走了”网上热传，作者是上海一家医院,https://www.thepaper.cn/newsDetail_forward_2338446,11小时前,2018-08-11 21:28:23
140,近日，一篇名为“《延禧攻略》的高贵妃就这么走了？如果能送到瑞金医院……”的文章在网上热传。一夜点击量就已突破10W+，甚至还得到了高贵妃扮演者谭卓的转发和评论。,澎湃新闻,第六声学者计划虻胤秸府为什么热衷于旅游扶贫,https://www.thepaper.cn/newsDetail_forward_2327570,11小时前,2018-08-11 21:28:23
141,旅游扶贫的确具有很多的优势，压油沟村的贫困人口的生活也确实得到了很大的改善。但旅游扶贫依然需要充分重视上面提到的这些问题，才能真正长久地造福于贫困人口。,澎湃新闻,第六声学者计划蛏衬硅谷之梦,https://www.thepaper.cn/newsDetail_forward_2320919,11小时前,2018-08-11 21:28:23
142,中卫尽管拥有各种天然资源和有利政策，但想要在短时期内引进优秀人才和缔造创业氛围，却是不可能完成的任务。,澎湃新闻,国家市场监管总局：持续推进互联网广告专项整治工作,https://www.thepaper.cn/newsDetail_forward_2338875,11小时前,2018-08-11 21:28:23
143,国家市场监管总局表示，对近日媒体报道的虚假违法广告问题高度重视，已在前期工作基础上采取措施，进一步加大广告监管执法力度，核实处理报道中所涉及的具体案例。,澎湃新闻,三大视频网站六家影视公司联合抑片酬：单个演员每集禁超百万,https://www.thepaper.cn/newsDetail_forward_2338910,11小时前,2018-08-11 21:28:24
144,爱奇艺、优酷、腾讯视频、正午阳光、华策影视、柠萌影业、慈文传媒、耀客传媒、新丽传媒联手发布《关于抑制不合理片酬，抵制行业不正之风的联合声明》。,澎湃新闻,稳预期，不畏浮云遮望眼,https://www.thepaper.cn/newsDetail_forward_2338912,11小时前,2018-08-11 21:28:24
145,国际货币基金组织发布最新评估，认为“中国经济继续保持强劲发展势头”，该机构最新一期《世界经济展望》预计2018年中国经济增长率为6.6%，与其4月的预测一致。,澎湃新闻,曼联用胜利拉开新赛季序幕，断过腿的卢克肖终于进球了,https://www.thepaper.cn/newsDetail_forward_2338633,11小时前,2018-08-11 21:28:24
146,赛季前，卢克・肖说自己会为了首发位置全力以赴。他表示，穆帅之所以对自己如此严厉，正是因为他知道自己的潜力没有得到发挥。,澎湃新闻,人民网评：每一个中国人都是逐梦的“真心英雄”,https://www.thepaper.cn/newsDetail_forward_2338894,11小时前,2018-08-11 21:28:24
147,这几天，一篇署名为“宣言”的重磅文章《风雨无阻创造美好生活》引起热议。有网友表示，“催人奋进、鼓舞士气，激发人们把握生命里的每一分钟，全力以赴我们的中国梦。”,澎湃新闻,视频直播丨诗话长江――大江奔流主题采访诗歌吟诵会,https://www.thepaper.cn/newsDetail_forward_2338799,11小时前,2018-08-11 21:28:25
148,长江，作为我们的母亲河，自古以来就是文人墨客笔下争相吟诵的对象。8月11日，“大江奔流”主题采访团来到了上海， 在上海举办一场气势磅礴的“诗话长江”诗歌吟诵会。,澎湃新闻,三家出版社卷入《红星照耀中国》的版权之争,https://www.thepaper.cn/newsDetail_forward_2338776,11小时前,2018-08-11 21:28:25
149,“RED STAR OVER CHINA”已经出版有81个春秋，在中文语境中以雏形本、全译本、节译本、抽印本、内部参考本等形式出版了不少于60种版本。,澎湃新闻,广西政府调整领导工作分工：严植婵分管自治区国土资源厅等,https://www.thepaper.cn/newsDetail_forward_2338876,11小时前,2018-08-11 21:28:25
150,根据广西壮族自治区人民政府领导班子成员变动情况，经自治区人民政府党组（扩大）会议研究，决定对政府领导工作分工进行调整。,澎湃新闻,四川攀枝花：法院将罪犯送交执行，三次都遭看守所拒收,https://www.thepaper.cn/newsDetail_forward_2338749,11小时前,2018-08-11 21:28:25
151,三次将李某送交看守所执行，看守所都以李某患病且有HIV为由拒收，判决成了一纸空文。攀枝花市检察院的一纸检察建议书，终使李某被收监执行。,澎湃新闻,9家公司联合声明，抵制不合理片酬,https://www.thepaper.cn/newsDetail_forward_2338862,11小时前,2018-08-11 21:28:25
152,8月10日，爱奇艺、优酷、腾讯视频、正午阳光、华策影视、柠萌影业、慈文传媒、耀客传媒、新丽传媒联合发布“关于抑制不合理片酬，抵制行业不正之风的联合声明 ”。,澎湃新闻,诺奖得主格罗斯：1万年后人类能播种外星人，但先得存活万年,https://www.thepaper.cn/newsDetail_forward_2338888,11小时前,2018-08-11 21:28:25
153,不同于硅谷狂人马斯克的火星殖民计划，格罗斯觉得人类不必自己乘坐宇宙飞船飞过去，只需要把生命的种子，也就是DNA信息播撒到银河系，更低成本，也更方便。,澎湃新闻,江西宜春市政府秘书长张梅任宜春学院纪委书记,https://www.thepaper.cn/newsDetail_forward_2338851,11小时前,2018-08-11 21:28:25
154,江西省委决定，张梅同志任宜春学院党委委员，纪委书记。张梅，女，江西万载人，1965年1月出生，此前任宜春市政府党组成员、 市政府秘书长、 市政府办党组书记。,澎湃新闻,朋友圈发旅游广告能赚外快？上千人陷入“庞氏骗局”,https://www.thepaper.cn/newsDetail_forward_2338854,11小时前,2018-08-11 21:28:25
155,内蒙古呼和浩特不少市民被星动网络公司的兼职“套路”了：只要在朋友圈发条旅游广告，一天可挣20元，前提是先交298元押金。近期，该公司管理层跑路，上千人押金被骗。,澎湃新闻,6所高校过百亿！教育部直属高校公布2017年决算数据,https://www.thepaper.cn/newsDetail_forward_2336621,11小时前,2018-08-11 21:28:25
156,2017年教育部直属高校年度决算总经费为3677.60亿元，相比2016年增长12.14%。在年度收入上，清华大学、浙江大学、北京大学和上海交通大学均超过百亿。,澎湃新闻,济宁打掉闫现攀涉黑犯罪组织：曾在监狱门口放鞭炮欢庆出狱,https://www.thepaper.cn/newsDetail_forward_2338844,11小时前,2018-08-11 21:28:26
157,2012年4月27日，赵连英纠集多人驾驶20多辆豪车，拒不服从管理，在监狱门口大肆燃放烟花爆竹，迎接闫现攀出狱，后大摆宴席，为闫现攀接风。,澎湃新闻,“上访户”敲诈勒索派出所所长获刑一年半：不给钱就上访,https://www.thepaper.cn/newsDetail_forward_2338748,11小时前,2018-08-11 21:28:26
158,“上访户”敲诈勒索派出所所长，称“不给钱就去北京上访、让所长下岗”。辽宁一上访户包某因敲诈勒索派出所所长有期徒刑一年零六个月，并处罚金2000元。,澎湃新闻,长安剑评“转让女儿救儿子”：这一次，没能消费人们的善良,https://www.thepaper.cn/newsDetail_forward_2338575,12小时前,2018-08-11 21:28:26
