,brief,classes_name,header,news_url,pubtime,savetime
143,今年以来，央行先是在1月将“宝宝类”等货币市场基金直接纳入M2统计，又在下半年两度调整社会融资规模统计口径。,澎湃新闻,297人参加北京冬奥组委招聘面试，拟聘用名单在本月底公布,https://www.thepaper.cn/newsDetail_forward_2549137,10小时前,2018-10-21 18:27:23
144,北京冬奥组委组织的2018年面向社会招聘昨天上午进行了面试，从笔试中脱颖而出的297名考生，在首钢的冬奥办公区为了冬奥梦想奋力一搏。,澎湃新闻,缅甸中华总商会：进博会助缅甸新发展,https://www.thepaper.cn/newsDetail_forward_2537282,10小时前,2018-10-21 18:27:23
145,全球政要名人点赞进口博览会。缅甸中华总商会荣誉会长杨钏玉、缅甸知名企业家潘继泽表示，进博会是历史性的机会，将会把缅甸的自然资源及农产品资源推广到中国。,澎湃新闻,秦岭最大违规超级别墅被拆，央视：多年整治为何没能叫停？,https://www.thepaper.cn/newsDetail_forward_2549145,10小时前,2018-10-21 18:27:23
146,7月底开始，陕西省秦岭北麓西安境内展开了违建别墅专项整治行动，大量违规别墅逐步被拆除。近日，这片区域规模最大的单体违建别墅也被拆除。,澎湃新闻,央视财经：回应经济热点问题，刘鹤副总理透露三大重要信息,https://www.thepaper.cn/newsDetail_forward_2549146,10小时前,2018-10-21 18:27:23
147,10月19日，国务院副总理刘鹤就当前经济金融热点问题接受采访。在采访中，刘鹤就股市、民营企业以及当前经济金融形势和产业结构变化等回答了记者提问。,澎湃新闻,沙特失踪记者卡舒吉的关系网：阿德南、拉登到瓦利德亲王,https://www.thepaper.cn/newsDetail_forward_2548265,10小时前,2018-10-21 18:27:23
148,在《华盛顿邮报》专栏的开篇文章中，卡舒吉依然写下了他对祖国的热爱――希望我们的国家能够蓬勃发展，看到“2030愿景”得以实现。,澎湃新闻,深观察｜的哥口角案：“一死人，就抓人”必须改改,https://www.thepaper.cn/newsDetail_forward_2548645,10小时前,2018-10-21 18:27:23
149,一个人没有法律上的过错，那么裁判者就不能站在道德的制高点对其进行法律制裁。在的哥滕广江明显没有过错的情况下，司法不能稀里糊涂地将其纳入处罚的对象。,澎湃新闻,“彩电大王”黄宏生要到徐州造车：盛赞它像深圳有移民化特质,https://www.thepaper.cn/newsDetail_forward_2548134,10小时前,2018-10-21 18:27:23
150,“站在新起点，徐州各项发展优势不断积累、加速转化，历史上的‘兵家必争之地’正在成为‘投资兴业宝地’。”徐州市委书记周铁根在洽谈会上说。,澎湃新闻,重庆六旬老人庭院内自建舞台，与猫狗、天鹅共赏患癌妻子跳舞,https://www.thepaper.cn/newsDetail_forward_2541376,10小时前,2018-10-21 18:27:23
151,65岁的重庆老人王国华专门为患癌的妻子搭建了一个舞台。每日清晨和傍晚，因患癌掉发而戴着帽子的妻子登上台，在丈夫、猫、狗和黑天鹅的注视下，开始跳舞。,澎湃新闻,美团：为保障食品卫生，正与商家沟通使用统一外卖餐盒封条,https://www.thepaper.cn/newsDetail_forward_2547611,10小时前,2018-10-21 18:27:23
152,美团网创立于2010年，从团购业务切入，陆续又推出电影票线上预订、酒店预订、旅游门票预订、外卖业务等等。,澎湃新闻,国务院扶贫办主任撰文：有效应对脱贫攻坚面临的困难和挑战,https://www.thepaper.cn/newsDetail_forward_2549106,10小时前,2018-10-21 18:27:23
153,10月17日是我国第五个扶贫日，也是第二十六个国际消除贫困日。习近平同志对脱贫攻坚工作作出重要指示强调，咬定目标加油干，如期打赢脱贫攻坚战。,澎湃新闻,乐山井研一男子因感情纠纷杀害妻子继子岳母姐夫，已自首,https://www.thepaper.cn/newsDetail_forward_2548858,11小时前,2018-10-21 18:27:23
154,嫌疑人彭某桃（男，40岁，井研县人）因感情纠纷引发矛盾将妻子聂某霞、继子漆某昆、岳母周某华、姐夫龙某君杀害，致岳父聂某松重伤。目前，犯罪嫌疑人已到公安机关自首。,澎湃新闻,川大一教师对学生请丧假言语不当，校方：教师已写检查并致歉,https://www.thepaper.cn/newsDetail_forward_2548879,11小时前,2018-10-21 18:27:24
155,四川大学一音乐表演专业学生因请丧假，任课教师对其发表不当言论。学院获知消息后第一时间积极介入调查此事，并发布调查处理情况通报。,澎湃新闻,特朗普宣布美国将退出与俄签订的中导条约,https://www.thepaper.cn/newsDetail_forward_2548866,11小时前,2018-10-21 18:27:24
156,据美联社报道，当地时间20日，美国总统宣布美国将退出与俄罗斯于1987年签订的中导条约，理由是俄方违反了条约规定。,澎湃新闻,官方：前三季度广东GDP7.06万亿元，同比增长6.9%,https://www.thepaper.cn/newsDetail_forward_2548699,11小时前,2018-10-21 18:27:24
157,广东省统计局20日通报称，初步核算并经国家统计局核定，前三季度广东地区生产总值(GDP)为7.06万亿元，同比增长6.9%。,澎湃新闻,环保督察回头看｜广西为开发项目在保护区“开天窗”、调边界,https://www.thepaper.cn/newsDetail_forward_2548621,19小时前,2018-10-21 18:27:24
158,中央环保督察组指出，广西相关整改工作虽取得积极进展和成效，但仍存在政治站位不高、推动落实不力、工作拖拉散漫等问题，一些地方和部门敷衍整改、表面整改、假装整改。,澎湃新闻,醉驾男子等红灯睡着，见到交警哈哈大笑,https://www.thepaper.cn/newsDetail_forward_2548606,19小时前,2018-10-21 18:27:24
159,10月16日，广东珠海。一宝马车停在红绿灯处，躺驾驶座的醉驾司机被交警叫醒。面对交警，男子忍不住笑。经警方调查，事发前晚，司机喝了11瓶啤酒。目前司机被刑拘。,澎湃新闻,男、女排世界杯时间确定：明年10月1日和9月14日开赛,https://www.thepaper.cn/newsDetail_forward_2548673,19小时前,2018-10-21 18:27:24
