,brief,classes_name,header,news_url,pubtime,savetime
71,从来不介意主帅感受的皇马球迷，已经准备用脚投票：输球后不到1小时，《马卡》发起的洛佩特吉是否该下课的民意调查中，59%的球迷选择了“Yes”。,澎湃新闻,数千移民冲击墨西哥边境试图借道进入美国，与警方爆发冲突,https://www.thepaper.cn/newsDetail_forward_2549572,4小时前,2018-10-21 18:27:16
72,20日，危地马拉-墨西哥边境仍滞留数千名中美洲移民，与墨西哥政府对峙。美国总统特朗普将此归咎于民主党。,澎湃新闻,山西新规：父母住院子女可享每年最多15天带薪照料假,https://www.thepaper.cn/newsDetail_forward_2549598,4小时前,2018-10-21 18:27:16
73,山西将立足老年人法定权益保障和服务需求，拓展服务内容，创新服务方式，提升服务质量，让老年人享受到更多看得见、摸得着的实惠。,澎湃新闻,江西宁都县两警察充当黑恶势力保护伞被查，一人为派出所长,https://www.thepaper.cn/newsDetail_forward_2549625,4小时前,2018-10-21 18:27:16
74,10月18日，赣州市纪委监委通报了一起涉黑涉恶腐败和“保护伞”问题。,澎湃新闻,黑龙江省机构改革方案获批，设党委机构17个政府机构43个,https://www.thepaper.cn/newsDetail_forward_2549606,4小时前,2018-10-21 18:27:17
75,20日上午，全省深化机构改革动员大会在哈尔滨召开，标志着我省机构改革进入全面实施阶段。,澎湃新闻,沙特记者哈苏吉DNA已找到，土方：其遗体或被丢弃附近森林,https://www.thepaper.cn/newsDetail_forward_2549679,4小时前,2018-10-21 18:27:17
76,土耳其官方表示，现已在停放于沙特领事馆前的汽车内发现哈苏吉的DNA，推测遗体可能被丢弃在近郊的森林或农场。,澎湃新闻,公安部刑侦专家张欣逝世，在模拟画像缉捕罪犯领域功勋卓著,https://www.thepaper.cn/newsDetail_forward_2549639,4小时前,2018-10-21 18:27:17
77,张欣同志因连续加班工作劳累过度，突感身体不适，经抢救无效不幸逝世，享年58岁。张欣长期奋战在打击刑事犯罪斗争第一线，在模拟画像缉捕罪犯领域成绩斐然、功勋卓著。,澎湃新闻,马上评｜精细设计，让个税专项扣除更加便利可及,https://www.thepaper.cn/newsDetail_forward_2549640,5小时前,2018-10-21 18:27:17
78,专项附加扣除的制度设计非常关键，如果程序复杂，纳税人申报成本过高，可能流于形式，纳税人享受不到实惠，也会使得纳税人、扣缴义务人和税务局之间的关系复杂化。,澎湃新闻,湖北鹤峰县委副书记、县人民政府县长胡平江接受审查调查,https://www.thepaper.cn/newsDetail_forward_2549605,5小时前,2018-10-21 18:27:17
79,恩施州纪委监委网站：鹤峰县委副书记、县人民政府县长胡平江涉嫌严重违纪违法，目前正接受恩施州纪委监委纪律审查和监察调查。,澎湃新闻,上海国际艺术节｜演出交易会：推介演出成中国原创舞台,https://www.thepaper.cn/newsDetail_forward_2549385,5小时前,2018-10-21 18:27:17
80,10月20日上午，艺术节交易会正式开幕，签约仪式共有7个与项目现场签约。在当天的演出推介会上，中国原创再一次吸引了关注。《最后一头战象》首次揭开面纱。,澎湃新闻,这名北大博士拟升正厅：著作、译著都有不少,https://www.thepaper.cn/newsDetail_forward_2549377,5小时前,2018-10-21 18:27:17
81,10月19日，山西省委组织部发布了一份涉及27人的拟任职干部公示名单。现任山西省委办公厅副主任曹荣湘拟任省直正厅长级职务。,澎湃新闻,邵氏“大侠”演员岳华去世，曾出演《珠光宝气》,https://www.thepaper.cn/newsDetail_forward_2549574,5小时前,2018-10-21 18:27:17
82,岳华，原名梁乐华，香港影视演员。生于上海市，原籍广东中山，1962年赴港，1963年考入南国实验剧团，为第三期毕业生。,澎湃新闻,华东两名校到西南重温西迁史，表态将为当地提供帮助,https://www.thepaper.cn/newsDetail_forward_2549381,5小时前,2018-10-21 18:27:17
83,今年是复旦大学抗战内迁八十周年，10月18日至19日，校党委书记焦扬一行来到重庆，参观红岩革命历史博物馆和复旦大学北碚旧址，举办纪念抗战内迁80周年系列活动等。,澎湃新闻,伦敦近70万民众示威游行，要求就脱欧进行“二次公投”,https://www.thepaper.cn/newsDetail_forward_2549561,5小时前,2018-10-21 18:27:17
84,中新社伦敦10月20日电 67万英国民众20日下午汇集在伦敦议会广场举行“人民投票”示威游行活动，呼吁对英国脱欧最终协议举行全民投票。,澎湃新闻,香港富豪郭炳湘病逝，其妻发公告称系在家人陪伴下安详离世,https://www.thepaper.cn/newsDetail_forward_2549557,5小时前,2018-10-21 18:27:17
85,公告指出，“自郭炳湘入院以来，得到医护团队的悉心照顾，各亲戚朋友以及商界友好之恳切关怀与问好，遂致以衷心感谢。而有关殡葬事宜将会容后通告。”,澎湃新闻,山东龙郓煤业泄水巷被破坏困住22人，应急管理部急派工作组,https://www.thepaper.cn/newsDetail_forward_2549515,6小时前,2018-10-21 18:27:18
86,20日23时左右，山东省能源集团龙矿集团龙郓煤业有限公司接到井下报告，1303泄水巷掘进工作面附近发生冲击地压事故，造成约100米范围内巷道出现不同程度破坏。,澎湃新闻,体坛联播│皇马连败想念C罗，梅西骨折世纪大战还看谁？,https://www.thepaper.cn/newsDetail_forward_2549463,6小时前,2018-10-21 18:27:18
87,皇马的球迷想念总裁，而西甲的球迷或许更怀念曾经的世纪大战。因为梅西手臂骨折，下周的世纪大战将是11年来，第一次没有梅罗两人的身影。,澎湃新闻,背负电诈源头地之名儋州誓言保卫名誉：机票退改签诈骗降九成,https://www.thepaper.cn/newsDetail_forward_2549373,6小时前,2018-10-21 18:27:18
88,儋州市委书记袁光平在会上强调，各级各部门要痛下决心，迅速行动起来，掀起新一轮扫黑除恶风暴，确保扫黑除恶专项斗争和打击整治电信网络诈骗犯罪百日攻坚战取得实效。,澎湃新闻,视频|一枪毙敌！各国狙击精英集体亮剑,https://www.thepaper.cn/newsDetail_forward_2549510,6小时前,2018-10-21 18:27:18
89,10月18日，“锋刃－2018”国际狙击手射击竞赛在燕山深处武警某训练基地开幕。来自21个国家的100余名狙击精英展开同场竞技。,澎湃新闻,昆明原厅官张兴华行贿中纪委官员53万获刑，曾陷桃色风波,https://www.thepaper.cn/newsDetail_forward_2536457,6小时前,2018-10-21 18:27:18
90,2005年至2014年间，张兴华为协调解决自己被云南和昆明两级纪委调查的问题，以及谋取职务晋升机会等不正当利益，先后12次向时任中纪委官员明玉清行贿53万元。,澎湃新闻,团中央直属机关召开警示教育大会：清水衙门也可能出大问题,https://www.thepaper.cn/newsDetail_forward_2549527,6小时前,2018-10-21 18:27:18
91,10月19日下午，团中央直属机关召开警示教育大会，大会由团中央书记处常务书记汪鸿雁主持。,澎湃新闻,关键补选落败，澳大利亚执政联盟沦为少数派政府,https://www.thepaper.cn/newsDetail_forward_2549505,6小时前,2018-10-21 18:27:18
92,澳大利亚悉尼市文特沃思选区20日举行联邦众议院补缺选举，初步计票结果显示执政联盟丢掉一个关键议席，不再占据众议院多数席位，沦为少数派政府。,澎湃新闻,希腊西尼罗病毒感染人数增至306人，已有41人死亡,https://www.thepaper.cn/newsDetail_forward_2549488,6小时前,2018-10-21 18:27:18
93,希腊疾病预防与控制中心的最新统计数据显示，截至当地时间18日，希腊感染西尼罗病毒的患者增加到306人，死亡人数达41人。,澎湃新闻,法治的细节蚨跃权的滥用应当保持零容忍,https://www.thepaper.cn/newsDetail_forward_2549518,6小时前,2018-10-21 18:27:18
94,一个城市或一个国家的道德水准往往与其对权力的约束成正比。只有权力被关进了笼子，普罗大众才可能保持一种较高的道德水准。,澎湃新闻,劳伦斯・弗里德曼谈战略理论和当下国际形势,https://www.thepaper.cn/newsDetail_forward_2547924,6小时前,2018-10-21 18:27:18
95,劳伦斯・弗里德曼爵士（1948- ）为伦敦国王学院的荣休教授，英国枢密院成员、英国学术院院士。他的主要研究领域为战略、核战略理论、国际关系、冷战和军事史。,澎湃新闻,上海歌舞团出品的舞剧《朱q》获中国版权金奖,https://www.thepaper.cn/newsDetail_forward_2549448,7小时前,2018-10-21 18:27:18
96,在此次博览会开幕式上举行的“2018年中国版权金奖”颁奖典礼中，由上海歌舞团出品的舞蹈作品《朱q》获得中国版权领域最高奖――中国版权金奖。,澎湃新闻,美国铁杆火车迷定居大理十年，乘火车走遍中国大陆所有省区,https://www.thepaper.cn/newsDetail_forward_2549466,7小时前,2018-10-21 18:27:18
97,布莱恩・林登是美国人，1984年第一次来到中国。作为一个火车迷，他乘火车走遍了中国的所有省区。,澎湃新闻,卸任陕西省委宣传部部长一职后，庄长兴次日即以新身份亮相,https://www.thepaper.cn/newsDetail_forward_2549395,7小时前,2018-10-21 18:27:19
98,卸任省委宣传部部长一职后，陕西省委常委庄长兴已兼任省委政法委书记，补上了杜航伟赴公安部担任党委委员、副部长后留下的职务空缺。,澎湃新闻,漳州这名70后干部被指“极度狂妄”：弄虚作假为自己造势,https://www.thepaper.cn/newsDetail_forward_2549384,7小时前,2018-10-21 18:27:19
99,福建漳州市纪委监委：“谢宇严重违反政治纪律和政治规矩，弄虚作假为自己造势；利用网络进行非组织活动，栽赃他人欺骗组织。”,澎湃新闻,国家版权局官员于慈珂：版权制度能够激发创新，促进繁荣,https://www.thepaper.cn/newsDetail_forward_2549398,7小时前,2018-10-21 18:27:19
100,目前，我国已形成了较为完备的既符合中国国情又和国际规则相衔接的版权法律体系，整体版权保护水平达到国际通行标准。,澎湃新闻,10月23日19时22分“霜降”：凄凄凉意升，绝美秋止符,https://www.thepaper.cn/newsDetail_forward_2549421,7小时前,2018-10-21 18:27:19
101,“霜降”是农历二十四节气中的第十八个节气，也是秋季的最后一个节气，是秋季到冬季过渡的开始，最低气温可达到零摄氏度左右。,澎湃新闻,朝中社批美国“用两张面孔对待朝鲜”：缺乏信义、表里不一,https://www.thepaper.cn/newsDetail_forward_2549345,7小时前,2018-10-21 18:27:19
102,朝中社20日播发署名评论文章，批评美国“用两张面孔对待朝鲜”，一面标榜朝美关系进展，一面叫嚣对朝制裁打压。,澎湃新闻,沙特承认记者遇害被疑隐瞒内情，多国促惩处责任人,https://www.thepaper.cn/newsDetail_forward_2549318,7小时前,2018-10-21 18:27:19
103,10月2日，沙特记者卡舒吉在进入沙特驻土耳其伊斯坦布尔领事馆后“失踪”。20日，沙特政府宣布，卡舒吉当日在领事馆内与人打斗后身亡，首次承认他遇害。,澎湃新闻,澳门中联办主任郑晓松坠楼身亡,https://www.thepaper.cn/newsDetail_forward_2549389,7小时前,2018-10-21 18:27:19
104,中央人民政府驻澳门特别行政区联络办公室主任郑晓松同志因患抑郁症于2018年10月20日晚在其澳门住所坠楼身亡。,澎湃新闻,全国多地启动老年人能力评估工作,https://www.thepaper.cn/newsDetail_forward_2549317,8小时前,2018-10-21 18:27:19
105,我国有失能半失能老人4000多万人，但是这些老人具体的失能情况并没有科学的统计数据，目前多个省份已经着手开展针对老年人能力的评定工作。,澎湃新闻,2019年度考试录用公务员工作开始，计划招录1.45万人,https://www.thepaper.cn/newsDetail_forward_2549303,8小时前,2018-10-21 18:27:19
106,本次招考共有中央机关75个单位和20个直属机构参加，计划招录1.45万余人。考生报名主要采取网络报名的方式，报名时间为2018年10月22日至10月31日。,澎湃新闻,想当年｜“克塞，前来拜访”：30年前特摄片在中国,https://www.thepaper.cn/newsDetail_forward_2547618,8小时前,2018-10-21 18:27:19
107,1988年，特摄片《恐龙特急克塞号》在中国上映时曾经红极一时，几乎与同时期的动画片《变形金刚》一起，成为一代人的儿时记忆。,澎湃新闻,媒体：“儿童专用”商品多为虚假宣传，监管部门不应不闻不问,https://www.thepaper.cn/newsDetail_forward_2549298,8小时前,2018-10-21 18:27:19
108,消费者组织揭露“儿童专用”的虚假问题已有多年，但类似商品、商家依然招摇过市，没有收敛，监管部门还在等什么？,澎湃新闻,如何培养小小键盘探险家――德国儿童音乐教育的现状与经验,https://www.thepaper.cn/newsDetail_forward_2547873,8小时前,2018-10-21 18:27:19
109,德国在州立学校系统之外的音乐教育中，给予所有年龄的人广泛的学习机会，从为儿童开展的亲子课程，到学前和学龄教育课程，以及专门针对成人或老年人的课程。,澎湃新闻,不平静的家委会,https://www.thepaper.cn/newsDetail_forward_2535824,8小时前,2018-10-21 18:27:20
110,潜在的博弈变成了明面的竞争。一方面，学校希望有家长群体为其分担一些风险和责任；另一方面，家长期待更多介入到孩子的校园生活中去，借此让孩子在集体中的参与度更强。,澎湃新闻,孟京辉版《茶馆》：重塑经典，要真正与经典对话,https://www.thepaper.cn/newsDetail_forward_2549226,8小时前,2018-10-21 18:27:20
111,“孟京辉版《茶馆》最好的地方就是让老舍变得更丰富了，逼着观众去想一些以前看原作时从来不想的东西。”沈林说。,澎湃新闻,山东龙郓煤业发生冲击地压事故22人被困,https://www.thepaper.cn/newsDetail_forward_2549254,8小时前,2018-10-21 18:27:20
112,10月20日23时左右，位于山东郓城的龙郓煤业有限公司发生冲击地压事故，造成22人被困。事故发生后，当地政府立即启动应急预案，积极救援。,澎湃新闻,长沙执行非法捕捞生态修复，电打鱼者被判投放鱼5400余尾,https://www.thepaper.cn/newsDetail_forward_2549264,8小时前,2018-10-21 18:27:20
113,长沙市开福区人民法院在湘江鹅羊山码头组织开展了四起非法捕捞水产品案件的增殖放流生态修复执行行动，共放流鳙、鲢鱼5400余尾，修复湘江渔业生态环境。,澎湃新闻,程纯任南京中医药大学党委书记，陈涤平不再担任,https://www.thepaper.cn/newsDetail_forward_2549297,8小时前,2018-10-21 18:27:20
114,南京中医药大学领导班子换届，胡刚同志任校长，张策华、方祝元、程海波、乔学斌、徐桂华、孙志广、曾莉同志任副校长，免去黄桂成、程革、谭仁祥同志副校长职务。,澎湃新闻,多起典型案例提醒广大党员干部：公务接待的“红线”不能踩,https://www.thepaper.cn/newsDetail_forward_2549285,8小时前,2018-10-21 18:27:20
115,广大党员干部要坚决抵制享乐主义和奢靡之风，始终做到公私分明、严格自律，既不做违规公务接待的制造者，也不做违规公务接待的笑纳者。,澎湃新闻,人民论坛杂志：扒一扒官场中那些精致的利己主义者,https://www.thepaper.cn/newsDetail_forward_2549260,8小时前,2018-10-21 18:27:20
116,选拔优秀年轻干部的重要性不言而喻，然而在选拔中，我们必须警惕一些精致利己主义者。这些人大多善于表演，是不折不扣的官场“两面人”。,澎湃新闻,体验18.8元套餐被贷10800元，合肥痘博士再曝套路贷,https://www.thepaper.cn/newsDetail_forward_2549238,9小时前,2018-10-21 18:27:20
117,合肥的小杨向我们栏目反映说，自己在痘博士体验18.8元的套餐时，在没有被告知的情况下，竟然被贷款了10800元。,澎湃新闻,刘鹤：切实推出一些具体政策推动股市健康发展,https://www.thepaper.cn/newsDetail_forward_2549263,9小时前,2018-10-21 18:27:20
118,10月19日上午，中共中央政治局委员、国务院副总理刘鹤就当前经济金融热点问题接受了人民日报记者龚雯、新华社记者赵承、中央电视台记者许强的联合采访。,澎湃新闻,青岛新机场国际最高等级跑道贯通，明年下半年转场运营,https://www.thepaper.cn/newsDetail_forward_2548587,9小时前,2018-10-21 18:27:20
119,青岛新机场建设又传来新进展：新机场工程一期建设的东、西两条跑道正式贯通。这标志着新机场正式进入校飞准备阶段，为2019年新机场转场运营奠定了坚实基础。,澎湃新闻,政知见：15省市机构改革方案落地，这个省有点“特殊”,https://www.thepaper.cn/newsDetail_forward_2549213,9小时前,2018-10-21 18:27:20
120,全国部分省市公布了改革后的党政机构数量，一些省市在部门设置上除了有与中央保持一致的“规定动作”，还不乏“自选动作”，一批新机构脱颖而出，凸显地方特色。,澎湃新闻,福建长汀一原派出所长充当制毒保护伞，收受财物106万,https://www.thepaper.cn/newsDetail_forward_2548542,9小时前,2018-10-21 18:27:21
121,10月19日，省纪委监委通报了近期查处的3起典型案例。,澎湃新闻,开封古董玩家：收藏全靠眼力，一年280天在外寻宝,https://www.thepaper.cn/newsDetail_forward_2540854,9小时前,2018-10-21 18:27:21
122,虽然提起开封，千年前创造中国艺术巅峰的北宋总会被首先想起，然而后世的开封人，并没有将传统的精粹摒弃或停滞不前。历史，早已植入开封人骨子里的兴趣。,澎湃新闻,最后的讨海人：凌晨3点起床捕蟹供孩子读书| 中国人的一天,https://www.thepaper.cn/newsDetail_forward_2545466,9小时前,2018-10-21 18:27:21
123,你见过凌晨三点的北上广深吗？然而对有些人来说，凌晨三点却刚好是一天的开始。这段夜与日交替的时光，陈民与海的故事，正在上演......,澎湃新闻,每小时收费5.5元至10元 ，成都这家共享自习室能走多远,https://www.thepaper.cn/newsDetail_forward_2549225,9小时前,2018-10-21 18:27:21
124,如果提供一个安静的自习室，每个类似于工作间的独立“格子间”需要每小时付费5.5元至10元不等，你会愿意付费看书吗？,澎湃新闻,视频|女子当街持刀砍交警，被正面抱摔制服,https://www.thepaper.cn/newsDetail_forward_2548573,9小时前,2018-10-21 18:27:21
125,10月16日，广西百色。一女子电动车挡道，交警劝离遭其辱骂。随后女子进路边商店拿出2把刀对民警挥舞。民警上前将其抱摔制服。事后民警因身体被划伤送医，女子被刑拘。,澎湃新闻,云南大理州永平县发生3.1级地震，震源深度10千米,https://www.thepaper.cn/newsDetail_forward_2549210,9小时前,2018-10-21 18:27:21
126,中国地震台网正式测定：10月21日08时20分在云南大理州永平县（北纬25.17度，东经99.49度）发生3.1级地震，震源深度10千米。,澎湃新闻,专家解读香港行政长官2018施政报告：抓住机遇，主动作为,https://www.thepaper.cn/newsDetail_forward_2549192,9小时前,2018-10-21 18:27:21
127,香港特区行政长官林郑月娥日前在特区立法会正式发布题为“坚定前行 燃点希望”的《行政长官2018年施政报告》。,澎湃新闻,经济日报刊文：书店卖门票，得让读者觉得“值”,https://www.thepaper.cn/newsDetail_forward_2549193,9小时前,2018-10-21 18:27:21
128,近日，位于河北省石家庄人民广场负一层的“城市书房”开始实行入场阅读收费制，即买门票方能进店。店方表示，收费将一直坚持下去。,澎湃新闻,一张图算清：个税专项附加扣除让你多拿多少钱？,https://www.thepaper.cn/newsDetail_forward_2549173,9小时前,2018-10-21 18:27:21
129,《暂行办法》明确个人所得税法规定的子女教育等6项专项附加扣除的具体实施办法。享受这些专项附加扣除，需要哪些条件？通过这些扣除项目，纳税人可少缴多少个税？,澎湃新闻,视频|老人坐轮椅拄拐过马路，民警停车挡车流,https://www.thepaper.cn/newsDetail_forward_2548392,9小时前,2018-10-21 18:27:21
130,10月19日，浙江乐清。早高峰。一名坐轮椅老人倒行过斑马线时，用拐杖撑地使力助行。民警开车路过看见，停车为其挡车流，随后帮推老人轮椅并安全将其送回家中。,澎湃新闻,消失的金钱,https://www.thepaper.cn/newsDetail_forward_2548368,9小时前,2018-10-21 18:27:21
131,所有事情中最可怕的部分在于，钱和信心一同消失了。,澎湃新闻,AG600成功首飞都攻克了哪些难题？有哪些实际用途？,https://www.thepaper.cn/newsDetail_forward_2549199,9小时前,2018-10-21 18:27:21
132,AG600从外形上看，其上半部分是飞机，下半部分是船的造型。它高12.1米，机身长度37米，翼展38.8米，机身外部尺寸与波音737相当。,澎湃新闻,个税法实施条例拟增反避税条款，个人凭纳税人识别号实名办税,https://www.thepaper.cn/newsDetail_forward_2549198,9小时前,2018-10-21 18:27:22
133,新个人所得税法增加了反避税条款，借鉴企业所得税法的成熟经验，实施条例细化了反避税的有关规定，明确了有关概念和判定标准。,澎湃新闻,在亚洲我们还能稳赢谁？国青不敌塔吉克斯坦小组出线又悬了,https://www.thepaper.cn/newsDetail_forward_2549191,9小时前,2018-10-21 18:27:22
134,亚青赛首战，塔吉克斯坦的一记世界波远射让国青队0-1输掉比赛，而开门黑也很有可能让这支国青输掉小组赛出线主动权。,澎湃新闻,全球化下新闻人才如何培养？,https://www.thepaper.cn/newsDetail_forward_2548325,9小时前,2018-10-21 18:27:22
135,城市本身也是非常重要的学习环境，当学生沉浸在不同的语言和文化环境中，他们会反思从前对他者及不同文化的假设与偏见，从而提升他们的分析思维，能够改变他们讲述的故事。,澎湃新闻,郭炳湘的恩怨人生：绑架、世纪贪案和一个女人引发的豪门内斗,https://www.thepaper.cn/newsDetail_forward_2549151,9小时前,2018-10-21 18:27:22
136,帝国集团主席、新鸿基地产前主席郭炳湘10月20日上午在医院病逝，享年68岁。郭炳湘是香港传统房地产豪门新鸿基郭氏家族的长子，也是多年来郭氏家族豪门宫斗剧的主角。,澎湃新闻,早安・世界｜四千中美洲移民强势入境墨西哥，父亲护娃闯关,https://www.thepaper.cn/newsDetail_forward_2549158,10小时前,2018-10-21 18:27:22
137,澎湃早安每日呈现全球新鲜事：四千中美洲移民强势入境墨西哥；卡舒吉友人要求沙特归还遇难记者遗体；欧日水星探测器升空。,澎湃新闻,百岁春秋⑥虼┱胍线间，不觉已百岁,https://www.thepaper.cn/newsDetail_forward_2530435,10小时前,2018-10-21 18:27:22
138,澎湃新闻在今年重阳节期间，推出“十位百岁老人的家・春秋”，是为该系列第二季。江苏省射阳县，张瑞瑞100岁，见证了农场从昔日荒草滩变成今日的“米粮仓”。,澎湃新闻,"俄罗斯回应美退出中导条约：幻想建立""单极世界""",https://www.thepaper.cn/newsDetail_forward_2549169,10小时前,2018-10-21 18:27:22
139,美国总统特朗普称将退出与俄罗斯签订的《中导条约》，理由是俄方违反了条约规定。据法新社最新消息，俄罗斯外交部回应称，美国这样做的目的是幻想建立“单极世界”。,澎湃新闻,对话与儿子签零用钱协议的律师妈妈：生活中并非都签协议,https://www.thepaper.cn/newsDetail_forward_2549141,10小时前,2018-10-21 18:27:22
140,近日，广东东莞一名律师妈妈与10岁儿子五年间签署的四份协议引发网友和媒体的关注，有人认为签协议有利于孩子法律意识的建立，也有人认为协议缺少了人情味。,澎湃新闻,透视中国经济：“经济滞胀论”站得住脚吗？,https://www.thepaper.cn/newsDetail_forward_2549144,10小时前,2018-10-21 18:27:22
141,在中美贸易摩擦带来的下行风险冲击下，“中国经济滞胀”等唱衰论调泛起。那么，中国经济运行态势到底如何？能否顺利实现全年增长目标？宏观政策又将在哪些地方发力？,澎湃新闻,微博现疑似“吃鸡”钓鱼网站链接，客服称已将涉事广告下线,https://www.thepaper.cn/newsDetail_forward_2549139,10小时前,2018-10-21 18:27:22
142,近日，有游戏博主发帖称，新浪微博推广的一条游戏活动帖子提供的链接指向一疑似盗号网站。微博广告审核人员表示，已下线了违规广告。,澎湃新闻,分析｜今年以来央行为何多次调整金融数据统计口径？,https://www.thepaper.cn/newsDetail_forward_2545727,10小时前,2018-10-21 18:27:22
