,brief,header,pub_time,url
30,36氪讯，乐视网公告称，截止2018年11月15日，公司无法按时偿还北京中泰创盈企业管理有限公司贷款及利息共19.14亿元。公告称，公司目前经营困难，现金流紧张，短期无法获得现金支持。,乐视网：无法按时偿贷款及利息共19.14亿元,2018-11-15 17:09,http://www.szse.cn/disclosure/listed/bulletinDetail/index.html?dd5abd9d-4c83-46e3-abd5-47743b6ae123
31,36氪讯，14日，针对迪信通通信服务有限公司连续三个季度骚扰电话被举报量居高不下的问题，工业和信息化部信息通信管理局约谈了迪信通公司，要求其高度重视，深入剖析原因，采取针对性措施，切实整改，加强骚扰电话管控，务求实效。,工信部：就骚扰电话问题约谈迪信通公司,2018-11-15 17:02,http://www.miit.gov.cn/n1146290/n1146402/n1146440/c6495711/content.html
32,易车宣布其AI开放平台上线。据悉，此次上线的易车AI开放平台是汽车垂直领域的首个AI开放平台，同时是易车AI战略项目“擎天柱”计划落地的又一项重要推进。除已经亮相过的小艾机器人外，易车AI还包括智能电话外呼的场景与线下店面人脸账号系统的场景。（亿欧）,易车AI开放平台上线，包括智能电话外呼场景,2018-11-15 16:59,https://www.iyiou.com/breaking/20702
33,据外媒报道，在今年反犹太与反仇恨的Never is Now峰会上，反诽谤联盟将为苹果CEO蒂姆・库克颁发反仇恨勇气奖。ADL表示，库克一直在强大道德指南针的引导下行动着并表态商界有责任让世界变得更加美好、造福所有人。（cnBeta）,库克被ADL授予“反仇恨勇气奖”：12月3日举行颁奖礼,2018-11-15 16:58,https://tech.sina.com.cn/i/2018-11-15/doc-ihmutuec0416763.shtml
34,企业保险服务平台“保险极客”宣布获得1亿元B轮融资，投资方包括国家中小企业发展基金、联想控股，保险极客创始人兼CEO任彬向亿欧介绍，本轮融资将用于加强技术与金融复合型人员的引进和企业效率的智能化提升。（亿欧）,保险极客获1亿元B轮融资,2018-11-15 16:48,https://www.iyiou.com/p/85486
35,36氪讯，今日起，以北京地区为起点，腾讯将在《王者荣耀》中启用“账号时长共享”的新功能；同时，以《王者荣耀》为试点，人脸识别验证的二次抽样测试也于今天从北京开始启动。一个未成年人在《王者荣耀》上最多两个号，一个微信，一个QQ。同时，不管TA是用微信还是QQ登陆《王者荣耀》，或者两个账号都用，游戏总时长最多也不超过2个小时，12周岁以下的最多不超过1个小时。,腾讯健康系统上线“账号时长共享”新功能,2018-11-15 16:44,https://mp.weixin.qq.com/s/k0NBPRm5i5ZjsilIVKC-pw
36,头颈部癌症患病人群庞大，但头颈部重要器官比较集中，解剖关系复杂，如果在放射治疗前未仔细隔离，可能造成周围组织严重受损。腾讯医疗AI实验室和美国加州大学合作探索人工智能如何帮助分割过程，辅助放疗规划，近日联合在国际期刊《Medical Physics》发表研究成果：《器官神经网络：深度学习用于快速和全自动整体头颈危及器官靶区勾画》。（腾讯科技）,腾讯医疗AI实验室和美国加州大学联合发布最新研究,2018-11-15 16:39,http://tech.qq.com/a/20181115/012340.htm
37,今日起，由国家组织谈判的阿扎胞苷等17种抗癌药品正式纳入北京医保报销范围，参保患者可持卡实时结算。在这一惠民政策下，有的抗癌药价格降幅达80%，一年将为患者省数十万元。本次17种抗癌药的医保支付标准有效期截至2020年11月30日。（北京商报）,北京：15日起17种抗癌药品可享医保报销,2018-11-15 16:35,http://www.bbtnews.com.cn/2018/1115/274142.shtml
38,由国家信息中心分享经济研究中心牵头组织的共享住宿领域行业自律标准《共享住宿服务规范》15日发布。《规范》针对入住核实登记、房源信息审核、卫生服务标准、用户信息保护体系等社会民众关心的焦点问题提出了规范要求，并结合智能安全硬件设施的使用等技术创新和未来发展趋势展开前瞻性引导。小猪短租、爱彼迎、途家、美团榛果等企业承诺将切实履行《规范》的各项要求。（新华社）,《共享住宿服务规范》在京发布,2018-11-15 16:28,http://www.xinhuanet.com//2018-11/15/c_1123719209.htm
39,《纽约时报》周三披露华盛顿咨询公司Definers Public Affairs曾协助Facebook散播信息，诋毁批评者与竞争对手。今日该媒体又援引知情人士消息称，Facebook目前已经结束了与该公司的合作关系。知情人士称，包括扎克伯格和桑德伯格在内的公司多名高管对Definers的某些所作所为并不知情。（新浪科技）,传Facebook已终止与“黑公关”合作：曾诋毁谷歌苹果,2018-11-15 16:27,https://tech.sina.com.cn/i/2018-11-15/doc-ihmutuec0465720.shtml
