,brief,header,pub_time,url
0,英特尔公司副总裁Naveen Rao认为，现在AI创业有很多泡沫，实际上想要规模化很难，或许会有一两家AI芯片创业公司能活下来。,英特尔AI负责人：AI芯片初创公司想做大很难,19:51,http://www.tmtpost.com/nictation/3591355.html
1,首汽约车在广州、长沙、重庆、武汉等12个主要城市推出升级后的CI车载智能硬件系统。,首汽部署CI车载智能系统，强化司乘安全硬件体系,19:49,http://www.tmtpost.com/nictation/3591352.html
2,今日，有媒体报道相关部门检测并通知下架了90个恶意App，其中包括豌豆荚、应用宝等知名应用市场。,豌豆荚澄清被下架传闻：实为配合相关部门下架违规App,19:46,http://www.tmtpost.com/nictation/3591347.html
3,报道称，传闻小米正在洽购美图手机业务相关资产，也有消息称，双方的接触并非涉及并购，而是影像方面的战略合作。,小米官方回应洽谈美图手机业务：不予置评,19:44,http://www.tmtpost.com/nictation/3591344.html
4,因涉嫌在移动支付领域存在垄断行为，瑞士竞争监管机构WEKO已经对包括瑞信（Credit Suisse）和瑞银（UBS）等巨头在内的金融公司展开调查。,涉嫌抵制苹果三星移动支付方案，瑞士金融巨头遭调查,19:36,http://www.tmtpost.com/nictation/3591334.html
5,提出：民办园一律不准单独或作为一部分资产打包上市。上市公司不得通过股票市场融资投资营利性幼儿园，不得通过发行股份或支付现金等方式购买营利性幼儿园资产。,学前教育发展意见：上市公司不得通过股票市场融资投资营利性幼儿园,19:30,http://www.tmtpost.com/nictation/3591326.html
6,AMS是iPhone手机环境光传感器的供应商，该公司表示，下调业绩预期主要是因为“来自一家消费者领域大客户的订单量在近期出现了下滑”。,iPhone需求低迷重创伙伴，第4家供应商调低业绩预期,19:21,http://www.tmtpost.com/nictation/3591314.html
7,美丽境界资本欧洲并购基金（一期）今天宣布，完成首单交易，以2.4亿欧元对价收购德国Cordenka公司（以下简称“Cordenka”）100%股权。,美丽境界资本完成首单交易，2.4亿欧元收购德国公司Cordenka,19:18,http://www.tmtpost.com/nictation/3591310.html
8,北京市上市挂牌企业总部基地15日在北京顺义揭牌，同时顺义区与上交所形成战略合作备忘录。,北京首家上市挂牌企业总部基地揭牌，顺义区与上交所将战略合作,19:12,http://www.tmtpost.com/nictation/3591302.html
9,手机与投资业界小范围流传称，小米在洽购美图公司手机业务相关资产。,传小米正在与美图公司就手机相关业务洽谈,19:10,http://www.tmtpost.com/nictation/3591296.html
10,今日，网易考拉就“黑卡陷阱”事件做出了情况说明。在说明中，网易考拉向用户表示歉意，并称已联系用户做出了妥善处理。,网易回应黑卡陷阱：媒体报道以偏概全，已简化操作流程,18:25,http://www.tmtpost.com/nictation/3591215.html
11,今日，云管理平台及服务提供商FIT2CLOUD（飞致云）宣布已完成B轮融资，此轮融资由红点创投中国基金（红点中国）领投，广发乾和跟投。,FIT2CLOUD飞致云完成红点中国领投B轮融资，全栈云管平台2.0发布,18:21,http://www.tmtpost.com/nictation/3591198.html
12,根据商务大数据监测，2018年“双十一”当天全国网络零售交易额超过3000亿元，同比增长约27%，再创历史新高。,商务部：双十一全网交易额超3000亿元，同比增长约27%,18:02,http://www.tmtpost.com/nictation/3591135.html
13,银隆新能源针对昨日银隆集团发布的“致珠海银隆新能源股东函”做出回应，称董明珠并非公司的实际控制人，函件“想绑架董小姐的知名度、给她泼脏水”。,银隆新能源再发文“回怼”魏银仓：想绑架董小姐的知名度、给她泼脏水,17:57,http://www.tmtpost.com/nictation/3591125.html
14,乐视网发布公告称，近日，公司收到北京中泰创盈企业管理有限公司发出的《贷款催收通知书》。截至目前，公司无法按时偿还北京中泰创盈企业管理有限公司贷款及利息共19.14亿元。,乐视网：无法偿还北京中泰创盈贷款及利息逾19亿元,17:35,http://www.tmtpost.com/nictation/3591098.html
15,思科在该季度财报中宣布，在2019财年一季度正式完成对互联网安全公司Duo Security和云计算专业公司July Systems的收购。,思科发最新财报：该季度营收为131亿美元，净利同比增48%,17:24,http://www.tmtpost.com/nictation/3591084.html
16,工业和信息化部信息通信管理局约谈了迪信通公司，要求其高度重视，深入剖析原因，采取针对性措施，切实整改，加强骚扰电话管控，务求实效。,工信部信息通信管理局就骚扰电话问题约谈迪信通公司,17:13,http://www.tmtpost.com/nictation/3591065.html
17,李飞飞离职50天后，另一位知名的谷歌AI华裔高管，也辞别了这家美国科技巨头。她就是李佳，谷歌云AI研发主管、谷歌AI中国中心总裁。,谷歌AI中国中心总裁李佳离职，将专攻AI医疗方向,17:11,http://www.tmtpost.com/nictation/3591062.html
18,易车宣布其AI开放平台正式上线，易车AI已具备对外赋能的条件。,易车AI开放平台正式上线,17:04,http://www.tmtpost.com/nictation/3591053.html
19,今天起，以北京地区为起点，腾讯将在《王者荣耀》中启用“账号时长共享”的新功能；同时，以《王者荣耀》为试点，人脸识别验证的二次抽样测试也于今天从北京开始启动。,腾讯游戏健康系统上线“账号时长共享”新功能，启动人脸识别二次测试,17:01,http://www.tmtpost.com/nictation/3591042.html
20,保险极客创始人兼CEO任彬介绍，本轮融资将用于加强技术与金融复合型人员的引进和企业效率的智能化提升。,保险极客获1亿元B轮融资，国家中小企业发展基金、联想控股参投,16:57,http://www.tmtpost.com/nictation/3591033.html
21,摩拜单车今日宣布，正式推出“LBS广告服务”，即利用LBS大数据实现广告服务系统。此外，摩拜还宣布与奢侈品牌路易威登达成合作。,摩拜推出LBS广告服务，与LV达成合作,16:42,http://www.tmtpost.com/nictation/3591004.html
22,今日该媒体又援引知情人士消息称，Facebook目前已经结束了与该公司的合作关系。,传Facebook已终止与“黑公关”合作：曾诋毁谷歌苹果,16:38,http://www.tmtpost.com/nictation/3590996.html
23,华润微电子将投资约100亿元在重庆西永微电园建设12英寸晶圆生产线，主要生产MOSFET、IGBT、电源管理芯片等功率半导体产品。,华润微电子将投资约100亿元在重庆建设12英寸晶圆生产线,16:20,http://www.tmtpost.com/nictation/3590968.html
24,万科董事会主席郁亮表示，没有成功的企业，只有时代的企业。如果没有改革开放，中国证券市场一定不会有今天的万科。,郁亮：万科发展离不开中国资本市场,16:16,http://www.tmtpost.com/nictation/3590959.html
25,泰然金融于2014年9月上线，从事互联网借贷信息撮合业务。截至2018年6月30日，泰然金融累计出借金额已超过408亿元，拥有用户254万，累计出借笔数超过314万笔。,泰然金融赴美提交IPO招股书：拟最多募集2000万美元,16:06,http://www.tmtpost.com/nictation/3590941.html
26,据路透社报道，当地时间周三，美国联邦通信委员会（FCC）启动了其首次高频段5G频谱拍卖，以为下一代高速移动通信网络清理频谱空间。,FCC启动首次高频段5G频谱拍卖，为下一代高速网络推出做准备,16:05,http://www.tmtpost.com/nictation/3590938.html
27,近日，国家电影局下发了《国产电影复映暂行规定》，规定将于2018年12月1日起施行。,国家电影局下发《国产电影复映暂行规定》，12月1日起执行,15:31,http://www.tmtpost.com/nictation/3590877.html
28,据记者了解，华软资本与瀚华金控签署合作协议，计划合作发起规模为100亿元人民币的金融科技基金。,华软资本与瀚华金控合作发起100亿金融科技基金,15:28,http://www.tmtpost.com/nictation/3590874.html
29,上线仅一天，京东金融与众惠相互共同推出的“京东互保”悄然下架。,京东互保闪电下架，或与触动传统保险公司利益有关,15:25,http://www.tmtpost.com/nictation/3590868.html
30,吴胜武在致辞中表示，2017年中国大陆地区显示面板企业为全球显示产业贡献了35%的出货面积和24%的营收及营业利润。,工信部吴胜武：2018年中国大陆显示产业规模将超3000亿元,15:20,http://www.tmtpost.com/nictation/3590860.html
31,台积电表示，目前相关程序仍在初期阶段，无法评估后续进展及可能结果或影响。,台积电：因病毒损失5.84亿元，无法评估欧盟调查的后果,15:17,http://www.tmtpost.com/nictation/3590853.html
32,主要原因就是苹果一直在iPhone中使用更先进的技术和质量更高的零部件，这降低了iPhone的利润率。,外媒：iPhone的利润率已从峰值74％降至60%,15:13,http://www.tmtpost.com/nictation/3590846.html
33,电动卡车制造商Nikola近日宣布获2.1亿美元C轮融资，该公司不久前曾起诉特斯拉侵犯专利。据了解，今年8月时公司就已经为C轮融资筹集了1亿美元。,电动卡车制造商Nikola获2.1亿美元C轮融资，估值达11亿美元,15:09,http://www.tmtpost.com/nictation/3590841.html
34,,北京卫生监督部门将约谈部分五星级酒店,14:42,http://www.tmtpost.com/nictation/3590799.html
35,美团官方回复是，因业务调整需要，美团租车将不再在四川郫县提供服务，停止分时租赁试点运营，针对APP中的用户账户余额已安排退还，充分保障用户的利益。,美团悄悄关停了分时租赁业务,14:38,http://www.tmtpost.com/nictation/3590790.html
36,,吉利长城就广告门事件达成和解：有人捏造信息制造误解,14:26,http://www.tmtpost.com/nictation/3590772.html
37,,三星将为5G网络投资220亿美元：2020年占至少20%份额,14:25,http://www.tmtpost.com/nictation/3590770.html
38,,传嘉楠耘智和亿邦国际今年无法在香港完成IPO,14:14,http://www.tmtpost.com/nictation/3590755.html
39,,传腾讯拟加入安踏收购财团，双方均不予置评,13:52,http://www.tmtpost.com/nictation/3590728.html
40,,英特尔表示其驾驶员辅助系统可减少29%的交通事故,13:46,http://www.tmtpost.com/nictation/3590719.html
41,,ofo被多法院列入被执行人，涉及金额5360万元,13:23,http://www.tmtpost.com/nictation/3590687.html
42,,蔚来18座换电站落地京港澳高速，ES8车主可享受一年十二次免费换电,13:22,http://www.tmtpost.com/nictation/3590685.html
43,,华为正为海外市场开发语音助手：与亚马逊和谷歌竞争,12:50,http://www.tmtpost.com/nictation/3590647.html
44,,氢动力卡车创企公司融资2.1亿美元,12:44,http://www.tmtpost.com/nictation/3590638.html
45,,自动驾驶公司智加科技完成新一轮融资，红杉资本领投,12:41,http://www.tmtpost.com/nictation/3590634.html
46,,阿里系回应“相互保”遭监管约谈：一直积极汇报，目前运行正常,12:22,http://www.tmtpost.com/nictation/3590609.html
47,,Uber推出常旅客积分计划,11:51,http://www.tmtpost.com/nictation/3590570.html
48,,FF逾250名小股东美国集体起诉：要求收回中国公司控制权,11:28,http://www.tmtpost.com/nictation/3590538.html
49,,华为将于12月底在南非正式上线提供云服务,11:27,http://www.tmtpost.com/nictation/3590534.html
50,,多家音乐版权方联合回应：音集协无权要求KTV删歌,11:17,http://www.tmtpost.com/nictation/3590521.html
51,,纽约时报：Facebook聘请公关写稿攻击Google和苹果,11:15,http://www.tmtpost.com/nictation/3590517.html
52,,微软收购聊天机器人创业公司XOXCO,10:43,http://www.tmtpost.com/nictation/3590459.html
53,,Google向日本地区开放“Youtube音乐”服务,10:21,http://www.tmtpost.com/nictation/3590431.html
54,,万魔声学将借壳共达电声实现上市，交易价格为34.1亿元,09:57,http://www.tmtpost.com/nictation/3590390.html
55,,平安好医生与泰国BDMS达成战略合作，将提供一站式赴泰医疗服务,09:54,http://www.tmtpost.com/nictation/3590385.html
56,,唯品会第三季度营收178亿元，净利同比降32%,09:44,http://www.tmtpost.com/nictation/3590368.html
57,,亚马逊签约好莱坞顶级制片人，一口气拍8部片子,09:40,http://www.tmtpost.com/nictation/3590361.html
58,,巴菲特结束了对沃尔玛长达20年的投资,09:24,http://www.tmtpost.com/nictation/3590338.html
59,无人重卡公司智加科技宣布完成A+轮融资，由红杉资本中国基金领投，该公司已制定两年运营1000辆量级智能驾驶重卡车队的目标。,智加科技获红杉投资，将运营1000辆无人重卡车队,09:08,http://www.tmtpost.com/nictation/3590318.html
60,,美国启动首次高频5G频谱拍卖，网速比当前4G网络快100倍,08:59,http://www.tmtpost.com/nictation/3590300.html
61,,Uber增长放缓，第三季度亏损近10亿美元,08:54,http://www.tmtpost.com/nictation/3590293.html
62,,戴姆勒11亿在华新建研发中心,08:41,http://www.tmtpost.com/nictation/3590276.html
63,,苹果创下4月下旬以来最长连跌，市值蒸发逾1000亿美元,08:26,http://www.tmtpost.com/nictation/3590249.html
64,,万科总部大重组，合伙人机制深化,08:08,http://www.tmtpost.com/nictation/3590228.html
65,,牛仔裤品牌李维斯计划IPO，估值可能高达50亿美元,07:49,http://www.tmtpost.com/nictation/3590201.html
66,,沙特PIF欲投资万达旗下传奇影业至多7亿美元,07:45,http://www.tmtpost.com/nictation/3590194.html
67,,比特币暴跌15%至逾一年新低，在美上市相关概念股亦大幅下挫,07:28,http://www.tmtpost.com/nictation/3590175.html
68,,Facebook内部士气大降，仅52%的员工对未来保持乐观,07:23,http://www.tmtpost.com/nictation/3590169.html
69,,网易三季度营收24.5亿美元，略高于分析师预期,07:17,http://www.tmtpost.com/nictation/3590160.html
