,brief,classes_name,header,news_url,pubtime,savetime
71,日前卫健委发了紧急通知，要求所有三级医院，包括已上线预约挂号服务的二级医院，将放号时间调回到老百姓方便的时间，晚上22时至第二天早上凌晨6时不提供放号。,澎湃新闻,改革开放后的中国为什么能在13个经济体中表现得最为抢眼？,https://www.thepaper.cn/newsDetail_forward_2735920,2小时前,2018-12-13 19:42:32
72,改革开放40年以来，中国七亿多人口按国际贫困线标准脱贫，对过去40年世界减贫事业的贡献率超过70%。改革开放至今，中国是世界上唯一没有出现金融经济危机的国家。,澎湃新闻,白菜一分钱一斤，大妈连续数天排队抢购,https://www.thepaper.cn/newsDetail_forward_2735727,2小时前,2018-12-13 19:42:32
73,12月11日，山东德州一商场举办促销活动，只要排队领号结账，就能以一分钱一斤的价格抢购大白菜。附近的大爷大妈在超市里大排长龙，本应已经结束的活动多持续了数天。,澎湃新闻,这一次，清华呈现的是张伯驹潘素伉俪的书画手稿等,https://www.thepaper.cn/newsDetail_forward_2731608,2小时前,2018-12-13 19:42:32
74,12月13日，“高山仰止――张伯驹、潘素伉俪艺术文献展”在清华艺博开幕，呈现了张伯驹与潘素伉俪的书画作品，张伯驹的书信、文稿及友朋翰墨。,澎湃新闻,利用pos机替人“养卡”，十堰一家3人因非法经营罪获刑,https://www.thepaper.cn/newsDetail_forward_2735647,2小时前,2018-12-13 19:42:32
75,如果在持卡人到期无法还款的情况下，先行帮助持卡人还款，之后再通过从pos机刷卡的方式，将信用卡内的钱非法套现，并按一定比例收取手续费。,澎湃新闻,外交部：中国入世17年获中肯评价，但个别国家对此视而不见,https://www.thepaper.cn/newsDetail_forward_2735949,2小时前,2018-12-13 19:42:32
76,外交部发言人陆慷回应称，当前，多边贸易体制站在了新的关键当口，面临单边主义和保护主义的严重冲击。中方将坚持走多边主义道路，支持世贸组织进行必要改革。,澎湃新闻,南京大屠杀死难者国家公祭日，万名社会各界人士参加公祭仪式,https://www.thepaper.cn/newsDetail_forward_2735919,2小时前,2018-12-13 19:42:32
77,今天（12月13日）上午，南京大屠杀死难者公祭仪式，在侵华日军南京大屠杀遇难同胞纪念馆举行。,澎湃新闻,《男朋友》：请了宋慧乔+朴宝剑，却只演了个风光片？,https://www.thepaper.cn/newsDetail_forward_2732299,2小时前,2018-12-13 19:42:32
78,宋慧乔和朴宝剑许久未出山，本该是值得期待的搭档。可惜，从《男朋友》前几集的互动来看，火花不多。单独看男女主的个人cut，你会以为误入了一部古巴风景片。,澎湃新闻,《绿毛怪格林奇》：一部有圣诞恐惧症的圣诞片,https://www.thepaper.cn/newsDetail_forward_2715667,2小时前,2018-12-13 19:42:32
79,作为一部合家欢的电影，《绿毛怪格林奇》是合格的，也暗含了很多美国文化。细细来看，处处都体现好莱坞对美国精神的解读。,澎湃新闻,国家发改委：采煤沉陷区转型任务艰巨，要集中力量破瓶颈,https://www.thepaper.cn/newsDetail_forward_2735935,2小时前,2018-12-13 19:42:32
80,12月12日至13日，国家发展改革委在江苏省徐州市贾汪区组织召开全国资源枯竭城市转型发展暨采煤沉陷区综合治理经验交流现场会。,澎湃新闻,铭记是最好的告慰，更是奋进的动力,https://www.thepaper.cn/newsDetail_forward_2735789,2小时前,2018-12-13 19:42:32
81,12月13日，在凄厉的警报声中，我们迎来了第五个南京大屠杀死难者国家公祭日。今年，更有重庆、沈阳等地加入了国家公祭的行列，共同缅怀南京大屠杀的无辜死难者。,澎湃新闻,武汉豆瓣书店经营11年后将关闭：货源不足、读者大量减少,https://www.thepaper.cn/newsDetail_forward_2735848,2小时前,2018-12-13 19:42:33
82,两家豆瓣书店都是以出售出版社库存书为主。据茉莉所述，现在他们能从出版社库存里选到的好书越来越少，因为包括中国图书网在内的电商已经基本买断了库存书。,澎湃新闻,国象女神来了，这不是你熟悉的居文君,https://www.thepaper.cn/newsDetail_forward_2735368,2小时前,2018-12-13 19:42:33
83,居文君成为了国际象棋历史上第三位既在淘汰赛制夺冠，又在对抗赛赛制夺冠的棋后。但27岁的她依旧平静如水，沉稳而内敛，坚定而有力。,澎湃新闻,香港举行公祭悼念南京大屠杀死难者，林郑月娥出席,https://www.thepaper.cn/newsDetail_forward_2735808,2小时前,2018-12-13 19:42:33
84,13日早，香港特区政府在海防博物馆举行公祭仪式，悼念南京大屠杀的死难者。行政长官林郑月娥和多名政府官员出席。,澎湃新闻,宁夏：利用干细胞移植治疗一例下肢瘫痪，7个月前完成手术,https://www.thepaper.cn/newsDetail_forward_2735878,2小时前,2018-12-13 19:42:33
85,专家团队经过6个多小时的手术协助，为1名“颈椎骨折、颈髓损伤并双下肢完全瘫痪”患者，实施了 “神经胶原支架联合自体骨髓干细胞移植”手术。,澎湃新闻,刘淑青辞任乐视网总经理：留任董事长，财务总监张巍接棒,https://www.thepaper.cn/newsDetail_forward_2735927,2小时前,2018-12-13 19:42:33
86,12月13日，乐视网（300104）发布公告称，公司董事会于近日收到总经理刘淑青、副总经理袁斌、董事李宇浩的辞职报告。,澎湃新闻,回顾中国金曲40年，这一台盛典有我们最熟悉的歌声,https://www.thepaper.cn/newsDetail_forward_2735529,2小时前,2018-12-13 19:42:33
87,盛典集结了40年来承载时代记忆的金曲，不同代际的艺术家和流行歌手也汇聚一堂，用经典作品唤起观众心中最真挚的情感。,澎湃新闻,国家外汇局旗下投资平台再添新成员，5亿元成立中汇储投资,https://www.thepaper.cn/newsDetail_forward_2735717,2小时前,2018-12-13 19:42:33
88,由梧桐树投资平台100%持股的中汇储投资有限责任公司12月5日在北京注册成立，而梧桐树投资平台则由国家外汇管理局100%持股。,澎湃新闻,杭州ofo被指欠费连夜搬走，新址难寻,https://www.thepaper.cn/newsDetail_forward_2735663,2小时前,2018-12-13 19:42:33
89,12月12日，浙江杭州。澎湃新闻探访杭州ofo办公点，发现其登记地址已清空。物业称ofo拖欠水电等费用，连夜搬走。ofo公关回应已付钱，不认可物业算的其它费用。,澎湃新闻,抗日英烈胡一新：不怕流血牺牲的革命“乐天派”,https://www.thepaper.cn/newsDetail_forward_2735776,2小时前,2018-12-13 19:42:33
90,内蒙古自治区丰镇市元山子乡，冬日的阳光下，胡一新烈士塑像熠熠生辉。不时有人来到这里，敬献一束鲜花，低头默哀，缅怀这位令人钦佩的革命先烈。,澎湃新闻,山东抗癌药专项集中采购完成，平均降价17.4%,https://www.thepaper.cn/newsDetail_forward_2735794,2小时前,2018-12-13 19:42:33
91,目前，山东省抗癌药物专项集中采购工作已经圆满完成，128种抗癌药、386个中标产品，平均价格下降了17.4%，最大降幅达到82.6%。,澎湃新闻,西安财经学院更名为西安财经大学，新校徽样式公布,https://www.thepaper.cn/newsDetail_forward_2735778,3小时前,2018-12-13 19:42:34
92,近日，教育部致函陕西省人民政府，同意西安财经学院更名为西安财经大学（《教育部关于同意西安财经学院更名为西安财经大学的函》教发函[2018]138号）。,澎湃新闻,山东整治合同格式条款违法行为，重点为房地产、汽车销售,https://www.thepaper.cn/newsDetail_forward_2735825,3小时前,2018-12-13 19:42:34
93,山东省市场监督管理局要求，针对重点领域不公平合同格式条款突出问题，组织全省工商和市场监管系统开展重点领域合同格式条款违法行为专项整治工作。,澎湃新闻,广州海关：团伙盗用个人信息走私奶粉63万罐，案值超1亿,https://www.thepaper.cn/newsDetail_forward_2735852,3小时前,2018-12-13 19:42:34
94,走私团伙盗用他人身份信息，以跨境电商的方式走私进口奶粉销售牟利，不仅侵犯了公民的隐私，还冒用了他人本该享用的跨境电商交易免税额度，损害了消费者的利益。,澎湃新闻,一个足球教练的奋斗：朴泰夏，首位执教中国国家队的韩国人,https://www.thepaper.cn/newsDetail_forward_2733208,3小时前,2018-12-13 19:42:34
95,在中国足坛，足协也给了一个人成为国字号主帅的支点，他可以做到什么？他，就是朴泰夏。一个50岁的典型韩国足球人，在中国找到了自我奋进的历程。,澎湃新闻,图解｜为您解读《干部人事档案工作条例》下篇,https://www.thepaper.cn/newsDetail_forward_2735772,3小时前,2018-12-13 19:42:34
96,近日，中共中央办公厅印发了《干部人事档案工作条例》，并发出通知，要求各地区各部门认真遵照执行。,澎湃新闻,习近平主持召开政治局会议：分析研究明年经济工作，部署反腐,https://www.thepaper.cn/newsDetail_forward_2735886,3小时前,2018-12-13 19:42:34
97,中共中央政治局12月13日召开会议，分析研究2019年经济工作，研究部署2019年党风廉政建设和反腐败工作。中共中央总书记习近平主持会议。,澎湃新闻,3名学生放学路上被烫伤：系热力管爆裂,https://www.thepaper.cn/newsDetail_forward_2735847,3小时前,2018-12-13 19:42:34
98,12月13日，陕西西安。道路上的热力管道突然爆裂，产生的热浪将路过的至少三名放学回家的学生烫伤，一名接孩子的家长也被烫伤。目前，伤者已送医。,澎湃新闻,《那座城这家人》：生活有苦难，生活也会消除苦难,https://www.thepaper.cn/newsDetail_forward_2734308,3小时前,2018-12-13 19:42:34
99,《那座城这家人》不是想渲染苦难、传递悲观，而是想让观众从这个家庭的浴火重生，明白生活虽制造苦难，但它也会消除苦难，生活有至暗时刻，但有更多的光明和希望。,澎湃新闻,财政部：11月个人所得税同比下降17.3%，上月增长7%,https://www.thepaper.cn/newsDetail_forward_2735875,3小时前,2018-12-13 19:42:34
100,12月13日，财政部公布2018年11月财政收支情况。其中，个税数字最引人注目。11月份，个人所得税同比下降17.3%。,澎湃新闻,涉医犯罪如何定罪量刑？专家：辱骂等医闹情形面临执法空白,https://www.thepaper.cn/newsDetail_forward_2735640,3小时前,2018-12-13 19:42:34
101,立法应该明确规定医院是事关患者生命安全的公共场所，应加强执法权的有效性、权威性、震慑力，很多辱骂、纠缠、推搡、打人无法取证的情形是执法的空白地带，应得到重视。,澎湃新闻,电商扶贫的实践：以四川省88个贫困县为样本,https://www.thepaper.cn/newsDetail_forward_2699713,3小时前,2018-12-13 19:42:34
102,我们特别选取四川省88个贫困县作为样本，对他们电商扶贫实践进行剖析，希望为推进农业农村现代化工作提供决策参考。,澎湃新闻,3工人中毒后“失踪”，家属医院找到遗体,https://www.thepaper.cn/newsDetail_forward_2735740,3小时前,2018-12-13 19:42:35
103,12月8日，河南孟津永龙能化3工人疑亚硝酸钠中毒抢救无效于晚10点先后死亡。次日家属询问工厂无果经工友指点在太平间找到遗体。该厂7月就曾发生有毒气体泄漏。,澎湃新闻,赏金提高10万，广东警方悬赏30万通缉杀害5人嫌犯覃志钢,https://www.thepaper.cn/newsDetail_forward_2735736,3小时前,2018-12-13 19:42:35
104,11月23日，公安部发布A级通缉令，全国缉捕先后在广西环江、广东陆丰两地杀害5人的犯罪嫌疑人覃志钢，广东警方悬赏30万元通缉该嫌疑人。,澎湃新闻,外交部：中国是否安全，加拿大老百姓心中自有一杆秤,https://www.thepaper.cn/newsDetail_forward_2735742,3小时前,2018-12-13 19:42:35
105,外交部发言人陆慷表示，中方一贯对与外界交往持积极开放态度，欢迎外国游客和公民来华旅行，经商、留学等，只要遵守中国法律法规没有什么可担心的。,澎湃新闻,刘振亚：全球能源互联网是应对气候变化的治本之策,https://www.thepaper.cn/newsDetail_forward_2735671,3小时前,2018-12-13 19:42:35
106,2018年联合国气候变化大会正在波兰卡托维兹举行。全球能源互联网发展合作组织主席刘振亚日前表示，全球能源互联网是应对气候变化的“治本之策”。,澎湃新闻,券商加入卖房大军，部分上市公司主动打折卖房依然卖不出去,https://www.thepaper.cn/newsDetail_forward_2733477,3小时前,2018-12-13 19:42:35
107,今年上市公司卖房大军呈现多个特点：像券商这种上市公司加入卖房大军；部分上市公司出现“卖房难”现象，主动打折出售房产却依然卖不出去，等等。,澎湃新闻,昆明福海街道3个月发生2起火灾致14死，3名领导干部被免,https://www.thepaper.cn/newsDetail_forward_2735679,3小时前,2018-12-13 19:42:35
108,12月13日，记者从昆明市纪委监委获悉，近3个月，云南省昆明市西山区福海街道办事处连续发生两起较大火灾事故，致14人遇难。,澎湃新闻,秦洪看盘｜增量资金裹足不前，制约弹升空间,https://www.thepaper.cn/newsDetail_forward_2735728,3小时前,2018-12-13 19:42:35
109,周四A股市场出现了高开高走的态势。不过，在午市后的成交量明显低于早盘的量能。买力不足，无论是上证指数还是创业板指，均有冲高受阻的态势。,澎湃新闻,湖南省张家界市人大常委会原副主任邓大渊接受审查调查,https://www.thepaper.cn/newsDetail_forward_2735482,3小时前,2018-12-13 19:42:35
110,据湖南省纪委监委消息：张家界市人大常委会原副主任邓大渊涉嫌严重违纪违法，目前正接受湖南省纪委监委纪律审查和监察调查。,澎湃新闻,男子持刀威胁妻子和岳父，民警搏斗受伤,https://www.thepaper.cn/newsDetail_forward_2735724,3小时前,2018-12-13 19:42:35
111,12月11日，湖北武汉。一名男子持刀欲伤害妻子和岳父。警方赶到现场处置，搏斗时一名民警的眉角被嫌疑人用头撞破，血流满面，但其忍痛将嫌疑人控制，其他群众均无伤亡。,澎湃新闻,马上评｜看直播考上清华北大，时代需要这样的励志故事,https://www.thepaper.cn/newsDetail_forward_2735686,3小时前,2018-12-13 19:42:35
112,沉迷游戏的是留守儿童，从穷乡僻壤考上北大清华的也是留守儿童。这些事情只是说明了一个古老的真理――有教无类。,澎湃新闻,老板请46名环卫工吃火锅，欲每月请一次,https://www.thepaper.cn/newsDetail_forward_2735701,3小时前,2018-12-13 19:42:35
113,12月11日，河南鹤壁。一家火锅店负责人请46名环卫工吃火锅，并打算在这个冬天每月请环卫工人吃一次火锅，负责人说他们真的很辛苦，希望能给他们带来一些温暖。,澎湃新闻,16个不同“版本”的国歌，听过几首？,https://www.thepaper.cn/newsDetail_forward_2735723,3小时前,2018-12-13 19:42:36
114,56岁张建洛是河南洛阳百年留声博物馆馆长，在他收藏的18000多张唱片中，有一套精心整理的“国歌唱片档案”，里面有16个“版本”国歌唱片，每张都有各自时代烙印。,澎湃新闻,陈刚：雄安交通枢纽“两主两辅”，火车在城际站地下穿城而过,https://www.thepaper.cn/newsDetail_forward_2735648,3小时前,2018-12-13 19:42:36
115,雄安新区将形成“两主两辅”，“两主”为雄安高铁站、城际站，“两辅”为白洋淀站、白沟站。主要枢纽性站场采取的产城一体模式，是雄安新区规划建设的一大特色和亮点。,澎湃新闻,美国科学家通过基因改造让水稻实现无性繁殖,https://www.thepaper.cn/newsDetail_forward_2735661,3小时前,2018-12-13 19:42:36
116,美国科学家团队通过基因改造技术，借助种子成功实现了水稻（通常为有性繁殖）的无性繁殖。这一成果证明了作物无性繁殖的可行性，代表了农作物育种领域的一项重大发展成果。,澎湃新闻,男子盗银行卡取走两万：密码就写卡上啊,https://www.thepaper.cn/newsDetail_forward_2735431,3小时前,2018-12-13 19:42:36
117,近日，浙江宁波。嫌疑人水某因连续盗窃他人车内物品被抓，审讯时其称，第三次盗窃时，本来不知道银行卡密码，但是发现密码就贴在卡背后。没办法“只能”取走卡里两万多元。,澎湃新闻,太原警方打掉网络卖淫团伙：键盘手招嫖，黑车司机接送卖淫女,https://www.thepaper.cn/newsDetail_forward_2735461,3小时前,2018-12-13 19:42:36
118,据悉，该团伙自今年10月以来，通过网络组织介绍卖淫300余次，现已查明非法获利30余万元。目前，案件仍在进一步办理当中。,澎湃新闻,祁连山张掖段再无矿山探采扰动，117个整治点完成整改,https://www.thepaper.cn/newsDetail_forward_2735631,3小时前,2018-12-13 19:42:36
119,祁连山国家级自然保护区张掖段矿山修复治理及矿业权退出补偿工作已全面完成，祁连山自然保护区张掖段从此再无矿山探采活动。,澎湃新闻,视频丨霸座女大闹京沪高铁称“想坐哪就坐哪”，被拘留7天,https://www.thepaper.cn/newsDetail_forward_2735558,3小时前,2018-12-13 19:42:36
120,近日，又一幕高铁“霸座”的闹剧再次上演，在从上海虹桥开往北京南的G170次高铁列车上，一名女子强行霸占他人座位，该女子被带回派出所依法予以行政拘留7日的处罚 。,澎湃新闻,国家药监局公布7家企业飞行检查结果，4家被要求限期整改,https://www.thepaper.cn/newsDetail_forward_2735589,3小时前,2018-12-13 19:42:36
121,长春民健医疗器械共发现12项一般缺陷；芜湖道润共发现8项一般缺陷；天津泰士康共发现14项一般缺陷；迈克生物共发现3项一般缺陷。四家企业均被要求限期整改。,澎湃新闻,浙江国企资产总额居全国第二，省属企业混合所有制比重超七成,https://www.thepaper.cn/newsDetail_forward_2735542,3小时前,2018-12-13 19:42:36
122,至2017年底，浙江国有企业资产总额10.44万亿元，居全国第二。“省属企业公司制改制已全面完成，混合所有制比重为70.7%，资产证券化率达61%。”,澎湃新闻,“心情不好去兜兜风”：浙江11岁男孩偷开爸爸汽车上了马路,https://www.thepaper.cn/newsDetail_forward_2735524,3小时前,2018-12-13 19:42:36
123,“儿子把我的汽车开走了，请帮忙寻找，他才11岁！”12月10日6时51分，浙江临海市交警部门接到浙J088**车主周先生的报警。,澎湃新闻,土耳其高铁脱轨事故已致7死46伤，暂无中国人伤亡报告,https://www.thepaper.cn/newsDetail_forward_2735435,4小时前,2018-12-13 19:42:36
124,当地时间13日清晨，土耳其首都安卡拉一辆高速列车撞向立交桥，两节车厢脱轨，目前，事故的死亡人数已升至7人，46名伤者中3人重伤。,澎湃新闻,市民吐槽地铁票价太低？沈阳地铁：确有投诉，未接涨价通知,https://www.thepaper.cn/newsDetail_forward_2735252,4小时前,2018-12-13 19:42:36
125,《沈阳晚报》12月11日消息称，有市民近日通过12345市民服务热线暨营商环境诉求平台吐槽沈阳地铁票价太低，并建议适当上涨。,澎湃新闻,巩义“村霸干部”调查续：违规厂房已拆,https://www.thepaper.cn/newsDetail_forward_2734265,4小时前,2018-12-13 19:42:37
126,12月12日，河南巩义。针对澎湃新闻日前报道的《巩义“村霸”调查：强拆坟，占地建厂》一事，当地宣传部回应，违建厂房已拆除，仅剩基本框架。,澎湃新闻,证监会：强化对证券交易所和行业协会监察监督,https://www.thepaper.cn/newsDetail_forward_2735588,4小时前,2018-12-13 19:42:37
127,中央纪委国家监委驻证监会纪检监察组召开座谈会，就前期形成的证监会系统证券交易所和行业协会学习贯彻监察法专题调研报告及有关公权力清单、责任清单进行集中讨论修改。,澎湃新闻,外交部证实中方对两加拿大公民采取强制措施：已分别通报加方,https://www.thepaper.cn/newsDetail_forward_2735634,4小时前,2018-12-13 19:42:37
128,外交部发言人陆慷就两名加拿大公民在中国被依法审查事应询表示，加拿大公民康明凯和加拿大公民迈克尔涉嫌从事危害中华人民共和国国家安全活动。,澎湃新闻,上海有了工业互联网标识解析国家顶级节点，二级节点也在建设,https://www.thepaper.cn/newsDetail_forward_2735403,4小时前,2018-12-13 19:42:37
129,标识解析体系顶级节点是国家工业互联网核心资源和重要基础设施，是支撑工业万物互联互通的神经枢纽，也为企业每个产品、零部件、机器设备等赋予唯一的“身份证”。,澎湃新闻,《甘肃省志》披露：祁连山冰川面积50年平均退缩35.6%,https://www.thepaper.cn/newsDetail_forward_2735430,4小时前,2018-12-13 19:42:37
130,《甘肃省志・自然地理志》于近日出版问世，首次完整介绍了甘肃自然地理历史与现状，其中披露内容显示，祁连山冰川面积50年平均退缩35.6%。,澎湃新闻,被辞退辅警穿“一级警司”警服到派出所“摆平事情”：已刑拘,https://www.thepaper.cn/newsDetail_forward_2735349,4小时前,2018-12-13 19:42:37
131,19岁的无业游民宋某，穿着网购的“警服”，佩戴警用标识，大摇大摆走进楚雄市公安局东城派出所，大张旗鼓地为其朋友“摆平”事情，结果当然是被真警察抓了个正着！,澎湃新闻,淘宝公益平台更名为阿里巴巴公益平台，运营主体保持不变,https://www.thepaper.cn/newsDetail_forward_2735274,4小时前,2018-12-13 19:42:37
132,近接浙江淘宝网络有限公司来函，申请变更公益平台名称。经研究，同意淘宝公益平台更名为阿里巴巴公益平台，运营主体保持不变。,澎湃新闻,四游客庐山赏雪困悬崖，获救后鞠躬感谢,https://www.thepaper.cn/newsDetail_forward_2735534,4小时前,2018-12-13 19:42:37
133,近日，江西九江。庐山迎来一场大雪，4名游客在五老峰景区游览途中迷路，被困悬崖边。他们用手机向外界求救，被成功营救后鞠躬道谢，“给大家添麻烦了，谢谢”。,澎湃新闻,马上评｜大学没电小区喝“墨”，为何甩锅的多了担当的少了,https://www.thepaper.cn/newsDetail_forward_2735331,4小时前,2018-12-13 19:42:37
134,供水供电等问题，对身处困境中的人来说，都是实实在在的大事，而且是等不得、等不起的急事，无人处置或处置不当将严重影响人们的生活、学习和工作。,澎湃新闻,姐姐患白血病，8岁弟弟欲增重捐骨髓,https://www.thepaper.cn/newsDetail_forward_2735453,4小时前,2018-12-13 19:42:37
135,12月7日，山东聊城。16岁的小怡7月份被查出急性白血病，一直被姐姐照顾的8岁弟弟想捐骨髓，但因体重只有50斤被拒绝，弟弟说我可以吃的胖胖的救姐姐。,澎湃新闻,特朗普前律师获刑3年，后悔“盲目效忠”,https://www.thepaper.cn/newsDetail_forward_2735213,4小时前,2018-12-13 19:42:37
136,12月12日，美国总统特朗普的前私人律师迈克尔・科恩被判处三年监禁。法官认定其违规支付封口费等罪名成立。科恩在庭上称后悔对特朗普“盲目效忠”。,澎湃新闻,土耳其高铁疑撞上火车头，至少7死43伤,https://www.thepaper.cn/newsDetail_forward_2735460,4小时前,2018-12-13 19:42:38
137,12月13日6时30分许，土耳其安卡拉附近，一高铁列车与一火车车头相撞，至少7人死亡43人受伤。据称，该高铁先撞上同一轨道的火车车头，后撞向立交桥。,澎湃新闻,2018中国融媒体发展论坛在昆明举行,https://www.thepaper.cn/newsDetail_forward_2735271,4小时前,2018-12-13 19:42:38
138,13日，2018中国融媒体发展论坛在云南昆明开幕。来自全国近百家中央和地方媒体，研究机构和高校的150余名专家学者、一线记者共论媒体融合发展的新方向与新路径。,澎湃新闻,当一个足球翻译有多难？读完这些，你会更佩服穆里尼奥,https://www.thepaper.cn/newsDetail_forward_2733204,4小时前,2018-12-13 19:42:38
139,如果不能实现成为职业球员、成为足球教练的梦想，那么无限接近这个行业，也会是一种美妙。如果你有足够的语言技能，又懂一点足球，当一个足球翻译会如何？,澎湃新闻,李公明蛞恢苁榧牵焊圆痔煨牡摹…“亚洲觉醒”,https://www.thepaper.cn/newsDetail_forward_2733820,4小时前,2018-12-13 19:42:38
140,全书的最后一句话是：“亚洲面临着外来大敌，最终的胜利只取决于自身是否能够觉醒。”这是他的“觉醒论”的最有力表述。,澎湃新闻,单亲妈妈骑车带娃剐蹭轿车，路过“宝马男”掏三百赔给车主,https://www.thepaper.cn/newsDetail_forward_2735173,4小时前,2018-12-13 19:42:38
