,brief,classes_name,header,news_url,pubtime,savetime
141,王女士说，当时她已经想好，通知朋友带钱过来，没想到“宝马男”直接帮忙出钱赔偿，自己都没反应过来。这一次，确实被感动了。,澎湃新闻,六集纪录片《黑暗时刻：我们在南京》今晚登陆江苏卫视,https://www.thepaper.cn/newsDetail_forward_2734800,4小时前,2018-12-13 19:42:38
142,《黑暗时刻：我们在南京》以6位外国友人在南京大屠杀中的亲身经历为线索，记录历史真相，揭露日军暴行，歌颂人性与正义之光。,澎湃新闻,独子救人溺亡，五旬母亲试管生下龙凤胎,https://www.thepaper.cn/newsDetail_forward_2734832,4小时前,2018-12-13 19:42:38
143,12月11日，河南濮阳。大学生孟瑞鹏2015年为救落水儿童溺亡，其走后母亲无法走出，52岁的母亲通过试管婴儿技术生下一对龙凤胎，孟瑞鹏的父亲说有孩子就有奔头。,澎湃新闻,母亲患病记忆停在多年前，31岁男子每天穿校服与其视频聊天,https://www.thepaper.cn/newsDetail_forward_2735291,4小时前,2018-12-13 19:42:38
144,三年前，王强的母亲因患有阿尔茨海默氏症，记忆永远停在了他的高中时期，为了让母亲开心、放心，今年31岁的王强开始扮演高中时期的自己。,澎湃新闻,联盟号裂缝采样，将送回地球检测,https://www.thepaper.cn/newsDetail_forward_2734929,4小时前,2018-12-13 19:42:38
145,12月11日，俄罗斯宇航员对联盟号MS-09裂缝采样，将送回地球检测。该飞船曾在8月30日出现裂缝，宇航员用特制胶水等堵住裂缝，有专家分析裂缝或是人为因素导致。,澎湃新闻,南大涉抄袭教授梁莹获七项处分？校方：处理结果近期公布,https://www.thepaper.cn/newsDetail_forward_2735086,4小时前,2018-12-13 19:42:38
146,近日，一张“南京大学给予梁莹以下处分”（以下简称“处分”）的图片引发网友关注。13日，知情者告诉记者，相关图片出自南京大学12日召开的“警示大会”。,澎湃新闻,快来接单！上海征集十大AI应用场景解决方案，涉及医院学校,https://www.thepaper.cn/newsDetail_forward_2734969,4小时前,2018-12-13 19:42:38
147,发布会上，上海10大人工智能应用场景、19个具体点位需求和60个人工智能创新产品集中首发，这是全国首次面向人工智能应用场景发布“英雄帖”。,澎湃新闻,贵州省政府副秘书长张吉兵任贵安新区管委会副主任,https://www.thepaper.cn/newsDetail_forward_2735091,4小时前,2018-12-13 19:42:39
148,张吉兵任贵州贵安新区管委会副主任，不再担任贵州省人民政府副秘书长职务。何秀黔正式任贵州省教育厅督学（副厅长级），任职时间从2017年10月起计算。,澎湃新闻,人民日报：用荧屏故事书写改革华章,https://www.thepaper.cn/newsDetail_forward_2734990,4小时前,2018-12-13 19:42:39
149,这些作品类型多样、风格各异，通过艺术的视角从不同领域与侧面浓墨重彩地展现出改革开放40年的探索实践和思想激荡，及其为百姓生活带来的翻天覆地之变。,澎湃新闻,美国那点事｜前私人律师已被判刑，特朗普能挺过通俄门调查吗,https://www.thepaper.cn/newsDetail_forward_2735042,4小时前,2018-12-13 19:42:39
150,新年过后，民主党控制众议院，通俄门的调查正要走向高潮。特朗普的考验在于能否守住他在共和党选民中的支持率。一场政治风暴即将降临华盛顿，特朗普将面临不小的考验。,澎湃新闻,武汉一男子花15万造“载人飞碟”，试飞时多次摔断肋骨,https://www.thepaper.cn/newsDetail_forward_2735045,4小时前,2018-12-13 19:42:39
151,他已制作了20余架飞行器，包括滑翔机、直升机、轻型固定翼飞机等多种机型，部分飞行器可以载人。他坦言，自己在试飞过程中多次摔断肋骨。,澎湃新闻,改革开放40周年｜多国前政要：中国为世界经济作出巨大贡献,https://www.thepaper.cn/newsDetail_forward_2735064,5小时前,2018-12-13 19:42:39
152,“巨大”、“惊人”、“了不起”，提到中国改革开放四十年，各国前政要用这样的词汇表达对中国改革开放成就的赞赏和钦佩。,澎湃新闻,网曝沈阳一高收费幼稚园有教师涉嫌虐童，警方已立案,https://www.thepaper.cn/newsDetail_forward_2735079,5小时前,2018-12-13 19:42:39
153,沈阳寿泉派出所一位民警告诉记者，家长前来报案后，派出所第一时间立案，并下发了立案告知书，目前此案已移交给皇姑区公安局刑侦大队。,澎湃新闻,土耳其媒体：高铁撞上铁路机车后脱轨，事故致4死43伤,https://www.thepaper.cn/newsDetail_forward_2734753,5小时前,2018-12-13 19:42:39
154,土耳其私营电视台NTV援引安卡拉省长瓦西普・沙辛(Vasip Sahin)消息称，事故造成至少4人死亡，43人受伤。,澎湃新闻,成都一小区内一男子坠亡，物业：非住户，警方已确认他是小偷,https://www.thepaper.cn/newsDetail_forward_2734902,5小时前,2018-12-13 19:42:39
155,物业公司工作人员12月13日向澎湃新闻确认，该男子不是小区住户，“警方已经确认是一名小偷，应该是一名惯偷。”,澎湃新闻,中国铁路40年丨从8亿到30亿的火车传奇,https://www.thepaper.cn/newsDetail_forward_2734120,5小时前,2018-12-13 19:42:39
156,从1978年的8.15亿人次，到2017年的30.84亿人次，中国铁路书写出精彩传奇。,澎湃新闻,被直播改变的贫困地区高中：就像“往井下打了光，丢了绳子”,https://www.thepaper.cn/newsDetail_forward_2733540,5小时前,2018-12-13 19:42:39
157,直播改变了这两条线。200多所学校，全天候跟随成都七中平行班直播，一起上课、作业、考试。有的学校出了省状元，有的本科升学率涨了几倍、十几倍。,澎湃新闻,国家林草局：继续实行严格禁止犀牛角和虎骨入药,https://www.thepaper.cn/newsDetail_forward_2734989,5小时前,2018-12-13 19:42:39
158,国家林业和草原局新闻发言人、宣传中心主任黄采艺明确表示，将继续严格禁止进出口、出售、收购、携带犀牛和虎及其制品，同时严格禁止犀牛角和虎骨入药。,澎湃新闻,指挥家俞潞：让中国少年奏响“巨人之声”,https://www.thepaper.cn/newsDetail_forward_2731987,5小时前,2018-12-13 19:42:39
159,笔者在采访间隙翻看了俞潞手边那本已经用不同颜色笔触做满了标记的总谱，才隐约知道了舞台上那份挥斥方遒的潇洒是怎样的勤勉与积淀换来的。,澎湃新闻,为何大学生屡成传销组织主要目标：没有社会经验少经风雨,https://www.thepaper.cn/newsDetail_forward_2733961,5小时前,2018-12-13 19:42:40
