,header,pub_time,url
0,区块链能否成为人工智能市场的催化剂？,6小时前,https://ai.ofweek.com/news/2018-10/ART-201713-8500-30274583.html
1,百度成为PAI首个中国会员，中国正在成为世界人工智能领导者,6小时前,https://ai.ofweek.com/news/2018-10/ART-201721-8440-30274562.html
2,科大讯飞上市十年：发展引擎何在？,9小时前,https://ai.ofweek.com/news/2018-10/ART-201718-8500-30274520.html
3,中国初创科技公司融资额位居世界第一，AI独角兽公司名列前茅,9小时前,https://ai.ofweek.com/news/2018-10/ART-201721-8460-30274512.html
4,Facebook正用人工智能检测深度假视频！,10小时前,https://ai.ofweek.com/news/2018-10/ART-201721-8140-30274441.html
5,人工智能正在彻底改变着人们的生活方式，推动市场经济整体快速发展,10小时前,https://ai.ofweek.com/news/2018-10/ART-201721-8420-30274438.html
6,人口红利渐行渐远 人工智能红利走来,11小时前,https://ai.ofweek.com/news/2018-10/ART-201721-8420-30274415.html
7,亚马逊增加1000名Alexa研发人员，意欲何为？,11小时前,https://ai.ofweek.com/news/2018-10/ART-201721-8460-30274401.html
8,力推开发者使能计划，华为云全面布局人工智能,17小时前,https://ai.ofweek.com/news/2018-10/ART-201721-8460-30274306.html
