,brief,classes_name,header,news_url,pubtime,savetime
0,为了确保自己遥遥领先的“绝对优势”，不惜打压13亿中国人追求美好生活的正当权利，这不是强权逻辑又是什么？又哪里有一点“历史正义”？,澎湃新闻,美国挑起贸易战的实质是什么？,https://www.thepaper.cn/newsDetail_forward_2334419,1小时前,2018-08-09 20:25:41
1,累计注册用户４００多万、收取押金超过８亿元，上线一年完成两轮融资。然而不过两年时间，风风火火的小鸣单车便宣布破产。,澎湃新闻,11万用户等退押金，首例共享单车破产案折射哪些行业困局？,https://www.thepaper.cn/newsDetail_forward_2334674,30分钟前,2018-08-09 20:25:42
2,也门萨达省卫生部负责人称，9日的袭击事件已经造成43人死亡61人受伤。红十字国际委员会在也门的负责人还在推特上称，大部分死伤者是10岁以下的儿童。,澎湃新闻,也门公交车遇袭事件已致43死61伤，多数为十岁以下儿童,https://www.thepaper.cn/newsDetail_forward_2334624,9分钟前,2018-08-09 20:25:42
3,似曾相识的牵连入罪、似曾相识的申诉抗争、似曾相识的峰回路转等，在冤案密集平反下，这起最新纠正的错案，或许已不像当初张氏叔侄案那样，让人以眼前一亮。,澎湃新闻,【社论】廖海军无罪，冤案平反还须久久为功,https://www.thepaper.cn/newsDetail_forward_2334062,2小时前,2018-08-09 20:25:42
4,海军“台州舰”舷号为533，隶属南海舰队，是我国自行设计建造的导弹护卫舰，20世纪80年代服役，原名“宁波舰”，2003年更名为“台州舰”。,澎湃新闻,海军南海舰队台州舰即将退役，曾在南沙海域怼美国军舰拉森号,https://www.thepaper.cn/newsDetail_forward_2333682,9分钟前,2018-08-09 20:25:43
5,消息人士称，特朗普不点名地表示：“几乎所有来到美国的学生都是间谍。”卡内基国际和平基金会高级研究员斯韦因评价说，特朗普的言论是“无知的胡话”。,澎湃新闻,特朗普称留学生都是间谍疑暗指中国，被批“无知的胡话”,https://www.thepaper.cn/newsDetail_forward_2334188,13分钟前,2018-08-09 20:25:43
6,近日，湖北武汉。一男子在朋友圈炫耀枪支照片，被民警查获。经查男子为网购仿真枪，后交由一名网友改造。民警按照该线索，捣毁了一个公安部督办网络贩枪团伙，抓获12人。,澎湃新闻,网购仿真枪再改造，男子朋友圈晒图被抓,https://www.thepaper.cn/newsDetail_forward_2333584,14分钟前,2018-08-09 20:25:43
7,郑靖已收到长沙开福公安分局的《移送起诉告知书》，称杨某某被合同诈骗一案，该局认为犯罪事实清楚，证据确实充分，现侦查终结，移送开福区检察院审查起诉。,澎湃新闻,主持人汪涵之妻杨乐乐疑被诈骗案进展：检察院正审查起诉,https://www.thepaper.cn/newsDetail_forward_2334551,16分钟前,2018-08-09 20:25:43
8,最高法近日出台关于为海南全面深化改革开放提供司法服务和保障的意见，充分发挥人民法院职能作用，推动海南自由贸易试验区和中国特色自由贸易港建设。,澎湃新闻,最高法出台意见为海南全面深化改革开放提供司法保障,https://www.thepaper.cn/newsDetail_forward_2333683,20分钟前,2018-08-09 20:25:44
9,8月7日下午，@成都地铁运营有限公司官方微博发布一则消息：“漆同学，你的暑假作业掉在太升南路站啦！请快来领取哦！希望没有耽误你的暑期学习计划。”,澎湃新闻,成都地铁站为遗失暑假作业找失主，网友：你是魔鬼吗？,https://www.thepaper.cn/newsDetail_forward_2334601,27分钟前,2018-08-09 20:25:44
10,8月2日，广西柳州。老人驾驶燃油三轮车被拦查后，因车已11年未年检被扣。老人竟辱骂、拳打、吐口水抹上执法城管脸。民警呵斥老人，“年纪大不代表可以为所欲为” 。,澎湃新闻,老人不满三轮车被扣，吐口水抹城管脸,https://www.thepaper.cn/newsDetail_forward_2333761,29分钟前,2018-08-09 20:25:44
11,43年来，在黄亚飞的考勤档案里找不到一次事假、病假记录，也找不到一次迟到、旷工的记录。居公小学主管教务主任张朱称他是“守时巨人”。,澎湃新闻,湖南山区教师双手只剩3根残指，坚守大山43年教出三千学生,https://www.thepaper.cn/newsDetail_forward_2334620,29分钟前,2018-08-09 20:25:44
12,去年产量下降，但是整体个头品质都要比往年的好，母蟹有三两多，公蟹则有四两多，平均每只都能比往年重20来克。今年的品质情况也将延续去年。,澎湃新闻,今年阳澄湖大闸蟹量升质优，价格预计较去年有所上浮,https://www.thepaper.cn/newsDetail_forward_2334502,32分钟前,2018-08-09 20:25:45
13,根据最高人民法院2018年1月出台的夫妻债务审理新规，区分钱款去向，上海一中院改判妻子对部分借款和利息承担共同偿还责任，剩余部分由丈夫独自偿还。,澎湃新闻,丈夫婚内举债谁来还？二审区分钱款去向，改判夫妻分别承担,https://www.thepaper.cn/newsDetail_forward_2333507,32分钟前,2018-08-09 20:25:45
14,针对河南省滑县政府多部门官员开办企业一事，滑县官方回应称：“滑县县委、县政府已成立由纪委监察委牵头、相关部门参加的联合调查组，对报道中反映的问题深入彻底调查。”,澎湃新闻,河南滑县回应“多部门经商办企业”：纪委监委介入调查,https://www.thepaper.cn/newsDetail_forward_2334463,34分钟前,2018-08-09 20:25:45
15,当前停车发展不平衡不充分状况突出，与发达国家标杆城市相比存在较大差距，难以适应现代化国际化创新型城市的目标要求。,澎湃新闻,深圳直面停车难：新增7万泊车位，医院停车差别化收费,https://www.thepaper.cn/newsDetail_forward_2334528,37分钟前,2018-08-09 20:25:45
16,据中共天津市纪律检查委员会、天津市监察委员会网站8月7日披露的消息，天津市委巡视六组近日向天津农村商业银行、天津渤海农村商业银行党组织反馈了相关巡视意见。,澎湃新闻,天津农商行选人用人有乱象，滨海农商行在信贷等方面监管缺失,https://www.thepaper.cn/newsDetail_forward_2334328,38分钟前,2018-08-09 20:25:46
17,8月4日，天津西青区王稳庄突发火灾，高层救援特别困难，最后消防员动用吊车从窗口成功救出被困群众。救援结束后，一名消防战士累到虚脱倒下了。,澎湃新闻,天津消防战士救火累瘫，网友：他们是普通人也是“超级英雄”,https://www.thepaper.cn/newsDetail_forward_2334030,42分钟前,2018-08-09 20:25:46
18,此前担任青海省委副书记、省委政法委书记的刘宁近日被任命为青海省副省长、代省长。8月9日，官方报道披露了此次人事调整的更多背景。,澎湃新闻,有了新搭档的青海省委书记表示：大事多商量、小事不插手,https://www.thepaper.cn/newsDetail_forward_2333466,46分钟前,2018-08-09 20:25:46
19,从上世纪80年代以来，我国已经淘汰了六六六、滴滴涕等43种高毒高风险农药，目前农业上使用的在登记有效状态的高毒农药有10种。,澎湃新闻,中国将在5年内淘汰10种高毒农药，并对草甘膦等开展再评价,https://www.thepaper.cn/newsDetail_forward_2334615,46分钟前,2018-08-09 20:25:46
20,中国银行将大幅度加大集团创新研发投入，在常规科技投入之外，每年投入科技创新研发的资金不少于当年营业收入的1%。,澎湃新闻,中国银行将加大科技创新研发投入：不少于当年营收的1%,https://www.thepaper.cn/newsDetail_forward_2334397,49分钟前,2018-08-09 20:25:47
21,天津大学牵头建设的大型地震工程模拟研究设施将建设尺寸和载重量更大的地震模拟振动台、能同时模拟地震与水下波流耦合作用的振动台台阵试验装置。,澎湃新闻,大型地震工程模拟研究设施将落户天津，面积7.7万平方米,https://www.thepaper.cn/newsDetail_forward_2334316,49分钟前,2018-08-09 20:25:47
22,一分钟后，“轰”的一声闷响过后，山体滑坡骤然发生：只见长约400米的山体急速地向下滑移和下坠，垮塌下来的大量土石随即将山下公路瞬间冲断后掩埋。,澎湃新闻,小区墙体雨中坍塌，两女子路过被砸身亡,https://www.thepaper.cn/newsDetail_forward_2333390,50分钟前,2018-08-09 20:25:47
23,8月8日，山东济南。当地暴雨，天齐奥东花园一处沿街墙体突然坍塌，两女子路过时被砸不幸身亡。目前事故调查及善后工作证调查中。,澎湃新闻,中国铁路首次穿越龙门山断裂带，成兰铁路防震站房开建,https://www.thepaper.cn/newsDetail_forward_2333564,51分钟前,2018-08-09 20:25:47
24,成都至川主寺（黄胜关）段为国家一级双线电气化铁路，设计时速200公里，线路正线长度275.832公里。,澎湃新闻,杭州一快递站站长给员工配“空调衣”，衣服自带蓄冷冰块降温,https://www.thepaper.cn/newsDetail_forward_2334242,51分钟前,2018-08-09 20:25:48
25,杭州某快递站站长自费为员工购买了8件“空调衣”，该衣服净重一斤多，自带蓄冷冰块和水循环制冷系统，穿上后3小时内体感温度维持在28℃左右。,澎湃新闻,法治课｜房子与开发商宣传不符能否解除合同？,https://www.thepaper.cn/newsDetail_forward_2334408,52分钟前,2018-08-09 20:25:48
26,购买的住宅与开发商宣传不符，是否可以要求解除合同呢？,澎湃新闻,上海持续“高烧”，台风“摩羯”正以15公里时速赶来降温,https://www.thepaper.cn/newsDetail_forward_2334389,53分钟前,2018-08-09 20:25:48
27,气象部门预计，“摩羯”将以每小时15公里左右的速度向偏北方向移动，强度变化不大。11日开始，中国东海海区逐渐转受“摩羯”影响。,澎湃新闻,新华网：证监会力推的这五项工作，为资本市场下一步改革定调,https://www.thepaper.cn/newsDetail_forward_2334593,54分钟前,2018-08-09 20:25:49
28,可以预见，随着中国资本市场对外开放的领域扩大，未来将会有越来越多的外资机构进入中国，与中国投资者同台竞技。,澎湃新闻,全国少工委严正谴责企业不正当使用红领巾营销炒作的声明,https://www.thepaper.cn/newsDetail_forward_2334549,55分钟前,2018-08-09 20:25:49
29,一公司邀请日本演员苍井空作为“助学使者”参加“公益活动”并佩戴红领巾事件引起网友极大愤慨。全国少工委办公室将联合有关部门，对当事企业依法追究其法律责任。,澎湃新闻,章丘通报“15岁男孩被打死”：遭生父脚踢棍打，未及时送医,https://www.thepaper.cn/newsDetail_forward_2333938,57分钟前,2018-08-09 20:25:49
30,村民陈某厚因其子陈某涛未按自己要求在屋后花生地拔草，随即对其踢打并用木棍击打，后未及时送医致死。目前，嫌疑人已被刑事拘留，案件正进一步调查。,澎湃新闻,深圳单价15万以上二手房源下架？中介：系统升级造成,https://www.thepaper.cn/newsDetail_forward_2334271,59分钟前,2018-08-09 20:25:49
31,关于当天上午链家网深圳部分房源下架的情况，经核实是系统升级造成，与网上不实传言无关。现正通过技术手段将系统自动下架的房源重新上架。,澎湃新闻,行李箱冲向人群，站务员瞬间抱走小女孩,https://www.thepaper.cn/newsDetail_forward_2333796,1小时前,2018-08-09 20:25:50
32,8月8日，湖北武汉光谷广场站一乘客行李箱，因手把断裂滚下楼梯，冲向一名小女孩，地铁站务员陈顺雨瞬间抱走小女孩，并一脚踩住行李箱，及时避免了事故发生。,澎湃新闻,浙江首创“银商合作”：银行参考工商部门数据给小微企业授信,https://www.thepaper.cn/newsDetail_forward_2333754,1小时前,2018-08-09 20:25:50
33,8月9日，针对小微企业融资难窘境，浙江省工商局与农行浙江省分行全国首创“银商合作”模式，打通数据壁垒，将工商部门的企业信用数据作为银行给小微企业授信的参考。,澎湃新闻,山西：2020年二氧化硫平均浓度降低50%，实施量化问责,https://www.thepaper.cn/newsDetail_forward_2334002,1小时前,2018-08-09 20:25:50
34,去年山西省完成了《大气污染防治行动计划》第一阶段的目标，但大气环境形势依然严峻，全省环境空气质量综合指数在全国排倒数第一，二氧化硫平均浓度全国最高。,澎湃新闻,男子在七星关被骗入传销，人民币上写求救信,https://www.thepaper.cn/newsDetail_forward_2333601,1小时前,2018-08-09 20:25:50
35,8月6日，七星关公安分局成功捣毁一传销窝点，解救被骗入传销窝点人员12名。,澎湃新闻,2018年度地方高校新建学科创新引智基地立项名单公布,https://www.thepaper.cn/newsDetail_forward_2334401,1小时前,2018-08-09 20:25:51
36,日前，国家外国专家局、教育部联合印发《关于2018年度地方高校新建学科创新引智基地立项的通知》，共有25个引智基地作为建设项目予以立项。,澎湃新闻,盒马CEO批评零售业乱象：特有的渠道建设造成普遍腐败问题,https://www.thepaper.cn/newsDetail_forward_2333755,1小时前,2018-08-09 20:25:51
37,“我们从来没有认为线下零售业做不好，（现在的窘境）正是因为零售业丧失经营能力，造成了电商冲击下中国零售业的全面溃败，中国零售业落后世界零售业至少十年以上。”,澎湃新闻,安徽岳西县、谯城区、怀远县、蒙城县4县脱贫“摘帽”,https://www.thepaper.cn/newsDetail_forward_2334414,1小时前,2018-08-09 20:25:51
38,记者8月9日从省扶贫办获悉，省政府批准岳西县、谯城区、怀远县、蒙城县退出贫困县。,澎湃新闻,美国16岁枪手受审，称受恶魔声音教唆,https://www.thepaper.cn/newsDetail_forward_2333760,1小时前,2018-08-09 20:25:51
39,当地时间8月8日，美国检方公开了佛州校园枪击案枪手的受审视频。16岁的枪手受审时情绪不稳，一度对自己比出枪击手势。他声称受到“恶魔声音”的教唆后犯下罪行。,澎湃新闻,两小偷逃窜遇车祸被撞飞，爬起继续跑,https://www.thepaper.cn/newsDetail_forward_2333401,1小时前,2018-08-09 20:25:52
40,8月8日，广西柳州。两男子偷窃时被发现，乘坐一辆助力车逃跑。在撞上一辆SUV后，两男子站起后分开跑。两民警紧追，最终抓获其中一名15岁男子。目前，该案正处理中。,澎湃新闻,浙江农发集团原副总经理翁云翔等受贿、贪污案开庭审理,https://www.thepaper.cn/newsDetail_forward_2334284,1小时前,2018-08-09 20:25:52
41,8月9日上午，台州市中级人民法院一审公开开庭审理了浙江省农村发展集团有限公司原党委委员、副总经理翁云翔等受贿、贪污案。,澎湃新闻,浙江金华警方破获一贩毒案：3人被刑拘，出租屋内种百株大麻,https://www.thepaper.cn/newsDetail_forward_2334281,1小时前,2018-08-09 20:25:52
42,金华江南警方日前成功破获一起贩毒案件，打掉以马某为首的贩毒团伙，缴获室内种植的大麻百余株，成品大麻叶5000余克，涉案金额近百万。,澎湃新闻,珠江人寿澄清增资万达项目公司：将部分股东借款转为注册资本,https://www.thepaper.cn/newsDetail_forward_2334280,1小时前,2018-08-09 20:25:52
43,珠江人寿方面就此回应澎湃新闻称，为了优化项目公司的股债结构，降低项目公司的整体负债率，将之前对上述5家万达广场项目公司的部分股东借款转为注册资本，并非新增投资。,澎湃新闻,开山岛“守岛英雄”王继才走了，江苏灌云准备追评其为烈士,https://www.thepaper.cn/newsDetail_forward_2333576,1小时前,2018-08-09 20:25:53
44,江苏灌云县正准备向上级申请，追评王继才为革命烈士，并号召广大干部群众向王继才学习，拟聘任他的妻子王仕花为开山岛民兵哨所名誉所长。,澎湃新闻,杭州河堤塌方，两车侧翻无人受伤,https://www.thepaper.cn/newsDetail_forward_2333474,1小时前,2018-08-09 20:25:53
45,8月9日，浙江杭州。西溪河堤旁一段路面塌陷，两辆停放在路边的车辆侧翻其中。事故发生前，河堤正进行清淤，河水基本被抽干。目前事故车辆已吊离现场，未造成人员伤亡。,澎湃新闻,天津市委巡视组：渤海银行违规购买消费白酒等问题仍然存在,https://www.thepaper.cn/newsDetail_forward_2334168,1小时前,2018-08-09 20:25:53
46,继年初给原银监会、天津市属重要机构等多人寄送水果礼品卡后，渤海银行依然存在营销费使用不规范、违规购买消费白酒等问题。,澎湃新闻,如果拍电影不能成名不能发财，还会成为人生目标么,https://www.thepaper.cn/newsDetail_forward_2324286,1小时前,2018-08-09 20:25:53
47,文学艺术的每个领域都有自己的明星，但总体而言，一个时代最流行的文艺形式能催生社会效应和经济效应的最大化。,澎湃新闻,呼和浩特市政协原副主席张海生被逮捕，涉单位受贿罪等,https://www.thepaper.cn/newsDetail_forward_2334020,1小时前,2018-08-09 20:25:54
48,8月7日，内蒙古自治区人民检察院依法以涉嫌单位受贿罪、贪污罪对犯罪嫌疑人张海生作出逮捕决定。该案正在进一步办理中。,澎湃新闻,河北省教育厅：“八个明确”加强校园足球特色学校建设,https://www.thepaper.cn/newsDetail_forward_2333889,1小时前,2018-08-09 20:25:54
49,高中校园足球特色学校可以根据组建学校足球队的需要，单列计划招收初中足球特长生。要把足球学习情况纳入学生档案，作为学生综合素质评价的参考依据。,澎湃新闻,巴以再次在加沙地带交火，已造成3名巴勒斯坦人死亡,https://www.thepaper.cn/newsDetail_forward_2333617,1小时前,2018-08-09 20:25:54
50,巴勒斯坦卫生部官员表示，8日晚，一名孕妇和她一岁的女儿在以色列军队的轰炸中丧生，另有一名哈马斯（巴勒斯坦伊斯兰抵抗运动）士兵死亡。,澎湃新闻,南京一健身教练在车后备箱藏半米长砍刀被拘3天，称是为防身,https://www.thepaper.cn/newsDetail_forward_2333727,1小时前,2018-08-09 20:25:54
51,民警在夜间清查行动中发现，一位健身教练在轿车后备厢内放置了一把半米长的砍刀，称此举是为了防身。目前，该健身教练已被警方依法处以行政拘留3天的处罚。,澎湃新闻,最高法出台意见为海南全面深化改革开放提供司法服务保障,https://www.thepaper.cn/newsDetail_forward_2334158,1小时前,2018-08-09 20:25:55
52,为认真贯彻落实以习近平同志为核心的党中央关于支持海南全面深化改革开放的重大决策部署，充分发挥人民法院职能作用，推动海南自由贸易试验区和中国特色自由贸易港...,澎湃新闻,山西右玉、吉县、中阳3县退出贫困县,https://www.thepaper.cn/newsDetail_forward_2333894,1小时前,2018-08-09 20:25:55
53,山西右玉县、吉县、中阳县达到贫困县退出相关指标，符合贫困县退出标准，经研究，批准右玉县、吉县、中阳县退出贫困县。,澎湃新闻,《黑豹》瓦坎达效应显现？黑人女性成为美时尚杂志封面宠儿,https://www.thepaper.cn/newsDetail_forward_2333580,1小时前,2018-08-09 20:25:55
54,纵观八月份出版的美国各类时尚杂志封面，“黑人女性的魅力”成为当之无愧的主题。这也打破了长久以来“黑人形象不能大卖”的魔咒。,澎湃新闻,上海推出智慧优惠关税系统，助力企业享受自贸协定关税红利,https://www.thepaper.cn/newsDetail_forward_2334096,2小时前,2018-08-09 20:25:55
55,亚太示范电子口岸网络运行中心主任黄峰介绍，此前，企业如想享受自贸协定带来的关税红利，需进行贸易方筛选、产地筛选、商品编码查询、关税查询、原产地验证等10个环节。,澎湃新闻,国务院农民工工作领导小组组成人员调整，胡春华任组长,https://www.thepaper.cn/newsDetail_forward_2334127,2小时前,2018-08-09 20:25:56
56,根据机构设置、人员变动情况和工作需要，国务院决定对国务院农民工工作领导小组组成人员进行调整。胡春华任组长。,澎湃新闻,东风本田宣布召回近7万辆优威汽车：制动系统、发动机存隐患,https://www.thepaper.cn/newsDetail_forward_2334041,2小时前,2018-08-09 20:25:56
57,国家市场监督管理总局官方微博“中国市场监管”发布公告称，东风本田汽车有限公司近日宣布召回部分2017-2018年款优威（UR-V）系列汽车，共计69090辆。,澎湃新闻,江凌已任河南省委常委，此前担任广东省委常委、秘书长,https://www.thepaper.cn/newsDetail_forward_2333864,2小时前,2018-08-09 20:25:56
58,江凌出生于1964年9月，广东紫金人，1986年6月入党，1984年7月参加工作，华南理工大学工商管理学院企业管理专业毕业，在职研究生学历，管理学硕士。,澎湃新闻,安徽首批：岳西、谯城、怀远、蒙城获省政府批准退出贫困县,https://www.thepaper.cn/newsDetail_forward_2333563,2小时前,2018-08-09 20:25:56
59,脱贫攻坚战打响以来，安徽省首批“摘帽”县诞生。记者8月9日从省扶贫办获悉，省政府批准岳西县、谯城区、怀远县、蒙城县退出贫困县。,澎湃新闻,Shotazone等被指传播色情内容，扫黄打非办协调处置,https://www.thepaper.cn/newsDetail_forward_2333937,2小时前,2018-08-09 20:25:57
60,昨晚（8月8日），有网友反映的Shotazone等网站传播涉未成年人的色情图片和视频等内容，涉嫌触犯我国法律法规。我办已协调相关部门对涉事网站进行了处置。,澎湃新闻,也门一载有儿童巴士遭不明武装袭击，造成数十人死伤,https://www.thepaper.cn/newsDetail_forward_2333852,2小时前,2018-08-09 20:25:57
61,新华社快讯：据红十字国际委员会消息，也门一辆载有儿童的巴士8月9日遭不明武装袭击，造成数十人死伤。,澎湃新闻,杭州语文老师免费给外来务工子弟上书法课：谈不上是教育理想,https://www.thepaper.cn/newsDetail_forward_2332178,2小时前,2018-08-09 20:25:57
62,面对家长们的赞扬，黄老师有些不好意思，“我教这些孩子也谈不上是教育理想，只要是老师，有时间有机会都会去做的。”在他看来，最好的教育，就是陪伴他们慢慢成长。,澎湃新闻,95后平均7个月就离职，销售、收银、后勤“闪辞率”最高,https://www.thepaper.cn/newsDetail_forward_2333797,2小时前,2018-08-09 20:25:57
63,你的第一份工作做了多久？今天，一则#95后平均7个月就离职#的消息引发关注。没想到，网友表示：7个月太长了……,澎湃新闻,张志安专栏：最新报告！互联网视频平台如何保护未成年人,https://www.thepaper.cn/newsDetail_forward_2333765,2小时前,2018-08-09 20:25:58
64,当下，未成年人新媒体使用现状和存在问题有哪些？互联网平台为保护未成年人推出了哪些积极措施、面临哪些挑战？怎样共建多方参与的未成年人互联网使用的保护机制？,澎湃新闻,云南省启动长春长生狂犬病疫苗续种补种工作,https://www.thepaper.cn/newsDetail_forward_2333762,2小时前,2018-08-09 20:25:58
65,记者9日从云南省疾病预防控制中心获悉，云南省已全面启动相关工作，有续种补种需求的公众，可免费到接种点补种续种。,澎湃新闻,中国驻叙使馆：叙利亚媒体报道中国军队介入叙局势不属实,https://www.thepaper.cn/newsDetail_forward_2333904,2小时前,2018-08-09 20:25:58
66,《祖国报》收到中国驻叙利亚使馆澄清如下：中国从未向叙利亚派遣军事力量参与叙政府军的任何军事行动，今后也不会这样做。,澎湃新闻,老干妈回应深交所调研：没有计划上市，没有公司高层说过,https://www.thepaper.cn/newsDetail_forward_2328980,2小时前,2018-08-09 20:25:59
67,8月9日，针对近日老干妈接受深交所调研的消息，南明老干妈风味食品有限公司工作人员向澎湃新闻表示：“没有计划上市，没有公司高层说过。”,澎湃新闻,前7月楼市调控次数达260次，部分一二线城市成下跌主力,https://www.thepaper.cn/newsDetail_forward_2333600,2小时前,2018-08-09 20:25:59
68,1-6月份，房价出现下跌的城市并不稳定，频繁出现在下跌榜单中的城市包括上海、北京、厦门、南京、合肥等地。可以说，部分一线城市和热点二线城市是下跌的主力。,澎湃新闻,讲座｜英、美、法三国的城市规划模式差异何在？,https://www.thepaper.cn/newsDetail_forward_2333539,2小时前,2018-08-09 20:25:59
69,面对愈加严重的“城市病”，建筑师们最早给出了药方，比如雷蒙德・欧文和巴里・帕克，他们提出要跳出城市固有区域，到郊区去，按照理想模式重新塑造美好社区。,澎湃新闻,女子助动车装遮阳篷被查，辱骂还袭警,https://www.thepaper.cn/newsDetail_forward_2333444,2小时前,2018-08-09 20:25:59
