,brief,classes_name,header,news_url,pubtime,savetime
140,8月9日，陕西榆林。榆靖公路无定河特大桥桥头路基被洪水冲垮，垮塌时一辆轿车被埋，致车上司机受伤，已送往医院救治。目前，道路已经封闭，正在抢修中。,澎湃新闻,“外卖可能是十天前做的”追踪：消协呼吁商家主动告知消费者,https://www.thepaper.cn/newsDetail_forward_2332912,6小时前,2018-08-09 20:26:18
141,成都市消协提示，呼吁各平台餐饮商家在开展网上外卖订餐服务时要履行好告知义务，主动告知消费者是否使用复热食品、向消费者明示商家地址、餐食制作日期、质量规格等信息。,澎湃新闻,焦作火车站候车厅34℃，副站长：空调全开了，将加强维护,https://www.thepaper.cn/newsDetail_forward_2332586,6小时前,2018-08-09 20:26:18
142,近日，有知情人向记者爆料，焦作火车站北候车大厅的空调不太管用，候车厅热的像蒸笼一样，在此候车的旅客都是汗流浃背，很多旅客向车站反映，但一直没有改观。,澎湃新闻,小伙点特价菜相亲失败差评餐厅，老板贴千字公开信怒怼,https://www.thepaper.cn/newsDetail_forward_2333131,6小时前,2018-08-09 20:26:18
143,一小伙相亲未询问女方意见，点了2个特价菜花53.8元，被女孩以太抠为由拒绝交往。小伙认为根源在服务员在上菜时说这是特价小龙虾，给餐厅差评还辱骂店员。,澎湃新闻,山东这些地方违法开展的房地产、旅游开发等将全叫停,https://www.thepaper.cn/newsDetail_forward_2333150,6小时前,2018-08-09 20:26:18
144,2020年年底前，45个省级及以上自然保护区核心区和缓冲区内违法开展的能源设施、房地产、旅游开发等活动，立即予以关停或关闭，限期拆除，并实施生态恢复。,澎湃新闻,视频|瑞士小镇泥石流，土石飞溅如火山喷发,https://www.thepaper.cn/newsDetail_forward_2332885,6小时前,2018-08-09 20:26:19
145,当地时间8月7日，瑞士小镇沙莫松突发泥石流。连日暴雨导致河水水位上涨。现场视频显示，大量泥土和石块入火山岩流般喷发，砸坏不少车辆。所幸泥石流未导致人员伤亡。,澎湃新闻,山东通报“男子开车转圈撞人”：与妻争执后撞伤妻弟，已投案,https://www.thepaper.cn/newsDetail_forward_2332267,6小时前,2018-08-09 20:26:19
146,针对“男子开车路口连续转圈撞人”一事，山东潍坊市昌乐县公安局政治处宣传科科长8月9日告诉澎湃新闻，开车撞人的嫌疑人已投案，被撞者受伤，无生命危险。,澎湃新闻,中国地震台网正式测定：印尼龙目岛发生5.9级地震,https://www.thepaper.cn/newsDetail_forward_2333034,6小时前,2018-08-09 20:26:19
147,8月9日13时25分在印尼龙目岛（南纬8.44度，东经116.23度）发生5.9级地震，震源深度20千米。,澎湃新闻,理论物理大奖狄拉克奖揭晓，MIT教授文小刚等三人获奖,https://www.thepaper.cn/newsDetail_forward_2332988,6小时前,2018-08-09 20:26:19
148,文小刚是第三位华裔狄拉克奖获奖者。此前两位为麻省理工学院物理学家李雅达（祖籍香港，2005年获奖）和斯坦福大学物理学家张首晟（祖籍江苏，2012年）。,澎湃新闻,意大利新法案望避免儿童被忘车内致死：安装有警报器的座椅,https://www.thepaper.cn/newsDetail_forward_2332870,6小时前,2018-08-09 20:26:20
149,意大利众议院在当地时间8月6日通过“梅洛尼法案”，即从2019年起，必须使用安装有报警器的“杜绝遗忘儿童座椅”，以避免儿童被忘在车内而死亡的悲剧再次发生。,澎湃新闻,应急管理部挂牌督办贵州“8・6”煤与瓦斯突出事故,https://www.thepaper.cn/newsDetail_forward_2333033,6小时前,2018-08-09 20:26:20
150,日前，应急管理部表示，将对贵州省六盘水市盘州市梓木戛煤矿“8.6”煤与瓦斯突出事故进行挂牌督办，坚决依法依规严肃处理。,澎湃新闻,中国新任驻旧金山总领事王东华履新，曾任职外交部,https://www.thepaper.cn/newsDetail_forward_2332935,6小时前,2018-08-09 20:26:20
151,中国新任驻旧金山总领事王东华偕夫人刘彬8日抵达美国加利福尼亚州旧金山国际机场，受到当地侨界、中资机构和留学生代表热烈欢迎。,澎湃新闻,田家炳中学脑瘫男孩潘翌昕终圆大学梦,https://www.thepaper.cn/newsDetail_forward_2332925,6小时前,2018-08-09 20:26:20
152,田家炳中学脑瘫男孩潘翌昕被上海政法学院国际政治本科专业录取。,澎湃新闻,美媒曝校园枪击“培训学校”：11名儿童接受训练,https://www.thepaper.cn/newsDetail_forward_2332673,6小时前,2018-08-09 20:26:21
153,一名男子8日在新墨西哥州一栋临时住房内被捕，警方还在现场发现11名营养不良的儿童和1名男童的尸体。法院文件显示，这些儿童被迫接受枪击训练，以制造校园枪击事件。,澎湃新闻,对话无罪释放的廖海军：想用赔偿金给女儿一个家,https://www.thepaper.cn/newsDetail_forward_2332868,6小时前,2018-08-09 20:26:21
154,19年前，17岁的河北唐山人廖海军，因故意杀人罪被判无期徒刑。2018年8月9日，案件重审再次开庭。唐山中院依法宣判廖海军及其父亲廖友、母亲黄玉秀无罪。,澎湃新闻,视频|厂家称“标致车”制动正常，车主不认,https://www.thepaper.cn/newsDetail_forward_2332581,7小时前,2018-08-09 20:26:21
155,近日，江西九江。“标致定速巡航失控狂飙”引争议。8日晚，东风标致公关部人员回应澎湃新闻：经检测车辆巡航和制动正常。车主称，检测时自己在场，认为制动功能不正常。,澎湃新闻,南昌：引进人才购房最高按300平米标准全额补贴,https://www.thepaper.cn/newsDetail_forward_2332864,7小时前,2018-08-09 20:26:21
156,近日南昌市下发了《南昌市人才购房及购房补贴实施办法（试行）》。A、B、C、D类人才及机关企事业单位引进人才都可享受购房补贴政策。,澎湃新闻,叙利亚第一夫人罹患乳腺癌入院，叙总统办公厅发布治疗照片,https://www.thepaper.cn/newsDetail_forward_2332457,7小时前,2018-08-09 20:26:22
157,叙利亚官方媒体阿拉伯通讯社援引叙总统办公厅在社交媒体平台推特上发布的消息称，叙利亚总统巴沙尔・阿萨德的妻子阿斯玛・阿萨德因患癌症住进首都大马士革的医院。,澎湃新闻,西安全市法院开会研判涉房地产案件：不能让违约者因违约获益,https://www.thepaper.cn/newsDetail_forward_2332599,7小时前,2018-08-09 20:26:22
158,澎湃新闻注意到，从蓝田县人民法院发布的消息来看，西安市已就房地产案件审理中出现的新动向、新问题，在全市法院范围内召开了研判会议。,澎湃新闻,湖南媒体：“楚菜”一地方菜占整个大区名字，邻居答不答应？,https://www.thepaper.cn/newsDetail_forward_2332562,7小时前,2018-08-09 20:26:22
159,真要较真起来，“楚”大概包括了湖北、湖南、江西等地区，一个地方菜霸占整个大区的名字，邻居答应不答应呢？,澎湃新闻,网民称“青岛一饭店加工9斤螃蟹收900”，官方：责令停业,https://www.thepaper.cn/newsDetail_forward_2332611,7小时前,2018-08-09 20:26:22
160,针对网民反映“青岛一饭店九斤螃蟹被收900加工费”一事，区物价局和区市场监管局对该酒店加工费不明码标价行为立案处理，并责令停业整顿。,澎湃新闻,清莱洞穴被解救足球队三名少年与教练获颁泰国国籍,https://www.thepaper.cn/newsDetail_forward_2332298,7小时前,2018-08-09 20:26:23
161,上月被成功从泰国清莱一处洞穴解除出来的3名“野猪”足球队队员与其25岁的教练8月8日获得泰国国籍。清莱府湄赛县幕僚长宋沙当天将泰国身份证颁发给三名队员和教练。,澎湃新闻,马斯克私有化特斯拉表态惹来美国证监会问询：资金到位了吗,https://www.thepaper.cn/newsDetail_forward_2332471,7小时前,2018-08-09 20:26:23
162,美国证券交易委员会（SEC）开始调查，马斯克要把特斯拉私有化的推文是否属实，所需资金是否已经真的敲定。,澎湃新闻,福建首例宣扬恐怖主义犯罪案：检察长出庭公诉，被告人获缓刑,https://www.thepaper.cn/newsDetail_forward_2332601,7小时前,2018-08-09 20:26:23
163,近日，福建黄某昆涉嫌宣扬恐怖主义罪一案在三明中院开庭审理，三明市检察院检察长张时贵出庭公诉，黄某昆最终被判处有期徒刑6个月，缓刑一年，他在法庭上流泪致歉。,澎湃新闻,视频|马云：创立支付宝时做好了入狱准备,https://www.thepaper.cn/newsDetail_forward_2332677,7小时前,2018-08-09 20:26:23
164,当地时间8月8日，南非约翰内斯堡，马云表示开始做支付宝时，自已就做好了入狱的准备，但如果自己不做，可能就永远不会有这一产业。,澎湃新闻,每天转3条信息日赚27元？贵州铜仁警方破获特大网络诈骗案,https://www.thepaper.cn/newsDetail_forward_2332798,7小时前,2018-08-09 20:26:24
165,记者从贵州省铜仁市公安局了解到，经过近3个月追踪和侦查，当地警方近日打掉一个借助微信实施诈骗的犯罪团伙，抓获8名犯罪嫌疑人。,澎湃新闻,视频|载两小孩电动车变道撞公交车，男孩身亡,https://www.thepaper.cn/newsDetail_forward_2332541,7小时前,2018-08-09 20:26:24
166,8月8日，海南三亚。一成年人骑车载两小孩，突然变道与同向行驶的公交车发生碰撞，致一男孩当场身亡。监控视频显示，电动车连人带车摔倒。目前事故正进一步调查。,澎湃新闻,美国费城发生枪击案造成2死4伤，枪手持大口径武器在逃,https://www.thepaper.cn/newsDetail_forward_2332797,7小时前,2018-08-09 20:26:24
167,据福克斯新闻网报道，据当地警方介绍，在枪击中死亡的2人分别是34岁男性和32岁女性。枪手使用的是大口径武器，威力较大，至少开了11枪。,澎湃新闻,一中国女子巴塞罗那街头遭恶匪抢劫：被长刀砍伤腿部,https://www.thepaper.cn/newsDetail_forward_2332650,7小时前,2018-08-09 20:26:24
168,据西班牙欧华报报道，一名中国女子在西班牙巴塞罗那街头突遭拦路勒索，被恶匪用长刀砍伤腿部，伤势严重紧急入院，目前没有生命危险。歹徒已被警方抓捕入狱。,澎湃新闻,辽宁运钞车劫案二审：律师建议从轻，检方建议维持原判,https://www.thepaper.cn/newsDetail_forward_2332722,7小时前,2018-08-09 20:26:25
169,辽宁营口的运钞车劫案8月9日上午二审开庭，李绪义的辩护律师以其主观恶性较小，希望法院从轻判决，检察机关建议维持原判。该案庭审至中午11时结束，法院宣布择日宣判。,澎湃新闻,辽宁运钞车劫案被告人妻子：仍未收到“三角债”欠款,https://www.thepaper.cn/newsDetail_forward_2332680,7小时前,2018-08-09 20:26:25
170,8月9日上午9时30分，辽宁营口运钞车劫案将开庭二审。一审时法院以抢劫罪判处李绪义有期徒刑十五年，并处罚金五万元。,澎湃新闻,杭州警方通报4死13伤事故调查：司机穿拖鞋，将油门当刹车,https://www.thepaper.cn/newsDetail_forward_2332792,7小时前,2018-08-09 20:26:25
171,经警方调查，涉案嫌疑人陈某某穿拖鞋驾驶小型越野客车上路行驶，因操作失误，将油门当刹车使用，致使车辆在竞舟路由北向南行驶过程中逐步加速至约132公里/小时。,澎湃新闻,上海再发高温黄色预警，预计周日起最高温将降至35℃以下,https://www.thepaper.cn/newsDetail_forward_2332775,7小时前,2018-08-09 20:26:25
172,据上海气象部门预计，本周，上海主要受副热带高压控制，持续晴热高温少雨天气。自周日（12日）起，气温将有所下降，最高气温将降至35℃以下。,澎湃新闻,中国首家航天育种种质资源研究中心在陕西杨凌成立,https://www.thepaper.cn/newsDetail_forward_2332705,7小时前,2018-08-09 20:26:26
173,研究中心及实验室的成立，将为太空育种建立强大资源库，为航天育种、选种的种质资源材料有效保护及研究、示范推广提供保障。,澎湃新闻,八千万欧元！凯帕刷新门将转会纪录，英超被卡里乌斯吓怕了,https://www.thepaper.cn/newsDetail_forward_2329030,7小时前,2018-08-09 20:26:26
174,“好门将等于半支队”是业内共识，但如今，门将的意义绝不仅限于在门前高接抵挡，而在于身为球队进攻发起点，在攻守转换中成为崭新的节拍器。,澎湃新闻,A股上午全线飘红：创业板大涨3.4%，沪指冲击2800点,https://www.thepaper.cn/newsDetail_forward_2332660,7小时前,2018-08-09 20:26:26
175,8月9日上午，沪深股市一改昨日颓势，全面上涨。两市在早盘集体低开之后，一路强势走高，创业板更是大涨3.41%，向1500点逼近，沪指也同样向2800点发起冲击。,澎湃新闻,男子用虚假报撤单操纵证券市场被批捕，曾被称为“超级牛散”,https://www.thepaper.cn/newsDetail_forward_2332655,7小时前,2018-08-09 20:26:26
176,上海市公安局确定犯罪手法：通过控制大量证券账户先行建仓，再以不同账户以大幅高于现价委托买入的手段，使该股形成受市场追捧的假象后立即撤单，诱骗投资者为其高位接盘。,澎湃新闻,2018高考学霸调查③｜近半受访者未上奥数班，重课内效率,https://www.thepaper.cn/newsDetail_forward_2329363,8小时前,2018-08-09 20:26:27
177,问卷调查显示，有74.07%的受访考生高中阶段没有参加过课外补习班，参加多于两个仅占14.81%。而类似的，有70.37%的人高中也没有参加过课外兴趣班。,澎湃新闻,豪夺“东北首富”1500万后内讧，湖南高院一副庭长被查,https://www.thepaper.cn/newsDetail_forward_2332574,8小时前,2018-08-09 20:26:27
178,不久前岳阳当地已经作出重审判决，对豪夺之事中的关键环节进行了“纠正”。知情人透露，在被查前，郑波等四人曾密谋对策，试图以借款掩盖行受贿往事。,澎湃新闻,未依法注册或设代表机构，哈萨克斯坦禁播88家外国电视台,https://www.thepaper.cn/newsDetail_forward_2332137,8小时前,2018-08-09 20:26:27
