,brief,header,pubtime,savetime
0,Sora Summit 是由 Sora Ventures 在澳门塔主办的 2018 年度首场区块链峰会，此次峰会将以学术探讨为主，72 位全球区块链行业领袖将齐聚澳门，会议讨论主题以地区进行划分，分别为北美、韩国、日本、中国，对区块链行业进行深度剖析。Binance Labs、OKEx 和 Huobi 三大交易所投资部负责人将首次齐聚 Sora Summit，链闻 ChainNews 总编辑刘锋先生也将出席活动，共同探讨亚洲地区投资机构、项目及投后管理服务等话题。,11 月 13 日 Sora Summit 将在澳门举办,16:20,2018-11-07 20:02:33
1,全球知名第三方 js 服务被劫持，存在针对交易所的攻击行为。StatCounter 作为美国一家网站通讯流量监测机构，提供各种类型的统计报告以及网站流量统计服务，全球有近 200 万站点使用。今日 ESET 的研究人员发现黑客修改 StatCounter 分析平台使用的 JavaScript 代码，并试图嵌入某知名交易所相关页面盗取加密货币。据悉，该脚本 statcounter.com/counter/counter.js 试图将比特币交易重定向到攻击者控制的几个钱包地址之一。影响范围覆盖所有使用 StatCounter 的平台，慢雾区建议各交易所自行检测是否使用此代码，同时检测站点是否异常，并使用自有 JavaScript。,慢雾区：全球知名第三方 js 服务被劫持，存在针对交易所的攻击行为,16:01,2018-11-07 20:02:33
2,硅谷的 AI 区块链安全公司 AnChain.ai 刚刚宣布，获 SIG 海纳基金、Brain Robotics Capital、明道未来资本投资。AnChain.ai 致力于 AI 驱动来维护区块链生态安全，由大数据及人工智能专家 Victor Fang 博士 和 Ben Wu 联合创立。 AnChain.ai 创始人 Victor Fang 表示，团队研发的 SAP（态势感知平台）及 CAP（智能合约审计平台）已经帮助多家交易所、DApp 项目方完成安全审计、智能合约漏洞检测等服务，新的融资将用于完善产品体验、提升产品安全性等方面。AnChain.ai 之前曾获得知名风险投资机构丰元创投 Amino Capital 、华尔街对冲基金背景的风险投资机构华岩资本 CRCM Ventures 等机构的投资。,区块链安全公司 AnChain.ai 获 SIG、Brain Robotics 和明道未来资本投资,11:42,2018-11-07 20:02:33
3,据 Tokenview 数据显示，昨日 BCH 活跃地址数为 48995 个，较前日上升 2.9%，较近 7 日 BCH 日均活跃地址数上升 12.45%；昨日 BCH 新增地址数为 25328 个，较前日上升 2.05%，较近 7 日 BCH 日均新增地址数上升 16.07%。但是昨日 BCH 单笔超过 2000 BCH 的大额转账共计 25 笔，较前日下降 40.48%，较近 7 日平均大额转账笔数下降 89.75%。,昨日 BCH 活跃度上升，但大额交易笔数下降剧烈,11:32,2018-11-07 20:02:33
4,加密资产交易所 Bitstamp 宣布采用瑞典交易所技术供应商 Cinnober 提供的撮合引擎 TRADExpress Trading System，提高交易的撮合速度。预计新的交易撮合引擎将于 2019 年第二季度正式投入使用。除了 Bitstamp 之外，Coinbase 也在改进自己的撮合引擎，以更好服务市场。总部位于瑞典的交易所技术供应商 Cinnober 今年 9 月刚刚被纳斯达克收购。,Bitstamp 计划更新撮合引擎，提高交易撮合速度,08:21,2018-11-07 20:02:33
5,一个挪威的创业团队推出新的点对点交易平台 Bitruption，提供类似 Localbitcoins 的服务，用户可以使用法币，进行加密货币交易。该平台最初将支持比特币和比特币现金的交易，支持的付款方式为银行转账，之后将扩展至其他加密货币，并支持更多付款方式。,挪威创业团队推出新的点对点交易平台 Bitruption,07:59,2018-11-07 20:02:33
6,据 Coindesk 报道，四大会计师事务所普华永道在香港的联盟所罗兵咸永道与路印基金会正在探讨稳定币的机会。报道指出，普华永道和路印基金会的合作并非对后者进行审计，而是为稳定币项目进行咨询服务。,普华永道香港与路印基金会探讨稳定币的机会,06:35,2018-11-07 20:02:33
7,美国得克萨斯州证券监管部门紧急叫停了云挖矿项目 AWS Mining 的证券发行。这个全名为「Automated Web Services Mining」的云挖矿项目总部位于澳大利亚，其在证券发行中声称可以保证投资者实现 200% 的投资回报。得克萨斯州证券监管部门认为此举违反了证券发行相关规定。,得克萨斯州监管部门叫停云挖矿项目 AWS Mining 的证券发行,05:44,2018-11-07 20:02:33
8,前迪士尼乐园总裁 Al Weiss 担任主席兼普通合伙人的区块链投资公司 Global Blockchain Ventures （GBV）宣布推出一支 1 亿美元的区块链风险投资基金 Global Blockchain Ventures Fund，另一家区块链技术投资公司 Stonegate Digital Capital Group 已经承诺为该基金注资数百万美元。,区块链投资公司 GBV 推出一支 1 亿美元的区块链风险投资基金,05:10,2018-11-07 20:02:33
9,欧洲的交易平台 eToro 宣布将推出加密钱包，该钱包的应用程序将通过 Google Play 和 Apple App Store 下载。该钱包服务最初仅提供给 eToro 的白金用户，即拥有 2.5 万美元加密资产的交易用户，最初仅提供比特币的钱包服务，随后将逐步推广向更多客户，支持更多币种。,欧洲交易平台 eToro 推出加密钱包,03:51,2018-11-07 20:02:33
10,美国存托和结算公司（DTCC）正在进行的一项区块链项目已经推进至测试阶段，已经有 15 家全球性银行参与其中。这些银行将与美国存托和结算公司合作，共同为后者的信用衍生品交易信息存储库推出分布式分类账本及云服务平台。英国的巴克莱银行已经确认参与该项目，其他 14 家银行尚未具名。美国存托和结算公司预计该项目将于今年年底之前进行开放测试，测试预计将于 2019 年第一季度完成，随后将正式发布。美国存托和结算公司主要提供股票、公司和市政债券、政府和房贷抵押证券、资金市场产品和OTC演示品的结算、交割和信息服务。,美国存托和结算公司联合 15 家全球性银行进行信用衍生品交易信息区块链项目的测试工作,02:01,2018-11-07 20:02:33
11,Stellar 基金会宣布与加密货币钱包 Blockchain 结成伙伴关系，并向 Blockchain 钱包的用户空投 1.25 亿美元 XLM 代币。这将成为历史上最大的空投活动。此次空投的 XLM 代币将占该代币总流通量的 0.47%。,Stellar 将向 Blockchain 的钱包用户空投 1.25 亿美元 XLM 代币，将创下空投记录,22:20,2018-11-07 20:02:34
12,自 11 月 2 日起 BCH 价格开始上涨，截至 6 日下午，其涨幅超过 31%。TokenInsight 认为，此次导火索是 11 月 15 日硬分叉事件，此次分叉已得到 Coinbase、Binance 等主流交易所支持，由此引来投资者提前布局。TokenInsight 分析发现，此次上涨主要由稳定币&场外法币流入推动。11 月 2 日至 3 日共计 1.86 亿美元资金从 USDT 流向 BCH，此外，仅 11 月 3 日一天内有超过 1.06 亿美元的法币资金入场。独立分析师 James 认为，在真正硬分叉之前该事件的热度不会下降，但链上数据表明 BCH 的交易热度已经恢复平静。因此，其价格很难在短时间内大幅上涨。,TokenInsight：此次 BCH 上涨主要由稳定币、场外法币流入推动,19:25,2018-11-07 20:02:34
13,BTCC 矿池宣布，由于业务调整，将于 11 月 15 日关停所有挖矿服务器，11 月 30日起无限期停止运营。BTCC 建议矿工于 11 月 15 日前完成算力切换，并于 11 月 20 日前绑定挖矿收益地址。,BTCC 矿池将于 11 月 15 日关停挖矿服务器，月底无限期停止运营,19:23,2018-11-07 20:02:34
14,比特币矿业巨头 Bitfury 在今日宣布，在新一轮融资中获得 8000 万美元，由欧洲风险投资基金 Korelya Capital 领投，其他参与者包括韩国互联网巨头 Naver Group，亚洲机构 Macquarie Capital 和 Dentsu Japan 以及 Michael Novogratz 的 Galaxy Digital。,比特币矿业巨头 Bitfury 获得 8000 万美元融资,18:35,2018-11-07 20:02:34
15,成都链安科技 Beosin 正式上线全新版「一键式」智能合约自动形式化验证平台 VaaS-ETH 精简版。VaaS 平台是成都链安科技经过 1 年多潜心钻研，采用形式化验证技术研发出的全球首个同时支持 ETH、EOS、Fabric 等多个区块链平台的智能合约安全检测系统，达到 95% 以上准确率。VaaS-ETH 精简版可让区块链从业者免费体验 VaaS「一键式」智能合约安全检测功能，对智能合约多项安全问题进行筛查。成都链安科技针对区块链安全问题打造的全生态安全服务还包括：钱包开发和审计、VaaS 平台定制化开发、安全的 DApp 开发与审计一条龙、安全的智能合约开发审计一条龙、交易所和公链平台安全检测等。,成都链安科技发布 VaaS「一键式」智能合约自动形式化验证平台,17:46,2018-11-07 20:02:34
16,据彭博，香港交易所行政总裁李小加表示：香港交易所将在中期内收购一家科技公司，以支持升级现有交易基础设施并研究使用区块链的计划。,港交所李小加：将在中期收购一家科技公司，研究使用区块链的计划,12:16,2018-11-07 20:02:34
17,比特大陆官方推特「BITMAINtech」公布了 7nm 矿机的最新消息。根据官方推文信息显示，比特大陆将推出两款搭载 7nm 芯片的矿机产品，型号分别为蚂蚁矿机 S15 和 T15，支持 SHA256 加密算法，并在全球公开发售。其中，国内市场开售时间为北京时间 11 月 8 日 14:00。,比特大陆最新 7nm 矿机 11 月 8 日开售，支持 SHA256 算法,11:10,2018-11-07 20:02:34
18,ERC-20 令牌的自主流动性协议 Bancor（BNT）宣布其新平台 BancorX 已上线，该平台已推出的项目包括 Everipedia，eosBLACK，BetDice，MEET.ONE，KARMA，Prochain，和 Chaince。,Bancor 宣布新平台 BancorX 已上线,08:06,2018-11-07 20:02:34
19,区块链技术公司 Blockstream 的首席执行官 Adam Back 在「Let’s Talk 比特币」播客中称，BTC 的可扩展性以及隐私问题可通过支付渠道和侧链解决。,Blockstream CEO：BTC 可扩展性和隐私问题可通过支付渠道和侧链解决,07:18,2018-11-07 20:02:34
