,brief,classes_name,header,news_url,pubtime,savetime
149,有分析人士认为，巨头们的这番转变，实际上是互联网将从发展购物、社交等为主的消费互联网产业，转向云计算等面向商业的产业互联网，互联网即将进入“下半场”。,澎湃新闻,浙江破获侵犯公民个人信息案：假冒身份注册万余“滴滴”账户,https://www.thepaper.cn/newsDetail_forward_2502023,9小时前,2018-10-05 20:01:54
150,浙江省东阳市警方日前破获一起侵犯公民个人信息案，捣毁了一个贩卖公民个人信息50多万条的犯罪团伙，先后抓获涉案人员46名，追缴赃款100多万元。,澎湃新闻,云南腾冲警方破获一起跨境贩毒案：缴毒逾17公斤,https://www.thepaper.cn/newsDetail_forward_2502039,9小时前,2018-10-05 20:01:54
151,据云南省腾冲市公安局通报，该局近日在德宏傣族景颇族自治州破获一起跨境贩卖毒品案，抓获4名犯罪嫌疑人，缴获毒品鸦片17.583公斤、运毒工具摩托车3辆。,澎湃新闻,印尼地震海啸已致1558死，废墟下现疑似生命迹象,https://www.thepaper.cn/newsDetail_forward_2502044,9小时前,2018-10-05 20:01:54
152,印尼国家灾害管理局表示，9月底发生在印尼的地震和海啸灾难目前已经造成1558人死亡，且遇难者人数可能进一步增加。,澎湃新闻,长沙特警国庆期间一天抓获四名逃犯，最快的只用了五秒,https://www.thepaper.cn/newsDetail_forward_2502012,9小时前,2018-10-05 20:01:55
153,10月2日，持续增长的外来旅客流量带来了新的“收获”， 长沙市公安局特巡警支队武装值守点民警在黄兴铜像广场、湘江风光带、火车站周边、解放西路分别抓获四名逃犯。,澎湃新闻,体坛联播│郎平调侃女排还缺一个朱婷，拳击恐被逐出奥运会,https://www.thepaper.cn/newsDetail_forward_2501994,9小时前,2018-10-05 20:01:55
154,世锦赛一路高歌猛进、豪取四连胜的中国女排，遭遇了自己的首败，郎平赛后调侃球队还缺一个朱婷。16岁的中国新星王简嘉禾以3分53秒97打破了400自短池世界纪录。,澎湃新闻,这就是传说中的“海上拼刺刀”！美军照片里中国海军如此英勇,https://www.thepaper.cn/newsDetail_forward_2501995,9小时前,2018-10-05 20:01:55
155,从美国海军公布的现场图片看，中国海军“兰州”号驱逐舰的动作专业、规范，符合国际规则，体现出极高的操作能力和国际法水平。,澎湃新闻,八旬老翁做船模型：将造船手艺传承后代,https://www.thepaper.cn/newsDetail_forward_2502024,9小时前,2018-10-05 20:01:55
156,10月5日，河北雄安新区安新县马家寨村，80岁的河北省非物质文化遗产传承人姜琳祥正在手工制作1：15比例的船只模型。他告诉澎湃新闻记者，一个月已经做了17条船模。另外，屋里展架上还有20余种不同类型和功能的船模。,澎湃新闻,何欢欢螋卖拇钤谖鞣外：穿在身上的净土真宗,https://www.thepaper.cn/newsDetail_forward_2493909,9小时前,2018-10-05 20:01:55
157,以袈裟为中心的僧侣衣装的变化可以说是“佛教中国化”进程中的一个缩影，而类似的更迭同样也是“佛教日本化”的一个有趣看点。,澎湃新闻,朝韩今合办《10・4宣言》纪念活动，系首次在平壤举办,https://www.thepaper.cn/newsDetail_forward_2501962,9小时前,2018-10-05 20:01:55
158,访朝团此后观看大型团体操《光荣的祖国》，与文在寅上月观看的内容一致，朝方当时删除宣传制度优越性的内容，侧重凸显民族和解。,澎湃新闻,百年老店弃高额房租，延续弹棉花老工艺,https://www.thepaper.cn/newsDetail_forward_2502005,9小时前,2018-10-05 20:01:55
159,国庆期间，浙江杭州。河坊街上的潘永泰号仍在营业，玻璃柜前“拒绝高额房租，延续弹棉工艺”的牌子十分醒目。这家老店始创于清光绪二十四年（公元1898年），是目前杭州城最后一间弹棉花的作坊。,澎湃新闻,浙江87岁老太小区内善意提醒别摔自行车遭暴打，嫌犯被批捕,https://www.thepaper.cn/newsDetail_forward_2501692,9小时前,2018-10-05 20:01:55
