,brief,classes_name,header,news_url,pubtime,savetime
141,未来，江苏省高速公路网的布局是“十五射六纵十横”，形成15条以南京为中心的对外放射线路，进一步提升南京首位度，增强省会城市的辐射能力。,澎湃新闻,加拿大：大麻合法化之后，科学家对“被禁植物”研究跃跃欲试,https://www.thepaper.cn/newsDetail_forward_2555681,4小时前,2018-10-23 20:00:11
142,加拿大成为继乌拉圭之后世界上第二个将所有用途的大麻合法化的国家。大麻生产商积极寻求与科学家合作，涉及领域从基因定位、代谢工程到最佳干燥技术和种植实践等。,澎湃新闻,美团点评新职业报告：宠物医生月入2万，最有“钱景”,https://www.thepaper.cn/newsDetail_forward_2555740,4小时前,2018-10-23 20:00:11
143,数据显示，新职业人群月收入高于5000元的已过半数，达到52.84%。其中，宠物医生平均月收入最高，有28.57%的月收入在2万元以上。,澎湃新闻,华中科大18名大学生被“本转专”：严把出口关的试水之举,https://www.thepaper.cn/newsDetail_forward_2555671,4小时前,2018-10-23 20:00:11
144,自去年7月出台《普通本科生转专科管理办法（试行）》引起普遍关注后，近日，华中科技大学将18名学分不达标学生从本科转到专科一事，再次让该校成为舆论焦点。,澎湃新闻,“上海服务”再提升，市场监管“店小二”提前入驻进口博览会,https://www.thepaper.cn/newsDetail_forward_2555663,4小时前,2018-10-23 20:00:11
145,记者近日在进口博览会主会场国家会展中心“四叶草”采访发现，来自上海工商和市场监管的众多“店小二”已经提前进驻，为四方来客提供贴心服务和全方位保护。,澎湃新闻,花莲地震台北震感明显，暂无灾情传出,https://www.thepaper.cn/newsDetail_forward_2555761,4小时前,2018-10-23 20:00:12
146,10月23日12时34分，在台湾花莲县海域发生6.0级地震，震源深度30千米。另据台湾方面消息，台北有明显震感，各地暂无灾情传出。,澎湃新闻,交了500万房子2年后才到手，预售制度到底是怎么来的？,https://www.thepaper.cn/newsDetail_forward_2555538,4小时前,2018-10-23 20:00:12
147,预售制下的房地产行业却是先收钱后干活，而且普遍18个月之后才“交货”。这种模式曾对促进我国房地产市场大繁荣起到了积极作用，却也带来了各种各样的问题。,澎湃新闻,吉林临江市长刘宝芳任省药监局局长，曾在药企工作,https://www.thepaper.cn/newsDetail_forward_2555564,4小时前,2018-10-23 20:00:12
148,10月23日，吉林省食品药品监督管理局网站发布的消息显示，县级市临江的“70后”女市长刘宝芳出任吉林省药品监督管理局党组书记、局长。,澎湃新闻,美海军军舰昨穿越台湾海峡，外交部：中方密切关注并全程掌握,https://www.thepaper.cn/newsDetail_forward_2555768,4小时前,2018-10-23 20:00:12
149,中方密切关注并全程掌握美国军舰过航台湾海峡的情况，已就此向美方表达了关切。台湾问题事关中国的主权和领土完整，是中美关系中最重要最敏感的问题。,澎湃新闻,“天和”号空间站核心舱将首次亮相，1:1实物参加珠海航展,https://www.thepaper.cn/newsDetail_forward_2555625,4小时前,2018-10-23 20:00:12
150,目前，载人航天工程全线正在全面开展空间站研制建设，各主要系统均在按计划进行初样研制，核心舱将于今年年底转入正样研制阶段。,澎湃新闻,A股缩量回调：沪指深成指均重挫逾2%，创业板跌1.74%,https://www.thepaper.cn/newsDetail_forward_2555715,4小时前,2018-10-23 20:00:12
151,截至收盘，上证综指跌2.26%，报2594.83点；深证成指跌2.24%，报7574.99点；创业板指跌1.74%，报1292.06点。,澎湃新闻,郑州3岁男童遗失人工耳蜗，称值二十万,https://www.thepaper.cn/newsDetail_forward_2555730,4小时前,2018-10-23 20:00:12
152,10月21日，河南郑州。一3岁男童的人工耳蜗不慎遗失。其称，耳蜗价值20多万，若重新安装孩子需手术。事件经报道后，市民自发帮忙。23日，丢失耳蜗被找到。,澎湃新闻,美国研究报告：男性吸烟会影响后代认知能力,https://www.thepaper.cn/newsDetail_forward_2555664,4小时前,2018-10-23 20:00:12
153,雄性小鼠暴露于尼古丁会导致其子女和孙子女出现认知缺陷。研究人员认为，这一研究结果同样适用于人类。他们警告那些欲为人父母者，更需注意吸烟的危害。,澎湃新闻,土耳其公布视频：卡舒吉遇害后沙特官员在领馆内焚烧文件,https://www.thepaper.cn/newsDetail_forward_2555608,4小时前,2018-10-23 20:00:12
154,土耳其电台主持人称：“这是一种老旧的销毁文件的方式，他们甚至不用文件粉碎机，看起来他们希望销毁所有跟卡舒吉有关的证据”。,澎湃新闻,追记“警坛神笔”张欣的画像人生：36载参与侦破刑案万余起,https://www.thepaper.cn/newsDetail_forward_2555628,4小时前,2018-10-23 20:00:12
155,30余年来，张欣画笔不辍，用一张张精心描绘的画像，擒获一个又一个犯罪嫌疑人，被誉为“警坛神笔”。然而，10月20日19时许，他却永远停下了画笔。,澎湃新闻,冒充台商来挖宝，村民一万二买回铅块,https://www.thepaper.cn/newsDetail_forward_2555560,4小时前,2018-10-23 20:00:12
156,10月21日，湖北利川。6月份两名自称来自台湾的男子到村里，称爷爷留了宝物，在地里挖出“白金元宝”一万两千元卖给村民，后被查为铅块。目前，案子告破钱款退还村民。,澎湃新闻,上海保交所与市卫计委联手，设立全国首个健康保险交易中心,https://www.thepaper.cn/newsDetail_forward_2555095,4小时前,2018-10-23 20:00:13
157,本次签约后，上海保交所探索发挥保险的控费机制，助力激发医改活力；上海市卫生计生委推动建立“保险+健康服务”模式，促进孵化多元化、多层次的健康保险产品。,澎湃新闻,进博会交通App上线：看路线看排队时间看会展动态都靠它,https://www.thepaper.cn/newsDetail_forward_2555638,4小时前,2018-10-23 20:00:13
158,10月23日，“进博会交通”App上线。观众只需打开“进博会交通”App，点击GO按钮，选择到达或离开场馆的起终点，“量身定制”的抵离馆路线便闪烁在手机上。,澎湃新闻,港珠澳大桥建设进程中的震撼瞬间,https://www.thepaper.cn/newsDetail_forward_2555636,4小时前,2018-10-23 20:00:13
159,10月23日，港珠澳大桥开通仪式在广东珠海举行。这是粤港澳三地首次合作共建的超大型跨海交通工程，建设历时8年，形象地说，这是像“搭积木”一样建起来的超级工程。,澎湃新闻,四川三台县男子加油站点燃加油机，附近居民穿着拖鞋奋勇灭火,https://www.thepaper.cn/newsDetail_forward_2555648,4小时前,2018-10-23 20:00:13
