,brief,header,pub_time,url
35,传言称“特斯拉正以三倍的薪资大规模地从上汽集团招募工程师和技术人员”。特斯拉就此回应称，消息完全不属实。公司表示，过去几天里，超级工厂在网上发布中国的招聘职位，其中包括工程和建筑相关的职位。但是，这并无涉及薪资范围，也没有录用任何上汽员工。薪资预期将与其当前的现金薪酬大致相当，并以特斯拉未来的股价涨幅为员工股票带来更高的薪酬的可能性而为主导。（财联社）,特斯拉：“以三倍薪资大规模抢人”系谣言,2018-08-07 14:52,http://share.baidu.com/s?type=text&searchPic=1&sign=on&to=tsina&key=595885820&url=http://36kr.com/newsflashes/131831&title=%E4%BC%A0%E8%A8%80%E7%A7%B0%E2%80%9C%E7%89%B9%E6%96%AF%E6%8B%89%E6%AD%A3%E4%BB%A5%E4%B8%89%E5%80%8D%E7%9A%84%E8%96%AA%E8%B5%84%E5%A4%A7%E8%A7%84%E6%A8%A1%E5%9C%B0%E4%BB%8E%E4%B8%8A%E6%B1%BD%E9%9B%86%E5%9B%A2%E6%8B%9B%E5%8B%9F%E5%B7%A5%E7%A8%8B%E5%B8%88%E5%92%8C%E6%8A%80%E6%9C%AF%E4%BA%BA%E5%91%98%E2%80%9D%E3%80%82%E7%89%B9%E6%96%AF%E6%8B%89%E5%B0%B1%E6%AD%A4%E5%9B%9E%E5%BA%94%E7%A7%B0%EF%BC%8C%E6%B6%88%E6%81%AF%E5%AE%8C%E5%85%A8%E4%B8%8D%E5%B1%9E%E5%AE%9E%E3%80%82%E5%85%AC%E5%8F%B8%E8%A1%A8%E7%A4%BA%EF%BC%8C%E8%BF%87%E5%8E%BB%E5%87%A0%E5%A4%A9%E9%87%8C%EF%BC%8C%E8%B6%85%E7%BA%A7%E5%B7%A5%E5%8E%82%E5%9C%A8%E7%BD%91%E4%B8%8A%E5%8F%91%E5%B8%83%E4%B8%AD%E5%9B%BD%E7%9A%84%E6%8B%9B%E8%81%98%E8%81%8C%E4%BD%8D%EF%BC%8C%E5%85%B6%E4%B8%AD%E5%8C%85%E6%8B%AC%E5%B7%A5%E7%A8%8B%E5%92%8C%E5%BB%BA%E7%AD%91%E7%9B%B8%E5%85%B3%E7%9A%84%E8%81%8C%E4%BD%8D%E3%80%82%E4%BD%86%E6%98%AF%EF%BC%8C%E8%BF%99%E5%B9%B6%E6%97%A0%E6%B6%89%E5%8F%8A%E8%96%AA%E8%B5%84%E8%8C%83%E5%9B%B4%EF%BC%8C%E4%B9%9F%E6%B2%A1%E6%9C%89%E5%BD%95%E7%94%A8%E4%BB%BB%E4%BD%95%E4%B8%8A%E6%B1%BD%E5%91%98%E5%B7%A5%E3%80%82%E8%96%AA%E8%B5%84%E9%A2%84%E6%9C%9F%E5%B0%86%E4%B8%8E%E5%85%B6%E5%BD%93%E5%89%8D%E7%9A%84%E7%8E%B0%E9%87%91%E8%96%AA%E9%85%AC%E5%A4%A7%E8%87%B4%E7%9B%B8%E5%BD%93%EF%BC%8C%E5%B9%B6%E4%BB%A5%E7%89%B9%E6%96%AF%E6%8B%89%E6%9C%AA%E6%9D%A5%E7%9A%84%E8%82%A1%E4%BB%B7%E6%B6%A8%E5%B9%85%E4%B8%BA%E5%91%98%E5%B7%A5%E8%82%A1%E7%A5%A8%E5%B8%A6%E6%9D%A5%E6%9B%B4%E9%AB%98%E7%9A%84%E8%96%AA%E9%85%AC%E7%9A%84%E5%8F%AF%E8%83%BD%E6%80%A7%E8%80%8C%E4%B8%BA%E4%B8%BB%E5%AF%BC%E3%80%82%EF%BC%88%E8%B4%A2%E8%81%94%E7%A4%BE%EF%BC%89
36,据外媒报道，德勤公布的报告称，美国在建设5G无线通讯竞赛中的花费被中国超过，并且因此有可能失去潜在的经济利益。中国目前支持5G通讯的基站超美国10倍。中国自2015年以来花费已比美国多出240亿美元，且已建设35万个新的无线基站，而美国建设的则不到3万个。在中国装设必要设备以增载5G的费用可能比美国便宜约35%。（Techweb）,德勤报告称中国目前支持5G通讯的基站超美国10倍,2018-08-07 14:41,http://www.techweb.com.cn/world/2018-08-07/2692917.shtml
37,36氪获悉，初创公司MOV.AI近日宣布完成300万美元的种子轮融资，由Viola Ventures和NFX领投。资金将用于研发智能机器人自动化的操作系统。,「MOV.AI」获得300万美元融资,2018-08-07 14:36,http://36kr.com/p/5146952.html
38,清华大学微纳电子系任天令教授团队日前研发出多层石墨烯表皮电子皮肤，该器件具有极高的灵敏度，可以直接贴覆在皮肤上用于探测呼吸、心率、发声等，在运动监测、睡眠监测、生物医疗等方面具有重大应用前景。（新华社）,清华大学成功研发出可测人体信号的“电子皮肤”,2018-08-07 14:28,http://www.xinhuanet.com/2018-08/07/c_1123234237.htm
39,法媒称，在一二十年前，法国将欧尚和家乐福等超市开到了世界的其他地方，尤其是中国。如今，整个趋势反过来了：法国要去中国取经，阿里巴巴创设的盒马鲜生和京东旗下的7Fresh成了超市集团的创新者，这值得业内人士去仔细研究。中国超市和法国超市最大的区别之一是水产品柜台。（参考消息）,法媒：中国“未来超市”模式值得法国借鉴,2018-08-07 14:25,http://www.cankaoxiaoxi.com/finance/20180807/2306115.shtml
