,brief,header,pubtime,savetime
0,9 月 19 日，Bibox 东南亚负责人刘国杰在接受记者采访时表示，现存主流稳定币的本质是一种市场价格锚定在其他资产价格的数字资产，所以锚定法币的数字资产都可以称为稳定币。在当下环境下，受监管的稳定币，比如在 Bibox 全球首次发行的 GUSD，是比较有效的金融工具，有助于区块链行业的应用和推广，就目前来看有比较正面的意义。另外，他还认为将来稳定币不仅仅可以锚定美元，也可以锚定其他主流法币，以及物价指数、贵金属等种类。,Bibox 刘国杰：看好稳定币，以后还可能锚定除美元外的其他资产,18:32,2018-09-19 20:00:18
1,芝加哥商品交易所 CME 董事总经理 Tim McCourt 在 CoinDesk 共识大会新加坡站表示，CME 推出比特币期货是对用户需求的一种回应。市场希望在一家受监管的交易所交易这些产品。CME 比特币期货 40-50% 的交易发生在美洲交易时段开始前，这意味着这些交易是发生在亚洲、欧洲等地区的。,CME 董事总经理：CME 比特币期货 40-50% 交易发生在亚洲、欧洲等地区,17:06,2018-09-19 20:00:18
2,CDN 加速服务商 Cloudflare 周二宣布支持 IPFS 网关。IPFS 是一种 P2P 文件系统，是能支持更快、更安全网络访问的 HTTP 协议替代方案，不需要在计算机上安装或运行任何特殊软件。开发人员希望使用者能够在 cloudflare-ipfs.com 上所托管的网关，将作为多数新的高可靠性与安全性全面增强的网络应用程序平台。这是去中心化服务朝着主流网络应用迈出的一大步。,Cloudflare 宣布支持 IPFS 网关,15:02,2018-09-19 20:00:18
3,在今日 Coindesk 共识大会新加坡站上，新加坡金管局金融科技和创新组科技基础设施处主管冯世坚表示，MAS 将代币分为应用型代币、付款型代币以及证券型代币。MAS 不打算监管应用型代币，但付款服务性条例草案将于本年年底制定，以适用于付款型代币。证券型代币适用于现有的新加坡证券及期货法。,新加坡金管局主管：证券型代币适用于现有的新加坡证券及期货法,14:27,2018-09-19 20:00:18
4,据 BusinessKorea 消息，韩国乐天信息通信公司近日宣布，将于近期举行的 Blockchain Seoul 2018 峰会上展示基于区块链技术的生鲜食品配送服务，乐天信息通信公司首席执行官 Ma Yong-deuk 表示，乐天信息通信加强了区块链技术的研发，这是第四次工业革命的一项很有前途的技术。,韩国乐天信息通信将区块链应用于生鲜食品配送服务,14:25,2018-09-19 20:00:18
5,据 Cryptonews 消息，日本金融服务管理局正准备着手处理积压的大量申请，这些申请来自那些希望获准在日本运营加密货币交易所的公司。今年 1 月份的 Coincheck 黑客事件之后，FSA 暂停了所有申请。目前积压的申请里面包括雅虎、Line、乐天、三菱 UFJ 金融集团的申请。,日本金融服务管理局准备处理大量积压的交易所牌照申请,14:18,2018-09-19 20:00:18
6,据 Coindesk 消息，新加坡管理局的 Toh Wee Kee 表示新加坡金管局目前正在试验的以分布式账本技术为基础的新加坡元是用于跨银行结算的，而不是供新加坡家庭使用。,新加坡金管局试验以 DLT 技术为基础的新加坡元仅用于跨银行结算,14:15,2018-09-19 20:00:18
7,杭州互联网法院常务副院长王江桥最近表示，杭州互联网法院司法区块链可以通过时间、地点、人物、事前、事中、事后等六个维度解决数据「生成」的认证问题，真正实现电子数据的全流程记录，全链路可信，全节点见证。王江桥还称，目前互联网纠纷，只要纠纷当事人能提交完整可信的证据，在链上机构的见证下，很多纠纷就不必再到法院，双方直接就能协商解决。,杭州互联网法院常务副院长：链上机构见证下，双方能直接解决纠纷,14:11,2018-09-19 20:00:18
8,以太坊联合创始人 Vitalik Buterin 在 Reddit 称：「过去一年中 OMG 团队给 Plasma 研究做出了大量贡献，我相信 OMG 团队现在几乎是处于测试网阶段。过去我们都低估了以太坊里面很多研究的难度。之前推迟了 Casper 和分片 sharding 的发布，让很多人开始怀疑。现在通过开发以及频繁发布客户端更新，我们接近完成以太坊 2.0 的 Casper 共识算法规则，Prysmatic（专注于分片技术的实验室）、Lighthouse（一个开源以太坊客户端）进展顺利。Plasma 扩容方案 也会这样，到来的速度会超过其他人的预想。」,Vitalik：以太坊 2.0 共识算法 Casper 规则接近完成,10:49,2018-09-19 20:00:18
9,莱特币创世人李启威稍早发连发数条推特解释自己当初出售全部莱特币 LTC 资产的动机。 他表示：「由于利益冲突，我卖掉了所有的 LTC 资产，这样我就可以专注于莱特币的发展而不是其价格，这两者之间并不总是相关的。但莱特币就像是我的孩子，我不需要用金钱的激励来让他成功。在牛市中卖出并没有与hodling 的理念相冲突。之前我说的『卖出全部 LTC 是件好事，不然我可能就要另找工作了』是个玩笑，我现在全职工作于 LTC。」「 关于 holding 理念是一位 bitcointalk 论坛用户提出的，他在市场崩盘的时候拒绝出售加密货币，hold 的意思是当价格下跌时不要恐慌出售，在牛市中卖出与 holding 的建议并不矛盾。」,李启威连发数条推特解释自己抛售 LTC 资产的动机,10:32,2018-09-19 20:00:19
10,据 Coingeek 报道，OKCoin 在其拥有美国监管牌照的平台开放五个新币种：XRP、 ADA、Stellar XLM、Zcash ZEC 和 0x ZRX 的法币及与比特币及 ETH 的币币交易。加州居民可以用法币买卖这五个币种，之前已经可以通过该平台进行法币买卖的币种包括比特币 BTC、比特币现金 BCH、ETH、以太坊经典 ETC 和莱特币 LTC。另外该平台面向美国 21 个州居民可以提供这五个新币种与比特币及 ETH 的币币交易。,OKCoin 美国合规平台新增五个交易币种,10:16,2018-09-19 20:00:19
11,据彭博社报道，纽约总检察长办公室周二在一份报告中表示，许多加密货币交易所缺乏基本的消费者保护，并且很容易受到市场操纵者的利用。该报告是长达数月的调查结果，并发现许多交易所缺乏适当的保障措施，使消费者面临风险。总检察长办公室还向纽约金融服务部提出，交易所 Kraken、币安和 Gate.io 允许居住在纽约的用户进行交易，可能涉嫌在纽约州非法经营。这三家交易所尚未立即发表评论。,检察长办公室：币安、Kraken 和 Gate.io 涉嫌在纽约州非法经营,10:08,2018-09-19 20:00:19
12,据 Juniper Research 2018 年 9 月的调查显示，在企业区块链解决方案方面，IBM 最受企业美国人的信任，其中 65％ 的受访者会选择 IBM Blockchain 来部署分布式账本技术 DLT 和类似的解决方案。亚军微软仅获得 7％ 的选票，名单上的其他公司还包括埃森哲，德勤和甲骨文。同样的调查发现，如果公司要部署 DApp 和相关解决方案，美国公司绝大多数都更喜欢以太坊网络，该平台获得近 50％ 的选票。,IBM 企业区块链解决方案最受美国企业青睐,08:11,2018-09-19 20:00:19
13,CME 比特币期货 BTC 10 月合约收涨 45 美元，涨幅超过 0.72%，报 6275 美元，据统计，6 月 29 日以 5865 美元创前月合约收盘纪录最低。CBOE 比特币期货 XBT 10 月合约收涨 85 美元，涨约 1.37%，报 6302.50 美元，6 月 29 日也以 5897.50 美元创 CBOE 比特币期货前月合约收盘纪录最低。,比特币期货收涨约 1%,08:10,2018-09-19 20:00:19
14,美国纽约州总检察长办公室发布的「虚拟市场诚信初步报告」中表示，虽然大多数参与调查的加密交易所报告称他们通过 IP 地址监控访问，但只有 Bitstamp 和 Poloniex 声称限制 VPN 访问。此外各平台在确认身份证件 ID 和实施网站访问政策方面存在显著差异。大多数交易所要求客户提交一系列个人信息和政府签发的身份证件，Bitfinex 和 Tidex 平台则不需要，仅通过一封电子邮件验证。纽约州总检察长办公室还对各平台用户身份证件的要求和注册政策做出了详细的比较。此外纽约州总检察长办公室称，所有接受调查的加密交易所都试图通过限制每个客户仅能注册一个账户来阻止洗钱交易。但「如果平台能够真正检测到试图注册多个帐户的客户」才能成立。,纽约州总检察长办公室：各交易所确认身份证件及网站访问政策方面存在显著差异,08:07,2018-09-19 20:00:19
15,基于 Ripple 技术的外汇服务平台桑坦德 OnePay FX 可在一天内完成国际汇款流程。该平台执行主席 Ana Botin 最近表示，该平台预计将在其他国家推出更广泛的服务功能，可供各种小型企业使用，也可能适用于金融机构。,桑坦德区块链外汇服务平台或将适用于金融机构,08:06,2018-09-19 20:00:19
16,据 Coindesk 报道，纽约州总检察长办公室发布「虚拟市场诚信初步报告」中表示，部分交易所可以量化其平台上的交易活动有多少来自他们自己。 Circle 称，Poloniex 平台交易量不到 1％ 来自其本身，而 BitFlyer USA 在其平台上进行约 10％ 的交易。值得注意的是 Coinbase 透露其平台上交易量的近 20％ 来自其本身。,检察官报告：Coinbase 平台交易量近 20％ 来自其本身,08:03,2018-09-19 20:00:19
17,据彭博社报道，与 CME 合作推动比特币期货市场发展的三家加密货币交易所已经被纽约州检察长办公室警告。根据纽约州检察长 Barbara Underwood 周二发布的报告，上述三家与 CME合作的交易所中，Bitstamp 和 itBit 没有正式的政策来打击市场操纵。而 Kraken 则拒绝参与检察长的审查，还曾声称即使「诈骗猖獗」，操纵「对大多数加密交易者来说无关紧要」。,三家与 CME 合作的加密交易所被警告监管政策欠缺,07:56,2018-09-19 20:00:19
18,据 CCN 报道，美国证券交易委员会 SEC 委员 Hester Peirce 表示，政府不应该根据比特币假设的弱点来限制加密市场中新产品的推出。Peirce 表示，SEC 不应该要求加密市场受到全面的政府监管，这是允许与加密市场挂钩的产品在 SEC 监管的市场上交易的先决条件。自 Peirce 对 SEC 否决 Gemini 创始人提出的比特币 ETF 表示反对后，她开始被外界称作「加密妈妈」。,SEC 委员：不应根据比特币弱点拒绝加密产品,07:53,2018-09-19 20:00:19
19,据证券日报消息，2018年 A 股上市公司围绕「区块链」做起了文章。仅今年 1 月份，沪深两市就有 16 家上市公司因涉炒作区块链概念被交易所问询。截至发稿日今年已有 34 家上市公司因「涉链」被监管部门问询。当被问及区块链业务时，大多数公司均回复称「处于研究阶段」，只有 9 家有落地应用，占比仅四分之一。,今年 34 家 A 股上市公司涉区块链遭问询，仅 9 家落地应用,07:49,2018-09-19 20:00:19
