,classes_name,header,news_url,pubtime
0,天下,卡塔尔退出欧佩克：“忤逆”了沙特，讨好了美国？,https://www.jiemian.com/article/2677728.html,2018-12-04 20:01:38
1,天下,【评论】卡塔尔退出OPEC的背后，除了分裂还有野心,https://www.jiemian.com/article/2677108.html,2018-12-04 20:01:38
2,天下,法国将宣布停止提高燃油税，财长提出降低整体征收额度,https://www.jiemian.com/article/2676979.html,2018-12-04 20:01:38
3,天下,气候变化大会开幕，古特雷斯敦促2050年实现“碳中和”,https://www.jiemian.com/article/2676123.html,2018-12-04 20:01:38
4,天下,巴黎学生与救护车司机加入抗议，组织者取消与政府对话,https://www.jiemian.com/article/2675944.html,2018-12-04 20:01:38
5,天下,中国驻札幌总领馆通报11名中国公民遭拘捕：疑遭中介欺骗,https://www.jiemian.com/article/2675333.html,2018-12-04 20:01:38
6,天下,【天下头条】市场情绪乐观美股反弹道指收涨288点 法国骚乱商户收入减少近半,https://www.jiemian.com/article/2675056.html,2018-12-04 20:01:38
7,天下,【天下奇闻】墨西哥新总统坐捷达参加交接仪式 考古证实人类来自240万年前的北非,https://www.jiemian.com/article/2673797.html,2018-12-04 20:01:38
8,中国,【界面晚报】38部门对知识产权领域严重失信主体开展联合惩戒 法国将宣布停止提高燃油税,https://www.jiemian.com/article/2677966.html,2018-12-04 20:01:38
9,中国,下半年来首个寒潮蓝色预警，中东部大部先后下降6-8℃,https://www.jiemian.com/article/2677872.html,2018-12-04 20:01:38
10,中国,地方新闻精选 | 湖北一医院手术途中向患者加价 长沙交警首次拘留马路“发卡族”,https://www.jiemian.com/article/2677539.html,2018-12-04 20:01:38
11,中国,村干部默许企业进村掩埋，近8000吨化工危险废料偷偷“下乡”,https://www.jiemian.com/article/2677742.html,2018-12-04 20:01:38
12,中国,直通部委|血友病进口特效药获批上市 公安办理行政案不再询问劳教信息,https://www.jiemian.com/article/2677401.html,2018-12-04 20:01:38
13,中国,外交部：朝鲜外务相李勇浩将访华,https://www.jiemian.com/article/2677462.html,2018-12-04 20:01:38
14,中国,中央气象台：未来十天冷空气活跃，零度线将移至长江沿江,https://www.jiemian.com/article/2676995.html,2018-12-04 20:01:38
15,中国,中纪委11月发布近70名干部案件信息，多名国企“一把手”被查,https://www.jiemian.com/article/2676776.html,2018-12-04 20:01:38
