,classes_name,header,news_url,pubtime
0,天下,担心被法国人带坏？埃及禁售黄色反光马甲,https://www.jiemian.com/article/2698853.html,2018-12-11 20:55:31
1,天下,【天下奇闻】美国男子因称圣诞老人不存在被捕 英王妃涂深色甲油违反王室礼仪,https://www.jiemian.com/article/2698589.html,2018-12-11 20:55:31
2,天下,新马海域争端或闹上国际法庭？马哈蒂尔：有信心能打赢,https://www.jiemian.com/article/2698002.html,2018-12-11 20:55:31
3,天下,除了拖延时间，特蕾莎・梅别无选择,https://www.jiemian.com/article/2697456.html,2018-12-11 20:55:31
4,天下,4年战争后七成也门人挨饿，和谈双方对荷台达归属分歧未决,https://www.jiemian.com/article/2697582.html,2018-12-11 20:55:31
5,天下,市场波动外部环境不确定，高盛调降美联储明年加息预期,https://www.jiemian.com/article/2697318.html,2018-12-11 20:55:31
6,天下,库什纳与沙特王储的“交情”引美国政界担忧,https://www.jiemian.com/article/2695088.html,2018-12-11 20:55:31
7,天下,联合国：全球首份移民问题政治宣言问世,https://www.jiemian.com/article/2696568.html,2018-12-11 20:55:31
8,中国,生态环境部：11月重污染期间267家企业未严格减排，河北占62.2%,https://www.jiemian.com/article/2698980.html,2018-12-11 20:55:31
9,中国,环境部规划院向全国人大环资委提交《长江保护法》建议稿,https://www.jiemian.com/article/2698876.html,2018-12-11 20:55:31
10,中国,【界面晚报】刘鹤应约与姆努钦、莱特希泽通电话 深交所拟对*ST长生强制退市,https://www.jiemian.com/article/2698212.html,2018-12-11 20:55:31
11,中国,地方新闻精选| 辽宁将给进城购房农民优惠补贴，湖北男子火车上“霸铺”被行拘,https://www.jiemian.com/article/2698472.html,2018-12-11 20:55:31
12,中国,国办：国家综合性消防救援车辆将悬挂应急救援专用号牌,https://www.jiemian.com/article/2698481.html,2018-12-11 20:55:31
13,中国,直通部委| 中国将建互联网失信黑名单制度，消防车辆年底前后将换发专用号牌,https://www.jiemian.com/article/2698305.html,2018-12-11 20:55:31
14,中国,渤海综合治理攻坚战行动计划发布：实施海上溢油风险防范,https://www.jiemian.com/article/2698358.html,2018-12-11 20:55:31
15,中国,审计署：7个地区存在扶贫资金闲置、套取、挪用等问题,https://www.jiemian.com/article/2697696.html,2018-12-11 20:55:31
