,brief,header,news_url,pubtime,savetime
0,哪些省市的儿童拐卖犯罪最为猖獗？中国的儿童拐卖网络有着怎样的特征？打击此类犯罪，应该重点关注哪些地区？抓取了寻子网站“宝贝回家”的上万条数据后，武汉大学王真团队建立的 ...,中国儿童拐卖地图:大数据显示，北上蓉渝+莆田是重点,http://tech.sina.com.cn/d/f/2018-09-04/doc-ihiixyeu3042954.shtml,大数据,2018-09-04 20:05:30
1,医疗大数据公司柯林布瑞获6800万元A轮融资】记者获悉，近日，医疗大数据公司柯林布瑞(ClinBrain)宣布于上半年完成6800万元A轮融资，本轮投资由正海资本和瑞健资本联合领投，京颐股份、广 ...,医疗大数据公司柯林布瑞获6800万元A轮融资,http://finance.sina.com.cn/7x24/2018-09-04/doc-ihiixzkm4446160.shtml,大数据,2018-09-04 20:05:30
2,法院执行加速 引入大数据评估房产 来源：北京日报 本报讯（记者 高健 通讯员 李婧怡）720万元！当电脑屏幕显示出数字时，被执行人王远（化名）当即表示同意。这是海淀法院近日首次用 ...,海淀法院用大数据评估房产价值 被执行人满意其价格,http://finance.sina.com.cn/china/dfjj/2018-09-04/doc-ihiqtcan7736188.shtml,大数据,2018-09-04 20:05:31
3,月3日电 中国司法大数据研究院近日发布报告显示，2016至2017年，全国电信网络诈骗案件数量呈上升趋势，案件多发于浙江、广东等沿海地区，且逐步向内陆地区蔓延。其中，网络诈骗案件 ...,司法大数据：充值刷单成电信网络诈骗典型骗术,http://tech.sina.com.cn/i/2018-09-03/doc-ihiixzkm3918642.shtml,大数据,2018-09-04 20:05:31
4,据《2018数据泄露损失研究》评估显示，大型数据泄露代价高昂，百万条记录可致损失4000万美元，5000万条记录可致损失3.5亿美元。遭遇数据泄露事件的公司企业平均要损失386万美元，同比去 ...,2018年全球互联网十大数据泄露事件盘点,http://tech.sina.com.cn/i/2018-09-03/doc-ihiqtcan1036279.shtml,大数据,2018-09-04 20:05:31
5,大数据报告|房租上涨，谁在说谎？来源：90度地产 艾普大数据“长 安居，大不易”。北漂、沪漂、深漂们继一套房的梦想破灭后，一张床的底线也受到了挑战。近两个月，以北京为代表的 ...,北京房租上涨大数据：国贸金融街西二旗望京溢价最高,http://finance.sina.com.cn/review/mspl/2018-09-03/doc-ihiqtcan1073011.shtml,大数据,2018-09-04 20:05:31
6,的问题，并表示数字经济即将进入爆发期。“大数据是信息化发展的新阶段，推动信息领域核心技术突破，是我们千载难逢的发展机遇。”梅宏表示，要加快建设数字中国，发挥信息化 ...,中国科学院院士梅宏在南京软博会上表示：大数据新阶段开启,http://finance.sina.com.cn/roll/2018-09-03/doc-ihiqtcan5129175.shtml,大数据,2018-09-04 20:05:32
7,原标题：2018“赢在东莞”全球大数据创新创业大赛决赛，冠军团队获百万创业基金▲优胜团队代表与大数据公司签约现场 全媒体记者 郑家雄 摄 2018“赢在东莞”全球大数据创新创业大赛决 ...,2018“赢在东莞”全球大数据创新创业大赛决赛，冠军团队获百万创业基金,http://news.sina.com.cn/c/2018-09-03/doc-ihiqtcan1355609.shtml,大数据,2018-09-04 20:05:32
8,原标题：史上最大数据窃取案：涉30亿用户信息 波及所有平台 [观察者网综合报道]微博莫名其妙关注了乱七八糟的营销号，QQ号忽然加了一些不认识的群聊，淘宝账号不知何时多了几个好友 ...,史上最大数据窃案：涉30亿用户信息 波及所有平台,http://news.sina.com.cn/c/2018-08-30/doc-ihiixyeu1110822.shtml,大数据,2018-09-04 20:05:32
