,brief,classes_name,header,news_url,pubtime,savetime
143,网络游戏道德委员会于近期成立，并对首批20款存在道德风险的网络游戏进行了评议。,澎湃新闻,听阿加西讲述自我：传奇只是虚名，我真的“憎恶”网球了,https://www.thepaper.cn/newsDetail_forward_2715155,5小时前,2018-12-07 20:04:29
144,无数的鲜花和掌声面前，阿加西却始终以一种桀骜不驯的姿态撕扯着自己和网球之间的羁绊，甚至不止一次在公开场合直言“憎恶网球”。,澎湃新闻,男子击打司机眼睛致公交车逆行撞护栏，获刑3年,https://www.thepaper.cn/newsDetail_forward_2715937,6小时前,2018-12-07 20:04:29
145,因下车问题与司机发生纠纷，已经年过半百的梁某趁对方驾驶车辆期间击打司机眼部，致使司机驾驶公交车逆行并撞上护栏，最终梁某获刑三年。,澎湃新闻,昆明将对小黄车“代收代转代管”：期限内不领回按无主车报废,https://www.thepaper.cn/newsDetail_forward_2716022,6小时前,2018-12-07 20:04:29
146,从12月6日起，城管部门将对全市小黄车进行“代收代转代管”，市、区监管部门将向社会公告，对于公告后60个工作日内仍不领回的小黄车，将按无主车辆作报废处置。,澎湃新闻,历时半年义务代理官司，西安两名大三女生帮农民工讨薪13万,https://www.thepaper.cn/newsDetail_forward_2716008,6小时前,2018-12-07 20:04:30
147,李金霏和熊镇两人为了保证代理词逻辑上的连贯性，且需要准备大量的案件材料，有时在宿舍熄灯后就开着台灯通宵工作，第二天再继续打起精神上课。,澎湃新闻,“失联男孩”父亲再发声：辜负爱心浪费公共资源，深感抱歉,https://www.thepaper.cn/newsDetail_forward_2715876,6小时前,2018-12-07 20:04:30
148,黄爸爸再度发布朋友圈，表示对社会各界的感谢和抱歉。他希望大家的热心和爱心永远保持下去。,澎湃新闻,美韩外长会面，就美朝对话及韩朝关系进行“深度”交流,https://www.thepaper.cn/newsDetail_forward_2715980,6小时前,2018-12-07 20:04:30
149,新华社华盛顿12月6日电 美国国务卿蓬佩奥6日同到访的韩国外长康京和举行会晤，双方就协调朝鲜半岛无核化事宜进行了磋商。,澎湃新闻,延安贾延成等14人被批捕，陕西警方征集其涉黑违法犯罪线索,https://www.thepaper.cn/newsDetail_forward_2715967,6小时前,2018-12-07 20:04:30
150,为该犯罪组织提供支持、纵容、包庇并逃避法律惩处的公职人员向纪检监察部门、公安机关主动说明情况并交代相关问题。,澎湃新闻,垃圾再生｜杭州青山村的一次青年训练营：乡村垃圾分类难在哪,https://www.thepaper.cn/newsDetail_forward_2711292,6小时前,2018-12-07 20:04:30
151,位于杭州西北郊的黄湖镇青山村，是一个正在推广垃圾分类的典型样本。2018年7月，公益组织“捡拾中国”在这里开展了为期8天的青年训练营。,澎湃新闻,宝钢湛江钢铁三号高炉项目正式启动，总投资188.5亿元,https://www.thepaper.cn/newsDetail_forward_2715985,6小时前,2018-12-07 20:04:30
152,宝钢湛江钢铁厂被称为钢铁行业的“梦工厂”，2008年获得国家发改委“路条”，允许开展前期工作。最终于2012年5月，国家发改委核准宝钢广东湛江钢铁基地项目。,澎湃新闻,辽宁鞍山一名消防员英勇牺牲：营救落水群众时冰面大面积坍塌,https://www.thepaper.cn/newsDetail_forward_2715982,6小时前,2018-12-07 20:04:30
153,一名消防员营救落水群众英勇牺牲，施救过程中，冰面大面积坍塌，救援人员落水，一名消防人员不幸牺牲。,澎湃新闻,视频|百万网友寻找的“最美弯腰女孩”找到了,https://www.thepaper.cn/newsDetail_forward_2715797,6小时前,2018-12-07 20:04:30
154,12月7日，山东青岛。“最美弯腰女孩”被找到。近日一名在公交车上弯腰蹲地为老人系鞋带女孩的事迹感动众人，引发网友寻找，其被称为“最美弯腰女孩”。,澎湃新闻,雪乡监管者生变：地方强调加强危机公关能力建设，护好招牌,https://www.thepaper.cn/newsDetail_forward_2715686,6小时前,2018-12-07 20:04:30
155,“在森工改革过渡期牡丹江市负责雪乡核心区监管，海林市负责雪乡外围区域监管”的要求，做好与牡丹江市政府、大海林林业局职能交接工作，明晰监管职责。,澎湃新闻,视频|9岁男孩见女王太“紧张”，直接爬走了,https://www.thepaper.cn/newsDetail_forward_2715759,6小时前,2018-12-07 20:04:30
156,当地时间12月5日，一名9岁的英国男孩在见到女王后，因为过于“紧张”，竟然直接爬走了。当天，英国女王伊丽莎白二世前往伦敦一家儿童慈善机构访问。,澎湃新闻,羊肉串5份样品2份不合格，网红店样本甚至查出不明物质,https://www.thepaper.cn/newsDetail_forward_2715911,6小时前,2018-12-07 20:04:30
157,业内人士透露，只需要一点羊油就能轻松做到。纯羊肉要卖到几十元一斤，成本可观，但假如10元3斤的羊油再配上其他低价肉类，就能比卖纯羊肉串多赚1倍。,澎湃新闻,中国移动董事长尚冰：2019年上半年推出自主品牌5G手机,https://www.thepaper.cn/newsDetail_forward_2715762,6小时前,2018-12-07 20:04:30
