,brief,classes_name,header,news_url,pubtime
0,经过一年多酝酿，腾讯零钱通最近上线公测，引起很多关注。零钱通本质上也是货币基金。获得邀请的用户开通零钱通之后，可以将微信钱包中的零钱或银行卡的资金转入享受收益，也可直接将零钱通的资金用于微信支付。从功能上看，零钱通与5年前就面世的余额宝基本一致。那么零钱通的上线会对先行,人工智能,货币基金风口已过，零钱通上线会撼动余额宝吗？,http://www.aihot.net/other/finance/12545.html,2018-11-24 20:11:59
1,史上最长黑色星期五购物季周五正式开启。受惠于经济强劲及薪资上涨，今年美国假期销售开局平稳。 Adobe Analytics的数据显示，截至美东时间早上10点，黑五在线销售额达到6.43亿美元。Adobe预计黑五当天在线销售额有望达到64亿美元。 然而，就在美国消费者从线下转移至线上消费的同时，许,人工智能,"美国最长""黑五""季开启：亚马逊9小时打破去年纪录",http://www.aihot.net/other/finance/12544.html,2018-11-24 20:11:59
2,▲霍金斯说，在世界能够开发真正的人工智能之前，它必须能够先解释人类智能，这样它才能创造出真正像人类大脑一样工作的机器。 11月24日消息，据国外媒体报道，杰夫&middot;霍金斯(Jeff Hawkins)曾是移动电脑公司Palm和Handspring的创始人，而揭示大脑工作机理是他长久以来的梦想。作为一名,人工智能,先理解大脑再创造AI，这个人的想法连DeepMind都没懂,http://www.aihot.net/application/12543.html,2018-11-24 20:11:59
3,【TechWeb】11月24日消息，上周，调研机构Strategy Analytics公布了三星2018年第三季度在华的销售业绩，仅出货60万部，这与三星第三季度全球总出货量7230万部相比，根本不值一提。去年同期三星全球销量为8340万部，今年也有较大幅度的下降。 针对三星手机在中国市场低迷的表现，三星移动业务负,人工智能,三星承认中国市场失败：智能手机占有率或不足1%,http://www.aihot.net/iot/12542.html,2018-11-24 20:12:00
4,11月23日消息，据国外媒体报道，日前笔者走进了位于英国埃塞克斯的亚马逊仓库（订单履约中心，Amazon Fulfillment Center），近距离观察着这些机器人是如何工作的。它们看不见我，自顾自地移动、制造噪音、相互联络，它们有条不紊地穿过金属地板，拖着能累死人的货物前进。 一个机器人走近了，我看了,人工智能,媒体走进自动化仓库：机器人的乐园，连椅子都没有,http://www.aihot.net/robot/12541.html,2018-11-24 20:12:00
5,▲氪信科技创始人兼CEO朱明杰 氪信科技携手合作伙伴华为、旷视科技、科大讯飞等在北京举行媒体发布会，正式推出氪信新一代AI金融领域智能引擎非或然引擎。同时，华为、旷视、讯飞等企业代表也分别介绍了各自与氪信的智能金融联合解决方案。 据悉，非或然引擎分为特征工程引擎、智能执,人工智能,氪信发布AI金融风控新引擎，打造智能金融解决方案,http://www.aihot.net/other/finance/12540.html,2018-11-24 20:12:00
6,刚从四川大山里把矿场迁过来，没想到币价跌得这么惨，几千台矿机每天光电费就接近3万块钱，越挖越赔。阿星（化名）这两天有点沮丧，新疆矿场的运输、基建搞了1个多月，本来准备开足马力，谁料比特币开启了狂跌模式。 比特币价格闪崩之后，挖矿彻底成了一门赔本生意。 不仅矿工纷纷离场，就连其上游,人工智能,深圳华强北一线：比特币矿机卖家转行卖丝袜,http://www.aihot.net/hardware/12539.html,2018-11-24 20:12:00
7,今年10月，家乐福加入了由IBM推出的基于区块链的食品信托基金。 据报道，零售业巨头家乐福正在西班牙网络中部署一个基于超级账本的区块链食品溯源平台。 据了解，这种食品溯源方案最初由IBM开发，其主要用于追踪加利西亚北部地区那些未接受抗生素治疗，而被打上高质量和出自原产地标签的,人工智能,家乐福将推出基于超级账本的区块链食品溯源平台,http://www.aihot.net/other/finance/12538.html,2018-11-24 20:12:00
8,研究人员投入了大量的精力来训练更聪明、更准确、更复杂的人工智能。然而看看沿途发生的花絮也是一件很有趣的事。 我们所知的是，算法可以创造出逼真的人像或足以以假乱真的视频，但来自微软和香港城市大学的人工智能开发者团队却回避了绘制的准确性。相反，他们把人工智能用于自动将,人工智能,解析AI漫画系统CariGAN：为何能与艺术家一决高下,http://www.aihot.net/application/12537.html,2018-11-24 20:12:00
9,据韩国媒体报道，朝鲜计划在明年4月份举办与区块链技术相关的国际会议。据韩媒称，11月21日，朝鲜友好协会（朝rH善f，KFA）在其网站上宣称由区块链和加密货币业内世界级专家参与的国际论坛将于明年4月22日至23日在平壤科学技术殿堂举办。 据悉，朝鲜友好协会（朝rH善f，KFA）是由西班牙国,人工智能,朝鲜拟举办区块链国际会议，或将从币到技术的转身,http://www.aihot.net/other/finance/12536.html,2018-11-24 20:12:00
10,应该将链上治理和链下治理结合起来。 上周的BCH分叉大战，让人们对POW世界的安全产生了心理阴影。我们看到了一句玩笑话：说EOS中心化，掌握在21个超级节点手中；BCH最后却只掌握在几个人手中。更有人对比特币耶稣Roger说：Roger，你向我们展示了攻击BCH网络有多么容易，只需要你一个人动动手指,人工智能,财阀式链上治理真的邪恶吗？,http://www.aihot.net/other/finance/12535.html,2018-11-24 20:12:00
11,▲Giga Watt矿场外观 随着比特币等数字货币价格一路急跌，曾盛极一时的挖矿行业正瑟瑟发抖于阵阵寒风之中。进入漫漫熊途的数字货币矿场和矿机生产商们，即使跑赢了哈希，却还是输给了周期。 近日，总部位于美国的比特币矿业公司Giga Watt在华盛顿州东区破产法庭申请破产保护，声称公司资,人工智能,比特币暴跌，美国一家数字币矿业巨头宣布破产,http://www.aihot.net/other/finance/12534.html,2018-11-24 20:12:00
