,brief,classes_name,header,news_url,pubtime,savetime
140,接电话的前台员工证实确有此事，但她表示，当日女童是在学游泳练习憋气，而并不是遇到危险。当时王先生慌忙下水将女童送上岸时，还给孩子吓了一跳。,澎湃新闻,黄河水利委员会近日督导黄河下游工程建设和山东黄河防汛,https://www.thepaper.cn/newsDetail_forward_2376831,5小时前,2018-08-24 20:07:06
141,8月15日～18日，黄河水利委员会党组成员、副主任赵勇率检查组，现场督导黄河下游防洪工程建设和山东黄河防汛工作。,澎湃新闻,银保监会：防范以“虚拟货币”“区块链”名义进行非法集资,https://www.thepaper.cn/newsDetail_forward_2376889,5小时前,2018-08-24 20:07:06
142,近期，一些不法分子打着“金融创新”“区块链”的旗号，通过发行所谓“虚拟货币”“虚拟资产”“数字资产”等方式吸收资金，侵害公众合法权益。,澎湃新闻,问政视频｜特快列车又见“霸座女”：买无座票强占座位两小时,https://www.thepaper.cn/newsDetail_forward_2376823,5小时前,2018-08-24 20:07:06
143,8月22日凌晨T398列车济宁段，一女子购买无座车票后强占女孩座位，女孩找来乘务人员协调。,澎湃新闻,《日文图书汉译出版史》：近代以来向日本学习的一个总结,https://www.thepaper.cn/newsDetail_forward_2376752,5小时前,2018-08-24 20:07:06
144,8月23日，南京大学出版社与东京大学出版会于第二十五届北京图书博览会联合举办《日文图书汉译出版史》版权输出签约仪式。,澎湃新闻,发改委谈“共享单车退潮”：要辩证、客观、全面地来看待,https://www.thepaper.cn/newsDetail_forward_2376804,5小时前,2018-08-24 20:07:06
145,共享单车的确存在一些无序增长、恶性竞争、管理滞后问题，对于企业来说，要扎实创新，不能跟风炒作。针对共享单车发展中的问题，对以创新之名行侵权欺诈之实的，要严惩。,澎湃新闻,蔬菜之乡寿光被淹：菜贩到北京抢菜回运，芹菜4小时涨30%,https://www.thepaper.cn/newsDetail_forward_2376807,5小时前,2018-08-24 20:07:07
146,由于山东寿光的水灾，蔬菜大批受灾，导致山东的菜贩收不上来菜。不少菜贩来到北京新发地农产品批发市场，进菜回山东售卖，仅4个小时，批发市场的芹菜价格就涨了30%。,澎湃新闻,马上评｜90人的“超级大班”，不怕政策规定就怕媒体曝光？,https://www.thepaper.cn/newsDetail_forward_2376794,5小时前,2018-08-24 20:07:07
147,每次非要媒体曝光才行动，到底是在认真办人民满意的教育，还只是被曝光后碍于面子、怕影响来年招生和上级印象而不得不整改？,澎湃新闻,2018中外文学出版翻译合作研修班结班仪式在京举行,https://www.thepaper.cn/newsDetail_forward_2376185,5小时前,2018-08-24 20:07:07
148,中国文化和旅游部外联局传播处参赞李峙在致辞中表示，希望各国出版翻译界代表和汉学家能携手并肩，深化文学翻译出版的合作与交流，架起民心相通的桥梁。,澎湃新闻,20名美国普林斯顿大学学生来上海学京剧，艺术家为学霸授课,https://www.thepaper.cn/newsDetail_forward_2376118,5小时前,2018-08-24 20:07:07
149,这几天的上海京剧院来了一群“洋学生”，他们特地从美国飞到上海，为的就是在这里了解中国文化，学习中国京剧。,澎湃新闻,高铁“霸座”男被处治安罚款200元，记入铁路征信体系,https://www.thepaper.cn/newsDetail_forward_2376836,5小时前,2018-08-24 20:07:07
150,记者刚刚从中国铁路济南局集团公司获悉，近期在网上“火”了的高铁“霸座”男孙某被处治安罚款200元，并在一定期限内被限制购票乘坐火车。,澎湃新闻,赌王妹妹何婉琪去世：享年95岁，遗产高达百亿,https://www.thepaper.cn/newsDetail_forward_2376780,5小时前,2018-08-24 20:07:07
151,据香港媒体报道，赌王何鸿霭妹十姑娘何婉琪惊曝已于6月5日离世，享年95岁。十姑娘发言人游小姐表示，十姑娘的遗愿是希望何鸿觥敖嵴省薄,澎湃新闻,视频直播丨山东寿光20万个蔬菜大棚被淹，蔬菜价格飙涨,https://www.thepaper.cn/newsDetail_forward_2376556,5小时前,2018-08-24 20:07:07
152,8月24日，受洪水影响，山东寿光20万个蔬菜大棚被淹，导致蔬菜价格大幅上升。其中叶菜类的价格尤其明显，白菜、芹菜、茄子等菜的涨幅高的达25%，低的在10%左右。,澎湃新闻,美国托福官网改标“中国台湾”，准考证、成绩单一并修改,https://www.thepaper.cn/newsDetail_forward_2376779,5小时前,2018-08-24 20:07:07
153,近日，举办托福（TOEFL）考试的美国教育测验服务社也加入这一行列，官网涉台标注改为“中国台湾”。托福总部发言人对此仅回应表示，“高度重视所有地区学生”。,澎湃新闻,媒体调查：1500元买篇论文，自主招生谁在“走门道”？,https://www.thepaper.cn/newsDetail_forward_2376191,5小时前,2018-08-24 20:07:07
154,记者调查发现，一些个人和机构收取高昂价格，号称能帮助参与自招学生“跨门槛”。可是，在自招考评中，这些“门道”仅凭高校一通求证电话、一道面试考题便可轻易拆解。,澎湃新闻,同观・德国｜历史、现实、困境：德国拥核旧事为何当下重提？,https://www.thepaper.cn/newsDetail_forward_2376489,5小时前,2018-08-24 20:07:07
155,目前要求德国拥有核武的呼声，更多地是体现了德国政治精英对特朗普政府的不满，以及在今天的国际局势下，对德国防务、安全和国家未来走向的思考。,澎湃新闻,男司机误挂倒挡，被自己的车拖行30米,https://www.thepaper.cn/newsDetail_forward_2376735,5小时前,2018-08-24 20:07:07
156,8月13日，江苏常州。一男子酒后驾车，与停放路面的压路机碰撞。男子称，自己下车查看时，错手将挡位挂至倒挡，造成被自己的车拖行。经测男子属醉驾，案件在进一步处理。,澎湃新闻,中国散裂中子源通过国家验收，“超级显微镜”在东莞投入运行,https://www.thepaper.cn/newsDetail_forward_2376679,5小时前,2018-08-24 20:07:08
157,8月23日，国家重大科技基础设施中国散裂中子源项目在东莞顺利通过国家验收，正式投入运行。,澎湃新闻,北京首个集体土地租赁房项目开工：供房901套一居室开间,https://www.thepaper.cn/newsDetail_forward_2376705,5小时前,2018-08-24 20:07:08
158,8月24日早上的北京南三环，车流穿梭忙碌，环路之外，已经树起围挡的丰台区成寿寺村集体土地租赁房项目工地里，工程车陆续进场。,澎湃新闻,国产055型万吨驱逐舰首舰开始首次试航,https://www.thepaper.cn/newsDetail_forward_2376718,5小时前,2018-08-24 20:07:08
