,brief,header,pub_time,url
0,阿里巴巴公布的2019财年二季报显示，营收851.48亿元，同比增长54%，连续7个季度收入增速超50%，已连续多个季度收入增速领跑FANG+BAT阵营。,阿里连续7个季度收入增速超50%，增速领跑FANG+BAT阵营,20:02,http://m.tmtpost.com/nictation/3567048.html
1,阿里巴巴今日发布2019财年第二财季。财报显示，截至2018年9月30日季度，支付宝国内年度活跃用户超过7亿，其中70%用户使用3项及以上支付宝的服务。,蚂蚁金服本季亏损3.52亿美元，因加大产品创新及投资,19:37,http://m.tmtpost.com/nictation/3567015.html
2,阿里巴巴第二财季调整后每股收益9.60元人民币，市场预估7.43元人民币；第二财季营收851.5亿元人民币，市场预期 864.6亿元人民币。,阿里巴巴第二财季营收851.5亿，不及预期,19:08,http://m.tmtpost.com/nictation/3566982.html
3,2018前三季度新增独角兽86家，完成IPO退出榜单20家，前两名是估值达1万亿的蚂蚁金服和估值增长1.5倍至5000亿的今日头条。,胡润发布独角兽指数：蚂蚁金服位列榜首，估值1万亿元,18:56,http://m.tmtpost.com/nictation/3566968.html
4,好邻居完成新轮融资，旷石科技入股，估值将达到2亿美元。截止目前，好邻居便利店拥有门店数400家左右。主要分布于北京、杭州两地。,好邻居完成新轮融资，旷石科技入股，估值将达到2亿美元,18:31,http://m.tmtpost.com/nictation/3566942.html
5,北京交管部门开始严查电动滑板车、平衡车、独轮车违法上路，违法者将面临扣留器械，处200元罚款的处罚。今日民警开出首张罚单。,北京禁电动滑板车上路，今天开出首张罚单,18:27,http://m.tmtpost.com/nictation/3566935.html
6,二次元音频社区猫耳 FM已被 bilibili 全资收购。,B站全资收购二次元音频社区猫耳FM,18:25,http://m.tmtpost.com/nictation/3566932.html
7,腾讯向中小学生在线辅导机构猿辅导投资2.5亿美元，猿辅导估值达到28亿美元。,腾讯向猿辅导投资2.5亿美元,18:24,http://m.tmtpost.com/nictation/3566930.html
8,在2018胡润百富企业家峰会上，知识产权与企业服务独角兽汇桔网获得胡润百富战略投资。,汇桔网获胡润百富战略投资，深耕知识产权变现与企业服务生态,18:03,http://m.tmtpost.com/nictation/3566899.html
9,Uber 已经将企业员工账单以及交通网络两项服务整合到了一起，推出了全新的 Eats for Business 商务订餐服务。,Uber推出Eats for Business商务订餐服务,17:40,http://m.tmtpost.com/nictation/3566867.html
10,智能锁德施曼近日宣布获超亿元B轮追投，由分享投资领投，红星美凯龙、好太太集团两大上市公司联合跟投。,"智能锁德施曼获超亿元B轮融资,分享投资领投",17:34,http://m.tmtpost.com/nictation/3566858.html
11,11月2日，来自德国的一体化商务解决方案专家DEVELOP品牌在近日宣布正式进入中国市场，有12款全新黑白/彩色数码复合机产品已上市。,DEVELOP德凡品牌进入中国，已有12款数码复合机上市,17:15,http://m.tmtpost.com/nictation/3566834.html
12,淘宝司法拍卖平台显示，上海市第一中级人民法院将于12月3日开始进行公开网络司法拍卖活动，拍卖深圳光汇石油集团股份有限公司持有的深圳前海微众银行1260万股权。,微众银行股权在淘宝被拍卖，该行估值1470亿元,17:08,http://m.tmtpost.com/nictation/3566823.html
13,据外媒最新消息，美国《华尔街日报》科技记者创办的科技新闻媒体Recode将被并入母公司的门户网站Vox.com。,美科技媒体Recode被并入母公司门户，访客下滑50%,16:57,http://m.tmtpost.com/nictation/3566808.html
14,在线音乐教育平台“VIP陪练”宣布，平台已完成1.5亿美元C轮融资，老虎环球基金领投，腾讯、兰馨亚洲、金沙江创投、蓝驰创投、长石资本、北京华联长山兴等老股东全部跟投。,VIP陪练完成1.5亿美元C轮融资，联合百所高校成立艺术人才基地,16:37,http://m.tmtpost.com/nictation/3566782.html
15,二次元视频社区B站（bilibili.com）计划收购网易旗下的漫画社区网易漫画，但尚未获悉具体的交易时间及价格。,B站计划收购网易漫画，后者曾与网易其他业务打包融资,16:33,http://m.tmtpost.com/nictation/3566776.html
16,苹果公司董事会宣布将在11月15日派发现金股息，巴菲特领导的伯克希尔・哈撒韦公司能分到1.8亿美元。,苹果11月15日派发股息，巴菲特公司能分到1.8亿美元,16:23,http://m.tmtpost.com/nictation/3566761.html
17,2018腾讯全球合作伙伴大会在南京开幕，大会次日的微信分论坛上，微信增值业务部李卿分享了微信小游戏目前的发展状况。,微信小游戏男女用户比例持平，成年人占比超90%,16:15,http://m.tmtpost.com/nictation/3566743.html
18,“B站引入阿里并不属于增资扩股。同时，基于AB股的安排，B站管理团队的投票权超过80%，这意味着腾讯也无法控制B站如何处理自己的老股。”,B站卖老股引入阿里巴巴，阿里与阿里系基金持股比例达10%,15:58,http://m.tmtpost.com/nictation/3566716.html
19,11月2日，调研机构Counterpoint近日发布了第三季全球手机出货同比下滑3%，全球排名前六的手机品牌中，仅小米与华为保持了高速增长，分别同比增长25%和33%。,Counterpoint研报：全球手机市场下滑3%，仅小米华为高增长,15:32,http://m.tmtpost.com/nictation/3566675.html
20,据介绍，目前微信小据介绍，目前微信小程序人均使用超20个，政务服务使用达到6.5亿人次，在商业服务方面，小程序日均交易量相较于半年前，增长142%。,微信小程序人均使用超20个，商业服务增长142%,15:15,http://m.tmtpost.com/nictation/3566651.html
21,远景集团收购日产汽车旗下动力电池业务AESC，将在无锡江阴正式投产世界最先进的811三元锂电池（NCM811）生产线。,远景AESC工厂落地无锡，明年底量产NCM811动力电池,15:13,http://m.tmtpost.com/nictation/3566647.html
22,HashiCorp一直在开发用于管理云基础设施的开源工具，公司拥有相当庞大的商业业务。今日，猎云网获悉，该公司完成了1亿美元D轮融资，成为估值达19亿美元的独角兽公司。,云计算自动化平台HashiCorp获1亿美元D轮融资，估值达19亿美元,15:08,http://m.tmtpost.com/nictation/3566640.html
23,为进一步广泛听取社会各界的声音，满足公众便捷安全的出行需求，11月2日，滴滴“公众评议会”上线试运行。,滴滴试行 “公众评议会” 邀全社会共同探讨平台治理,15:05,http://m.tmtpost.com/nictation/3566636.html
24,,HS Markit：华为在第三季度全球智能手机出货量中保持了第二的位置,14:59,http://m.tmtpost.com/nictation/3566626.html
25,,Uber整合推出Eats for Business商务订餐服务,14:45,http://m.tmtpost.com/nictation/3566605.html
26,,星巴克计划明年在全球开设2100家新店,14:21,http://m.tmtpost.com/nictation/3566567.html
27,,扎克伯格未来押注Instagram和视频，暂获华尔街支持,13:49,http://m.tmtpost.com/nictation/3566523.html
28,,IBM大中华区客户中心北京揭幕，展示全线业务,13:31,http://m.tmtpost.com/nictation/3566484.html
29,,蚂蚁金服正式推出技术风险防控平台TRaaS,13:27,http://m.tmtpost.com/nictation/3566477.html
30,当地时间11月1日美国国家航空航天局（NASA）宣布，一直在小行星带灶神星(Vesta)和谷神星(Ceres)轨道上运行的“黎明”号小行星探测器因燃料耗尽而寿终正寝。,NASA宣布小行星探测器黎明号因燃料耗尽而退役,13:05,http://m.tmtpost.com/nictation/3566451.html
31,,FF签约美国投行寻求新投资方，但融资仍需过恒大这一关,12:51,http://m.tmtpost.com/nictation/3566436.html
32,WhatsApp副总裁丹尼斯（ Chris Daniels）日前证实，公司将会在WhatsApp聊天工具的“动态”（Status）板块中显示广告内容。,聊天工具WhatsApp将首次卖广告,12:45,http://m.tmtpost.com/nictation/3566428.html
33,饿了么正式在其天猫旗舰店开售电子消费券，消费者可以购买包括星巴克、肯德基、五芳斋在内的多种商品消费券，并在3天到180天不等的时间里随意消费。,饿了么正式在其天猫旗舰店开售电子消费券,12:39,http://m.tmtpost.com/nictation/3566422.html
34,,必胜客与丰田推出路上制作外卖，送到时刚好制作完成,12:09,http://m.tmtpost.com/nictation/3566382.html
35,Paypal联合创始人、著名投资人彼得・蒂尔日前谈到，他认为硅谷在走下坡路，并且将来不会再有更多具有突破性的消费互联网公司出现。,PayPal联合创始人彼得・蒂尔：硅谷在走下坡路,12:06,http://m.tmtpost.com/nictation/3566378.html
36,英特尔人工智能产品事业部副总裁兼首席运营官Remi El-Ouazzane宣布了与腾讯优图实验室合作开发的人工智能（AI）新成果：腾讯优图AI摄像机以及优图AI盒子。,英特尔与腾讯优图合作推出AI摄像机、AI盒子,12:00,http://m.tmtpost.com/nictation/3566371.html
37,电商SaaS ERP服务商聚水潭宣布完成2.5亿人民币B及B+轮融资，由蓝湖资本和元Z资本联合领投，嘉海基金跟投。,聚水潭完成B轮和B+轮共2.5亿元融资,11:42,http://m.tmtpost.com/nictation/3566342.html
38,［原文链接］,宜家增长放缓，投资中国市场超160亿布局多渠道零售,11:40,http://m.tmtpost.com/nictation/3566339.html
39,,当当李国庆：未来文创产业要与区块链结合,11:35,http://m.tmtpost.com/nictation/3566332.html
40,Zume正在通过软银愿景基金筹集新一轮的主要资金，这笔交易预计将为这家披萨外卖和食品物流初创公司带来约22.5亿美元的价值。,传软银3.75亿美元投资食品初创企业Zume，估值22.5亿,11:23,http://m.tmtpost.com/nictation/3566316.html
41,国际数据公司（IDC）初步数据显示，第三季度智能手机出货量总计3.552亿部，同比下降6%。这是连续第四个季度同比下降，引发了人们对智能手机市场未来的疑虑。,IDC第三季手机出货量：三星大跌，华为小米增长迅猛,11:05,http://m.tmtpost.com/nictation/3566284.html
42,,日本明年将对Google、苹果等科技巨头展开反垄断调查,10:41,http://m.tmtpost.com/nictation/3566240.html
43,,内地首辆自动驾驶出租车在广州试运营,10:26,http://m.tmtpost.com/nictation/3566211.html
44,,法拉第未来签约投行斯提夫尔，加速推进全球融资,10:22,http://m.tmtpost.com/nictation/3566203.html
45,盟科医药宣布其自主研发的“超级抗生素”MRX-4（contezolid acefosamil）获得国家药品监督管理局颁发的药物临床试验批件，将启动中国的一期临床试验。,盟科医药“超级抗生素”MRX-4临床试验获NMPA批准,10:09,http://m.tmtpost.com/nictation/3566185.html
46,,欧盟打算在边境启用人工智能测谎，目前预计准确率只有85%,09:40,http://m.tmtpost.com/nictation/3566133.html
47,法拉第未来（Faraday Future）周四表示，公司正在考虑采取战略性措施，包括债务以及资本融资。,ff考虑“战略性措施”：包括债务和资本融资,09:35,http://m.tmtpost.com/nictation/3566126.html
48,“我们将很快获得盈利。”Tsuga说道，但拒绝给出明确期限。“一旦我们完成现在的计划，盈利是毋庸置疑的。”,松下称与特斯拉合作运营的大型美国电池工厂即将获得盈利,09:27,http://m.tmtpost.com/nictation/3566114.html
49,出狱后鲜有消息的王欣今日在在行开号。用户只要支付一小笔费用，就有机会与他约见。据该平台上的资料介绍，他将与大家分享他最近几年关于产品与技术的思考等相关话题。,快播王欣当“创业导师”：希望帮助更多年轻人完成梦想,09:18,http://m.tmtpost.com/nictation/3566101.html
50,此前，融创房地产（融创中国间接全资附属公司）向法院申请对乐视控股进行强制执行，执行标的额为7.9亿元，日前已经终结执行程序。根据法院裁定，融创已追回欠款约5.3亿元。,孙宏斌用29万元诉讼费讨回贾跃亭5.3亿元欠款,09:14,http://m.tmtpost.com/nictation/3566088.html
51,在调解小组提议赔偿后，三星电子周四称公司将向其芯片与显示屏工厂内患有严重职业病的前员工和现员工予以赔偿。,纠缠10年三星终于制定职业病赔偿标准，一人13万美元,08:53,http://m.tmtpost.com/nictation/3566061.html
52,,微软首席会计长出售了价值215万美元的公司股票,08:45,http://m.tmtpost.com/nictation/3566052.html
53,为了留住优质司机，Uber正在制定一项计划，将为司机提供额外薪资以及亚利桑那州立大学的在线教育，受欢迎且订单量最高的司机可获得机会。,为留优质司机，Uber计划给予额外补贴及上大学机会,08:40,http://m.tmtpost.com/nictation/3566044.html
54,据自媒体“独角兽早知道”消息，团车网将于11月20日登陆纳斯达克，11月8日开始路演。据悉，团车网Pre-IPO轮融资金额达到7亿美金。,传团车网11月20日登录发斯达克，Pre-IPO轮融资7亿美金,08:23,http://m.tmtpost.com/nictation/3566029.html
55,在苹果发布财报之后的电话会议上，公司宣布将停止报告iPhone、iPad和Mac的下一季度单位销售额。,苹果下季度将停止报告iPhone等设备的具体销量,07:49,http://m.tmtpost.com/nictation/3565991.html
56,智能穿戴设备制造商Fitbit（FIT）涨超30%。在周三公布财报后，该公司表示，其智能手表销量三季度大幅增长，占总收入的49%，而上年同期不到10%。,周三公布财报后，智能穿戴设备制造商Fitbit涨超30%,07:48,http://m.tmtpost.com/nictation/3565989.html
57,在土耳其对美国进口产品实施高额关税后，特斯拉已经停止了所有在土耳其的订单，并取消在土耳其开设门店的计划。,受土耳其高额关税影响，特斯拉取消在土耳其开店计划,07:43,http://m.tmtpost.com/nictation/3565983.html
58,星巴克在美股市场周四收盘后公布了该公司的2018财年第四季度及全年财报。这份财报显示星巴克第四季度调整后每股收益超出预期，从而推动其盘后股价大涨近8%。,星巴克Q4每股收益及营收超出预期，盘后大涨近8%,07:37,http://m.tmtpost.com/nictation/3565974.html
59,苹果于周四美股盘后发布2018财年第四季度财务业绩，EPS 2.91美元，市场预期2.78美元。第四财季营收同比增长20%至629亿美元，市场预期614.4亿美元。,苹果Q4盈利营收均超市场预期，盘后股价跌超7%,07:24,http://m.tmtpost.com/nictation/3565958.html
