,brief,classes_name,header,news_url,pubtime,savetime
142,湖北咸宁有人成立生猪屠宰公司，拉拢社会闲杂人员成立“地下稽查队”，使用打砸等暴力手段阻止外部猪肉进入咸宁市区集贸市场，垄断猪肉供应。,澎湃新闻,《平凡的世界》出版30周年，路遥的理想主义色彩与浪漫主义,https://www.thepaper.cn/newsDetail_forward_2541142,5小时前,2018-10-18 20:30:37
143,“路遥对世界的理解和呈现就是他要坚持的现实主义，这种现实主义就是文艺复兴以来确定的人本主义精神――人有自由选择的权利、自由选择的能力以及承担选择后果的能力。”,澎湃新闻,视频|南京大屠杀幸存者照片墙的灯，又暗两盏,https://www.thepaper.cn/newsDetail_forward_2541177,5小时前,2018-10-18 20:30:38
144,10月18日，江苏南京。侵华日军南京大屠杀遇难同胞纪念馆内举行熄灯仪式，张兰英与沈淑静老人的照片灯光暗了下来。据悉今年已有17位幸存者离开我们，照片墙越来越暗。,澎湃新闻,视频|轿车超车失败惹怒保时捷，被5次别车,https://www.thepaper.cn/newsDetail_forward_2541172,5小时前,2018-10-18 20:30:38
145,10月16日，广东东莞。网友称，其驾车正常行驶遭一保时捷2分钟内5次别车。网友质疑，其驾车时超车失败惹怒旁边的保时捷。知情人士告诉澎湃新闻，交警已介入调查。,澎湃新闻,中国恒天集团董事长张杰涉嫌严重违纪违法，正接受审查调查,https://www.thepaper.cn/newsDetail_forward_2541203,5小时前,2018-10-18 20:30:38
146,据中央纪委国家监委驻国资委纪检监察组、北京市纪委监委消息：中国恒天集团有限公司党委书记、董事长张杰涉嫌严重违纪违法，目前正接受纪律审查和监察调查。,澎湃新闻,沪指跌穿2500点！创近4年新低，中字头个股全线杀跌,https://www.thepaper.cn/newsDetail_forward_2541160,5小时前,2018-10-18 20:30:38
147,10月18日，A股再现暴跌，三大股指均收跌逾2%。其中，上证综指失守2500点，跌幅2.94%，以2486.42点报收。,澎湃新闻,江苏启东新城吾悦项目被曝楼板裂缝等问题，检测称整改可达标,https://www.thepaper.cn/newsDetail_forward_2540192,5小时前,2018-10-18 20:30:38
148,新城控股表示，上述问题是因项目管理团队质量管控不严，施工质量不过关所致，而发现问题后，项目团队又未能及时、有效进行整改。事发后，该公司已免除项目负责人职务。,澎湃新闻,城事｜暴雪“速冻”新疆：我在西北的寒夜里大雪纷飞,https://www.thepaper.cn/newsDetail_forward_2541027,5小时前,2018-10-18 20:30:38
149,10月17日起，裹挟着风雪的较强冷空气“速冻”新疆大部地区。暴雪致乌鲁木齐市区多条道路拥堵，10余条输电线路中断，截至目前乌鲁木齐国际机场延误航班35班次。,澎湃新闻,成都天府国际机场可无缝换乘高铁、地铁等交通，还有内部捷运,https://www.thepaper.cn/newsDetail_forward_2540940,5小时前,2018-10-18 20:30:38
150,天府国际机场内部设计曝光，2020年成都人这样“赶飞机”！,澎湃新闻,长江委布置河湖采砂专项整治行动督查工作，将派出7个工作组,https://www.thepaper.cn/newsDetail_forward_2541163,5小时前,2018-10-18 20:30:38
151,长江流域河湖采砂专项整治行动督查工作计划于10月下旬展开，共派出7个工作组，分赴流域13个省（市、自治区），对长江流域除干流以外的部分河湖开展督导检查。,澎湃新闻,贵州桥新突破：六威高速李子沟特大桥双幅贯通,https://www.thepaper.cn/newsDetail_forward_2540951,5小时前,2018-10-18 20:30:38
152,李子沟特大桥自2015年12月20日开展施工以来，历经1032个日夜，克服了诸多困难，最终实现“安全零事故”合龙。由于恶劣天气影响，项目有效施工时间仅为20个月,澎湃新闻,美国4家公共基金提议免去扎克伯格脸书董事会主席职务,https://www.thepaper.cn/newsDetail_forward_2540991,5小时前,2018-10-18 20:30:38
153,包括纽约市养老基金在内的4支美国公共基金加入了要求免除CEO马克・扎克伯格（Mark Zuckerberg）公司董事会主席职务的提议。,澎湃新闻,台湾一男子因养狗发生冲突朝对方泼油漆，第二天被刺死,https://www.thepaper.cn/newsDetail_forward_2541095,5小时前,2018-10-18 20:30:38
154,台湾新北市三重区1名周姓男子17日晚间疑似因养狗问题与别人发生口角，并朝对方泼油漆，引发对方不满。18日早晨，周某在街上遭人以剪刀刺伤，被紧急送医仍宣告不治。,澎湃新闻,实至名归，梵净山旅游区拟确定为5A级旅游景区,https://www.thepaper.cn/newsDetail_forward_2540947,5小时前,2018-10-18 20:30:39
155,梵净山位于贵州省东北部的铜仁地区，海拔2572米，系武陵山脉主峰、国家级自然保护区、联合国“人与生物圈”保护网成员。总面积567平方公里。,澎湃新闻,研究：2040中国人均预期寿命或超80岁，西班牙人最长寿,https://www.thepaper.cn/newsDetail_forward_2540634,5小时前,2018-10-18 20:30:39
156,包括中国在内的59个国家和地区的人均预期寿命有望超过80岁;西班牙、日本、新加坡、瑞士男性和女性的人均预期寿命均有望超过85岁。,澎湃新闻,广西一医生疑指使产检报告做假：医院声明误会，患者方不接受,https://www.thepaper.cn/newsDetail_forward_2541056,5小时前,2018-10-18 20:30:39
157,柳州市一孕妇在进行B超复查时，还没开始做检查，就有医院工作人员在排号条上写下“报羊水少”。患者及家属发现后，质疑该院医生指使做假B超报告。,澎湃新闻,蚌埠市卫计委原副主任赵春淮今日受审，收受财物近1200万,https://www.thepaper.cn/newsDetail_forward_2541026,5小时前,2018-10-18 20:30:39
158,公诉机关认为，被告人赵春淮身为国家工作人员，利用职务上的便利，为他人谋取利益，非法收受他人财物，数额特别巨大。此外，其个人财产和支出明显超过合法收入。,澎湃新闻,联合国发布重磅报告：全球极端天气或将更频繁出现,https://www.thepaper.cn/newsDetail_forward_2541032,5小时前,2018-10-18 20:30:39
159,近日，联合国发布了最新的气候报告，称如果再不做出必要的努力，极端天气将在全球范围内更频繁地出现。,澎湃新闻,马上评｜“锦鲤”最近很忙，但骗子也没闲着,https://www.thepaper.cn/newsDetail_forward_2541028,5小时前,2018-10-18 20:30:39
160,送车、送手机、送现金，你抱着天选之子的美梦转发这条锦鲤，等来的可能不是天降福利，而是被营销号和骗子围猎。,澎湃新闻,郑州一小学要求家长轮流在校门口执勤，学校称家长自愿,https://www.thepaper.cn/newsDetail_forward_2540565,6小时前,2018-10-18 20:30:39
161,近日，郑州大学实验小学一名学生的母亲向河南商报记者反映，学校给每位家长排出值班表，要求家长轮流去位于高新区的学校门口执勤，这样的安排让他们“喘不过气”。,澎湃新闻,《崇明成陆1400年记碑》书写者刘小晴谈书法入门,https://www.thepaper.cn/newsDetail_forward_2537204,6小时前,2018-10-18 20:30:39
