,brief,classes_name,header,news_url,pubtime,savetime
72,今日（10月18日）起，滴滴平台将增加并试行以下四项安全保护功能和措施。,澎湃新闻,融合与隔离：一个犹太女孩眼中的30年代上海法租界,https://www.thepaper.cn/newsDetail_forward_2537503,2小时前,2018-10-18 20:30:31
73,当我长到十几岁的时候，我也成了和黄包车夫砍价的高手，但我从来没有想过，我拒绝额外付出的那几个铜板，他们原本可以用来多买些蔬菜，或者给碗里增加几块豆腐。,澎湃新闻,与白血病斗争的十八年里，我结婚生子，重获新生,https://www.thepaper.cn/newsDetail_forward_2540981,2小时前,2018-10-18 20:30:32
74,我已经被几个医生宣判死刑，家里也债台高筑。我不知道父亲靠什么支撑下来，又有什么底气一次又一次往医院砸钱。,澎湃新闻,司机喊冤：喷完玻璃水后酒测数值爆表,https://www.thepaper.cn/newsDetail_forward_2541293,2小时前,2018-10-18 20:30:32
75,10月15日，湖北襄阳。明明靠近车辆就有一股酒味，酒测数值爆表，司机却表示自己未饮酒。民警排查发现，使用车主的玻璃水后，快测棒立刻报警。,澎湃新闻,株洲县回应“女教师让迟到女生罚站被带到派出所”：纪委介入,https://www.thepaper.cn/newsDetail_forward_2541541,2小时前,2018-10-18 20:30:32
76,针对网传的“小学女教师因罚站迟到学生，被家长报警后带入派出所调查7小时”一事，湖南株洲市株洲县委宣传部相关负责人称，情况基本属实，目前当地纪委已介入调查。,澎湃新闻,沙特记者失踪案15名“疑凶”之一因“可疑车祸”丧生,https://www.thepaper.cn/newsDetail_forward_2541797,2小时前,2018-10-18 20:30:32
77,据土耳其自由报每日新闻网报道，沙特记者失踪案中的一名嫌疑人博斯塔尼（Mashal Saad al-Bostani）在沙特首都利雅得的一场“可疑车祸”中丧生。,澎湃新闻,中国青花瓷赴陆上“丝路”古国乌兹别克斯坦展出,https://www.thepaper.cn/newsDetail_forward_2541141,2小时前,2018-10-18 20:30:32
78,10月15日塔什干当地时间下午3时，由上海博物馆、上海科技馆共同策划的“青出于蓝――青花瓷的起源、发展与交流”特展在塔什干的国家历史博物馆拉开帷幕。,澎湃新闻,抖音用户烹煮保护动物被罚：自己买的鱼,https://www.thepaper.cn/newsDetail_forward_2541698,2小时前,2018-10-18 20:30:32
79,10月18日青海西宁。省渔政管理总站人员告诉澎湃新闻，烹煮湟鱼（省保护动物）的抖音发布者被找到、非高校教师，已对其处罚。16日，违法者指认现场承认购买烹煮湟鱼。,澎湃新闻,新华人寿因欺骗投保人、编制提供虚假资料等行为被罚110万,https://www.thepaper.cn/newsDetail_forward_2541694,3小时前,2018-10-18 20:30:32
80,银保监会网站披露的罚单显示，新华人寿存在欺骗投保人、编制提供虚假资料、未按照规定使用经批准或者备案的保险费率等违法行为，合计被罚110万元。,澎湃新闻,"问吧精选 | 古代王朝那么多，为何明朝的皇帝多""奇葩""？",https://www.thepaper.cn/newsDetail_forward_2541047,3小时前,2018-10-18 20:30:32
81,有些人觉得明代的历史充满了专制独裁，有些人却认为，明代的历史洋溢着开放文明。来问吧，一起聊聊明朝那些事儿！,澎湃新闻,“隐形巨头”启示录：知识产权能保护原创互联网科技公司吗？,https://www.thepaper.cn/newsDetail_forward_2541320,3小时前,2018-10-18 20:30:32
82,“你可能不知道极验是谁，但你肯定用过我们的产品”，9月，一次抵制抄袭的公开发声，让身处网络安全专业领域不为人知的极验第一次走入公众视野。,澎湃新闻,前三季全国财政支出增7.5%，比序时进度快2.8个百分点,https://www.thepaper.cn/newsDetail_forward_2541622,3小时前,2018-10-18 20:30:32
83,企业所得税、个人所得税同比分别增长12.5%、21.1%，合计拉高全国财政收入增幅4个百分点。工商业增值税、改征增值税同比分别增长9.5%、15.8%,澎湃新闻,9月外汇占款环比骤降1194亿元，创去年1月来最大降幅,https://www.thepaper.cn/newsDetail_forward_2541479,3小时前,2018-10-18 20:30:32
84,中国人民银行10月18日更新的“货币当局资产负债表”显示，9月末央行口径外汇占款余额为214084.15亿元，较8月环比骤减1193.95亿元。,澎湃新闻,钱塘江漩涡究竟是怎么形成的？请看专家为你图解,https://www.thepaper.cn/newsDetail_forward_2541496,3小时前,2018-10-18 20:30:32
85,专家解释说，“漩涡”的形成与杭州钱塘江底下的地质有一定关系：地铁盾构在地底下掘进过程中，刀片与土壤会发生摩擦，推进过程中，对江底下的土层来说，是一种挤压的过程。,澎湃新闻,盒马回应“用烂苹果榨汁”：下架系列饮品，已购买者可退款,https://www.thepaper.cn/newsDetail_forward_2541477,3小时前,2018-10-18 20:30:33
86,记者获悉，盒马鲜生已于16日通知全国门店下架“清谷田园”系列的饮品。此前，有媒体报道，有企业用腐烂的落地苹果榨果汁。,澎湃新闻,秦洪看盘｜惯性力量会放大短线做空氛围，市场进入最紧张时期,https://www.thepaper.cn/newsDetail_forward_2541435,3小时前,2018-10-18 20:30:33
87,短线来说，惯性力量会放大短线做空氛围，从而使得短线仍有调整空间。与此同时，盘面也显示补跌的蓝筹股范围还在拓展中，这就意味着短线的调整压力源泉尚待进一步释放。,澎湃新闻,司马义・艾买提同志遗体送别在京举行,https://www.thepaper.cn/newsDetail_forward_2541608,3小时前,2018-10-18 20:30:33
88,中国人民政治协商会议第七届全国委员会副主席，原国务委员，第十届全国人民代表大会常务委员会副委员长司马义・艾买提同志遗体送别18日在北京八宝山革命公墓举行。,澎湃新闻,中石化汽油颜色像是半成品？中石化回应：成品油颜色无关质量,https://www.thepaper.cn/newsDetail_forward_2541491,3小时前,2018-10-18 20:30:33
89,小石头看到一个视频：两个男子从德国产汽车中抽出汽油，又到中石化加油站，加了汽油把两者一对比于是他们说：从颜色上可见，中石化的汽油就像没有加工好的半成品一样。,澎湃新闻,上海报业集团与国泰君安证券达成战略合作,https://www.thepaper.cn/newsDetail_forward_2541585,3小时前,2018-10-18 20:30:33
90,10月18日，上海报业集团与国泰君安证券股份有限公司正式签署战略合作协议，希望进一步发挥各自优势，创新产品和服务，加速推进上海文化金融深度合作。,澎湃新闻,视频|东京街头现浣熊，警察消防员齐上阵,https://www.thepaper.cn/newsDetail_forward_2541584,3小时前,2018-10-18 20:30:33
91,当地时间10月17日，日本东京市中心出现一只浣熊。当地警方和消防员随后出动抓捕，在经过2小时的“斗智斗勇”后，这只浣熊才终于“落网”。,澎湃新闻,一款系统提升球员30%表现，中国足球要靠AI想办法了？,https://www.thepaper.cn/newsDetail_forward_2521978,3小时前,2018-10-18 20:30:33
92,IntelliGym系统的球员已超过35000名，年龄覆盖青训少年到职业运动员。而据公司首席执行官丹尼・当肯纳介绍，它可将球员在场上的表现提高20％-40％。,澎湃新闻,黄河滩区秋收季：89岁老人步行数里捡豆子，给重孙做豆浆,https://www.thepaper.cn/newsDetail_forward_2540873,3小时前,2018-10-18 20:30:33
93,黄河滩区又到了一年一度的秋收季节，田里的庄稼收完以后，就会有很多附近乡村的群众到田里捡落下的粮食，在当地称之为“拾秋”。,澎湃新闻,“城市看海”终结者，带你看懂海绵城市策略,https://www.thepaper.cn/newsDetail_forward_2540549,3小时前,2018-10-18 20:30:33
94,2010年以来，我国平均每年有185座城市受到城市内涝的威胁。为了解决城市内涝问题，2015年我国提出了建设“海绵城市”。那么，什么是“海绵城市”呢？,澎湃新闻,施一公谈为学之道：科学家往往需要独立人格和一点点脾气,https://www.thepaper.cn/newsDetail_forward_2541391,3小时前,2018-10-18 20:30:33
95,“要想在科学研究上取得突破和成功，只有时间的付出和刻苦，是不够的。批判性分析（critical analysis）是必须具备的一种素质。”,澎湃新闻,美国退群万国邮政联盟如何影响跨境电商：廉价商品卖家最受伤,https://www.thepaper.cn/newsDetail_forward_2541198,3小时前,2018-10-18 20:30:33
96,10月18日，跨境电商业内人士告诉澎湃新闻记者，这一举措将让很多出口美国的跨境电商中小卖家很受伤，如果美国确定退出，以后直邮寄往美国的包裹运输成本将大大增加。,澎湃新闻,美退出万国邮政联盟，外交部：感到遗憾，没必要拿中国说事,https://www.thepaper.cn/newsDetail_forward_2541389,3小时前,2018-10-18 20:30:33
97,中国外交部发言人陆慷在今天（18日）的例行记者会上表示，美国近来做出了不是一个两个退群的决定，美方有自己的考虑，但没有必要拿中国说事。,澎湃新闻,比尔・盖茨发文悼念保罗・艾伦：没有保罗，微软就不可能创立,https://www.thepaper.cn/newsDetail_forward_2541312,3小时前,2018-10-18 20:30:34
98,比尔・盖茨（Bill Gates）10月16日在其博客发文，纪念10月15日去世的保罗・艾伦（Paul Allen），并称：“如果没有保罗，微软就不可能创立。”,澎湃新闻,东方园林回应北京证监局请23名债权人暂不强平：预防性措施,https://www.thepaper.cn/newsDetail_forward_2541328,3小时前,2018-10-18 20:30:34
99,在市场质疑存在质押风险后，东方园林（002310）回应称，目前公司债务及现金流状况都在可控范围之内，质押股权目前没有平仓风险。,澎湃新闻,汇丰回应欲尝鲜沪伦通实现在华上市：正在研究相关政策,https://www.thepaper.cn/newsDetail_forward_2541345,3小时前,2018-10-18 20:30:34
100,沪伦通开通越来越近，汇丰控股有望尝鲜在上交所发行中国存托凭证，汇丰表示，正在研究沪伦通项下中国存托凭证发行的相关规定。,澎湃新闻,视频|巴西劫匪抢劫彩票店，还用25人当肉盾,https://www.thepaper.cn/newsDetail_forward_2541385,3小时前,2018-10-18 20:30:34
101,当地时间10月13日，巴西马瑙斯市，5名劫匪抢劫彩票店并用25名人质做人盾，逼退围攻警察。当地警方诱劫匪到陷进时，双方交火，4名劫匪被击毙，1人被捕，人质安全。,澎湃新闻,OCT-LOFT爵士节・节中节（下）：真正的即兴就像流水,https://www.thepaper.cn/newsDetail_forward_2541259,3小时前,2018-10-18 20:30:34
102,真正自由的即兴难以描述，因为身临其境的亦会遗忘，就像流水。但即兴中蕴藏的生命活力已经注入在场每一位的身体里，变成身体的记忆，永远不会被剥夺。,澎湃新闻,视频|潍坊西红柿“劫后余生”，价格翻四倍,https://www.thepaper.cn/newsDetail_forward_2541298,3小时前,2018-10-18 20:30:34
103,近日，山东潍坊，在前段时间的洪涝中，不少大棚都进了水，延迟了种植时间，近期尚家庄村的西红柿快要收获了，收购价在一块多的西红柿如今攀升到四块多一斤，依旧一果难求。,澎湃新闻,半月谈微评：对暴力伤医者不能有丝毫退让，必须零容忍,https://www.thepaper.cn/newsDetail_forward_2541110,3小时前,2018-10-18 20:30:34
104,医疗是全民刚需，无端殴打医生不仅缺德，更是对全体人民医疗资源的无情践踏。对暴力伤医者不能有丝毫退让，必须零容忍。,澎湃新闻,陕西贫困人口6年减少591万余，4个贫困县（区）脱贫摘帽,https://www.thepaper.cn/newsDetail_forward_2541200,3小时前,2018-10-18 20:30:34
105,陕西省建立了逐年增长的财政资金保障机制，今年已安排资金达30亿元，重点向深度贫困地区倾斜。全省各级共新增帮扶干部6075人。,澎湃新闻,美未将中国列为“汇率操纵国”，中方：符合常识与国际共识,https://www.thepaper.cn/newsDetail_forward_2541327,3小时前,2018-10-18 20:30:34
106,陆康：中国将坚定不移地深化汇率市场化改革，继续完善以市场供求为基础、参考一篮子货币进行调节、有管理的浮动汇率制度，保持人民币汇率在合理均衡水平上的基本稳定。,澎湃新闻,武汉市民防办原主任徐秋成被开除党籍：违规提拔领导干部子女,https://www.thepaper.cn/newsDetail_forward_2541272,3小时前,2018-10-18 20:30:34
107,18日，湖北省纪委监委网站发布消息，武汉市纪委监委对武汉市民防办公室原主任徐秋成、原副主任盛英友，原巡视员袁为民（已退休）严重违纪违法问题进行审查调查。,澎湃新闻,美国知名学者约瑟夫・奈：美中关系长远看合作是大势所趋,https://www.thepaper.cn/newsDetail_forward_2541291,4小时前,2018-10-18 20:30:34
108,曾出任卡特政府助理国务卿、克林顿政府国家情报委员会主席和助理国防部长的约瑟夫・奈指出，“我不认为美国和中国对彼此构成生存威胁，我们都可以从合作中获益良多”。,澎湃新闻,八旬老太保外就医被拒，其女：狱方称诊断结论不符办理规定,https://www.thepaper.cn/newsDetail_forward_2541271,4小时前,2018-10-18 20:30:34
109,今日上午，河北省女子监狱电话告知关桂侠，狱方委托河北省人民医院于10月10日出具了李淑贤的病情诊断书，狱方认为诊断结论不符合办理保外就医的相关规定。,澎湃新闻,海南：特别关注有无将红领巾及其名义用于商标、广告活动,https://www.thepaper.cn/newsDetail_forward_2541260,4小时前,2018-10-18 20:30:35
110,要特别关注有无将红领巾及其名义用于商标、商业广告以及商业活动。核查各类“进校园”活动是否有夹带商业活动等问题，坚决杜绝任何商业行为侵蚀校园。,澎湃新闻,中国使领馆：旅美中国公民注意美边境执法部门查验电子设备,https://www.thepaper.cn/newsDetail_forward_2541354,4小时前,2018-10-18 20:30:35
111,今年以来，中国驻美使领馆接到多名赴美中国公民反映，在入美境时所携手机、电脑等个人电子设备被美边境海关执法人员检查。,澎湃新闻,江苏一团伙非法拆卸废电池损害环境，治理成本需2000万,https://www.thepaper.cn/newsDetail_forward_2541195,4小时前,2018-10-18 20:30:35
112,该案涉案金额超亿元，被告人非法牟利1000多万元。经权威机构鉴定，犯罪造成的生态损害治理成本需要2000万元。,澎湃新闻,广西大藤峡水利枢纽工程有望2019年实现大江截流,https://www.thepaper.cn/newsDetail_forward_2541236,4小时前,2018-10-18 20:30:35
113,广西大藤峡水利枢纽有望在2019年11月实现大江截流目标。工程建成后将在珠江流域防洪、促进沿江经济发展等方面发挥重要作用。,澎湃新闻,因散布非洲猪瘟不实消息，辽宁营口一男子被拘留,https://www.thepaper.cn/newsDetail_forward_2541245,4小时前,2018-10-18 20:30:35
114,刘某涉嫌“散布谣言，谎报险情、疫情、警情或者以其他方法故意扰乱公共秩序”，被处以行政拘留十日的处罚。,澎湃新闻,王瑞连同志任湖北省委常委、省委组织部部长,https://www.thepaper.cn/newsDetail_forward_2541308,4小时前,2018-10-18 20:30:35
115,近日，中共中央批准：王瑞连同志任湖北省委委员、常委。经湖北省委研究决定，王瑞连同志任湖北省委组织部部长。,澎湃新闻,新疆多地出现暴雪：当地气象部门连续两天共发布六种预警,https://www.thepaper.cn/newsDetail_forward_2541058,4小时前,2018-10-18 20:30:35
116,从昨天到今天，新疆气象部门连续两天，共发布了六种预警：有沙尘暴黄色预警、大风蓝色预警、寒潮蓝色预警、暴雪蓝色预警、霜冻蓝色预警和道路结冰黄色预警。,澎湃新闻,AA制自驾游出事故，驾驶人赔乘车人24万,https://www.thepaper.cn/newsDetail_forward_2541246,4小时前,2018-10-18 20:30:35
117,以“AA制”的方式结伴自驾出游，不料途中发生事故，致乘车人受伤构成十级伤残。今天，通州法院对该案作出一审判决，判令驾驶人赔偿伤者各项损失共计24万余元。,澎湃新闻,西藏那曲市双湖县发生4.8级地震，震源深度18千米,https://www.thepaper.cn/newsDetail_forward_2541307,4小时前,2018-10-18 20:30:35
118,中国地震台网正式测定：10月18日15时52分在西藏那曲市双湖县（北纬33.48度，东经89.18度）发生4.8级地震，震源深度18千米。,澎湃新闻,泰洞穴救援事件将拍成电影，足球队将获150万美元报酬,https://www.thepaper.cn/newsDetail_forward_2541228,4小时前,2018-10-18 20:30:35
119,今年6月底受困洞穴超过两周的泰国少年足球队的事情将被拍成电影。作为电影拍摄的版权费，“野猪”足球队的教练和球员们将获150万美元，这笔钱将平均分给这13人。,澎湃新闻,央视评“妈妈看手机孩子掉下站台”：边走边看手机的病该治了,https://www.thepaper.cn/newsDetail_forward_2541229,4小时前,2018-10-18 20:30:35
120,随着智能手机的普及，边走路边看手机已经成为一个很普遍的社会现象。由于注意力分散，对自己造成伤害的例子实在不在少数。,澎湃新闻,安徽泾县：扬子鳄保护区内停止征地、停止26个建设项目施工,https://www.thepaper.cn/newsDetail_forward_2541107,4小时前,2018-10-18 20:30:36
121,安徽省宣城市泾县对扬子鳄国家级自然保护区核心区已征用的土地暂停开发利用，对其中26个企业建设项目停止施工，并暂缓其他在谈项目和意向入园项目的推进进程或签约。,澎湃新闻,书包谁来背？深圳一校长站校门口制止家长替孩子背书包引热议,https://www.thepaper.cn/newsDetail_forward_2541222,4小时前,2018-10-18 20:30:36
122,这位校长在学校已经工作四年了，家长对他的评价都很高。他教育学生是很经常的事，让孩子自己背书包只是他教育孩子的一种形式，为的就是让孩子学会平等、自主等思想。,澎湃新闻,乌鲁木齐发布暴雪黄色预警，目前城区降雪达12.1毫米以上,https://www.thepaper.cn/newsDetail_forward_2541231,4小时前,2018-10-18 20:30:36
123,乌鲁木齐市18日9时13分发布暴雪黄色预警：目前城区已出现12.1毫米以上的暴雪，预计今天白天降雪仍将持续，对交通运输、农牧业生产有较大影响，建议防范。,澎湃新闻,袁惟仁意外跌倒脑溢血，现已脱离险境,https://www.thepaper.cn/newsDetail_forward_2541192,4小时前,2018-10-18 20:30:36
124,袁惟仁好友邱宽在社交媒体上透露，袁惟仁已经脱离险境，现在只等观察肿瘤状况。“这‘祸害’肯定会活千年无误。”,澎湃新闻,光明网：酒店偷拍泛滥，真没法治了？,https://www.thepaper.cn/newsDetail_forward_2541196,4小时前,2018-10-18 20:30:36
125,在法治成熟的现代社会，涉及广泛民众的问题显然不能只是通过“生活智慧”“防范贴士”来解决，必然要有更为稳固的制度安排。,澎湃新闻,安倍访华拟与中国商量租借大熊猫事宜，日方称场馆已提前找好,https://www.thepaper.cn/newsDetail_forward_2541149,4小时前,2018-10-18 20:30:36
126,日方将向中国提出请求，希望租借新的大熊猫，预计安倍此访将讨论具体租借日程、头数等。日方甚至已经为新熊猫选好了居住地。,澎湃新闻,怕打扰孩子们上课，溧阳一妈妈脱下高跟鞋赤脚跑了四层楼,https://www.thepaper.cn/newsDetail_forward_2541136,4小时前,2018-10-18 20:30:36
127,到学校给儿子送东西，担心高跟鞋走路声音太响影响学生听课，溧阳这位暖心妈妈竟悄悄脱下鞋子，赤脚跑了四层楼。,澎湃新闻,医院傍名牌调查：全国1700家“协和”，有的仅花3万注册,https://www.thepaper.cn/newsDetail_forward_2541104,4小时前,2018-10-18 20:30:36
128,你以为“协和医院”指的就是北京协和医院?记者通过第三方软件检索发现，全国竟有1700多家“协和医院”。“同济”“华山”等知名医院，同样长期遭遇“傍名牌”困扰。,澎湃新闻,国际能源署：今年全球碳排放量将创新高 ，巴黎协定实现困难,https://www.thepaper.cn/newsDetail_forward_2541219,4小时前,2018-10-18 20:30:36
129,2015年12月达成的《巴黎协定》提出，要把全球平均气温较工业化前水平的升高幅度控制在2摄氏度之内，并为把升温控制在1.5摄氏度之内而努力。,澎湃新闻,人民日报批基层检查考核过多：有干部一年200天忙于应对,https://www.thepaper.cn/newsDetail_forward_2541146,4小时前,2018-10-18 20:30:36
130,一些名目繁多、频次过密的督查检查考核，重留痕轻实绩、不问因果就追责问责的做法，成为抓落实过程中形式主义、官僚主义新表现，给基层干部群众带来困扰。,澎湃新闻,河北省人大常委会原副主任张杰辉案开庭：受贿超1.26亿元,https://www.thepaper.cn/newsDetail_forward_2541275,4小时前,2018-10-18 20:30:36
131,直接或者通过特定关系人非法收受相关人员给予的财物，共计折合人民币1.269976765亿元。依法应以受贿罪追究张杰辉的刑事责任。,澎湃新闻,中菲就南海问题举行第三次磋商：推动海上务实合作,https://www.thepaper.cn/newsDetail_forward_2541126,4小时前,2018-10-18 20:30:36
132,中菲南海问题双边磋商机制第三次会议举行，中国外交部副部长孔铉佑与菲律宾外交部副部长马纳罗出席，就政治安全、渔业事务和海洋科研与环保三个领域，寻求进一步合作。,澎湃新闻,西藏疏散撤离雅鲁藏布江堰塞湖受灾群众六千多人，无伤亡报告,https://www.thepaper.cn/newsDetail_forward_2541209,4小时前,2018-10-18 20:30:37
133,雅鲁藏布江西藏林芝米林县加拉村堰塞湖抗灾救灾前线指挥部１８日介绍，堰塞湖险情发生后，截至目前米林县、墨脱县共疏散撤离６０００多受灾人员，无伤亡报告。,澎湃新闻,山东蒙阴：教师月平均工资高出机关事业单位人员1415元,https://www.thepaper.cn/newsDetail_forward_2541185,4小时前,2018-10-18 20:30:37
134,据统计，2014年，蒙阴全县教师平均月工资为3897元。目前，教师平均月工资已经达到8688元，翻了一番还多。蒙阴县教师的工资水平，也已和临沂市区教师工资持平。,澎湃新闻,沙特记者“失踪”事件持续发酵，或将影响中东格局,https://www.thepaper.cn/newsDetail_forward_2541048,4小时前,2018-10-18 20:30:37
135,蓬佩奥的紧急到访说明了美国政府对于这起事件的重视，因为如果处理不好，影响的可能不仅仅是美国和沙特的关系，还可能是美国整个的中东战略，甚至是中东格局的博弈。,澎湃新闻,武汉军运会明年10月举行，35个场馆设施明年4月底前建好,https://www.thepaper.cn/newsDetail_forward_2541105,4小时前,2018-10-18 20:30:37
136,截至目前，35个场馆设施建设项目已有10个基本具备办赛条件、19个建设或改造工程预计今年内完成，其余6个明年4月底前全部完成。,澎湃新闻,贵州男子醉酒后带3岁孩子车流中搭车，被拒后撒泼睡在公路上,https://www.thepaper.cn/newsDetail_forward_2541102,4小时前,2018-10-18 20:30:37
137,一名男子酒后牵着一个3岁左右的小孩在路上摇摇晃晃，差点就摔倒在地。让人意想不到的是，男子竟然带着孩子往马路中间走去拦车。,澎湃新闻,爱尔兰一医院发现超级病菌，8名患者死因与其有关,https://www.thepaper.cn/newsDetail_forward_2541204,4小时前,2018-10-18 20:30:37
138,据爱尔兰《新岛周报》报道，经调查发现，一种名为产碳青霉烯酶肠杆菌(简称CPE)的超级病菌正在爱尔兰利默里克大学医院蔓延，有8名病人的死因与这种病菌有关。,澎湃新闻,上海国际艺术节｜黄豆豆问：怎样才能被招进纽约城市芭蕾舞团,https://www.thepaper.cn/newsDetail_forward_2540881,4小时前,2018-10-18 20:30:37
139,大师谢幕之后，后人如何做到继承并发扬巴兰钦的精神？演出前，舞蹈家黄豆豆与纽约城市芭蕾舞团代理艺术总监乔纳森・斯塔福德就此进行了对谈。,澎湃新闻,党的十九大以来治国理政系列评述“治党篇”：伟大工程启新局,https://www.thepaper.cn/newsDetail_forward_2541111,5小时前,2018-10-18 20:30:37
140,如果说党的十八大以来全面从严治党更多致力于“正本清源”，那么党的十九大后，党的建设新的伟大工程展现出“守正创新”的新气象。,澎湃新闻,北京便利店今后可卖乙类非处方药，市食药监局将出台具体目录,https://www.thepaper.cn/newsDetail_forward_2541043,5小时前,2018-10-18 20:30:37
141,今后北京连锁便利店可按有关标准申请零售乙类非处方药。市食药监局将出台具体药品目录，便利店可售的主要是常用药。,澎湃新闻,咸宁肉霸暴力打砸运肉车辆垄断市场，拉拢多名干部充当保护伞,https://www.thepaper.cn/newsDetail_forward_2541132,5小时前,2018-10-18 20:30:37
