,brief,classes_name,header,news_url,pubtime,savetime
0,习近平指出，文明交流互鉴是人类文明进步和世界和平发展的重要动力。人类始终在不同民族、不同文化的相遇相知中向前发展。,澎湃新闻,习近平向太湖世界文化论坛第五届年会致贺信,https://www.thepaper.cn/newsDetail_forward_2540613,7小时前,2018-10-18 20:30:25
1,党员、干部在干事创业时要不断增强大局意识，识大体、顾大局，这样才能有大作为。,澎湃新闻,人民日报：增强大局意识才有大作为,https://www.thepaper.cn/newsDetail_forward_2541244,4小时前,2018-10-18 20:30:26
2,商务部新闻发言人高峰表示，此次美方挑起的贸易摩擦从总体上看，影响有限，风险可控，主要是对部分外向型企业造成了不同程度的影响。,澎湃新闻,商务部：美方应摒弃贸易保护主义,https://www.thepaper.cn/newsDetail_forward_2542341,1小时前,2018-10-18 20:30:26
3,湖南株洲市株洲县委宣传部和教育局相关负责任人10月18日晚向澎湃新闻证实，带队到学校带走女教师的副所长是被罚站女生的父亲。,澎湃新闻,株洲官方证实：带走罚站女教师的派出所副所长系被罚女生父亲,https://www.thepaper.cn/newsDetail_forward_2542483,20分钟前,2018-10-18 20:30:26
4,中国共产党上海警备区第十三次代表大会10月18日上午闭幕。会议全面总结过去五年工作，部署今后五年目标任务，选举产生新一届警备区党委和纪委。,澎湃新闻,上海警备区新一届党委和纪委选举产生，李强出席并讲话,https://www.thepaper.cn/newsDetail_forward_2542590,23分钟前,2018-10-18 20:30:26
5,10月19日，@济南公安 通报，16日晚，高新区一彩票站发生警情，彩票店老板的丈夫持刀将一男子砍死。目前，犯罪嫌疑人已被警方刑拘。,澎湃新闻,警方通报“济南男子在彩票站被店主丈夫砍死”：嫌犯已被刑拘,https://www.thepaper.cn/newsDetail_forward_2542551,27分钟前,2018-10-18 20:30:26
6,微信群用于工作交流，已经具备了媒体属性，如果使用者尤其是群内的主导者，对平台的媒体属性没有基本认识，仍然以私人聚会的方式对其进行使用，就存在出问题的风险。,澎湃新闻,中国教育报：谨防微信群发酵负面教育舆情,https://www.thepaper.cn/newsDetail_forward_2542395,28分钟前,2018-10-18 20:30:26
7,18日，黑龙江省大气污染防治行动联席会议办公室发布重污染天气预警通知，预计19日至23日，哈大绥齐等多地，将发生中度至重度污染。,澎湃新闻,黑龙江重污染天气预警：19日至23日多地中度至重度污染,https://www.thepaper.cn/newsDetail_forward_2541808,30分钟前,2018-10-18 20:30:26
8,统计显示，近年来，高龄妈妈的比率明显增加，生育能力的下降将会导致出生缺陷发生率进一步增高。儿童期的发育和代谢异常将会直接造成成年期慢性疾病的易感和高发。,澎湃新闻,上海交大医学院成立生命早期健康研究院，委托新华医院管理,https://www.thepaper.cn/newsDetail_forward_2541469,30分钟前,2018-10-18 20:30:26
9,韩国总统文在寅当地时间18日在罗马教廷拜访教皇方济各，并进行了38分钟的会谈，期间文在寅向教皇转达了朝鲜国务委员会委员长金正恩邀请访朝的口信。,澎湃新闻,文在寅拜访教皇转达金正恩邀访，教皇：如果正式邀请函会访朝,https://www.thepaper.cn/newsDetail_forward_2542508,30分钟前,2018-10-18 20:30:26
10,在连续跌停之后，康美药业公告称，控股股东的一致行动人许冬瑾，基于对康美药业未来发展前景的信心以及内在价值的认可，拟在6个月内以5亿元-10亿元增持。,澎湃新闻,康美药业：控股股东的一致行动人拟半年内增持5亿-10亿元,https://www.thepaper.cn/newsDetail_forward_2542509,31分钟前,2018-10-18 20:30:26
11,有报道称近日美军两架B-52轰炸机在南海执行训练任务，外交部发言人陆慷表示，注意到有关报道，正在进一步核实具体情况。,澎湃新闻,报道称美B-52轰炸机在南海执行训练任务，我外交部回应,https://www.thepaper.cn/newsDetail_forward_2542469,31分钟前,2018-10-18 20:30:26
12,近期，美国领导人指责中国舰船逼近美国“迪凯特”号驱逐舰，摆出一副受了惊吓的委屈样。在南海问题上，过去几年，美国使尽各路招数，但不外乎三种套路。,澎湃新闻,新华社：美国在南海问题上兴风作浪，不外乎三种套路,https://www.thepaper.cn/newsDetail_forward_2542488,33分钟前,2018-10-18 20:30:26
13,韩正表示，习近平总书记高度重视北方地区冬季清洁取暖，强调这项工作关系广大人民群众生活，是重大的民生工程、民心工程。,澎湃新闻,韩正：积极推进北方地区冬季清洁取暖，持续改善大气环境质量,https://www.thepaper.cn/newsDetail_forward_2542543,33分钟前,2018-10-18 20:30:27
14,10月18日，正在上海访问的挪威国王哈拉尔五世、王后宋雅与马云一同参加了两场活动，讨论的话题都围绕海洋。,澎湃新闻,马云对话挪威国王王后：除了引进三文鱼，更要联手保护海洋,https://www.thepaper.cn/newsDetail_forward_2542301,35分钟前,2018-10-18 20:30:27
15,10月16日至17日，全国扫黑除恶专项斗争推进会在湖北武汉召开。,澎湃新闻,一图读懂｜全国扫黑除恶推进会核心内容,https://www.thepaper.cn/newsDetail_forward_2542460,43分钟前,2018-10-18 20:30:27
16,今天下午2点左右，郑州一3岁男童坠入郑州市航空港区河头陈村一废弃井内。据现场记者最新消息，港区坠井孩子已经确定身亡。,澎湃新闻,郑州航空港区一3岁男孩掉进弃井，被救出送医抢救时身亡,https://www.thepaper.cn/newsDetail_forward_2542319,44分钟前,2018-10-18 20:30:27
17,位于合肥经开区的永红幼教报业园幼儿园出现孩子集体呕吐现象，初步判断为感染诺如病毒。目前，该校已通知全体家长来幼儿园将孩子全部接走。,澎湃新闻,合肥一幼儿园学生集体呕吐：初判系感染“诺如”病毒，已停课,https://www.thepaper.cn/newsDetail_forward_2542239,45分钟前,2018-10-18 20:30:27
18,近日，新西兰反对党领袖因隐瞒接受中国商人的政治献金受到抨击。对此，外交部回应，中方无意、也从来没有意图去干涉其他国家内政。,澎湃新闻,新西兰反对党领袖隐瞒收中国商人政治献金被抨击，外交部回应,https://www.thepaper.cn/newsDetail_forward_2542396,47分钟前,2018-10-18 20:30:27
19,据悉，美国防长马蒂斯今日将在新加坡与中国国防部长魏凤和举行会晤。外交部发言人陆慷表示，中美双方在各个领域保持着沟通与对话。,澎湃新闻,中美防长将在新加坡会晤，外交部：中美在各领域保持沟通对话,https://www.thepaper.cn/newsDetail_forward_2542438,48分钟前,2018-10-18 20:30:27
20,翟先生现在非常担心女儿，那么医院为什么会注射“过期”疫苗呢？郑大五附院给出的回应是写错了。在调查过程中，院方主动承认，疫苗批号写错的问题自查的结果为90例。,澎湃新闻,郑州90名幼儿疑被注射“问题疫苗”，医院：护士粗心写错了,https://www.thepaper.cn/newsDetail_forward_2542461,48分钟前,2018-10-18 20:30:27
21,长安君第一时间为剑友奉上了17日在武汉召开的重要会议――全国扫黑除恶专项斗争推进会的全部笔记。,澎湃新闻,长安剑：要坚持有黑扫黑、有恶除恶、有乱治乱,https://www.thepaper.cn/newsDetail_forward_2542459,51分钟前,2018-10-18 20:30:27
22,前三季度上海本外币个人住房贷款新增462.85亿元，同比少增1016.48亿元。换句话说，今年前三季度上海新增的个人住房贷款金额，仅为去年同期的三成。,澎湃新闻,上海前三季度新增个人住房贷款463亿，仅为去年同期的三成,https://www.thepaper.cn/newsDetail_forward_2542265,55分钟前,2018-10-18 20:30:27
23,近日网上热传“针眼蟹”，并附带图片。,澎湃新闻,商家给螃蟹“打针”来保鲜、增重？此举得不偿失,https://www.thepaper.cn/newsDetail_forward_2542158,57分钟前,2018-10-18 20:30:27
24,央行和国资委官员的公开讲话带火了竞争中性。所有制中立和改革乘数效应也受到关注。竞争中性、所有制中立、改革乘数效应是什么？它们被提出对中国经济发展有何意义？,澎湃新闻,财政部回应财政收入增速高于GDP增速：计算口径不同,https://www.thepaper.cn/newsDetail_forward_2542107,59分钟前,2018-10-18 20:30:27
25,财政部表示，财政收入和GDP增速计算口径不同，财政收入增速以现价计算，GDP增速以不变价计算，如果不做调整，不能直接对比。,澎湃新闻,服刑老太申请保外就医失败，监狱称不符,https://www.thepaper.cn/newsDetail_forward_2542328,1小时前,2018-10-18 20:30:28
26,10月18日，河北石家庄。86岁老太监狱服刑申请保外就医，其女被监狱方告知，结合医院诊断，李淑贤不符合保外就医范围。其代理律师称，致电监狱得到无法提供书面回复。,澎湃新闻,上海市政协将召开首次监督性常委会议，注重用对策说话,https://www.thepaper.cn/newsDetail_forward_2542161,1小时前,2018-10-18 20:30:28
27,10月24日，上海市政协将围绕“深入破解难题瓶颈，推动科技创新中心建设重大政策举措落实落地”主题，召开首次监督性常委会议。,澎湃新闻,空军指挥学院原副政委杨胜万将军逝世，享年74岁,https://www.thepaper.cn/newsDetail_forward_2542261,1小时前,2018-10-18 20:30:28
28,公开资料显示，杨胜万1944年出生于贵州遵义，1961年进入重庆邮电学院学习，毕业后进入原广州军区空军服役。,澎湃新闻,融创拟再接手4个万达文旅城，全国文旅城项目将增至17个,https://www.thepaper.cn/newsDetail_forward_2541382,1小时前,2018-10-18 20:30:28
29,10月18日，澎湃新闻（www.thepaper.cn）获悉，大连万达集团拟将文旅集团旗下的4个万达文旅城项目出售给融创中国（01918.HK）。,澎湃新闻,宠物互助献血低调成风：喵星人病危待血，“铲屎官”组团相救,https://www.thepaper.cn/newsDetail_forward_2542106,1小时前,2018-10-18 20:30:28
30,记者了解到，类似的宠物互助献血行为其实并不少见，但17只宠物主人组团一起来为宠物献血，这样的暖心场面却不多见。,澎湃新闻,商务部：中国加入区域全面经济伙伴关系是自身发展战略选择,https://www.thepaper.cn/newsDetail_forward_2542354,1小时前,2018-10-18 20:30:28
31,对于推动区域自贸安排相关的问题，中方的立场是一贯的，只要符合世贸组织的原则，开放、包容、透明，有利于推动经济全球化和区域经济一体化，我们都持积极的态度。,澎湃新闻,马来西亚前副总理扎希德涉嫌洗黑钱遭逮捕,https://www.thepaper.cn/newsDetail_forward_2542135,1小时前,2018-10-18 20:30:28
32,马来西亚反腐败委员会证实，前副总理扎希德18日下午在位于布城的该委员会总部遭逮捕，并决定于19日早将其控上吉隆坡法庭。,澎湃新闻,俄“联盟MS-10”飞船发射失败，美宇航员亲述逃生全过程,https://www.thepaper.cn/newsDetail_forward_2542302,1小时前,2018-10-18 20:30:28
33,俄罗斯和美国宇航员搭乘“联盟MS-10”号载人飞船前往国际空间站。升空中飞船的运载火箭引擎发生故障，两名宇航员启动了紧急逃生机制紧急降落在哈萨克斯坦。,澎湃新闻,浙大党委书记赴贵州考察：重温西迁历史，助力第二故乡发展,https://www.thepaper.cn/newsDetail_forward_2542108,1小时前,2018-10-18 20:30:28
34,浙江大学党委书记邹晓东一行赴贵州省贵阳市、遵义市、湄潭县、台江县调研考察，参加浙江大学―湄潭县合作交流座谈会、浙江大学―台江县帮扶工作交流会。,澎湃新闻,第二届世界油商大会在舟山举行，签约项目总投资1656亿元,https://www.thepaper.cn/newsDetail_forward_2541803,1小时前,2018-10-18 20:30:28
35,大会由浙江省政府主办，中国（浙江）自由贸易试验区管委会等承办，本届大会签约项目投资额比去年的大会增长一倍以上。,澎湃新闻,湖南娄底市政协原副主席肖扬受贿案开庭，被控受贿686万,https://www.thepaper.cn/newsDetail_forward_2541983,1小时前,2018-10-18 20:30:28
36,湖南省郴州市中院公开开庭审理娄底市政协原副主席（兼）、娄底市中心医院原院长肖扬受贿一案。肖扬被控45次非法收受他人给予的财物，共计人民币686万余元。,澎湃新闻,秦皇岛公安公开通缉李海涛、孙启星等5名涉黑恶案件在逃人员,https://www.thepaper.cn/newsDetail_forward_2542186,1小时前,2018-10-18 20:30:28
37,秦皇岛市公安局发布通缉令，公开通缉李海涛、孙启星、肖海金、郭健铭、刘玺利5名涉黑恶案件在逃人员，希望社会各界和广大人民群众提供有关线索。,澎湃新闻,重庆解放碑最老擦鞋匠：不为挣钱只为聊天，年轻人不忍让她擦,https://www.thepaper.cn/newsDetail_forward_2541815,1小时前,2018-10-18 20:30:29
38,徐治培被称为重庆解放碑“最老擦鞋匠”，如今已年过八旬的她仍然闲不下来。她说，看不懂电视，不会玩儿手机，就靠擦鞋和人聊聊天打发时间。,澎湃新闻,中央环保督察组：银川市污水处理厂提标改造等工作敷衍整改,https://www.thepaper.cn/newsDetail_forward_2541712,1小时前,2018-10-18 20:30:29
39,银川市政府对城市污水处理设施提标改造工程抓的不紧、推进不力，除第四污水处理厂征地款项测算报告外，未实质性专题研究过任何工程推进中的困难和问题，工作进展迟缓。,澎湃新闻,督察组向宁夏反馈“回头看”督察情况：腾格里沙漠整改不彻底,https://www.thepaper.cn/newsDetail_forward_2541691,1小时前,2018-10-18 20:30:29
40,腾格里沙漠违法排污问题引起中央高度重视，2016年督察又专门指出整改不到位问题，此次“回头看”仍发现整改不够彻底。,澎湃新闻,宁夏回族自治区机构改革方案出台：共设置党政机构55个,https://www.thepaper.cn/newsDetail_forward_2541586,1小时前,2018-10-18 20:30:29
41,机构改革后，共设置党政机构55个。党委机构16个，其中，纪检监察机关1个，工作机关12个，工作机关管理的机关(规格为副厅级) 3个。,澎湃新闻,哈尔滨检方回应“男子与的哥口角身亡，的哥被捕”：责成复查,https://www.thepaper.cn/newsDetail_forward_2541922,1小时前,2018-10-18 20:30:29
42,针对社会关注的南岗区人民检察院审查批捕的滕广江过失致人死亡案，哈尔滨市人民检察院高度重视，现已责成南岗区人民检察院进行复查并报告结果。,澎湃新闻,“隔代抚养”新焦虑：妈妈生，姥姥养，奶奶定期来观赏,https://www.thepaper.cn/newsDetail_forward_2541633,1小时前,2018-10-18 20:30:29
43,记者在成都、福州、长春等城市小区调查发现，进入“二孩时代”，姥姥、外婆逐渐成为城市带娃的“主力军”，“奶奶去哪儿了”折射“隔代抚养”新焦虑。,澎湃新闻,半挂车司机高速上停车支锅为老婆做饭：A2驾照最后6分扣光,https://www.thepaper.cn/newsDetail_forward_2541423,1小时前,2018-10-18 20:30:29
44,司机因此被计6分，他此前已被扣6分，这6分一扣，A2驾照将面临降级，不能再开半挂车了。这辆半挂车是夫妻俩不久前贷款买的，这顿饭代价巨大。,澎湃新闻,首条超级高铁可行性报告：年省4亿美元,https://www.thepaper.cn/newsDetail_forward_2541285,1小时前,2018-10-18 20:30:29
45,10月17日，马斯克旗下的Hyperloop One首次公布美国密苏里州超级高铁的可行性研究结果，结果显示其每年可省下4.1亿美元，行程最多可缩短3小时。,澎湃新闻,央行：推动网贷机构全面接入征信系统，审慎发放个人征信牌照,https://www.thepaper.cn/newsDetail_forward_2542226,1小时前,2018-10-18 20:30:29
46,面对新挑战，央行将加强互联网信用体系建设，推动小贷公司、网贷机构全面接入征信系统，实现互联网金融、互联网电商等领域的信用信息覆盖。,澎湃新闻,烟斗网店其实在卖烟丝：浙江最大非法经营走私烟草案由此破获,https://www.thepaper.cn/newsDetail_forward_2541388,1小时前,2018-10-18 20:30:29
47,义乌市公安局、市烟草专卖局侦破浙江最大的非法经营走私烟草案，查获走私烟9300多条、烟丝2323公斤，还有雪茄数千支，涉案金额1.2亿余元。,澎湃新闻,糖里有石灰？十斤糖一斤是酸？网曝《食用糖的安全问题》假的,https://www.thepaper.cn/newsDetail_forward_2542043,1小时前,2018-10-18 20:30:29
48,近日，一篇题为《食用糖的安全问题》的文章在网上流传。,澎湃新闻,幼儿园多名孩子呕吐，园方称系病毒感染,https://www.thepaper.cn/newsDetail_forward_2542117,1小时前,2018-10-18 20:30:29
49,10月17日安徽合肥。报业园幼儿园多名孩子呕吐。家长称，当天园方通知接回小孩，有孩子被送医打吊针。18日幼儿园人员告诉澎湃新闻，起因常规病毒感染，已无孩子呕吐。,澎湃新闻,郑州一医院被指将右肺穿刺手术做成左肺，涉事医生已被停职,https://www.thepaper.cn/newsDetail_forward_2541317,1小时前,2018-10-18 20:30:30
50,10月17日，医院方面回应澎湃新闻称，已将涉事医生停职，等待下一步处理。至于赔偿，可以免除患者一万余元的医疗费用并赔偿营养费和精神损失费计4000元。,澎湃新闻,中办、国办印发《组建国家综合性消防救援队伍框架方案》,https://www.thepaper.cn/newsDetail_forward_2542157,1小时前,2018-10-18 20:30:30
51,中办国办印发《组建国家综合性消防救援队伍框架方案》，就推进公安消防部队和武警森林部队转制，组建国家综合性消防救援队伍，部署建设中国特色应急救援主力军和国家队。,澎湃新闻,陕西男子与继子争吵后山中服毒，警民合力抬下山抢救,https://www.thepaper.cn/newsDetail_forward_2541501,1小时前,2018-10-18 20:30:30
52,10月8日中午11时许，陕西商洛市商州区大赵峪街道办事处刘河村村民任某国报警称，继父李某民疑似喝农药自尽，现在找不见其踪迹。,澎湃新闻,【社论】用法律定分止争,https://www.thepaper.cn/newsDetail_forward_2541986,2小时前,2018-10-18 20:30:30
53,普的这个“法”，不是庸俗的“朋友妻不可欺”，而是《婚姻法》里夫妻相互忠诚的义务，是民法的诚实信用原则。鸡毛落地了，吃瓜群众也该散散了。,澎湃新闻,超九成患者被诊断为性病，长沙一民营医院涉嫌医疗欺诈被关,https://www.thepaper.cn/newsDetail_forward_2541466,2小时前,2018-10-18 20:30:30
54,执法人员检查发现，该院为314例患者进行前列腺常规检测，全部出具阳性检查结果，而淋球菌检测的阳性率高达93%。,澎湃新闻,女教师罚站学生被派出所关7小时， 官方：涉事副所长已停职,https://www.thepaper.cn/newsDetail_forward_2542052,2小时前,2018-10-18 20:30:30
55,18日，湖南一派出所副所长为女儿“强出头”的消息引发争议。株洲县委宣传部副部长称，目前纪委已介入，涉事副所长已被停职，接受调查。,澎湃新闻,马上评丨反思扬州拆违事件：拆迁“产业链”不能再持续了,https://www.thepaper.cn/newsDetail_forward_2541840,2小时前,2018-10-18 20:30:30
56,针对闹得沸沸扬扬的“扬州驾车撞人事件”，10月18日，扬州警方发布通告称，公安机关依法对驾驶轿车撞人的韦刚以涉嫌“以危险方法危害公共安全罪”采取刑事强制措施。,澎湃新闻,著名宪法学家、中国政法大学孙丙珠教授逝世,https://www.thepaper.cn/newsDetail_forward_2541884,2小时前,2018-10-18 20:30:30
57,孙丙珠教授是我国著名宪法学者，中国政法大学宪法学科的主要创立者之一，为学校宪法学的学科建设和人才培养做出了历史性贡献。,澎湃新闻,司马义・艾买提同志生平,https://www.thepaper.cn/newsDetail_forward_2541888,2小时前,2018-10-18 20:30:30
58,司马义・艾买提同志退出领导岗位后，仍然关注我国改革开放事业发展，关注国际国内形势变化，关心人民群众生活，特别是十分关注民族工作、民族团结和民族地区经济社会发展。,澎湃新闻,女儿书本被同学撕毁，陕西丹凤一家长闯学校怒打师生被拘,https://www.thepaper.cn/newsDetail_forward_2541386,2小时前,2018-10-18 20:30:30
59,女儿因同学间摩擦被撕毁书本，孩子父亲不仅没有与对方家长及老师沟通，反而一气之下闯入学校殴打涉事学生及老师。,澎湃新闻,12队打季后赛，奖杯不再“网购”，CBA第二年改革来了,https://www.thepaper.cn/newsDetail_forward_2540040,2小时前,2018-10-18 20:30:30
60,不只是赛制，CBA联赛还提供了更多的球场保障、完善的安保细则、新修订的裁判员管理办法，即将推出的《CBA联赛俱乐部球迷方针实行草案》也将提升球迷的观赛体验。,澎湃新闻,吉林省文旅厅成全省首家挂牌省级新机构，70后女博士任厅长,https://www.thepaper.cn/newsDetail_forward_2541055,2小时前,2018-10-18 20:30:30
61,10月18日上午，吉林省文化和旅游厅正式挂牌。吉林省委常委、宣传部部长王晓萍，副省长石玉钢出席揭牌仪式。,澎湃新闻,吉林厅官李晓明一次受贿6套房房号尾数均为7，已被判13年,https://www.thepaper.cn/newsDetail_forward_2541147,2小时前,2018-10-18 20:30:31
62,原任吉林省交通运输厅副厅长的李晓明一句话，就让一名工程老板赚了两三千万。作为回报，李晓明获得该老板一次性赠送的6套房产，每套房号尾数均为“7”。,澎湃新闻,车主开车追剧被拦停：这跟看导航一样,https://www.thepaper.cn/newsDetail_forward_2541422,2小时前,2018-10-18 20:30:31
63,10月15日，湖北襄阳。民警在对一辆轿车进行检查时，发现车辆的仪表盘上放着一个手机，正播放着电视剧。司机被拦停后表示“这跟看导航是一样的”。,澎湃新闻,证券交易印花税收入年内首现负增长：前9月同比降6.5%,https://www.thepaper.cn/newsDetail_forward_2541965,2小时前,2018-10-18 20:30:31
64,1-9月主要收入项目中，印花税占1809亿元，同比增长1.2%。其中，证券交易印花税881亿元，同比下降6.5%。,澎湃新闻,外交部：王岐山将访问以色列、巴勒斯坦、埃及、阿联酋,https://www.thepaper.cn/newsDetail_forward_2541750,2小时前,2018-10-18 20:30:31
65,外交部发言人陆慷宣布：国家副主席王岐山将于10月22日至30日访问以色列、巴勒斯坦、埃及、阿联酋并主持中以创新合作联委会第四次会议。,澎湃新闻,减税降费政策落地，9月全国财政、增值税收入增速创年内新低,https://www.thepaper.cn/newsDetail_forward_2541920,2小时前,2018-10-18 20:30:31
66,前三季度，全国财政收入总体保持平稳较快增长，但稳中趋缓态势明显。9月份，全国财政收入增幅降至2%，创年内新低。,澎湃新闻,CBA宣传片出炉，这是好莱坞既视感啊,https://www.thepaper.cn/newsDetail_forward_2541883,2小时前,2018-10-18 20:30:31
67,10月21日，CBA新赛季揭幕战将在辽宁沈阳打响。就在新赛季鸣哨前三天，CBA官方发布了新赛季宣传片，网友看后直言拍出了好莱坞和奥特曼的感觉。,澎湃新闻,福州共有产权住房首付比例调整，最低为房屋总价的18%,https://www.thepaper.cn/newsDetail_forward_2541471,2小时前,2018-10-18 20:30:31
68,福州市房管局日前已会同建设银行等金融机构研究共有产权住房个人贷款比例问题，并确定个人首付比例由原先的不低于房屋总价的30%调整为不低于个人出资购房总额的30%。,澎湃新闻,女子当街遭多人强拉上车：入传销家人救,https://www.thepaper.cn/newsDetail_forward_2541595,2小时前,2018-10-18 20:30:31
69,10月17日，广西防城港。“3男子拉扯1女子上出租车”视频热传。警方通报称：3男系女子家人，女子被骗入传销组织，家人劝说未果，遂决定将其强行带往公安局接受教育。,澎湃新闻,鲁迅的夫人许广平 ――纪念她诞生120周年，逝世50周年,https://www.thepaper.cn/newsDetail_forward_2541165,2小时前,2018-10-18 20:30:31
70,她说：“关于我和鲁迅先生的关系，我们以为两性生活，是除了当事人之外，没有任何方面可以束缚，而彼此间在情投意合，以同志一样对待，互相信任，就不必有任何的俗套。,澎湃新闻,车主往外扔垃圾，后方公交女司机下车捡,https://www.thepaper.cn/newsDetail_forward_2541727,2小时前,2018-10-18 20:30:31
71,10月16日，河南郑州。12日一名男子开车等红绿灯时从车窗向外扔垃圾，后方的公交女司机张瑞华看到，便下车捡起垃圾，男子下车称是习惯性动作，并向张瑞华道歉。,澎湃新闻,滴滴宣布小范围测试短信报警功能，未成年乘客需由监护人陪同,https://www.thepaper.cn/newsDetail_forward_2541848,2小时前,2018-10-18 20:30:31
