,header,pub_time,url
0,非洲媒体：中非合作论坛是一个非常有益的平台,8-25 17:39,http://www.chinanews.com/gj/2018/08-25/8610224.shtml
1,日本高温天气仍持续 枫叶可能比往年晚些变红,8-25 16:23,http://www.chinanews.com/gj/2018/08-25/8610188.shtml
2,澳总理频更换 悉尼杜莎夫人蜡像馆：不想做新的了,8-25 14:57,http://www.chinanews.com/gj/2018/08-25/8610148.shtml
3,芬兰军队士兵每周吃两顿素食 防长发火：谁决定的？,8-25 14:47,http://www.chinanews.com/gj/2018/08-25/8610140.shtml
4,苏格兰政府前首席部长性丑闻引纷争,8-25 14:27,http://www.chinanews.com/gj/2018/08-25/8610110.shtml
5,外媒：阿伯特被指应为澳大利亚“逼宫行动”负责,8-25 14:26,http://www.chinanews.com/gj/2018/08-25/8610130.shtml
6,法小镇游客抱怨蝉鸣声太大 镇长：他们不懂欣赏大自然,8-25 13:45,http://www.chinanews.com/gj/2018/08-25/8610119.shtml
7,美警察同嫌犯搏斗请求帮忙 保安一旁拍视频无动于衷,8-25 13:23,http://www.chinanews.com/gj/2018/08-25/8610099.shtml
8,美国一机场启用面部识别技术仅3天查获一冒名者,8-25 13:12,http://www.chinanews.com/gj/2018/08-25/8610092.shtml
9,欧洲多家航空公司9月起暂停飞往伊朗德黑兰航班,8-25 13:05,http://www.chinanews.com/gj/2018/08-25/8610085.shtml
10,马斯克宣布特斯拉将放弃私有化：耗费时间和精力,8-25 13:03,http://www.chinanews.com/gj/2018/08-25/8610081.shtml
11,“基地”再发视频 扎瓦希里时隔一年多现身,8-25 11:25,http://www.chinanews.com/gj/2018/08-25/8610052.shtml
12,美俄安全对话：会谈5小时 未发布联合声明,8-25 11:14,http://www.chinanews.com/gj/2018/08-25/8610044.shtml
13,美教育部酝酿为校园配枪 教育界猛批,8-25 11:13,http://www.chinanews.com/gj/2018/08-25/8610043.shtml
14,美国取消对约旦河西岸和加沙地带的2亿多美元援助,8-25 11:11,http://www.chinanews.com/gj/2018/08-25/8610042.shtml
15,美国务卿访朝计划取消 特朗普称仍希望与金正恩会晤,8-25 10:53,http://www.chinanews.com/gj/2018/08-25/8610028.shtml
16,美国重建第二舰队 俄罗斯称将采取适当措施回应,8-25 10:49,http://www.chinanews.com/gj/2018/08-25/8610030.shtml
